Clé de ticket,Clé Ticket IT,Résumé,Description,Rapporteur,Utilisateurs,Entreprises,Equipe,Canal,Module,Sous-Module(s),Type_Ticket,Type de bug,Projet,Priorité,Etat,Date de creation de Jira,Date de mise à jour Jira,Date de résolution,Fonctionnalité
OBCS-11729,OD-2974,Finance/Comptabilité générale/Journal générale : Suppression des écritures importés du journal ODCAIS de Janvier à juin 2025 d'ARIC.,"Suppression des écritures *importés* du journal *ODCAIS* de *Janvier à juin 2025*.

* Entité : *ARIC*
* Journal : *ODCAIS*
* Origine : *import*
* Période concernée : *de Janvier à juin 2025*",GNAHORE AMOS,,ARIC,,Constat Interne,Finance,Comptabilité Générale,Requêtes,Non renseigné,OBC Customer Support,Priorité 1,Terminé(e),2025-11-14 15:17,14/11/2025 18:14,2025-11-14 18:14,
OBCS-11719,OD-2970,RH/Salaire/Calcul OHADA : Prise en compte du nombre de jours travaillé dans le calcul de la gratification.,"Lors du calcul de la gratification, OBC ne prend pas correctement en compte le nombre réel de jours travaillés.
Exemple : un salarié ayant travaillé *10 mois et 8 jours* est considéré par OBC comme ayant travaillé *11 mois*.

",GNAHORE AMOS,KONE Mariam,SIT BTP,,Appel WhatsApp,RH,Salaire,Bug,Dysfonctionnement sur le Calcul des salaires,OBC Customer Support,Priorité 1,Terminé(e),2025-11-12 10:27,14/11/2025 10:09,2025-11-14 10:09,
OBCS-11623,OD-2963,Demande de sortie de caisse : Donner la possibilité de choisir son supérieur hiérarchique lors de la demande,Demande de sortie de caisse : Donner la possibilité de choisir son supérieur hiérarchique lors de la demande. Sinon la réception de tous les managers pour une demande n'est pas optimale,Vivien DAKPOGAN,Sbidje Stephanie,KOFFI & DIABATE,,En présentiel,Finance,Comptabilité Générale,Requêtes,Non renseigné,OBC Customer Support,Priorité 1,À faire,2025-11-07 16:10,7/11/2025 16:10,,
OBCS-11619,OD-2961,RH/DOCUMENT/Certificat de travail : Les informations de l'employé ne se déverse pas pas à l'impression du fichier du certificat de travail.,Les informations de l'employé ne se déverse pas à l'impression du fichier du certificat de travail.,GNAHORE AMOS,KONE Mariam,SIT BTP,,Appel Téléphonique,RH,Documents,Bug,Mauvais déversement des données,OBC Customer Support,Priorité 1,Terminé(e),2025-11-04 16:09,10/11/2025 06:10,2025-11-10 06:10,
OBCS-11602,OD-2956,Finance/Comptabilité générale/Interrogation de compte tiers ou compte général : Donner la possibilité de faire un pré-lettrage.,"Donner la possibilité de faire un pré lettrage.

Commencer le lettrage et lorsqu'on fini le règlement, ont termine le lettrage.",GNAHORE AMOS,Rodrigue KOUAKOU,ETS MAB,,En présentiel,Finance,Comptabilité Générale,Requêtes,Non renseigné,OBC Customer Support,Priorité 1,À faire,2025-11-02 15:39,2/11/2025 15:40,,
OBCS-11605,OD-2957,"Opération/Vente/Contrat: Dans le cycle de vente, remplacer le libellé ""Contrat"" par ""Récurrent mensuel""","Remplacer le libellé ""*Contrat*"" par ""*Récurrent mensuel*""",GNAHORE AMOS,Rodrigue KOUAKOU,ETS MAB,,En présentiel,Opérations,Vente,Requêtes,Non renseigné,OBC Customer Support,Priorité 1,À faire,2025-11-02 15:45,2/11/2025 15:45,,
OBCS-11609,OD-2958,Finance/Opération de caisse: Afficher le nom du fournisseur à l'impression du bon de caisse,"Afficher le nom du fournisseur à l'impression du bon de caisse.

",GNAHORE AMOS,Rodrigue KOUAKOU,ETS MAB,,En présentiel,Finance,Comptabilité Générale,Requêtes,Non renseigné,OBC Customer Support,Priorité 1,À faire,2025-11-02 15:51,2/11/2025 15:51,,
OBCS-11613,OD-2960,Finance/Comptabilité générale/Journal général: Avoir la possibilité de réimputer les comptes à partir du journal général.,Avoir la possibilité de réimputer les comptes à partir du journal général.,GNAHORE AMOS,Rodrigue KOUAKOU,ETS MAB,,En présentiel,Finance,Comptabilité Générale,Requêtes,Non renseigné,OBC Customer Support,Priorité 1,À faire,2025-11-02 15:55,2/11/2025 15:55,,
OBCS-11562,OD-2955,OPERATION/VENTE/FACTURE CLIENT/ Mauvais déversement de données à l'édition des factures clients,"OPERATION/VENTE/FACTURE CLIENT/ Mauvais déversement de données à l'édition des factures clients

Après avoir saisit une facture de 13 lignes, en historique on a un bon montant mais à l'édition ce n’est que 3 lignes qui apparaissent.

!20251031-1827-20.1856447.mp4|width=666,alt=""20251031-1827-20.1856447.mp4""!",N'GBRA MOYE BERNICE DORIS,ERIC KOUADIO,FALCON,,Appel Téléphonique,Opérations,Vente,Bug,Mauvais déversement des données,OBC Customer Support,Priorité 1,Terminé(e),2025-10-31 18:17,14/11/2025 10:29,2025-11-14 10:29,
OBCS-11147,OD-2874,Mauvais récupération du numéro de BON DE COMMANDE.,"Mauvais récupération du numéro de BON DE COMMANDE. Lors de l’enregistrement d’un bon de commande, le numéro attribué est toujours *1*, quel que soit le nombre de bons créés.",GNAHORE AMOS,KONE Mariam,SIT BTP,,Appel WhatsApp,Opérations,Achat,Bug,Mauvais déversement des données,OBC Customer Support,Priorité 1,Terminé(e),2025-10-01 09:12,5/11/2025 08:42,2025-11-05 08:42,
OBCS-11492,OD-2950,Bon de commande : Export Excel en vrac,Bon de commande : Export Excel en vrac. Possibilité d’exporter sous Excel les bons de commande avec le détail des différents articles.,Vivien DAKPOGAN,Kouamé Stéphane,SIE-TRAVAUX,,Appel Téléphonique,Opérations,Achat,Requêtes,Non renseigné,OBC Customer Support,Priorité 1,Terminé(e),2025-10-23 13:00,24/10/2025 10:09,2025-10-24 10:09,
OBCS-11481,OD-2945,Finance/Opérations de Caisse : Un message d'erreur apparait à l'enregistrement d'une demande de sortie de caisse,"Finance/Opérations de Caisse : Un message d'erreur apparait à l'enregistrement d'une demande de sortie de caisse

!Capture d'écran 2025-10-22 112801.png|width=666,alt=""Capture d'écran 2025-10-22 112801.png""!",N'GBRA MOYE BERNICE DORIS,Corinne LADJI,KOFFI & DIABATE,,Appel Téléphonique,Finance,Comptabilité Générale,Bug,Page d'erreur,OBC Customer Support,Priorité 1,Terminé(e),2025-10-22 11:42,23/10/2025 11:42,2025-10-23 11:42,
OBCS-11483,OD-2946,Finance/Comptabilité Générale / Création compte Tiers entité - Impossible de Créer et modifier un compte tiers,"Il est impossible de créer un compte tiers /Générale sur la base du client CILAGRI CAJOU

!20251022-1240-01.6322961.mp4|width=671,alt=""20251022-1240-01.6322961.mp4""!

!image-20251022-124537.png|width=501,alt=""image-20251022-124537.png""!",Edwige KOUASSI,Nadia Jocelyn Bouazo,CILAGRI,,Chat WhatsApp,Finance,Comptabilité Générale,Bug,Enregistrement impossible,OBC Customer Support,Priorité 1,En cours,2025-10-22 12:44,23/10/2025 07:14,,
OBCS-11480,OD-2944,"RH/SALAIRE/SIMULATEUR DE SALAIRE: Lorsqu’on tente d’accéder au simulateur, une page blanche s’affiche.","Lorsqu’on tente d’accéder au simulateur, une page blanche s’affiche.",GNAHORE AMOS,KONE Mariam,SIT BTP,,Appel WhatsApp,RH,Salaire,Bug,Page d'erreur,OBC Customer Support,Priorité 1,Terminé(e),2025-10-22 08:35,5/11/2025 08:31,2025-11-05 08:31,
OBCS-11478,OD-2943,Finance/Comptabilité Général/ Plan comptable Tiers / Doublon constaté dans la Comptabilité / Ecorigine,"Doublon constaté dans la Comptabilité / Ecorigine 

!image-20251021-172139.png|width=694,alt=""image-20251021-172139.png""!",Edwige KOUASSI,MICHEL TETE,ECORIGINE,,En présentiel,Finance,Comptabilité Générale,Bug,Autres,OBC Customer Support,Priorité 1,En cours,2025-10-21 17:20,22/10/2025 14:44,,
OBCS-11471,OD-2939,MODULE RH/ gestion des employés/ affectation des employés : Doublons dans l’affectation des employés à un site.,"Doublons dans l’affectation des employés à un site. Nous avons constaté qu’il y a des employés qui sont affectés deux fois au même site, ce qui génère des doublons.",GNAHORE AMOS,,AFREX/MEHO CAPITAL,,En présentiel,RH,Gestion employé,Bug,Mauvais déversement des données,OBC Customer Support,Priorité 1,Terminé(e),2025-10-20 14:43,24/10/2025 09:18,2025-10-24 09:18,
OBCS-11458,OD-2938,"FINANCE/COMPTABILITE GENERALE/Plan comptable tiers entité/ Au niveau des tiers salariés, il est impossible de supprimer un compte tiers salarié","FINANCE/COMPTABILITE GENERALE/Plan comptable tiers entité/ Au niveau des tiers salariés, il est impossible de supprimer un compte tiers salarié tel que : 

# Compte existant sans compte generale ni numero de compte tiers en historique
# Impossible d’importer les ",N'GBRA MOYE BERNICE DORIS,KOUAME BRICE,SIE-TRAVAUX,,Appel Téléphonique,Finance,Comptabilité Générale,Bug,Historique vide/non exhaustif,OBC Customer Support,Priorité 1,Terminé(e),2025-10-20 10:41,23/10/2025 12:02,2025-10-23 12:02,
OBCS-11473,OD-2941,Finance/Comptabilité générale/Paramétrage comptabilisation de la paie : Rajouter une action permettant d'avoir le detail de l'imputation et donner la possibilité d’afficher l’historique sur plus de 10 lignes.,"Finance/Comptabilité générale/Paramétrage comptabilisation de la paie : 

# Dans le listing des paramétrage imputation comptable, rajouter une action permettant d'avoir le detail de l'imputation.
# Au niveau de l’historique, donner la possibilité d’afficher l’historique sur plus de 10 lignes.",GNAHORE AMOS,,2AAZ,,En présentiel,Finance,Comptabilité Générale,Requêtes,Non renseigné,OBC Customer Support,Priorité 1,À faire,2025-10-20 15:29,20/10/2025 15:29,,
OBCS-11472,OD-2940,RH/Gestion Employés/Affectation employés : Rajouter un champ qui permet de filtrer sur le type d’employés.,Rajouter un champ qui permet de filtrer sur le type d’employés. Cela permettra de rechercher facilement les permanents ou les journaliers.,GNAHORE AMOS,KOKONBO PHILOMENE,AFREX/MEHO CAPITAL,,Appel Téléphonique,RH,Gestion employé,Requêtes,Non renseigné,OBC Customer Support,Priorité 1,À faire,2025-10-20 14:56,20/10/2025 14:56,,
OBCS-11383,OD-2937,RH/Gestion employé/Contrat OHADA : Modification du type de contrat renseigner lors de l'importation du fichier.,"Lors du traitement du fichier d’import, nous avons renseigné le type de contrat en *CDI*. Cependant, après importation, le contrat apparaît avec la mention *« CDIAE »* au lieu de *« CDI »*.",GNAHORE AMOS,,ENVIPUR,,Constat Interne,RH,Gestion employé,Bug,Mauvais déversement des données,OBC Customer Support,Priorité 1,En cours,2025-10-18 09:32,22/10/2025 08:41,,
OBCS-11382,OD-2936,RH/Gestion employé/Fichier du personnel : Non prise en compte de la situation matrimoniale et du mode de règlement lors de l’importation du fichier du personnel.,"Lors de l’importation du fichier du personnel, les champs « *Situation matrimoniale* » et « *Mode de règlement* » ne sont pas pris en compte, bien que ces informations aient été correctement renseignées dans le fichier d’import.",GNAHORE AMOS,,AFREX/MEHO CAPITAL,,En présentiel,RH,Gestion employé,Bug,Mauvais déversement des données,OBC Customer Support,Priorité 1,En cours,2025-10-17 19:57,22/10/2025 12:59,,
OBCS-11325,OD-2906,Finance/comptabilité générale/journal général : Suppression des journaux.,"Suppression des journaux :

* OD
* TR P
* CAIS
* BQE

* CAIS S (supprimé uniquement pour le 10ème mois)",GNAHORE AMOS,,ETS MAB,,Constat Interne,Finance,Comptabilité Générale,Requêtes,Non renseigné,OBC Customer Support,Priorité 1,Terminé(e),2025-10-16 12:23,17/10/2025 08:49,2025-10-16 15:08,
OBCS-11318,OD-2899,"Opération/Cycle de vente/Facture client : La remise est renseignée, mais n’est pas déduite du montant total.","Bien que la valeur de la remise soit renseignée, il n’y a aucune déduction sur le montant total.",Edwige KOUASSI,Nadia Jocelyn Bouazo,CILAGRI,,"Online (Google Meet, Teams...)",Opérations,Vente,Bug,Mauvais déversement des données,OBC Customer Support,Priorité 1,Terminé(e),2025-10-15 12:36,17/10/2025 14:18,2025-10-17 14:18,
OBCS-11317,OD-2898,Opération/Achat/Bon de commande : Répétition des numéros bon de commande.,"Il y a une répétition au niveau des numéros de bon de commande.
Les numéros corrects sont les suivants :

* *2025-0113* : Ademat
* *2025-0114* : Sogelux",GNAHORE AMOS,KONE Mariam,SIT BTP,,Chat WhatsApp,Opérations,Achat,Bug,Mauvais déversement des données,OBC Customer Support,Priorité 1,En cours,2025-10-14 11:23,21/10/2025 16:54,,
OBCS-11243,OD-2893,Lenteur et non affichage respectivement du bulletin et du livre de paie,"*Bulletin :* Il met du temps à afficher mais affiche après quelques minutes
*Livre de paie :* N’affiche rien même après 10 minutes.

",Vivien DAKPOGAN,Sanankoua Mickaelle,ARIC,,Chat WhatsApp,RH,Documents,Bug,Lenteur Système,OBC Customer Support,Priorité 1,Terminé(e),2025-10-10 07:03,12/10/2025 09:44,2025-10-12 09:44,
OBCS-11239,OD-2889,"Finance/Trésorerie/Banque - Liste incomplète des banques dans ""Statut des chèques""","Liste partielle des banques dans la section ""Statut des chèques"" Bien qu’il y ait des chèques émis a partie des banques différente 

* *Description* :
Dans la fonctionnalité *""Statut des chèques""*, *seules deux banques* apparaissent dans la liste déroulante, alors que des chèques sont émis depuis *plusieurs autres banques*.
Cela empêche le client de faire un suivi global sur tous les chèques émis.
* *Comportement attendu* :
La liste des banques devrait inclure *toutes les banques à partir desquelles des chèques ont été émis*, afin d’assurer une couverture complète.
* *Priorité* : Haute

!image-20251009-173349.png|width=1252,height=706,alt=""image-20251009-173349.png""!

Récap des chèques émis et reçu incomplet

!image-20251009-173528.png|width=1254,height=764,alt=""image-20251009-173528.png""!

Liste des opérations réglé par chèque de banque diverses











!image-20251009-173927.png|width=1233,height=712,alt=""image-20251009-173927.png""!



Quelques chèques utilisé par banque",Edwige KOUASSI,MICHEL TETE,ECORIGINE,,Appel Téléphonique,Finance,Trésorerie,Bug,Autres,OBC Customer Support,Priorité 1,Terminé(e),2025-10-09 17:39,15/10/2025 21:00,2025-10-15 21:00,
OBCS-11225,OD-2880,Un message d'erreur s'affiche lorsqu'on enregistre un contrat de stage.,"Un message d’erreur s’affiche lors de l’enregistrement d’un contrat de stage. Cependant, le contrat apparaît dans l’historique avec des doublons.",GNAHORE AMOS,Joël SIE,ONPOINT,,En présentiel,RH,Gestion employé,Requêtes,Non renseigné,OBC Customer Support,Priorité 1,À faire,2025-10-07 14:21,7/10/2025 14:21,,
OBCS-11223,OD-2878,OPERATION/ACHAT/BON DE COMMANDE/Ecart constaté au niveau de la conversion de devise étrangère en devise locale,"OPERATION/ACHAT/BON DE COMMANDE/Ecart constaté au niveau de la conversion de devise étrangère en devise locale.

!image-20251006-115546.png|width=1904,height=1029,alt=""image-20251006-115546.png""!",N'GBRA MOYE BERNICE DORIS,COULIBALY SERGES,S-TEL,,Appel Téléphonique,Opérations,Achat,Bug,Non renseigné,OBC Customer Support,Priorité 1,Terminé(e),2025-10-06 15:06,20/10/2025 11:44,2025-10-20 11:44,
OBCS-11089,OD-2871,RH / Paramétrage / Poste – Impossible de supprimer un poste.,RH / Paramétrage / Poste – Impossible de supprimer un poste.,GNAHORE AMOS,,CILAGRI,,Constat Interne,RH,Paramétrage,Bug,Page d'erreur,OBC Customer Support,Priorité 1,Terminé(e),2025-09-24 12:05,5/11/2025 08:45,2025-11-05 08:45,
OBCS-11139,OD-2873,Appel pour point d'utilisation OBC + état d'avancement des requêtes + bugs,Appel pour point d'utilisation OBC + état d'avancement des requêtes + bugs,Vivien DAKPOGAN,NADIA CISSE,ARIC,,Appel Téléphonique,Finance,Comptabilité Générale,Requêtes,Non renseigné,OBC Customer Support,Priorité 1,À faire,2025-09-28 19:15,28/9/2025 19:15,,
OBCS-11090,OD-2872,Donner la possibilité d'éditer / Imprimer des bulletins par entité.,"Donner la possibilité d'éditer / Imprimer des bulletins par entité.

",GNAHORE AMOS,,CILAGRI,,Constat Interne,RH,Documents,Requêtes,Non renseigné,OBC Customer Support,Priorité 1,À faire,2025-09-24 15:12,24/9/2025 15:12,,
OBCS-10967,OD-2868,Achat/Comptabilité/ Impossible de Supprimer une écriture comptable provenant des notes de frais,"Impossible de supprimer une écriture automatique provenant des notes de frais.

!image-20250918-204110.png|width=1262,height=456,alt=""image-20250918-204110.png""!

!image-20250918-204231.png|width=1269,height=625,alt=""image-20250918-204231.png""!",Edwige KOUASSI,MARCELLE AHOUSSOU,2AAZ,,Appel Téléphonique,Finance,Comptabilité Générale,Bug,Suppression impossible,OBC Customer Support,Priorité 1,En cours,2025-09-18 20:42,22/10/2025 08:25,,
OBCS-10966,OD-2867,Comptabilité Générale - Fusionner les comptes 4111056 du plan comptable tiers,Comptabilité Générale - Fusionner les comptes 4111056 du plan comptable tiers,Edwige KOUASSI,MARCELLE AHOUSSOU,2AAZ,,Appel Téléphonique,Finance,Comptabilité Générale,Bug,Duplication anormale,OBC Customer Support,Priorité 1,En cours,2025-09-18 20:25,3/10/2025 10:19,,
OBCS-10965,OD-2866,Finance,"Lors de la suppression d’une comptabilisation de paie généré, supprimer automatiquement les traces des écritures dans la comptabilité (Journal)",Edwige KOUASSI,MARCELLE AHOUSSOU,2AAZ,,"Online (Google Meet, Teams...)",RH,Salaire,Bug,Mauvais déversement des données,OBC Customer Support,Priorité 1,Terminé(e),2025-09-18 19:51,15/10/2025 21:59,2025-10-15 21:59,
OBCS-10961,OD-2865,CRM : Filtre Commercial et Période Création Opportunité,"# Sur le filtre commercial, lorsque vous sélectionnez des commerciaux, après chargement il ne conserve pas liste des personnes sélectionnées.
# Sur le filtre des périodes, malgré que vous définissez une période à afficher, il vous déverse toute la liste sans tenir compte de la période prédéfinie.",Vivien DAKPOGAN,Fidel Benao,ARIC,,Appel Téléphonique,CRM,Activités commerciales,Bug,Mauvais déversement des données,OBC Customer Support,Priorité 1,Terminé(e),2025-09-17 18:20,17/9/2025 19:23,2025-09-17 19:23,
OBCS-10957,OD-2862,Stock Inventaire : Impossible de supprimer un inventaire non validé et de valider un inventaire,"Stock Inventaire : Impossible de supprimer un inventaire non validé et de valider un inventaire

",Vivien DAKPOGAN,Brahima COULIBALY,KORI TRANSPORT,,"Online (Google Meet, Teams...)",Opérations,Gestion de stock,Bug,Enregistrement impossible,OBC Customer Support,Priorité 1,Terminé(e),2025-09-16 15:57,17/9/2025 19:27,2025-09-17 19:27,
OBCS-10952,OD-2856,Gestion de prêts multiples sur 2 échéanciers courants sur le même mois,"Pour 2 prêts qui cours dans le mois, au moment de faire la paie, on a un seul qui apparait sur le bulletin au lieu des 2.
Faudra permettre d’avoir 2 ou plusieurs prêts qui apparaissent sur le bulletin si un collaborateur a bénéficié de 2 prêts ou plusieurs qui cours sur les mêmes échéanciers.",Vivien DAKPOGAN,Diane N'GBLA,KOFFI & DIABATE,,En présentiel,RH,Gestion employé,Bug,Récupération de données impossible,OBC Customer Support,Priorité 1,Terminé(e),2025-09-16 08:59,16/9/2025 14:49,2025-09-16 14:49,
OBCS-10956,OD-2861,Finance /Comptabilité Générale / Programmation dette antérieur - Nettoyage du listing des programmations de dettes antérieures,"Dans le cadre du suivi des dettes antérieures, merci de procéder aux actions suivantes sur le listing des programmations :

# *Supprimer toutes les dettes liées uniquement aux comptes généraux* (c'est-à-dire ne correspondant à aucun fournisseur ou tiers spécifique).
# *Exclure également les règlements liés*, c’est-à-dire celles pour lesquelles un paiement a été effectué.

L’objectif est d’obtenir un listing épuré, ne comportant que les dettes encore à régler et rattachées à des tiers identifiables.",Edwige KOUASSI,MICHEL TETE,ECORIGINE,,Appel Téléphonique,Finance,Comptabilité Générale,Requêtes,Non renseigné,OBC Customer Support,Priorité 1,À faire,2025-09-16 15:41,16/9/2025 15:46,,
OBCS-10951,OD-2855,Module Agro - Création fonctionnalité et formulaire contrat société,"Création fonctionnalité et formulaire contrat société qui Permettra l’enregistrement, la consultation et la gestion des contrats entre les sociétés et l’administration portuaire/agroalimentaire pour encadrer leurs opérations (livraisons, inspections, stockages, etc.).

Cette fonctionnalité doit garantir la traçabilité des contrats, la validité des autorisations, et conditionner l’accès à certaines opérations dans le module Agro. 

Utilité  : 

# Enregistrer un nouveau contrat pour une société
# Chaque contrat est obligatoirement lié à une société existante
# Type de contrat, dates de validité, numéro de contrat, objet, statut
# Rajouter Pièces jointes : PDF du contrat, annexes, documents légaux
# Lister les anciens contrats par société, avec possibilité d’archiver
# Affichage des Statuts automatique basé sur les dates de validité
# Filtrage et recherche : Par société, date, statut, type de contrat",Edwige KOUASSI,Ismaël KONE,ECORIGINE,,En présentiel,Opérations,AGRO,Requêtes,Non renseigné,OBC Customer Support,Priorité 1,À faire,2025-09-15 19:34,14/10/2025 13:20,,
OBCS-10950,OD-2854,Module Agro – Export - Création Fonctionnalité identification navire,"Permettre aux utilisateurs d’*identifier un navire* de manière fiable et rapide via :

* Son nom,
* Son numéro IMO (International Maritime Organization),
* Ou un autre identifiant unique.

L’identification permet ensuite d’associer le navire à une opération (déchargement, inspection, etc.).

Recherche par nom ou IMO 

# L'utilisateur peut rechercher un navire par son nom ou son numéro 
# Une fois le navire identifié, les informations suivantes s'affichent : nom, IMO, pavillon, port d’attache, armateur
# Auto-complétion lors de la saisie du nom du navire
# Donner la possibilité de Créer un nouveau navire
# L'utilisateur peut créer une fiche navire si celui-ci est absent de la base

Dans l’historique des navires afficher la liste des derniers navires identifiés ou utilisés",Edwige KOUASSI,Ismaël KONE,ECORIGINE,,En présentiel,Opérations,AGRO,Requêtes,Non renseigné,OBC Customer Support,Priorité 1,Terminé(e),2025-09-15 19:25,15/10/2025 22:10,2025-10-15 22:10,
OBCS-10879,OD-2850,Ajout numéro de pièces sur le grand livre,*Grand Livre :* Possibilité de rajouter les numéros de pièce saisis pour faciliter les corrections et les rapprochements bancaires,Vivien DAKPOGAN,LYTA KENA-RABE,KOFFI & DIABATE,,Appel Téléphonique,Finance,Comptabilité Générale,Requêtes,Non renseigné,OBC Customer Support,Priorité 1,À faire,2025-09-11 08:21,11/9/2025 08:21,,
OBCS-10878,OD-2849,Bouton export compte analytique,Créer au bouton export des comptes analytiques qui permette d’exporter tous les comptes analytiques.,Vivien DAKPOGAN,Kramo,ARIC,,Appel Téléphonique,Finance,Comptabilité analytique,Requêtes,Non renseigné,OBC Customer Support,Priorité 1,À faire,2025-09-11 07:56,11/9/2025 07:56,,
OBCS-10872,OD-2845,Finance/Compta Générale/Plan comptable Générale - Fusionner les doublons qui apparaissent dans le plan comptable,"Fusion des doublons constaté dans la base.

!image-20250909-111721.png|width=1298,height=674,alt=""image-20250909-111721.png""!",Edwige KOUASSI,FERDINAND KOUADIO,FIRST CAPITAL,,"Online (Google Meet, Teams...)",Finance,Comptabilité Générale,Requêtes,Non renseigné,OBC Customer Support,Priorité 1,À faire,2025-09-09 11:16,9/9/2025 11:18,,
OBCS-10870,OD-2844,RH/Gestion des employés/ Mise à jour Compteur congés payés.,Mise à jour du compteur de congés payés dans OBC avec possibilité d'être décompté à chaque validation de congés validé,Edwige KOUASSI,MARIE AUDE COFFIE,FIRST CAPITAL,,E-mail,RH,Gestion employé,Requêtes,Non renseigné,OBC Customer Support,Priorité 1,À faire,2025-09-08 20:10,8/9/2025 20:11,,
OBCS-10868,OD-2843,Finance / Comptabilité Générale - Demande de suppression des programmations de paiement de dette – OBC,"Nous avons constaté que la *plupart des opérations de programmation de paiement de dette dans l’OBC ont été enregistrées avec le compte général au lieu du compte tiers*, ce qui constitue une erreur de saisie.

Afin de corriger cette situation, le client demande la *suppression de l’ensemble des programmations de paiement concernées*, afin de pouvoir les réenregistrer correctement avec les comptes tiers appropriés.",Edwige KOUASSI,MICHEL TETE,ECORIGINE,,Appel Téléphonique,Finance,Comptabilité Générale,Requêtes,Non renseigné,OBC Customer Support,Priorité 1,À faire,2025-09-08 16:55,8/9/2025 16:55,,
OBCS-10867,OD-2842,RH/Processus de Demande d'absence et congés - Intégration de la limite légale de 10 jours d’absence autorisée dans le système (conformité au Code du travail ivoirien),"Conformément aux dispositions du *Code du travail en vigueur en Côte d’Ivoire*, chaque salarié bénéficie d’un *droit à 10 jours d'absence autorisée par an*, notamment pour des événements exceptionnels tels que :

* Mariage du salarié ou d’un membre proche de la famille,
* Naissance d’un enfant,
* Décès d’un parent proche,
* Autres circonstances prévues par la loi ou la convention collective.

Actuellement, cette limite *ne semble pas être prise en compte dans le système* de gestion des absences.

# *Intégrer un contrôle bloquant ou une alerte* lorsque les 10 jours d’absence autorisée sont dépassés sur une année civile,
# *S’assurer que ce plafond est appliqué par salarié et par année*, indépendamment des autres types d'absence (congés payés, maladies, etc.).

Cette évolution vise à garantir la *conformité légale du système* et à éviter les dépassements non autorisés.",Edwige KOUASSI,MARIE AUDE COFFIE,FIRST CAPITAL,,En présentiel,RH,Gestion employé,Requêtes,Non renseigné,OBC Customer Support,Priorité 1,À faire,2025-09-08 11:55,8/9/2025 11:55,,
OBCS-10824,OD-2839,Finance/Programmation Dette Antérieur,"Dans le formulaire de programmation de  dette antérieur, déverser uniquement les N° de poste comptable tiers de sorte à ce que l’utilisateur ne programme pas de montant sur le compte générale.

!image-20250905-112409.png|width=1177,height=490,alt=""image-20250905-112409.png""!",Edwige KOUASSI,MICHEL TETE,ECORIGINE,,En présentiel,Finance,Comptabilité Générale,Requêtes,Non renseigné,OBC Customer Support,Priorité 1,À faire,2025-09-05 11:23,5/9/2025 11:24,,
OBCS-10823,OD-2838,AGRO/Sous Module Export - Contrat société,"*Création nouvelle fonctionnalité* dans le sous-module *Export - Contrat Société* de l'application AGRO.
Actuellement, aucune fonctionnalité ne permet de gérer les contrats liés aux sociétés exportatrices.

Mettre à disposition une interface permettant la *création, la gestion et le suivi des contrats* des sociétés intervenant dans l’export.

* *Création d’un contrat société*, avec les champs suivants :
** Raison sociale de la société (liste ou saisie libre)
** Référence du contrat
** Date de début / Date de fin
** Type de contrat (Annuel, Ponctuel, etc.)
** Produits / Services concernés
** Conditions commerciales
** Upload de fichiers (PDF, annexes…)
* *Consultation et gestion des contrats existants* :
** Tableau de bord des contrats avec filtres (société, statut, période…)
** Recherche par mot-clé ou référence
** Suivi du statut : _Actif / En attente / Expiré / Résilié_
* *Alertes / notifications* :
** Notification en cas de contrat arrivant à échéance (J-30, J-15…)",Edwige KOUASSI,Ismaël KONE,ECORIGINE,,En présentiel,Opérations,AGRO,Requêtes,Non renseigné,OBC Customer Support,Priorité 1,Terminé(e),2025-09-05 09:59,15/10/2025 21:40,2025-10-15 21:40,
OBCS-10820,OD-2836,CRM/Activités commerciales/Gestion des opportunités/ Les filtres année mois dernier trimestre et semaine n’affichent pas les données souhaitées,CRM/Activités commerciales/Gestion des opportunités/ Les filtres année mois dernier trimestre et semaine n’affichent pas les données souhaitées,N'GBRA MOYE BERNICE DORIS,COULIBALY SERGES,S-TEL,,Appel Téléphonique,CRM,Activités commerciales,Bug,Non renseigné,OBC Customer Support,Priorité 3,Terminé(e),2025-09-03 15:16,16/9/2025 14:51,2025-09-16 14:51,
OBCS-10816,OD-2832,Avance - Liaison de facture vente : Doublons constaté dans les écritures et à la génération du Grand Livre,"Nous avons constaté la génération d’une écriture en double lorsqu’on lie une avance à une facture. Nous avons le cas de Prosuma chez Aric par exemple, pour lequel nous avons 2 avances du 03/04/2025 et du 30/04/2025. Nous avons lié les avances à une facture le 26/08/2025 qui a généré des écritures supplémentaires.",Vivien DAKPOGAN,Kramo,ARIC,,"Online (Google Meet, Teams...)",Finance,Comptabilité Générale,Bug,Mauvais déversement des données,OBC Customer Support,Priorité 1,Terminé(e),2025-09-02 18:20,22/9/2025 08:20,2025-09-22 08:20,
OBCS-10812,OD-2829,Anomalie Grand Livre : A la génération de l'Excel/vrac du grand livre (tiers par exemple),"Grand Livre : A la génération de l'Excel/vrac du grand livre (tiers par exemple) la colonne Compte général récupère les comptes tiers. Aussi la colonne solde progressif n'apparait pas. Il apparait plutôt code projet bien qu'on ait sélectionné ""Normal"" pour le modèle

",Vivien DAKPOGAN,Kramo,ARIC,,"Online (Google Meet, Teams...)",Finance,Comptabilité Générale,Bug,Mauvais déversement des données,OBC Customer Support,Priorité 1,Terminé(e),2025-09-02 17:36,6/10/2025 09:46,2025-10-06 09:46,
OBCS-10811,OD-2828,"Suppression d'un personne de la paie puis recalcule : Lorsqu'on supprime une personne de la paie, il est impossible de faire le recalcul de cette dernière. A moins de supprimer toute la paie et recalculer.","Suppression d'un personne de la paie puis recalcule : Lorsqu'on supprime une personne de la paie, il est impossible de faire le recalcul de cette dernière. A moins de supprimer toute la paie et recalculer.",Vivien DAKPOGAN,Jean-Jacques LIKANE,LABOGEM,,Appel Téléphonique,RH,Salaire,Bug,Dysfonctionnement sur le Calcul des salaires,OBC Customer Support,Priorité 1,Terminé(e),2025-09-02 12:03,3/9/2025 09:05,2025-09-03 09:05,
OBCS-10810,OD-2827,Finance/Comptabilité Général/ Balance Générale - Déséquilibre constaté dans la balance générale,"Lors de l’interrogation de la balance générale, nous avons constaté qu’elle est *déséquilibrée* sur la période du 01 Janvier au 1er Septembre 2025

!image-20250901-190140.png|width=1257,height=701,alt=""image-20250901-190140.png""!",Edwige KOUASSI,Souleymane CISSE,ECORIGINE,,Appel Téléphonique,Finance,Comptabilité Générale,Bug,Incohérence des données,OBC Customer Support,Priorité 3,En cours,2025-09-01 18:55,6/11/2025 14:48,,
OBCS-10808,OD-2826,Finance/Comptabilité Générale/Balance - Anomalie d'affichage du compte SUC001 dans la balance générale,"Lors de l’interrogation de la balance générale, nous avons constaté que le compte *SUC001 (tiers client)* apparaît à la *dernière ligne*, avec un montant de *110 000 000*.

!image-20250901-184738.png|width=1250,height=750,alt=""image-20250901-184738.png""!",Edwige KOUASSI,Souleymane CISSE,ECORIGINE,,Appel Téléphonique,Finance,Comptabilité Générale,Bug,Mauvaise récupération,OBC Customer Support,Priorité 3,En cours,2025-09-01 18:46,2/9/2025 15:30,,
OBCS-10804,OD-2825,Finance/Opération de Caisse/ Edition Opération de caisse - Anomalie modification opération de caisse,"Impossible de modifier une écriture sans avoir sélectionné au préalable une demande de sortie. 

Action menée : 

# Edition de l'écriture
# Modification rubrique concerné
# Enregistrer l’opération 

Résultat : Notification ci dessous

!image-20250901-163321.png|width=1322,height=642,alt=""image-20250901-163321.png""!

Dans le champ demande de sortie aucune demande ne s’affiche à l'édition

!image-20250901-162242.png|width=1641,height=849,alt=""image-20250901-162242.png""!",Edwige KOUASSI,,ONPOINT,,Constat Interne,Finance,Comptabilité Générale,Bug,Modification Imppossible,OBC Customer Support,Priorité 3,Terminé(e),2025-09-01 17:24,2/9/2025 10:32,2025-09-02 10:32,
OBCS-10803,OD-2824,Suppression du plan comptable tiers entité.,Suppression du plan comptable tiers entité.,EVA BASSE,,AFREX/MEHO CAPITAL,,Constat Interne,Finance,Comptabilité Générale,Requêtes,Non renseigné,OBC Customer Support,Priorité 1,Terminé(e),2025-09-01 15:02,1/9/2025 18:38,2025-09-01 18:38,
OBCS-10758,OD-2820,"Comptabilité analytique/Comptes analytiques - Amélioration du filtre dans la section ""Comptes analytiques""","À chaque enregistrement, la page se recharge automatiquement, ce qui m'oblige à cliquer de nouveau sur le bouton ""Enregistrer"" pour que le formulaire réapparaisse. 

Cette manipulation répétitive est fastidieuse et fait perdre du temps lors de la saisie ou du traitement en masse.

Serait-il possible d'améliorer ce processus afin que le formulaire reste affiché après l’enregistrement, ou que la page ne se recharge pas automatiquement ?

Par ailleurs, il serait également très utile d’ajouter un *champ ""N° de code""* dans les filtres, afin de faciliter la recherche et le tri des comptes analytiques.",Edwige KOUASSI,,SERTEM,,Constat Interne,Finance,Comptabilité analytique,Requêtes,Non renseigné,OBC Customer Support,Priorité 1,À faire,2025-08-31 11:17,31/8/2025 11:17,,
OBCS-10759,OD-2821,"Importer un plan analytique entité - Rejet des lignes à l'import – Erreur ""La nature du compte n'existe pas""","Lors d'une tentative d'importation de comptes analytiques, toutes les lignes ont été rejetées avec le message suivant :
*""La nature du compte n'existe pas""*.

Après vérification, j'ai renseigné *le libellé* dans le champ *""N° de compte parent""*, ce qui semble être à l'origine du blocage.

Voici les colonnes du fichier importé :

!image-20250831-114849.png|width=1366,height=650,alt=""image-20250831-114849.png""!

# Confirmer si le champ ""N° de compte parent"" doit contenir *le code* et non *le libellé*,
# M’indiquer la nature exacte de l’erreur liée au champ ""NATURE COMPTE""",Edwige KOUASSI,,SERTEM,,Constat Interne,Finance,Comptabilité analytique,Bug,Import de fichiers impossible,OBC Customer Support,Priorité 1,En cours,2025-08-31 11:48,1/9/2025 15:21,,
OBCS-10757,OD-2819,Suppression contrat et fichier du personnel en double,"Suppression du contrat et du fichier du personnel enregistrés à plusieurs reprises.

Id fichier du personnel : 641 | CC-0284

Id & Matricule Contrat : 362 | CC-0284",Edwige KOUASSI,EHUI Inesse,CILAGRI,,"Online (Google Meet, Teams...)",RH,Gestion employé,Bug,Duplication anormale,OBC Customer Support,Priorité 1,En cours,2025-08-29 12:48,18/9/2025 09:30,,
OBCS-10747,OD-2817,Opération/Vente/Devis / Historique devis - Impossible d'effectuer une action (Suppression/Edition/Modification) sur les devis,"Impossible d'effectuer une action (Supprimer/Editer/Modifier) sur les devis

Message d’erreur apparait également lors de la suppression

!image-20250826-173826.png|width=1534,height=774,alt=""image-20250826-173826.png""!",Edwige KOUASSI,Raïssa CAMARA,JOEL K PROPERTIES,,Appel Téléphonique,Opérations,Vente,Bug,Edition impossible,OBC Customer Support,Priorité 1,Terminé(e),2025-08-26 17:34,28/8/2025 15:58,2025-08-28 15:58,
OBCS-10825,OD-2840,CRM/Offres/Programme offre BTP/ Impossible d'ajouter de nouvelles construction à un programme offre BTP déjà créé,CRM/Activités commerciales/Gestion des opportunités/ Impossible d'ajouter de nouvelles construction à un programme offre BTP déjà créé,N'GBRA MOYE BERNICE DORIS,Roselin Tiecoura,EGBV,,Appel Téléphonique,CRM,Offres,Bug,Non renseigné,OBC Customer Support,Priorité 1,Terminé(e),2025-09-05 20:03,9/9/2025 09:51,2025-09-09 09:51,
OBCS-10696,OD-2816,OPERATIONS/VENTE/Nous constatons que le détail ou l'impression de la facture vente affiche que 4 lignes au lieu du nombre de lignes exact,"OPERATIONS/VENTE/Nous constatons que le détail ou l'impression de la facture vente affiche que 4 lignes au lieu du nombre de lignes exact

Pour exemple nous avons le client KLENZI DISTRIBUTION qui fait apparaitre que 4 liges lors de l’impression ou à l'édition au lieu de 12 lignes enregistrées.

En historique le montant HT est de 601334 (montant correspondant à 12 lignes).",N'GBRA MOYE BERNICE DORIS,ERIC KOUADIO,FALCON,,Appel Téléphonique,Opérations,Vente,Bug,Mauvais déversement des données,OBC Customer Support,Priorité 1,Terminé(e),2025-08-22 15:18,29/8/2025 08:34,2025-08-29 08:34,
OBCS-10692,OD-2812,CRM/OFFRE/PROGRAMME OFFRE BTP/ Impossible de supprimer les programmes enregistrés malgré que la gestion des opportunités er les zones soient vides,CRM/OFFRE/PROGRAMME OFFRE BTP/ Impossible de supprimer les programmes enregistrés malgré que les historiques de “gestion des opportunités” et ”fiche offre BTP” soient vides,N'GBRA MOYE BERNICE DORIS,Amary TCHOTCHE,EGBV,,Appel Téléphonique,CRM,Offres,Bug,Suppression impossible,OBC Customer Support,Priorité 1,Terminé(e),2025-08-21 09:18,2/9/2025 10:44,2025-09-02 10:44,
OBCS-10689,OD-2810,Dysfonctionnement sur le filtre PROGRAMMATION DE REGLEMENT FOURNISSEUR,OPERATION/PROGRAMMATION DE REGLEMENT FOURNISSEUR/ Nous constatons que le filtre date n’affiche le detail sur 2024.,EVA BASSE,,SIT BTP,,Constat Interne,Opérations,Achat,Bug,Dysfonctionnement des filtres,OBC Customer Support,Priorité 1,Terminé(e),2025-08-19 11:42,27/8/2025 09:03,2025-08-27 09:03,
OBCS-10691,OD-2811,RH/Gestion Employé / Congés et Absence/ Suppression de toutes les demande d'absence et de congés - Pour réorganisation et mise à jour du stock de congés,RH/Gestion Employé / Congés et Absence/ Suppression de toutes les demande d'absence et de congés - Pour réorganisation et mise à jour du stock de congés,EVA BASSE,SYLVIANE KOBRI,FIRST CAPITAL,,"Online (Google Meet, Teams...)",RH,Gestion employé,Requêtes,Non renseigné,OBC Customer Support,Priorité 1,En cours,2025-08-19 23:04,2/9/2025 14:18,,
OBCS-10678,OD-2800,Impossible de Supprimer un Fichier du personnel,Impossible de supprimer un fichier du personnel bien que celui ci ne soit rattaché à un contrat employé.,Edwige KOUASSI,EHUI Inesse,CILAGRI,,"Online (Google Meet, Teams...)",RH,Gestion employé,Bug,Suppression impossible,OBC Customer Support,Priorité 1,Terminé(e),2025-08-18 13:27,31/8/2025 12:05,2025-08-31 12:05,
OBCS-10684,OD-2806,"Opération / Analytique / Achat - Refonte Dashboard _ Création d'un bloc recap ""bon de commande"" émis sur le tableau de bord",h1. Refonte Dashboard- Création d'un bloc récapitulatif des B de commande émis,Edwige KOUASSI,M. SANANKOUA,ONPOINT,,En présentiel,Opérations,Analytique,Requêtes,Non renseigné,OBC Customer Support,Priorité 1,À faire,2025-08-18 18:19,18/8/2025 18:19,,
OBCS-10683,OD-2805,"Opération / Analytique / Achat -  Refonte Dashboard, Création d'une section recap demande d'achat sur le tableau de bord",Refonte Dashboard Création d'une section recap demande d’achat,Edwige KOUASSI,M. SANANKOUA,ONPOINT,,En présentiel,Opérations,Analytique,Requêtes,Non renseigné,OBC Customer Support,Priorité 1,Terminé(e),2025-08-18 18:08,17/10/2025 10:44,2025-10-17 10:44,
OBCS-10682,OD-2804,"Opération / Analytique / Achat -  Refonte Dashboard, Création d'une section Factures fournisseurs","Refonte Dashboard, Création d'une section Factures fournisseurs",Edwige KOUASSI,M. SANANKOUA,ONPOINT,,En présentiel,Opérations,Analytique,Requêtes,Non renseigné,OBC Customer Support,Priorité 1,Terminé(e),2025-08-18 18:05,17/10/2025 09:59,2025-10-17 09:59,
OBCS-10681,OD-2803,"Opération / Analytique / Vente -  Refonte Dashboard, Création d'une section Factures clients","Opération / Analytique / Vente -  Refonte Dashboard, Création d'une section Factures clients",Edwige KOUASSI,M. SANANKOUA,ONPOINT,,En présentiel,Opérations,Analytique,Requêtes,Non renseigné,OBC Customer Support,Priorité 1,Terminé(e),2025-08-18 18:01,16/9/2025 16:23,2025-09-16 16:23,
OBCS-10680,OD-2802,Refonte Dashboard /Opération / Analytique / Vente - Création d'une section récap des devis enregistré à date,Vente - Création d'une section récap des devis enregistré à date,Edwige KOUASSI,M. SANANKOUA,ONPOINT,,En présentiel,Opérations,Analytique,Requêtes,Non renseigné,OBC Customer Support,Priorité 1,Terminé(e),2025-08-18 17:56,31/8/2025 12:21,2025-08-31 12:21,
OBCS-10679,OD-2801,RH/Gestion Employé/ Fichier du personnel,"Modification de masse des N° de matricule.

Nomenclature Actuel : CC0001 

Mise à jour demandé : CC{color:#ff5630}*-*{color}0001",Edwige KOUASSI,EHUI Inesse,CILAGRI,,"Online (Google Meet, Teams...)",RH,Gestion employé,Requêtes,Non renseigné,OBC Customer Support,Priorité 1,À faire,2025-08-18 13:33,18/8/2025 13:33,,
OBCS-10635,OD-2796,Agro/ Création fonctionnalité / Mouvements de lots – Gestion et traçabilité,"Mettre en place une fonctionnalité de gestion des mouvements de lots dans le module Agro, permettant de tracer les entrées, sorties et transferts entre différents emplacements (champs, silos, entrepôts...).

*Description :*

* Permettre l'enregistrement de tous les mouvements de lots avec date, quantité, unité, origine, destination, utilisateur.
* Historique consultable par lot.
* Impact des mouvements sur le stock temps réel.
* Lier les mouvements aux documents associés (bon de transfert, de livraison, etc.).",Edwige KOUASSI,MICHEL TETE,ECORIGINE,,En présentiel,Opérations,AGRO,Requêtes,Non renseigné,OBC Customer Support,Priorité 1,Terminé(e),2025-08-14 09:25,29/9/2025 07:53,2025-08-14 10:43,
OBCS-10633,OD-2793,"Bordereau de retour : A la validation d'une quantité retournée, le stock n'est pas incrémenté de sa valeur. La quantité retournée n'est pas impactée","Bordereau de retour : A la validation d'une quantité retournée, le stock n'est pas incrémenté de sa valeur. La quantité retournée n'est pas impactée",Vivien DAKPOGAN,Fidel Benao,ARIC,,Appel Téléphonique,Opérations,Gestion de stock,Bug,Récupération de données impossible,OBC Customer Support,Priorité 1,Terminé(e),2025-08-12 11:03,9/9/2025 12:15,2025-09-09 12:15,
OBCS-10632,OD-2792,Suppression des journaux comptables de l'exercice 2024 de SERTEM GROUPE SASU.,Suppression des journaux comptables de l’exercice 2024.,EVA BASSE,,SERTEM,,Constat Interne,Finance,Comptabilité Générale,Requêtes,Non renseigné,OBC Customer Support,Priorité 1,À faire,2025-08-12 10:23,12/8/2025 10:23,,
OBCS-10623,OD-2784,Page d'erreur après chargement de la fonctionnalité gestion des prospects,"Page d'erreur après chargement de la fonctionnalité gestion des prospects



Controleur : Client   |  Action : IndexProspect
Message : Cannot perform runtime binding on a null reference
StackTrace : at CallSite.Target(Closure , CallSite , Object ) at System.Dynamic.UpdateDelegates.UpdateAndExecute1[T0,TRet](CallSite site, T0 arg0) at ASP._Page_Views_Client_IndexProspect_cshtml.<Execute>b__39(Object item) in c:\inetpub\wwwroot\onpointbusinesscenter\Views\Client\IndexProspect.cshtml:line 199 at System.Web.Helpers.WebGridRenderer.Format(Func{{2 format, Object arg) at System.Web.Helpers.WebGridRenderer.<>c__DisplayClass1_0.<Table>b__0(TextWriter __razor_helper_writer) at System.Web.WebPages.HelperResult.ToString() at System.Web.WebPages.WebPageBase.Write(Object value) at ASP._Page_Views_Client_IndexProspect_cshtml.Execute() in c:\inetpub\wwwroot\onpointbusinesscenter\Views\Client\IndexProspect.cshtml:line 168 at System.Web.WebPages.WebPageBase.ExecutePageHierarchy() at System.Web.Mvc.WebViewPage.ExecutePageHierarchy() at System.Web.WebPages.StartPage.ExecutePageHierarchy() at System.Web.WebPages.WebPageBase.ExecutePageHierarchy(WebPageContext pageContext, TextWriter writer, WebPageRenderingBase startPage) at System.Web.Mvc.ViewResultBase.ExecuteResult(ControllerContext context) at System.Web.Mvc.ControllerActionInvoker.InvokeActionResultFilterRecursive(IList}}1 filters, Int32 filterIndex, ResultExecutingContext preContext, ControllerContext controllerContext, ActionResult actionResult) at System.Web.Mvc.ControllerActionInvoker.InvokeActionResultFilterRecursive(IList{{1 filters, Int32 filterIndex, ResultExecutingContext preContext, ControllerContext controllerContext, ActionResult actionResult) at System.Web.Mvc.ControllerActionInvoker.InvokeActionResultFilterRecursive(IList}}1 filters, Int32 filterIndex, ResultExecutingContext preContext, ControllerContext controllerContext, ActionResult actionResult) at System.Web.Mvc.ControllerActionInvoker.InvokeActionResultWithFilters(ControllerContext controllerContext, IList`1 filters, ActionResult actionResult) at System.Web.Mvc.Async.AsyncControllerActionInvoker.<>c__DisplayClass21.<BeginInvokeAction>b__1e(IAsyncResult asyncResult)",N'GBRA MOYE BERNICE DORIS,FABIEN VATI,ONPOINT,,E-mail,CRM,Client,Bug,Page d'erreur,OBC Customer Support,Priorité 1,Terminé(e),2025-08-11 15:18,20/8/2025 08:10,2025-08-20 08:10,
OBCS-10622,OD-2783,Analyser mon stock/ mouvement récapitulatif de stock/Le CMUP de plusieurs articles est incorrecte (voir le fichier excel détaillé),Analyser mon stock/ mouvement récapitulatif de stock/Le CMUP de plusieurs articles est incorrecte (voir le fichier Excel détaillé dans la feuille intitulée *NOUVEAU STOCK A CORRIGER)*,N'GBRA MOYE BERNICE DORIS,MONSIEUR KOUASSI,S-TEL,,Appel Téléphonique,Opérations,Gestion de stock,Bug,Historique vide/non exhaustif,OBC Customer Support,Priorité 1,Terminé(e),2025-08-11 10:02,29/9/2025 18:56,2025-09-29 18:56,
OBCS-10628,OD-2788,Finance/Comptabilité Générale/Audit/ Réconciliation bancaire,"Donner la possibilité d’effectuer un rapprochement bancaire en utilisant le fichier transmis par la banque, ce qui nécessite que notre système puisse s'adapter aux données qu'il fournit.

Permettre le rapprochement bancaire en se basant sur les données disponibles dans le fichier du client, en levant l’obligation sur la colonne “REFERENCE_OPERATION” Cela aiderait grandement à répondre aux besoins du client et à faciliter la réconciliation bancaire

----

!image-20250811-185452.png|width=930,height=169,alt=""image-20250811-185452.png""!",Edwige KOUASSI,Florence OUAYOU,FIRST CAPITAL,,"Online (Google Meet, Teams...)",Finance,Comptabilité Générale,Requêtes,Non renseigné,OBC Customer Support,Priorité 1,À faire,2025-08-11 18:50,11/8/2025 18:55,,
OBCS-10626,OD-2787,CRM/ACTIVITE COMMERCIALE/HISTORIQUE DE GESTION DES OPPORTUNITES/Revoir le tri du listing des opportunités en historique de gestion des opportunités pour prioriser les “en cours” au niveau des étapes du pipeline,"CRM/ACTIVITE COMMERCIALE/HISTORIQUE DE GESTION DES OPPORTUNITES/Revoir le tri du listing des opportunités en historique de gestion des opportunités pour prioriser les “en cours” au niveau des étapes du pipeline.

*Exemple* : Dans le listing des opportunités, nous avons les différentes étapes du pipeline qui donnent des nombres tel que *“analyse des besoins 12”* au lieu de *3* qui sont en cours actuellement et le reste du nombre (*9*) qui sont des opportunités *perdues* ou *gagnées* ou *abandonnées*.{color:#ffffff}*5*{color}",N'GBRA MOYE BERNICE DORIS,FABIEN VATI,ONPOINT,,En présentiel,CRM,Activités commerciales,Requêtes,Non renseigné,OBC Customer Support,Priorité 1,À faire,2025-08-11 15:56,11/8/2025 15:56,,
OBCS-10625,OD-2786,"CRM/ACTIVITE COMMERCIALE/HISTORIQUE DE GESTION DES OPPORTUNITES/ Afficher en premier les opportunités en cours dans la liste récapitulative composée des offres en cours, abandonnées, gagnées et perdues","CRM/ACTIVITE COMMERCIALE/HISTORIQUE DE GESTION DES OPPORTUNITES/ Afficher en premier les opportunités en cours dans la liste récapitulative composée des offres en cours, abandonnées, gagnées et perdues",N'GBRA MOYE BERNICE DORIS,FABIEN VATI,ONPOINT,,En présentiel,CRM,Activités commerciales,Requêtes,Non renseigné,OBC Customer Support,Priorité 1,À faire,2025-08-11 15:35,11/8/2025 15:35,,
OBCS-10617,OD-2782,"Gestion des opportunités : Dans le filtre de sélection des commerciaux, donnez la possibilité de pouvoir sélectionner plusieurs en plus de Tout ou Un","Gestion des opportunités : Dans le filtre de sélection des commerciaux, donnez la possibilité de *pouvoir sélectionner plusieurs* en plus de Tout ou Un",Vivien DAKPOGAN,Fidel Benao,ARIC,,Appel Téléphonique,CRM,Activités commerciales,Requêtes,Non renseigné,OBC Customer Support,Priorité 2,Terminé(e),2025-08-09 18:34,26/8/2025 08:28,2025-08-26 08:28,
OBCS-10558,OD-2781,Suppression des comptes tiers de la balance générale 2025.,"Après avoir effectué un pointage entre les données de la balance générale & le RAN 2025, nous avons constaté que les comptes tiers apparaissent sur la balance, bien que créé dans les comptes tiers.

Suppression des comptes tiers de la balance générale 2025.",EVA BASSE,,ARIC,,Constat Interne,Finance,Comptabilité Générale,Bug,Mauvais déversement des données,OBC Customer Support,Priorité 1,Terminé(e),2025-08-06 16:54,7/8/2025 16:51,2025-08-07 16:51,
OBCS-10520,OD-2767,Finance/Comptabilité Générale/ Livre comptable/ Balance comptable (Générale/Tiers) - Aucune données lors de l'affichage de la balance générale,"h1. Aucune données lors de l'affichage de la balance générale et tiers

!image-20250731-192414.png|width=1534,height=722,alt=""image-20250731-192414.png""!",Edwige KOUASSI,KONE Mariam,SIT BTP,,Appel Téléphonique,Finance,Comptabilité Générale,Bug,Non affichage de pages/données,OBC Customer Support,Priorité 1,Terminé(e),2025-07-31 19:23,1/8/2025 14:39,2025-08-01 14:39,
OBCS-10517,OD-2766,Journal général/import d'écritures comptables ventes/ Malgré l'existence des tiers clients dans le module opération (compte client) et finance (plan comptable tiers) les imports ne sont pas enregistrés,"Journal général/import d'écritures comptables ventes/ Malgré l'existence des tiers clients dans le module opération (compte client) et finance (plan comptable tiers) les imports ne sont pas enregistrés

",N'GBRA MOYE BERNICE DORIS,ZAGBAYOU ANNE,EDIPRESSE,,Appel Téléphonique,Finance,Comptabilité Générale,Bug,Import de fichiers impossible,OBC Customer Support,Priorité 1,Terminé(e),2025-07-31 17:28,1/8/2025 19:11,2025-08-01 19:11,
OBCS-10512,OD-2762,Impossible d'afficher une balance générale et tiers,Impossible d'afficher une balance générale et tiers,Edwige KOUASSI,,JOEL K PROPERTIES,,Constat Interne,Finance,Comptabilité Générale,Bug,Non affichage de pages/données,OBC Customer Support,Priorité 1,Terminé(e),2025-07-30 12:08,1/8/2025 14:28,2025-08-01 14:28,
OBCS-10511,OD-2761,Suppression du compte 4711OC de la balance générale 2024 de KDA,"Dans la balance générale 2024 KDA, il y a un compte tiers qui devait pas y apparaitre. Ce compte tiers à été pris en compte dans le compte 4711 Créditeur divers.",EVA BASSE,,KOFFI & DIABATE,,Constat Interne,Finance,Comptabilité Générale,Bug,Mauvais déversement des données,OBC Customer Support,Priorité 1,Terminé(e),2025-07-30 09:39,1/8/2025 16:42,2025-08-01 16:42,
OBCS-10419,OD-2712,Modification de la requête sur nomenclature de bon de commande,"Modification de la requête sur nomenclature de bon de commande tel que 

# Adapter la nomenclature du bon de commande au modèle 6 (modele SIE TRAVAUX)
# Rajouter le numéro séquentiel du bon de commande (*OD-2486* (*Modifier la nomenclature du numéro du bon de commande comme suit : BC-[3 premières lettres du projet]-[2 chiffres de l'année en cours]-*{color:#bf2600}*[Numéro séquentiel du bon]*{color}*. Exemple : BC-PER 23-*{color:#bf2600}*001*{color})",N'GBRA MOYE BERNICE DORIS,KOUAME KONAN GUY ROGER,SIE-TRAVAUX,,"Online (Google Meet, Teams...)",Opérations,Achat,Bug,Mauvais déversement des données,OBC Customer Support,Priorité 1,Terminé(e),2025-07-22 16:18,24/7/2025 17:56,2025-07-24 17:56,
OBCS-10365,OD-2709,Finance/Comptabilité générale/Plan comptable tiers entité/ Doublons compte tiers client,"Doublons compte tiers (4111OC).

*Solution* : Fusionner ces deux comptes.",EVA BASSE,,KOFFI & DIABATE,,Constat Interne,Finance,Comptabilité Générale,Bug,Duplication anormale,OBC Customer Support,Priorité 1,Terminé(e),2025-07-18 14:38,30/7/2025 09:14,2025-07-30 09:14,
OBCS-10371,OD-2710,CRM/Vente/Devis - Retirer la condition de sélection de l'offre dans le formulaire de Devis,Retirer la condition de sélection de l'offre dans le formulaire de Devis qui se trouve dans CRM Opportunité Onglet Facturation,Edwige KOUASSI,,ARIC,,En présentiel,CRM,Offres,Requêtes,Non renseigné,OBC Customer Support,Priorité 1,Terminé(e),2025-07-18 16:16,28/7/2025 09:43,2025-07-28 09:43,
OBCS-10693,OD-2813,"Ressources Humaines | Salaire Opérations de paie : ODP  - Ecart écriture de paie généré, Montant d'écart 22000","Ecart écriture de paie généré, Montant d'écart 22000",Edwige KOUASSI,Nadia Jocelyn Bouazo,CILAGRI,,Appel Téléphonique,RH,Salaire,Bug,Mauvais déversement des données,OBC Customer Support,Priorité 1,À faire,2025-08-21 15:31,21/8/2025 15:31,,
OBCS-10356,OD-2706,Finance/Comptabilité Général/ Audit - Réconciliation bancaire {Message d'erreur lors d'une opération de réconciliation bancaire},"Message d'erreur lors de l’enregistrement d’une opération de réconciliation bancaire}

!image-20250717-180721.png|width=1689,height=920,alt=""image-20250717-180721.png""!

h2. Attention

Exception-Create : resumeExecutionMethod : --STEP-00----STEP-01----STEP-02----STEP-03----STEP-03--indexMvtTreso:1--bis01----STEP-03--indexMvtTreso:1--bis02----STEP-03--indexMvtTreso:1--bis02 v1----STEP-03--indexMvtTreso:1--bis02 v2----STEP-03--indexMvtTreso:1--bis02 v3----STEP-03--indexMvtTreso:1--bis02 v4----STEP-03--indexMvtTreso:2--bis01----STEP-03--indexMvtTreso:2--bis02----STEP-03--indexMvtTreso:2--bis02 v1----STEP-03--indexMvtTreso:2--bis02 v2----STEP-03--indexMvtTreso:2--bis02 v3-- ---------//--------- An item with the same key has already been added. // at System.ThrowHelper.ThrowArgumentException(ExceptionResource resource) at System.Collections.Generic.Dictionary`2.Insert(TKey key, TValue value, Boolean add) at ONPOINTBUSINESSCENTER.Controllers.ReconciliationBancaireController.Create(ReconciliationBancaireVModel ReconciliationBancaireVModel)",Edwige KOUASSI,Florence OUAYOU,FIRST CAPITAL,,"Online (Google Meet, Teams...)",Finance,Comptabilité Générale,Bug,Page d'erreur,OBC Customer Support,Priorité 1,En cours,2025-07-17 18:08,30/7/2025 13:02,,
OBCS-10359,OD-2707,Devis - CRM : Donner la possibilité de pouvoir saisir un devis à partir d'une offre quelque soit le type d'opération,Devis - CRM : Donner la possibilité de pouvoir saisir un devis à partir d'une offre quelque soit le type d'opération,Vivien DAKPOGAN,NDADJI Koua Henry Michel,ARIC,,Chat WhatsApp,CRM,Activités commerciales,Requêtes,Non renseigné,OBC Customer Support,Priorité 1,Terminé(e),2025-07-17 20:01,28/7/2025 09:43,2025-07-28 09:43,
OBCS-10351,OD-2702,"Projet/Gestion Projet - Impossible de modifier les dates d'un projet, une notification ""Attention"" affiche sans donner suite à l'action","Impossible de modifier les dates d'un projet, une notification ""Attention"" affiche sans donner suite à l'action

!WhatsApp Image 2025-07-16 à 15.11.57_bcfd8345-20250716-151726.jpg|width=1280,height=480,alt=""WhatsApp Image 2025-07-16 à 15.11.57_bcfd8345-20250716-151726.jpg""!",Edwige KOUASSI,Ursula YANGANGOUSSOU,ONPOINT,,En présentiel,Projets,Gérer mes projets,Bug,Edition impossible,OBC Customer Support,Priorité 1,Terminé(e),2025-07-16 15:45,18/7/2025 15:34,2025-07-18 15:34,
OBCS-10346,OD-2697,"Ecriture manuelle - Ventilation : A l'enregistrement d'une opération ventilé avec une valeur négative, elle apparait vide dans l'historique des données","Ecriture manuelle - Ventilation : A l'enregistrement d'une opération ventilé avec une valeur négative, elle apparait vide dans l'historique des données",Vivien DAKPOGAN,,KOFFI & DIABATE,,En présentiel,Finance,Comptabilité analytique,Bug,Récupération de données impossible,OBC Customer Support,Priorité 1,Terminé(e),2025-07-15 10:35,21/7/2025 07:57,2025-07-21 07:57,
OBCS-10345,OD-2696,"Ecriture manuelle : A l'édition d'une écriture manuelle avec pour valeur négative, il est impossible d'enregistrer. Il met un message d'erreur en P.J","Ecriture manuelle : A l'édition d'une écriture manuelle avec pour valeur négative, il est impossible d'enregistrer. Il met un message d'erreur en P.J",Vivien DAKPOGAN,,KOFFI & DIABATE,,En présentiel,Finance,Comptabilité analytique,Bug,Enregistrement impossible,OBC Customer Support,Priorité 1,Terminé(e),2025-07-15 10:33,21/7/2025 07:56,2025-07-21 07:56,
OBCS-10344,OD-2695,"Facture vente : A l'édition d'une facture vente, les taux des taxes disparaissent. Et à la modification des montant la taxe ne se met pas automatiquement à jour","Facture vente : A l'édition d'une facture vente, les taux des taxes disparaissent. Et à la modification des montant la taxe ne se met pas automatiquement à jour",Vivien DAKPOGAN,Tapé Thibault Julien,ARIC,,Appel Téléphonique,Opérations,Vente,Bug,Récupération de données impossible,OBC Customer Support,Priorité 1,Terminé(e),2025-07-15 10:30,16/7/2025 09:23,2025-07-16 09:23,
OBCS-10350,OD-2701,Fonctionnalité exclusion : Intégration exclusion de certains journaux de la balance,Fonctionnalité exclusion : Intégration exclusion de certains journaux de la balance,Vivien DAKPOGAN,LYTA KENA-RABE,KOFFI & DIABATE,,Appel Téléphonique,Finance,Comptabilité analytique,Requêtes,Non renseigné,OBC Customer Support,Priorité 1,Terminé(e),2025-07-16 07:53,21/7/2025 07:57,2025-07-21 07:57,
OBCS-10349,OD-2700,Opération/Tableau de bord Vente - Vérification cohérence de données Dashboard Vente,"Objet : Test approfondie et détaillé 

Action à mener : Vérification cohérence de données Dashboard Vente",Edwige KOUASSI,M. SANANKOUA,ONPOINT,,En présentiel,Opérations,Analytique,Requêtes,Non renseigné,OBC Customer Support,Priorité 1,En cours,2025-07-15 22:58,17/7/2025 09:29,,
OBCS-10329,OD-2693,Opération/Achat/ Bon de commande - Erreur lors del'édition d'un bon de commande,"Erreur lors de l'édition d'un bon de commande, erreur signalé par le client, aucun détails supplémentaire.",Edwige KOUASSI,KONE Mariam,SIT BTP,,Appel Téléphonique,Opérations,Achat,Bug,Page d'erreur,OBC Customer Support,Priorité 1,Terminé(e),2025-07-13 23:07,15/7/2025 17:57,2025-07-13 23:49,
OBCS-10317,OD-2692,La base fiscale reste égale à la base sociale bien que la prime de fonction soit socialement imposable,La base fiscale reste égale à la base sociale bien que la prime de fonction soit socialement imposable,Vivien DAKPOGAN,Ousseyni Oumarou,EJARA,,Appel Téléphonique,RH,Salaire,Bug,Mauvais déversement des données,OBC Customer Support,Priorité 1,Terminé(e),2025-07-13 07:00,13/7/2025 07:01,2025-07-13 07:01,
OBCS-10316,OD-2691,Dysfonctionnement sur l'affichage des Etats résumé des cotisations sociales,Dysfonctionnement sur l'affichage des Etats résumé des cotisations sociales,Vivien DAKPOGAN,Sanankoua Mickaelle,ARIC,,E-mail,RH,Documents,Bug,Mauvais déversement des données,OBC Customer Support,Priorité 1,Terminé(e),2025-07-13 06:58,13/7/2025 07:01,2025-07-13 07:01,
OBCS-10275,OD-2690,"Labogem : Intégration Processus de vente (Modèle devis, Ordre d'exécution, facture client)","Intégration du processus de vente de Labogem.

3 éléments essentiels pour nous :


#  L’intégration de leur modèle de devis (joint)
# Intégration du modèle d’ordre d’exécution
# Intégration de leur modèle de facture

Faut noter que nous pouvons nous servir des modèles existants, pour aller vite en faisant des modifications.

Il faut falloir rattaché leur process dans un workflow updaté au workflow de vente classique 

",Vivien DAKPOGAN,KANATE VASSIRIKI,LABOGEM,,En présentiel,Opérations,Vente,Requêtes,Non renseigné,OBC Customer Support,Priorité 1,En cours,2025-07-09 17:15,10/9/2025 14:47,,
OBCS-10273,OD-2688,Module Finance / Comptabilité Générale /Livre comptable - Ecart balance Exercice 2024,"Ecart constatés sur la balance comptable de l’exercice 2024

*Période données équilibré :* Janvier - Juin 

Période concernée par le déséquilibre :  Juillet à Décembre 2024

{color:#ff5630}*01/07/2024 - 30/07/2024 [Ecart Juillet = 1]*{color}

0 ───────── ─────────  13 142 090

13 142 089 ─────────  ───────── 0

{color:#ff5630}*01/08/2024 - 30/08/2024 [Ecart Aout = 1]*{color}

65 884 398  ───────── ────────  0

0  ──────── ─────────  65 884 397

{color:#ff5630}*01/9/2024 - 30/09/2024 [Ecart Septembre = 1]*{color}

84 540 674 ───────── ─────────  0

0  ───────  ──────────  84 540 673

{color:#ff5630}*01/10/2024 - 31/10/2024 [Ecart Octobre = 99]*{color}

148 104 231 ───────── ────────── 0

0  ──────── ─────────── 148 104 330

{color:#ff5630}*01/11/2024 - 30/11/2024 [Ecart Septembre = 100]*{color}

 182 803 478 ───────── ─────────  0

0  ───────  ──────────  182 803 578

{color:#ff5630}*01/12/2024 - 31/12/2024 [Ecart Décembre = 600]*{color}

202 570 067 ───────── ────────── 0

0  ──────── ───────────  202 570 667",Edwige KOUASSI,Jean-Jacques LIKANE,LABOGEM,,Appel Téléphonique,Finance,Comptabilité Générale,Bug,Erreur de calcul/Erreur sur Dashboard,OBC Customer Support,Priorité 1,Terminé(e),2025-07-08 17:54,10/7/2025 19:21,2025-07-10 19:21,
OBCS-10274,OD-2689,Opération/Achat /Immobilisation - La création de sous totaux pour chaque famille d'immobilisation,"A la génération du tableau d’amortissement faire apparaitre les sous totaux pour chaque famille d’immobilisation pour simplifier la lecture du tableau d’amortissement (TA).

[^AMORTISSEMENT LABOGEM.xls] ",Edwige KOUASSI,Jean-Jacques LIKANE,LABOGEM,,Appel Téléphonique,Opérations,Immobilisations,Requêtes,Non renseigné,OBC Customer Support,Priorité 1,À faire,2025-07-08 18:13,4/8/2025 21:14,,
OBCS-10347,OD-2698,RH/Document/Gestion des Employés - Impossible d'afficher & imprimer les contrats des agents enquêteurs,"Impossible d'afficher & imprimer les contrats des agents enquêteurs



!image-20250715-172019.png|width=1858,height=929,alt=""image-20250715-172019.png""!",Edwige KOUASSI,Gaelle TOURE,ONPOINT,,En présentiel,RH,Documents,Bug,Impression impossible,OBC Customer Support,Priorité 1,Terminé(e),2025-07-15 17:17,16/7/2025 11:25,2025-07-16 11:25,
OBCS-10263,OD-2683,Finance/Comptabilité Générale / PROGRAMMATION PAIEMENT DETTE,"Impossible de programmer une programmation de paiement dette.

Aucune action derrière le bouton Nouvelle Programmation paiement de dette antérieur ",Edwige KOUASSI,MICHEL TETE,ECORIGINE,,Appel Téléphonique,Finance,Comptabilité Générale,Bug,Edition impossible,OBC Customer Support,Priorité 1,En cours,2025-07-07 11:28,7/7/2025 17:26,,
OBCS-10266,OD-2686,OBC - Réorganisation des dossiers / Modules & Fonctionnalité,Réorganisation des dossiers par modules et fonctionnalités et ajout des fichiers dans la Clean Architecture,Edwige KOUASSI,Ulrich GBO,ONPOINT,,En présentiel,Global,Global,Requêtes,Non renseigné,OBC Customer Support,Priorité 1,Terminé(e),2025-07-07 14:14,15/7/2025 22:43,2025-07-15 22:43,Global
OBCS-10265,OD-2685,Opération/Achat/Facture Avoir - Prendre en compte la réinitialisation du bon de commande après une facture d'avoir.,"Après avoir établie une facture d’avoir, le bon de commande ne se déverse pas à l’enregistrement d’une nouvelle facture.",Edwige KOUASSI,KONE Mariam,SIT BTP,,"Online (Google Meet, Teams...)",Opérations,Achat,Requêtes,Non renseigné,OBC Customer Support,Priorité 1,À faire,2025-07-07 12:07,7/7/2025 12:07,,
OBCS-10202,OD-2681,Facture vente/Modification/Impossible de modifier les factures ventes,"Facture vente/Modification/Impossible de modifier les factures ventes.

Quand on modifie les quantités les anciens montants restent figés.

quand on clique sur enregistrer il y a un message d’erreur.

!Capture d’écran 2025-07-03 171602.png|width=1200,height=675,alt=""Capture d’écran 2025-07-03 171602.png""!",N'GBRA MOYE BERNICE DORIS,ERIC KOUADIO,FALCON,,Appel Téléphonique,Opérations,Vente,Bug,Non affichage de pages/données,OBC Customer Support,Priorité 1,Terminé(e),2025-07-04 09:53,4/7/2025 18:52,2025-07-04 18:52,
OBCS-10201,OD-2680,"BL - Import en Excel : EN cliquant sur le lien, la page devient noir, impossible de faire un import","BL - Import en Excel : EN cliquant sur le lien, la page devient noir, impossible de faire un import",Vivien DAKPOGAN,Brahima COULIBALY,KORI TRANSPORT,,Appel Téléphonique,Opérations,Vente,Bug,Error 503,OBC Customer Support,Priorité 1,Terminé(e),2025-07-04 07:13,6/7/2025 17:46,2025-07-06 17:46,
OBCS-10200,OD-2679,Nous constatons un mauvais calcul du total cotisation à cause des rubriques qui ont le sous-groupe RETRAITE qui ont changé en passant à un champ vide,Nous constatons un mauvais calcul du total cotisation à cause des rubriques qui ont le sous-groupe RETRAITE qui ont changé en passant à un champ vide,Vivien DAKPOGAN,,ARIC,,En présentiel,RH,Paramétrage,Bug,Historique vide/non exhaustif,OBC Customer Support,Priorité 1,Terminé(e),2025-07-04 07:04,6/7/2025 17:46,2025-07-06 17:46,
OBCS-10248,OD-2682,Comptabilisation de la paie : Message d'erreur à la génération des écritures de paie,Comptabilisation de la paie : Message d'erreur à la génération des écritures de paie,Vivien DAKPOGAN,,ARIC,,En présentiel,RH,Salaire,Bug,Récupération de données impossible,OBC Customer Support,Priorité 1,Terminé(e),2025-07-04 17:24,15/7/2025 17:57,2025-07-15 17:57,
OBCS-10179,OD-2677,Finance - Comptabilité Générale - Ecart Balance,"Entité Concerné :  EJARA CENTRAL AFRICA & MAKEDA ASSET MANAGEMENT

Makeda :  en Septembre la balance est équilibrée, par contre en Octobre on remarque un écart de 1 franc

Lorsqu'on génère la balance du mois d'Octobre (du 1er au 31 Octobre), elle est quant à elle équilibrée,

Idem pour EJARA CENTRAL AFRICA cette fois entre Octobre et Novembre",Edwige KOUASSI,Ousseyni Oumarou,EJARA,,Appel Téléphonique,Finance,Comptabilité Générale,Bug,Autres,OBC Customer Support,Priorité 1,Terminé(e),2025-07-01 16:56,6/7/2025 19:06,2025-07-06 19:06,
OBCS-10180,OD-2678,RH/Gestion Employé/Fichier du personnel - Fonction Export de données,"🛠 Requête d'amélioration du processus d’importation & exportation des données du personnel

*Contexte :*
Lors de la mise à jour du fichier du personnel et des contrats des employés du groupe OP, des données ont été importées afin de mettre à jour les informations existantes. Pour vérifier la conformité de ces données importées, un export du fichier a été réalisé à des fins de comparaison.

*Problème constaté :*
L’export généré ne reflète pas l’ensemble des données enregistrées ou importées. Après vérification de certains fichiers (notamment les formulaires employés), plusieurs champs essentiels n’ont pas été pris en compte notamment :

* La civilité
* La situation matrimoniale
* Le numéro de poste comptable
* etc. 

Cette omission rend le fichier exporté incomplet et inutilisable pour les vérifications ou traitements ultérieurs.

*Requête :*
➡️ Lors de l’exportation des données enregistrées, il est impératif de prendre en compte l’intégralité des informations importées, y compris tous les champs du formulaire employé, pour chaque employé concerné.",Edwige KOUASSI,Ursula YANGANGOUSSOU,ONPOINT,,En présentiel,RH,Gestion employé,Requêtes,Non renseigné,OBC Customer Support,Priorité 2,Terminé(e),2025-07-02 16:15,8/7/2025 10:14,2025-07-08 10:14,
OBCS-10550,OD-2773,Intégration modèle d'attestation de congé avec les modifications en attente,Intégration modèle d'attestation de congé avec les modifications en attente,Vivien DAKPOGAN,Brahima COULIBALY,KORI TRANSPORT,,E-mail,RH,Documents,Requêtes,Non renseigné,OBC Customer Support,Priorité 2,Terminé(e),2025-08-04 09:44,4/8/2025 09:58,2025-08-04 09:58,
OBCS-10124,OD-2675,"Rh/Calcul OHADA : Quand on clique sur la fonctionnalité ""calcul Ohada"" , on a un message d'erreur (voir capture)","Rh/Calcul OHADA : Quand on clique sur la fonctionnalité ""calcul Ohada"" , on a un message d'erreur (voir capture)",EVA BASSE,KONE Mariam,SIT BTP,,Appel Téléphonique,RH,Salaire,Bug,Page d'erreur,OBC Customer Support,Priorité 1,Terminé(e),2025-06-25 10:00,27/6/2025 21:44,2025-06-27 21:44,
OBCS-10090,OD-2673,Donner la possibilité de pouvoir rattacher tout type de document au Dévis,Donner la possibilité de pouvoir rattacher tout type de document au Dévis,Vivien DAKPOGAN,M. SANANKOUA,ARIC,,Appel Téléphonique,Opérations,Vente,Requêtes,Non renseigné,OBC Customer Support,Priorité 1,Terminé(e),2025-06-22 12:15,24/6/2025 13:40,2025-06-24 13:40,
OBCS-10004,OD-2669,RH/Calcul de paie/Autre Paie - Historique de paie vide après calcul de salaire pour simulation gratification,"Résultat calcul de paie Vide

!image-20250618-210920.png|width=1089,height=680,alt=""image-20250618-210920.png""!",Edwige KOUASSI,Léa DIABATE,CILAGRI,,Constat Interne,RH,Salaire,Bug,Edition impossible,OBC Customer Support,Priorité 1,Terminé(e),2025-06-18 21:08,23/6/2025 15:58,2025-06-23 15:58,
OBCS-9999,OD-2668,Finance/Comptabilité Générale/Plan comptable Général - Fusionner les comptes en double dans le plan comptable,"Fusionner les comptes en double dans le plan comptable 

{adf:display=block}
{""type"":""table"",""attrs"":{""isNumberColumnEnabled"":false,""layout"":""default"",""localId"":""57cf47a9-3055-413f-a118-26c477b08481""},""content"":[{""type"":""tableRow"",""content"":[{""type"":""tableHeader"",""attrs"":{""colspan"":2},""content"":[{""type"":""paragraph"",""content"":[{""type"":""text"",""text"":""Doublon(s) trouvé(s) à ce jour 18/06/2025 () : 3""}]}]}]},{""type"":""tableRow"",""content"":[{""type"":""tableCell"",""attrs"":{},""content"":[{""type"":""paragraph"",""content"":[{""type"":""text"",""text"":""71000000""}]}]},{""type"":""tableCell"",""attrs"":{},""content"":[{""type"":""paragraph"",""content"":[{""type"":""text"",""text"":""2""}]}]}]},{""type"":""tableRow"",""content"":[{""type"":""tableCell"",""attrs"":{},""content"":[{""type"":""paragraph"",""content"":[{""type"":""text"",""text"":""71100000""}]}]},{""type"":""tableCell"",""attrs"":{},""content"":[{""type"":""paragraph"",""content"":[{""type"":""text"",""text"":""2""}]}]}]},{""type"":""tableRow"",""content"":[{""type"":""tableCell"",""attrs"":{},""content"":[{""type"":""paragraph"",""content"":[{""type"":""text"",""text"":""71200000""}]}]},{""type"":""tableCell"",""attrs"":{},""content"":[{""type"":""paragraph"",""content"":[{""type"":""text"",""text"":""2""}]}]}]}]}
{adf}",Edwige KOUASSI,Nadia Jocelyn Bouazo,CILAGRI,,"Online (Google Meet, Teams...)",Finance,Comptabilité Générale,Bug,Edition impossible,OBC Customer Support,Priorité 1,Terminé(e),2025-06-18 21:02,20/6/2025 16:02,2025-06-20 16:02,
OBCS-9996,OD-2666,Finance/Comptabilité Générale/Edition Compte Général - Impossible de modifier un plan comptable,"Modification d’un numéro de poste comptable impossible. 

N° poste Comptable : *40110000 FOURNISSEURS ORDINAIRES*

Voir capture ci-après 👇 

!image-20250618-193418.png|width=1534,height=702,alt=""image-20250618-193418.png""!",Edwige KOUASSI,Nadia Jocelyn Bouazo,CILAGRI,,"Online (Google Meet, Teams...)",Finance,Comptabilité Générale,Bug,Edition impossible,OBC Customer Support,Priorité 1,Terminé(e),2025-06-18 19:51,20/6/2025 16:06,2025-06-20 16:06,
OBCS-9989,OD-2661,"Comptabilité générale / Livres comptables : Ne pas avoir de nombre décimaux sur les livres comptables (Journal, Grand Livre, Balance comptable)","Comptabilité générale / Livres comptables : Ne pas avoir de nombre décimaux sur les livres comptables (Journal, Grand Livre, Balance comptable)",EVA BASSE,Jean-Jacques LIKANE,LABOGEM,,Appel Téléphonique,Finance,Comptabilité Générale,Requêtes,Non renseigné,OBC Customer Support,Priorité 1,Terminé(e),2025-06-18 09:47,19/6/2025 15:43,2025-06-19 15:43,
OBCS-9985,OD-2657,Admin.Syst/Gestion Utilisateur - Affichage d'un message d'erreur lors de l'octroi des droits et accès aux fonctionnalités.,"Ce message d’erreur ci après affiche lorsque qu’on décoche et coche les cases liées aux fonctionnalités à octroyer à un utilisateur.

h2. Attention

Exception : Object reference not set to an instance of an object. // at ONPOINTBUSINESSCENTER.Controllers.ParametrageAccesMenuController.UpdateAccesUtilisateurModule(Int32 idUser, Int32 idMenuItem, Boolean etatAcces)",Edwige KOUASSI,,SIT BTP,,Constat Interne,Support,Administration Système,Bug,Page d'erreur,OBC Customer Support,Priorité 1,En cours,2025-06-17 13:08,18/6/2025 08:59,,
OBCS-9994,OD-2665,RH/Calcul Salaire/ Autre Paie - Fournir davantage d'informations sur les Rubriques concernées.,"Fournir davantage d'informations sur les Rubriques concernées.

h2. Attention

Données non enregistrées. Erreur Paramétrage Veuillez paramétrer une rubrique avec le champ ""ctrl_prorata "" coché. Assurer vous que cette rubrique soit le nombre de jour travaillé. 

Elle est la seule rubrique de paie devant avoir ce champ coché et activé. 

Aussi, assurez vous qu'il n'aie pas d'autre rubriques ayant ce champ coché.

!image-20250618-135957.png|width=326,height=422,alt=""image-20250618-135957.png""!",Edwige KOUASSI,Léa DIABATE,CILAGRI,,Appel Téléphonique,RH,Salaire,Requêtes,Non renseigné,OBC Customer Support,Priorité 1,À faire,2025-06-18 12:43,18/6/2025 14:00,,
OBCS-9992,OD-2664,"Améliorer la qualité des extractions Excel des balances, Bilan et Comptes de résultats","Améliorer la qualité des extractions Excel des balances, Bilan et Comptes de résultats",EVA BASSE,Jean-Jacques KOUASSI,KOFFI & DIABATE,,En présentiel,Finance,Comptabilité Générale,Requêtes,Non renseigné,OBC Customer Support,Priorité 1,À faire,2025-06-18 11:38,18/6/2025 11:39,,
OBCS-9991,OD-2663,Comptabilité générale : Avoir les numéros de pièces sur le grand livre en plus des numéros d'imputations,Comptabilité générale : Avoir les numéros de pièces sur le grand livre en plus des numéros d'imputations,EVA BASSE,LYTA KENA-RABE,KOFFI & DIABATE,,En présentiel,Finance,Comptabilité Générale,Requêtes,Non renseigné,OBC Customer Support,Priorité 1,À faire,2025-06-18 11:36,18/6/2025 11:36,,
OBCS-9986,OD-2658,Finance/Comptabilité Générale/ Livre comptable - Faire disparaitre les virgules pour ne conserver que les nombres entiers,"Lors de l'interrogation de la balance ou du grand livre, les chiffres se présentent comme suit :

Exemple:  4 000 000,{color:#ff5630}*00*{color}.

Pourriez vous faire disparaître les zéros qui apparaissent après la virgule, s'il vous plaît ?

Résultat attendu  :  4 000 000",Edwige KOUASSI,Nadia Jocelyn Bouazo,CILAGRI,,E-mail,Finance,Comptabilité Générale,Requêtes,Non renseigné,OBC Customer Support,Priorité 1,En cours,2025-06-17 15:30,18/6/2025 21:10,,
OBCS-9924,OD-2652,"Etas financiers : Quand on génère les états financiers de 2024, les données de 2023 n'apparaisse pas","Etas financiers : Quand on génère les états financiers de 2024, les données de 2023 n'apparaisse pas",EVA BASSE,Kouadio N'dri Florent Alfred YAO,KOFFI & DIABATE,,"Online (Google Meet, Teams...)",Finance,Comptabilité Générale,Bug,Mauvais déversement des données,OBC Customer Support,Priorité 1,Terminé(e),2025-06-13 22:03,17/6/2025 18:52,2025-06-17 18:52,
OBCS-9889,OD-2650,RH/Salaire/Calcul de salaire occasionnel ou journalier - Dans le listing des salaires occasionnels les données ne correspondent pas au montant réel des salaires,"1-Le montant réel des salaires calculé des agents ne correspond pas aux données dans la liste des salaires occasionnels.

!WhatsApp Image 2025-06-12 à 11.22.33_bcc12b7d-20250612-112233.jpg|width=50%,alt=""WhatsApp Image 2025-06-12 à 11.22.33_bcc12b7d-20250612-112233.jpg""!

!WhatsApp Image 2025-06-12 à 11.22.46_7e09b63e-20250612-112245.jpg|width=50%,alt=""WhatsApp Image 2025-06-12 à 11.22.46_7e09b63e-20250612-112245.jpg""!

2- Aussi, dans le volet validation ou annulation de la paie, aucune donnée n’affiche bien qu’il y ait une paie calculée.",Edwige KOUASSI,Ursula YANGANGOUSSOU,ONPOINT,,En présentiel,RH,Salaire,Bug,Mauvais déversement des données,OBC Customer Support,Priorité 1,En cours,2025-06-13 16:09,13/6/2025 16:17,,
OBCS-9884,OD-2646,RH/Gestion des Employés/Contrat - Suppression Contrat enquêteur  enregistrer  le 12/05/2025,"Suppression Contrat enquêteur  N°2 enregistrer  le 12/05/2025 

(Deuxième demande du client pour la suppression - Erreur sur les dates des contrats importé)",Edwige KOUASSI,Ursula YANGANGOUSSOU,ONPOINT,,En présentiel,RH,Gestion employé,Requêtes,Non renseigné,OBC Customer Support,Priorité 1,Terminé(e),2025-06-13 10:36,18/7/2025 15:33,2025-07-18 15:33,
OBCS-9885,OD-2647,RH/Gestion des Employés/Contrat - Demande de Suppression Contrat enquêteur enregistrer le 11/05/2025,RH/Gestion des Employés/Contrat - Suppression Contrat enquêteur  enregistrer  le 11/05/2025,Edwige KOUASSI,Ursula YANGANGOUSSOU,ONPOINT,,En présentiel,RH,Gestion employé,Requêtes,Non renseigné,OBC Customer Support,Priorité 1,Terminé(e),2025-06-13 10:42,18/7/2025 15:31,2025-07-18 15:31,
OBCS-9883,OD-2645,RH/Gestion_Employé/Timesheet Journalier - Donner la possibilité d'importer les données à partir d'un fichier import,Donner la possibilité d'importer les données via un fichier import,EVA BASSE,Ursula YANGANGOUSSOU,ONPOINT,,En présentiel,RH,Feuille de temps,Requêtes,Non renseigné,OBC Customer Support,Priorité 2,À faire,2025-06-12 17:16,12/6/2025 17:23,,
OBCS-9882,OD-2644,RH/Gestion Employé/Productivité Journalière - Créer un fichier d'importation,Donner la possibilité d’importer des données via un fichier import pour faciliter les traitements de données massifs.,Edwige KOUASSI,Ursula YANGANGOUSSOU,ONPOINT,,En présentiel,RH,Feuille de temps,Requêtes,Non renseigné,OBC Customer Support,Priorité 2,À faire,2025-06-12 17:11,12/6/2025 17:11,,
OBCS-9881,OD-2643,RH/Gestion Employé/Contrat - Donner plus de détails sur les lignes non Importé,"Donner plus de détails sur les lignes non Importé 

Ligne exacte et cellule à revoir !",Edwige KOUASSI,Ursula YANGANGOUSSOU,ONPOINT,,En présentiel,RH,Feuille de temps,Requêtes,Non renseigné,OBC Customer Support,Priorité 2,À faire,2025-06-12 17:01,12/6/2025 17:01,,
OBCS-9868,OD-2637,"Dashboard audit projet/ sur le PL des projets, la facture d'avoir au niveau des projets au lieu de venir en diminution elle vient plus en augmentation","Dashboard audit projet/ sur le P&L des projets, la facture d'avoir au niveau des projets au lieu de venir en diminution elle vient plus en augmentation

!image (7).png|width=524,height=252,alt=""image (7).png""!

!image (8).png|width=524,height=252,alt=""image (8).png""!",N'GBRA MOYE BERNICE DORIS,FRANCIS AURELIEN KOUTOU,S-TEL,,Appel Téléphonique,Projets,Budget,Bug,Mauvais déversement des données,OBC Customer Support,Priorité 1,Terminé(e),2025-06-10 09:01,10/6/2025 18:13,2025-06-10 18:13,
OBCS-9880,OD-2642,Plan analytique : Figer les plans analytiques existant dans une comptabilité analytique (ARIC) sans toutefois empêcher le fait qu'on puisse choisir nos plans pour certains (Cas de K&D),Plan analytique : Figer les plans analytiques existant dans une comptabilité analytique (ARIC) sans toutefois empêcher le fait qu'on puisse choisir nos plans pour certains (Cas de K&D),Vivien DAKPOGAN,Kramo,ARIC,,"Online (Google Meet, Teams...)",Finance,Comptabilité analytique,Requêtes,Non renseigné,OBC Customer Support,Priorité 1,Terminé(e),2025-06-12 16:29,19/6/2025 10:26,2025-06-19 10:26,
OBCS-9879,OD-2641,Fichier import BL : Permettre l'import du Bon de livraison à partir de l'export de Teamo afin d'alimenter OBC,Fichier import BL : Permettre l'import du Bon de livraison à partir de l'export de Teamo afin d'alimenter OBC,Vivien DAKPOGAN,Brahima COULIBALY,KORI TRANSPORT,,E-mail,Opérations,Vente,Requêtes,Non renseigné,OBC Customer Support,Priorité 2,Terminé(e),2025-06-12 16:26,26/6/2025 13:34,2025-06-26 13:34,
OBCS-9844,OD-2636,Opération/Vente/Contrat souscripteur et Encaissement - Possibilité de supprimer un contrat de vente bien que des encaissements aient été effectué,"Possibilité de supprimer un contrat de vente bien que des encaissements aient été effectué sur celui ci. 

Condition de suppression : De l’enfant au parent 

Tant qu’un contrat est lié a un encaissement l’utilisateur ne doit avoir la possibilité de le supprimer.",Edwige KOUASSI,,IVOIRE DEVELOPPEMENT,,Constat Interne,Opérations,Vente,Bug,Autres,OBC Customer Support,Priorité 1,En cours,2025-06-08 00:24,10/6/2025 06:52,,
OBCS-9785,OD-2635,Intégration des plans analytiques multiples dans les fonctionnalités,Intégration des plans analytiques multiples dans les fonctionnalités,EVA BASSE,Martial GNALI,ONPOINT,,En présentiel,Global,Global,Requêtes,Non renseigné,OBC Customer Support,Priorité 1,En cours,2025-06-04 09:48,4/6/2025 09:52,,Global
OBCS-9779,OD-2632,Affichage de logo en haut et au bas de la feuille d'impression,"Affichage de logo en haut et au bas de la feuille d'impression. Pièce jointe de la capture d'écran

!image-20250603-113253.png|width=1421,height=880,alt=""image-20250603-113253.png""!",N'GBRA MOYE BERNICE DORIS,OUSSOU Martine,SIE-TRAVAUX,,Appel Téléphonique,RH,Gestion employé,Bug,Mauvais déversement des données,OBC Customer Support,Priorité 1,Terminé(e),2025-06-03 11:24,10/6/2025 10:39,2025-06-10 10:39,
OBCS-9776,OD-2630,Impossible d'imprimer une demande d'absence (autre que congés annuel) quand l'accès imprimer est coché chez l'utilisateur,Impossible d'imprimer une demande d'absence (autre que congés annuel) quand l'accès imprimer est coché chez l'utilisateur,N'GBRA MOYE BERNICE DORIS,OUSSOU Martine,SIE-TRAVAUX,,Appel Téléphonique,RH,Gestion employé,Bug,Impression impossible,OBC Customer Support,Priorité 1,Terminé(e),2025-06-03 10:53,10/6/2025 10:39,2025-06-10 10:39,
OBCS-9775,OD-2629,Point de requêtes sur l'enregistrement d'une opportunité,"Point de requêtes sur l'enregistrement d'une opportunité tel que :

# Impossible de choisir une offre BTP autre que terrain nu lors de la création d’une opportunité.
# Impossible de créer une offre BTP via le lien disponible dans le formulaire de la création d’une opportunité.
# Impossible d’enregistrer une offre BTP dans la partie fiche offre BTP.
#  La liste des offres disponibles dans le formulaire de création d’une opportunité n’est pas exhaustive. Exemple : 10 offres dans la liste au lieu de 100 ou plus qui doivent apparaitre.",N'GBRA MOYE BERNICE DORIS,Madame ADJA,EGBV,,Appel Téléphonique,CRM,Activités commerciales,Bug,Enregistrement impossible,OBC Customer Support,Priorité 1,Terminé(e),2025-06-03 10:43,17/6/2025 10:28,2025-06-17 10:28,
OBCS-9784,OD-2634,RH/Gestion Employé/Validation demande d'absence - Donner la possibilité de validé en cliquant sur la case à cocher pour valider a partir du formulaire,RH/Gestion Employé/Validation demande d'absence - Donner la possibilité de validé en cliquant sur la case à cocher pour valider a partir du formulaire.,Edwige KOUASSI,COULIBALY EVE,IVOIRE DEVELOPPEMENT,,En présentiel,RH,Gestion employé,Requêtes,Non renseigné,OBC Customer Support,Priorité 1,À faire,2025-06-03 14:57,3/6/2025 14:57,,
OBCS-9780,OD-2633,RH/Pointage/Calcul Salaire - Prise en compte des heures de retards de façon automatique,RH/Pointage/Calcul Salaire - Prise en compte des heures de retards de façon automatique,Edwige KOUASSI,COULIBALY EVE,SERTEM,,En présentiel,RH,Feuille de temps,Requêtes,Non renseigné,OBC Customer Support,Priorité 2,À faire,2025-06-03 14:17,3/6/2025 14:17,,
OBCS-9777,OD-2631,Intégration de modèles de factures ventes,"Intégration de modèles de factures ventes que vous trouverez en pièces jointes

[^Facture N°04.xlsx]
[^FACTURE 1 UNICEF 15.xls]

",N'GBRA MOYE BERNICE DORIS,MINGA Somgbo,SIE-TRAVAUX,,Appel Téléphonique,Opérations,Vente,Requêtes,Non renseigné,OBC Customer Support,Priorité 1,À faire,2025-06-03 11:01,3/6/2025 11:02,,
OBCS-9772,OD-2627,"Achat/Facture client : Quand on choisi un bon de commande , les quantités et prix unitaires ne s'actualise pas","Achat/Facture client : Quand on choisi un bon de commande , les quantités et prix unitaires ne s'actualise pas",EVA BASSE,KONE Mariam,SIT BTP,,Appel Téléphonique,Opérations,Achat,Bug,Mauvais déversement des données,OBC Customer Support,Priorité 1,Terminé(e),2025-06-02 17:22,4/6/2025 09:21,2025-06-04 09:21,
OBCS-9771,OD-2626,Opération/Achat/Enregistrement Bon de C à partir d'une Expression de besoin,"Impossible d'établir ou enregistrer un bon de commande à partir d’une expression de besoin

Bien que l’expression de besoin soit validé.

L’utilisateur est comme obligé de passer par : 

1- Synthèse de cotation 

2- Arbitrage

PS_: En sélectionnant le fournisseur l’expression de besoin disparait et vis versa

!image-20250602-112122.png|width=1534,height=702,alt=""image-20250602-112122.png""!",Edwige KOUASSI,Gaelle TOURE,ONPOINT,,En présentiel,Opérations,Achat,Bug,Récupération de données impossible,OBC Customer Support,Priorité 1,Terminé(e),2025-06-02 11:35,4/6/2025 17:47,2025-06-04 17:47,
OBCS-9765,OD-2625,"Facture Achat : Quand on veut enregistrer une facture à partir d'un bon de commande comprenant plusieurs lignes, seulement 2lignes se déversent","Facture Achat : Quand on veut enregistrer une facture à partir d'un bon de commande comprenant plusieurs lignes, seulement 2lignes se déversent",EVA BASSE,KOUAME BRICE,SIE-TRAVAUX,,Appel Téléphonique,Opérations,Achat,Bug,Mauvais déversement des données,OBC Customer Support,Priorité 1,Terminé(e),2025-05-30 10:35,2/6/2025 17:23,2025-06-02 17:23,
OBCS-9763,OD-2623,Facture client_ Résoudre l'anomalie concernant le rapport avec le nom produit/service avec des longue chaines de caractère,Facture client_ Résoudre l'anomalie concernant le rapport avec le nom produit/service avec des longue chaines de caractère,Vivien DAKPOGAN,Tapé Thibault Julien,ARIC,,Appel Téléphonique,Opérations,Vente,Bug,Non affichage de pages/données,OBC Customer Support,Priorité 2,Terminé(e),2025-05-28 20:09,2/6/2025 06:45,2025-06-02 06:45,
OBCS-9762,OD-2622,Facture client : Possibilité d'incrémenter les numéros de factures clients à partir du dernier numéro de facture,Facture client : Possibilité d'incrémenter les numéros de factures clients à partir du dernier numéro de facture,Vivien DAKPOGAN,NADIA CISSE,ARIC,,"Online (Google Meet, Teams...)",Opérations,Vente,Requêtes,Non renseigné,OBC Customer Support,Priorité 2,Terminé(e),2025-05-28 20:03,3/6/2025 16:51,2025-06-03 16:51,
OBCS-9761,OD-2621,Facture_client - Historique et Export : Afficher l'intitulé dans l'historique et l'export de facture client,Facture_client - Historique et Export : Afficher l'intitulé dans l'historique et l'export de facture client,Vivien DAKPOGAN,NADIA CISSE,ARIC,,"Online (Google Meet, Teams...)",Opérations,Vente,Requêtes,Non renseigné,OBC Customer Support,Priorité 2,Terminé(e),2025-05-28 19:56,3/6/2025 16:57,2025-06-03 16:57,
OBCS-9760,OD-2620,Incrémentation des numéros code client : Possibilité d'incrémenter automatiquement les codes clients.,Incrémentation des numéros code client : Possibilité d'incrémenter automatiquement les codes clients.,Vivien DAKPOGAN,NADIA CISSE,ARIC,,"Online (Google Meet, Teams...)",Opérations,Vente,Requêtes,Non renseigné,OBC Customer Support,Priorité 2,Terminé(e),2025-05-28 19:48,3/6/2025 16:51,2025-06-03 16:51,
OBCS-9756,OD-2617,Opération/Vente/Encaissement client - Incohérence des montants avance et initial sur le bon de versement à chaque versement effectué,"Incohérence des montants avance et initial sur le bon de versement à chaque versement effectué

Voir la capture ci après 👇 

!image-20250526-110231.png|width=866,height=546,alt=""image-20250526-110231.png""!

!image-20250526-110400.png|width=866,height=544,alt=""image-20250526-110400.png""!

!image-20250526-110449.png|width=862,height=541,alt=""image-20250526-110449.png""!



!image-20250526-110548.png|width=850,height=541,alt=""image-20250526-110548.png""!",Edwige KOUASSI,GAHI Lezou Jean,IVOIRE DEVELOPPEMENT,,En présentiel,Opérations,Vente,Bug,Mauvais déversement des données,OBC Customer Support,Priorité 1,Terminé(e),2025-05-26 11:05,28/5/2025 11:31,2025-05-28 11:31,
OBCS-9757,OD-2618,Opération/vente/Devis - Donner la possibilité d'afficher les devis enregistré uniquement par l'utilisateur,Donner la possibilité d'afficher les devis enregistré uniquement par l'utilisateur,Edwige KOUASSI,Raïssa CAMARA,JOEL K PROPERTIES,,Appel Téléphonique,Opérations,Vente,Requêtes,Non renseigné,OBC Customer Support,Priorité 1,À faire,2025-05-26 12:32,26/5/2025 12:32,,
OBCS-9736,OD-2615,Achat : Impossible d'éditer les factures 437 et 438 du fournisseur DR ADDAI,Achat : Impossible d'éditer les factures 437 et 438 du fournisseur DR ADDAI,EVA BASSE,ZAGBAYOU ANNE,EDIPRESSE,,E-mail,Opérations,Achat,Bug,Edition impossible,OBC Customer Support,Priorité 1,Terminé(e),2025-05-23 16:38,30/5/2025 10:23,2025-05-30 10:23,
OBCS-9719,OD-2613,Dashboard projet/Audit projet/Impossible d'accéder au gant chart,Dashboard projet/Audit projet/Impossible d'accéder au gant chart,N'GBRA MOYE BERNICE DORIS,MINGA Somgbo,SIE-TRAVAUX,,En présentiel,Projets,Analytique,Bug,Page d'erreur,OBC Customer Support,Priorité 1,Terminé(e),2025-05-23 09:50,2/6/2025 06:52,2025-06-02 06:52,
OBCS-9764,OD-2624,Opération/vente/ Facture - Créer un lien entre OBC et la plateforme FNE afin de récupérer automatiquement les factures saisie,"Créer un lien entre OBC et la plateforme FNE afin de récupérer automatiquement les factures saisie



*Préoccupation ou observation client :* 

J'attire ton attention sur le lancement de la plateforme de la Facture Normalisée Électronique (FNE) prévue, pour les entreprises au régime normal, au 1er juin 2025.

 CILAGRI CAJOU doit s'inscrire à la plateforme avant cette date et je suggère d'en faire une priorité au cours de la semaine prochaine.

Mme la DG ou toi-même devez avoir reçu un mail qui contient un lien pour l'inscription sur la plateforme.

La première difficulté est celle de l'interface du logiciel de facturation de CILAGRI avec la plateforme FNE.  Sans la mise en place de cette interface, toutes les factures de vente émises par la société devront être ressaisies manuellement sur la plateforme pour être validées et recevoir le sticker électronique.

Lors de la phase d'enregistrement sur la plateforme, il faut renseigner le nom du logiciel (probablement dans la rubrique autre parce que seuls 3 logiciels sont officiellement dispensés de cette interface et OBC n'en fait pas partie).",Edwige KOUASSI,ATTOUNGBRE K Gerard (Associete Manager),CILAGRI,,E-mail,Opérations,Vente,Requêtes,Non renseigné,OBC Customer Support,Priorité 1,Terminé(e),2025-05-28 20:12,16/9/2025 16:21,2025-09-16 16:21,
OBCS-9718,OD-2612,Stock de congés : Mise à jour automatique des stocks de congés des collaborateurs depuis Janvier 2025 - Incrément de 2.5 jours acquis mensuel,Stock de congés : Mise à jour automatique des stocks de congés des collaborateurs depuis Janvier 2025 - Incrément de 2.5 jours acquis mensuel,Vivien DAKPOGAN,Sanankoua Mickaelle,ARIC,,Appel Téléphonique,RH,Salaire,Requêtes,Non renseigné,OBC Customer Support,Priorité 1,Terminé(e),2025-05-22 20:29,28/7/2025 09:44,2025-07-28 09:44,
OBCS-9714,OD-2608,"RH/Gratification: Avant l'intégration de ""autres paies"" , la gratification a été calculé et après l'intégration les montants calculés sont différents de ceux trouvés en Décembre à quelques francs près.","RH/Gratification: Avant l'intégration de ""autres paies"" , la gratification a été calculé et après l'intégration les montants calculés sont différents de ceux trouvés en Décembre à quelques francs près. Nous souhaitons donc pointer les premiers montants trouvés",EVA BASSE,,KOFFI & DIABATE,,Constat Interne,RH,Salaire,Bug,Mauvais déversement des données,OBC Customer Support,Priorité 1,Terminé(e),2025-05-21 10:23,23/5/2025 15:58,2025-05-23 15:58,
OBCS-9713,OD-2607,RH/Salaire/ Historique de calcul de paie,Lors du calcul de paie pour certains mois des employés ne sont pas pris en compte bien que leur contrat soit en cours et que dans le fichier du personnel il soit dans l’effectif,Edwige KOUASSI,COULIBALY EVE,IVOIRE DEVELOPPEMENT,,Appel Téléphonique,RH,Documents,Bug,Récupération de données impossible,OBC Customer Support,Priorité 1,Terminé(e),2025-05-20 16:50,23/5/2025 12:34,2025-05-23 12:34,
OBCS-9712,OD-2606,RH/DOcument/Livre de paie Individuel - Impossible d'afficher la liste des employés,"!image-20250520-164420.png|width=1265,height=541,alt=""image-20250520-164420.png""!",Edwige KOUASSI,COULIBALY EVE,IVOIRE DEVELOPPEMENT,,Appel Téléphonique,RH,Documents,Bug,Récupération de données impossible,OBC Customer Support,Priorité 1,Terminé(e),2025-05-20 16:48,23/5/2025 16:19,2025-05-23 16:19,
OBCS-9670,OD-2604,"OPERATION/BON DE COMMANDE : Quand on enregistre ou modifie un bon de commande, on a un message d'erreur (voir capture)","!image-20250516-154414.png|width=969,height=815,alt=""image-20250516-154414.png""!

OPERATION/BON DE COMMANDE : Quand on enregistre ou modifie un bon de commande, on a un message d'erreur (voir capture)",EVA BASSE,ETEKOU ETEKOU JEAN CHRISTIAN,SIT BTP,,Appel Téléphonique,Opérations,Achat,Bug,Page d'erreur,OBC Customer Support,Priorité 1,Terminé(e),2025-05-16 15:44,21/5/2025 10:19,2025-05-21 10:19,
OBCS-9710,OD-2605,Intégration d'une IA générative au logiciel OBC,Intégration d'une IA générative au logiciel OBC,Edwige KOUASSI,Souleymane CISSE,ECORIGINE,,Appel Téléphonique,Global,Global,Requêtes,Non renseigné,OBC Customer Support,Priorité 1,À faire,2025-05-16 21:14,16/5/2025 21:14,,Global
OBCS-9663,OD-2600,RH/Contrat de travail : Les grades sur OCCI sont en doublons,RH/Contrat de travail : Les grades sur OCCI sont en doublons,EVA BASSE,,KOFFI & DIABATE,,En présentiel,RH,Gestion employé,Bug,Mauvais déversement des données,OBC Customer Support,Priorité 1,Terminé(e),2025-05-15 18:04,30/5/2025 10:35,2025-05-30 10:35,
OBCS-9662,OD-2599,Impossible de calculer une paie et les historiques de paies ont disparu,Impossible de calculer une paie et les historiques de paies ont disparu,EVA BASSE,,SIT BTP,,En présentiel,RH,Salaire,Bug,Dysfonctionnement sur le Calcul des salaires,OBC Customer Support,Priorité 1,Terminé(e),2025-05-15 18:03,16/5/2025 11:41,2025-05-16 11:41,
OBCS-9737,OD-2616,RH/Document/Livre de Paie-Bulletin - Base de calcul  Retraite et Accident de travail,"Retraite PS et retraite PP est égale respectivement 75000 × 6,3 % et 75000×7,7% et non 67161×6,3%,67161×7,7%.

Parce que la base retraite ne peut être inférieure à 75000F

Accident de travail est égal à 75000×5%(taux AT ID) et non 67161×5%(taux AT ID).
Prestation Familiale est égale à 75000×0,75% et non 67161×0.75% car base AT et PF minimum et plafonné à 75000.

!WhatsApp Image 2025-05-24 à 07.42.59_180cfd23-20250523-151755.jpg|width=768,height=1024,alt=""WhatsApp Image 2025-05-24 à 07.42.59_180cfd23-20250523-151755.jpg""!",Edwige KOUASSI,GAHI Lezou Jean,IVOIRE DEVELOPPEMENT,,Appel Téléphonique,RH,Documents,Bug,Erreur de calcul/Erreur sur Dashboard,OBC Customer Support,Priorité 1,Terminé(e),2025-05-24 07:46,3/6/2025 10:17,2025-06-03 10:17,
OBCS-9661,OD-2598,RH/Salaire & Document/ - Suppression de la valeur contenue dans la rubrique retenue prêt salarié,"Suppression de la valeur contenue dans la rubrique retenue prêt salarié

Lors du calcul de paie nous constatons qu'un montant de 50000 est alloué a la rubrique retenue prêt précisément chez l’employé TANOH Affoué Anne Marie.

N’ayant pas la source il est impossible pour nous de supprimer la valeur et recalculer correctement la paie.",Edwige KOUASSI,Serge Tahi,CILAGRI,,Appel Téléphonique,RH,Documents,Bug,Mauvais déversement des données,OBC Customer Support,Priorité 1,Terminé(e),2025-05-14 15:52,2/6/2025 12:02,2025-06-02 12:02,
OBCS-9660,OD-2597,"RH/FINANCE/Comptabilisation de la paie - Lors de la comptabilisation de la paie si les paramétrages sont effectué sans un numéro de poste comptable par employé, donner la possibilité d'avoir uniquement le montant groupé ou total","Lors de la comptabilisation de la paie si les paramétrage son effectué sans un numéro de poste comptable par employé, donner la possibilité d'avoir uniquement le montant groupé ou total des salaires en lieu et place des détails par employés dans le *42200000*",Edwige KOUASSI,Nadia Jocelyn Bouazo,CILAGRI,,Appel Téléphonique,RH,Comptabilité Générale,Requêtes,Non renseigné,OBC Customer Support,Priorité 1,À faire,2025-05-14 15:22,14/5/2025 15:22,,
OBCS-9659,OD-2596,Etat Résumé des cotisations mensuelles : Mise à jour des données,"Des points de mise à jour ont été demandé ce jour:

# *Modification des libellés*

Assiette cotisations : Rémunération brute

Base : Assiette cotisation

# *Revue des formules et des bases*

Base Assurance maternité : Base * nbre salarié (75000*171) = 12.825.000

Base Prestation familiale :  Base * nbre salarié (75000*171) = 12.825.000

Base des fdfp : Base fiscale

Base Accident de travail : Base * nbre salarié (75000*171) = 12.825.000

Retraite : Base sociale

",Vivien DAKPOGAN,Kramo,ARIC,,Appel Téléphonique,RH,Documents,Requêtes,Non renseigné,OBC Customer Support,Priorité 1,Terminé(e),2025-05-13 17:45,23/5/2025 16:16,2025-05-23 16:16,
OBCS-9653,OD-2592,"RH/Contrat de travail : Quand on a 2 entités définies comme base de travail , on a la possibilité de créer le contrat d'un employé sur une entité sur laquelle il n'a pas de fichier de personnel","RH/Contrat de travail : Quand on a 2 entités définies comme base de travail , on a la possibilité de créer le contrat d'un employé sur une entité sur laquelle il n'a pas de fichier de personnel",EVA BASSE,,SIE-TRAVAUX,,En présentiel,RH,Gestion employé,Bug,Mauvais déversement des données,OBC Customer Support,Priorité 1,Terminé(e),2025-05-12 19:36,3/6/2025 08:48,2025-06-03 08:48,
OBCS-9650,OD-2589,"Calcul OHADA/Autre paies : Quand on veux supprimer une ""autre paie"" , on a le récap de toutes les paies du mois (voir capture)","!image-20250512-191757.png|width=1430,height=910,alt=""image-20250512-191757.png""!",EVA BASSE,,KOFFI & DIABATE,,En présentiel,RH,Salaire,Bug,Mauvais déversement des données,OBC Customer Support,Priorité 1,Terminé(e),2025-05-12 19:18,16/5/2025 20:16,2025-05-16 20:16,
OBCS-9613,OD-2587,RH/Document/Livre de Paie Employé - Impossible d'imprimer un livre de paie individuel,"Impossible d'imprimer un livre de paie individuel  la liste des employés est introuvable et la page du navigateur bug.

!20250509-1236-20.8294017.mp4|width=1920,height=932,alt=""20250509-1236-20.8294017.mp4""!",Edwige KOUASSI,Serge Tahi,CILAGRI,,Appel Téléphonique,RH,Documents,Bug,Edition impossible,OBC Customer Support,Priorité 1,Terminé(e),2025-05-09 12:41,23/5/2025 16:21,2025-05-23 16:21,
OBCS-9608,OD-2584,RH/Salaire/Solde de Tout compte - Aucune données en historique bien que l'enregistrement soit effectué,"Aucune données en historique bien que l'enregistrement soit effectué

NB*: Il est aussi impossible d’enregistrer le reçu de solde de Tout compte",Edwige KOUASSI,EHUI Inesse,CILAGRI,,Appel Téléphonique,RH,Salaire,Bug,Historique vide/non exhaustif,OBC Customer Support,Priorité 1,En cours,2025-05-08 12:31,9/5/2025 09:38,,
OBCS-9607,OD-2583,"Pop up écriture manuelle vs ventilation analytique : Bien que n'ayant pas activer la ventilation analytique à partir des écritures manuelles, à chaque saisie avec un compte de charge, le pop up de proposition de ventilation apparait systématiquement","Pop up écriture manuelle vs ventilation analytique : Bien que n'ayant pas activer la ventilation analytique à partir des écritures manuelles, à chaque saisie avec un compte de charge, le pop up de proposition de ventilation apparait systématiquement",Vivien DAKPOGAN,Ousseyni Oumarou,EJARA,,Chat WhatsApp,Finance,Comptabilité Générale,Bug,Autres,OBC Customer Support,Priorité 1,Terminé(e),2025-05-08 10:33,9/5/2025 09:33,2025-05-09 09:33,
OBCS-9606,OD-2582,"Chargement des articles : Dans budget de dépenses, lorsqu'on crée une rubrique qui rappelle les articles stockables, la liste charge indéfiniment jusqu'à planter.","Chargement des articles : Dans budget de dépenses, lorsqu'on crée une rubrique qui rappelle les articles stockables, la liste charge indéfiniment jusqu'à planter.",Vivien DAKPOGAN,COULIBALY SERGES,S-TEL,,Chat WhatsApp,Opérations,Gestion de stock,Bug,Page d'erreur,OBC Customer Support,Priorité 1,Terminé(e),2025-05-08 10:27,14/5/2025 09:47,2025-05-14 09:47,
OBCS-9605,OD-2581,"Timbre 100 FCFA : Le calcul de la timbre n'est pas correct, le montant TTC est multiplié par 100","Timbre 100 FCFA : Le calcul de la timbre n'est pas correct, le montant TTC est multiplié par 100",Vivien DAKPOGAN,Fidel Benao,ARIC,,En présentiel,Opérations,Achat,Bug,Mauvais déversement des données,OBC Customer Support,Priorité 3,Terminé(e),2025-05-08 10:22,12/5/2025 12:03,2025-05-12 12:03,
OBCS-9604,OD-2580,Mise à jour + Amélioration Bon de commande,"Mise à jour et amélioration Bon de commande  : 

*Ajouter le type de codage nom produits dans le paramétrage entité ( création et édition)*
*Ajout de mode de paiement différé et en espèces en création, édition et détails*
*Ajout dans le bon mode de paiement au pieds de page*
*Ajouter la mention: arrêté le présent bon de commande à la somme de : en lettre et devise*",Vivien DAKPOGAN,Fidel Benao,ARIC,,En présentiel,Opérations,Achat,Requêtes,Non renseigné,OBC Customer Support,Priorité 2,Terminé(e),2025-05-08 10:20,12/5/2025 12:03,2025-05-12 12:03,
OBCS-9580,OD-2574,"Retenue de Garantie - Facture client : A l'édition d'une facture client, afin de rajouter une retenue de garantie, ce sont des comptes tiers salariés qui se déversent. Aucun soucis à l'enregistrement","Retenue de Garantie - Facture client : A l'édition d'une facture client, afin de rajouter une retenue de garantie, ce sont des comptes tiers salariés qui se déversent. Aucun soucis à l'enregistrement",Vivien DAKPOGAN,Tapé Thibault Julien,ARIC,,"Online (Google Meet, Teams...)",Opérations,Vente,Bug,Mauvais déversement des données,OBC Customer Support,Priorité 1,Terminé(e),2025-05-02 17:49,19/5/2025 07:34,2025-05-19 07:34,
OBCS-9539,OD-2571,"RH/Document/Livre de paie : A l'extraction du livre de paie en Excel , des nombres se rajoutent aux matricules employé (Voir capture)","!image-20250502-113510.png|width=1533,height=926,alt=""image-20250502-113510.png""!",EVA BASSE,ZAGBAYOU ANNE,EDIPRESSE,,En présentiel,RH,Documents,Bug,Autres,OBC Customer Support,Priorité 1,Terminé(e),2025-05-02 11:35,21/5/2025 12:06,2025-05-21 12:06,
OBCS-9581,OD-2575,"Duplication Facture client : Possibilité de dupliquer une facture client, en donnant la possibilité de pouvoir modifier certains éléments de la facture","Duplication Facture client : Possibilité de dupliquer une facture client, en donnant la possibilité de pouvoir modifier certains éléments de la facture",Vivien DAKPOGAN,NADIA CISSE,ARIC,,"Online (Google Meet, Teams...)",Opérations,Vente,Requêtes,Non renseigné,OBC Customer Support,Priorité 2,À faire,2025-05-02 17:51,2/5/2025 17:51,,
OBCS-9541,OD-2573,Intégrer le plan comptable des associations sur OBC,Intégrer le plan comptable des associations sur OBC,N'GBRA MOYE BERNICE DORIS,MARCELLE AHOUSSOU,2AAZ,,Appel Téléphonique,Finance,Comptabilité Générale,Requêtes,Non renseigné,OBC Customer Support,Priorité 1,À faire,2025-05-02 16:33,2/5/2025 16:33,,
OBCS-9540,OD-2572,RH / Rapport & Document - Création des rôles sur les fonctionnalités,"RH / Rapport & Document - Création des rôles sur les fonctionnalités suivante : 

1- Rapport des ordres de mission 

2- Rapport Paie journalier ",Edwige KOUASSI,,CILAGRI,,Constat Interne,Support,Administration Système,Requêtes,Non renseigné,OBC Customer Support,Priorité 1,À faire,2025-05-02 13:41,2/5/2025 13:41,,
OBCS-9534,OD-2568,RH/Programmation Paie Journ - Impossible de programmer une paie Jour,RH/Programmation Paie Journ - Impossible de programmer une paie Jour,Edwige KOUASSI,Ursula YANGANGOUSSOU,ONPOINT,,Appel Téléphonique,RH,Salaire,Bug,Récupération de données impossible,OBC Customer Support,Priorité 1,En cours,2025-04-30 17:54,5/5/2025 17:18,,
OBCS-9533,OD-2567,"Finance/Comptabilité générale/Imputation de la paie : Quand on supprime une ligne paramétré, la page devient blanche ( voir capture)","!image-20250430-174825.png|width=2027,height=967,alt=""image-20250430-174825.png""!",EVA BASSE,,KOFFI & DIABATE,,Constat Interne,Finance,Comptabilité Générale,Bug,Autres,OBC Customer Support,Priorité 1,Terminé(e),2025-04-30 17:48,16/5/2025 11:41,2025-05-16 11:41,
OBCS-9532,OD-2566,RH/Document/Bulletin Salaire - Données incomplète sur le bulletin de salaire,"Données incomplète sur le bulletin de salaire 

Rubrique concerné : 

* IS : pour certains sans libellé et à la mauvaise position pour d’autre part employé non récupéré
* Retraite 

!image-20250430-115023.png|width=1304,height=724,alt=""image-20250430-115023.png""!",Edwige KOUASSI,Estelle BOA,JOEL K PROPERTIES,,Appel Téléphonique,RH,Documents,Bug,Mauvais déversement des données,OBC Customer Support,Priorité 1,En cours,2025-04-30 11:52,5/5/2025 17:18,,
OBCS-9597,OD-2577,Demande de sortie de caisse:  A la création d'une nouvelle demande lorsque l'utilisateur sélectionne un employé on devra affiché son département juste en dessous,Demande de sortie de caisse:  A la création d'une nouvelle demande lorsque l'utilisateur sélectionne un employé on devra affiché son département juste en dessous,Vivien DAKPOGAN,NADIA CISSE,ARIC,,"Online (Google Meet, Teams...)",Finance,Comptabilité Générale,Requêtes,Non renseigné,OBC Customer Support,Priorité 2,Terminé(e),2025-05-06 11:01,7/5/2025 10:34,2025-05-07 10:34,
OBCS-9528,OD-2562,Finance/Comptabilité analytique : Lier des fonctionnalités à la comptabilité analytique,Finance/Comptabilité analytique : Lier des fonctionnalités à la comptabilité analytique,EVA BASSE,,ARIC,,En présentiel,Finance,Comptabilité analytique,Requêtes,Non renseigné,OBC Customer Support,Priorité 1,Terminé(e),2025-04-30 11:09,7/5/2025 10:58,2025-05-07 10:58,
OBCS-9525,OD-2559,Vente/Facture client : Le formulaire des factures clients n'affiche pas,Vente/Facture client : Le formulaire des factures clients n'affiche pas,EVA BASSE,Ousseyni Oumarou,EJARA,,Appel Téléphonique,Opérations,Vente,Bug,Non affichage de pages/données,OBC Customer Support,Priorité 1,Terminé(e),2025-04-29 08:54,30/4/2025 09:28,2025-04-30 09:28,
OBCS-9609,OD-2585,RH/Salaire/solde de Tout compte - Prise en compte Non effective des soldes négatif,Prise en compte Non effective des soldes négatif (Cette option est a prendre en compte au cas ou l'employé doit reverser des sous à l'employeurs),Edwige KOUASSI,Estelle BOA,CILAGRI,,Appel Téléphonique,RH,Salaire,Bug,Enregistrement impossible,OBC Customer Support,Priorité 1,Terminé(e),2025-05-08 12:34,16/5/2025 11:54,2025-05-16 11:54,
OBCS-9523,OD-2557,"Dashboard projets/P&L/ pour un budget projet défini, au niveau d'une ligne budgétaire, les factures achats d'autres projets apparaissent donc viennent augmenter le montant global de la ligne budgétaire","Dashboard projets/P&L/ pour un budget projet défini, au niveau d'une ligne budgétaire, les factures achats d'autres projets apparaissent donc viennent augmenter le montant global de la ligne budgétaire



!image-20250428-182108.png|width=1623,height=885,alt=""image-20250428-182108.png""!",N'GBRA MOYE BERNICE DORIS,FRANCIS AURELIEN KOUTOU,S-TEL,,Appel Téléphonique,Projets,Budget,Bug,Mauvais déversement des données,OBC Customer Support,Priorité 1,Terminé(e),2025-04-28 18:13,12/5/2025 14:23,2025-05-02 16:31,
OBCS-9717,OD-2611,Opération/Vente/Création compte client - Générer les codes clients en fonction du code sélectionné dans Poste comptable,Générer les codes clients en fonction du code sélectionné dans Poste comptable tout en laissant la possibilité de modifier,Edwige KOUASSI,GAHI Lezou Jean,IVOIRE DEVELOPPEMENT,,En présentiel,Opérations,Vente,Requêtes,Non renseigné,OBC Customer Support,Priorité 1,À faire,2025-05-22 10:20,22/5/2025 10:20,,
OBCS-9521,OD-2555,Opération / Agro / Historique de Bordereaux de réception - Ajouter une colonne pour N° de connaissement ...,"Historique de Bordereaux de réception - Ajouter une colonne pour N° de connaissement ...

* Ajouter dans le récapitulatif _""Historique des bordereaux de réception""_ le nom de la coopérative ainsi que le numéro de connaissement associé à chaque réception ;
* Intégrer un nouvel onglet permettant l’export de l’ensemble des réceptions enregistrées à ce jour ;

 ",Edwige KOUASSI,Serge AMOUZOU,ECORIGINE,,Appel Téléphonique,Opérations,Achat,Requêtes,Non renseigné,OBC Customer Support,Priorité 1,En cours,2025-04-28 14:48,14/8/2025 10:45,,
OBCS-9522,OD-2556,Facture client : Augmenter la taille du champ description afin de mieux voir les saisies de libellés.,Facture client : Augmenter la taille du champ description afin de mieux voir les saisies de libellés.,Vivien DAKPOGAN,Tapé Thibault Julien,ARIC,,Appel Téléphonique,Opérations,Vente,Requêtes,Non renseigné,OBC Customer Support,Priorité 1,Terminé(e),2025-04-28 14:49,7/5/2025 10:35,2025-05-07 10:35,
OBCS-9519,OD-2554,Bordereau de sortie - Bordereau de retour : Enlever les prix unitaires et les prix totaux sur les modèles,Bordereau de sortie - Bordereau de retour : Enlever les prix unitaires et les prix totaux sur les modèles,Vivien DAKPOGAN,Fidel Benao,ARIC,,En présentiel,Opérations,Gestion de stock,Requêtes,Non renseigné,OBC Customer Support,Priorité 1,Terminé(e),2025-04-26 10:57,26/4/2025 10:59,2025-04-26 10:59,
OBCS-9518,OD-2553,"RH/Document : Quand on calcul ""une autre paie"" , le livre de paie ne prend pas en compte le cumul des paies","RH/Document : Quand on calcul ""une autre paie"" , le livre de paie ne prend pas en compte le cumul des paies",EVA BASSE,,KOFFI & DIABATE,,Constat Interne,RH,Documents,Bug,Mauvais déversement des données,OBC Customer Support,Priorité 1,Terminé(e),2025-04-24 19:06,28/4/2025 11:11,2025-04-28 11:11,
OBCS-9515,OD-2550,Les utilisateurs ne recoivent pas de notifications par mail,Les utilisateurs ne recoivent pas de notifications par mail,EVA BASSE,Brahima COULIBALY,KORI TRANSPORT,,Appel Téléphonique,Global,Global,Bug,Autres,OBC Customer Support,Priorité 1,Terminé(e),2025-04-24 15:10,25/4/2025 16:00,2025-04-25 16:00,Global
OBCS-9512,OD-2547,Admin.Syst/Gestion Utilisateur - Affichage d'un Message d'erreur à la création d'un Compte utilisateur,"Affichage d'un Message d'erreur à la création d'un Compte utilisateur

!image-20250424-131718.png|width=1395,height=639,alt=""image-20250424-131718.png""!",Edwige KOUASSI,,CILAGRI,,Constat Interne,Support,Administration Système,Bug,Page d'erreur,OBC Customer Support,Priorité 2,Terminé(e),2025-04-24 13:20,25/4/2025 15:59,2025-04-25 15:59,
OBCS-9509,OD-2545,Incoterms : Intégrer la liste des incoterms afin de la rendre sélectionnable,"Incoterms : Intégrer la liste des incoterms afin de la rendre sélectionnable. 

Liste des Incoterms : EXW , FCA , CPT, CIP, DAP, DPU, DDP, FAS, FOB, CFR, CIF, LETTER OF CREDIT, ADVANCE PAYMENT, OTHER",Vivien DAKPOGAN,Fidel Benao,ARIC,,En présentiel,Opérations,Achat,Requêtes,Non renseigné,OBC Customer Support,Priorité 2,Terminé(e),2025-04-24 08:39,28/4/2025 14:47,2025-04-28 14:47,
OBCS-9508,OD-2544,Modèle Bon de commande Achat import CARHIS,"Pour les achats imports spécifiques avec le Fournisseur CARHIS, seul ce modèle est accepté. Nécessité d’intégrer ce modèle",Vivien DAKPOGAN,Fidel Benao,ARIC,,En présentiel,Opérations,Achat,Requêtes,Non renseigné,OBC Customer Support,Priorité 2,À faire,2025-04-24 08:28,24/4/2025 08:28,,
OBCS-9507,OD-2543,Bon de commande : Amélioration du modèle,"Avec le modèle en P.J 

La récupération de la référence est correcte.

La colonne Désignation peut être remplacé par Description. Cependant au niveau du formulaire, dans la partie description, récupérer par défaut le “Nom de l’article” qui pourra être modifiable. Par exemple pour Raccord galva mâle diam 160 - ARIC SA-02AERAU-1508 -0 - 0, on gardera *Raccord galva mâle diam 160*",Vivien DAKPOGAN,Fidel Benao,ARIC,,En présentiel,Opérations,Achat,Requêtes,Non renseigné,OBC Customer Support,Priorité 2,Terminé(e),2025-04-24 08:23,30/4/2025 09:29,2025-04-30 09:29,
OBCS-9505,OD-2541,"Accès via gestion des profils : l'entité et l'exercice comptable associé au profil ""Standard"" sur l'entité KDA BENIN n'apparaissent pas à la connexion des utilisateurs","Accès via gestion des profils : l'entité et l'exercice comptable associé au profil ""Standard"" sur l'entité KDA BENIN n'apparaissent pas à la connexion des utilisateurs",EVA BASSE,Jeronime GBAGUIDI,KOFFI & DIABATE,,Appel WhatsApp,Support,Administration Système,Bug,Mauvais déversement des données,OBC Customer Support,Priorité 1,Terminé(e),2025-04-23 08:37,16/5/2025 20:15,2025-05-16 20:15,
OBCS-9503,OD-2540,Finance / Compta Générale - Enregistrement de RAN Impossible,"Enregistrement de RAN impossible pour l’option Saisie directe.

Message d’erreur généré.",Edwige KOUASSI,Souleymane CISSE,ECORIGINE,,"Online (Google Meet, Teams...)",Finance,Comptabilité Générale,Bug,Enregistrement impossible,OBC Customer Support,Priorité 1,Terminé(e),2025-04-23 05:19,24/4/2025 09:15,2025-04-24 09:15,
OBCS-9472,OD-2539,Finance/Comptabilité/Paramétrage des rubriques de paie : Apparition d'une page blanche lors des suppressions des rubriques de paies,"!image-20250422-162804.png|width=2287,height=899,alt=""image-20250422-162804.png""!

{noformat}{noformat}",EVA BASSE,,KOFFI & DIABATE,,Constat Interne,Finance,Comptabilité Générale,Requêtes,Non renseigné,OBC Customer Support,Priorité 1,Terminé(e),2025-04-22 16:30,14/8/2025 15:46,2025-08-14 15:46,
OBCS-9471,OD-2538,Le livre de paie ne s'affiche pas sur 2 entités de Onpoint (OD et OCG),Le livre de paie ne s'affiche pas sur 2 entités de Onpoint (OD et OCG),EVA BASSE,Joël SIE,ONPOINT,,Chat WhatsApp,RH,Documents,Requêtes,Non renseigné,OBC Customer Support,Priorité 1,Terminé(e),2025-04-22 15:38,30/4/2025 09:29,2025-04-30 09:29,
OBCS-9459,OD-2531,Finance/Comptabilité/Plan comptable entité : Impossible de créer un nouveau poste comptable générale,"Quand on cllique sur le bouton “Nouveau compte général”, la page s’assombrit 

!image-20250415-100945.png|width=2541,height=1209,alt=""image-20250415-100945.png""!",EVA BASSE,MICHEL TETE,ECORIGINE,,E-mail,Finance,Comptabilité Générale,Bug,Non affichage de pages/données,OBC Customer Support,Priorité 1,Terminé(e),2025-04-15 10:09,15/4/2025 18:40,2025-04-15 18:40,
OBCS-9462,OD-2533,Impossible de modifier une opération de caisse,Impossible de modifier une opération de caisse,EVA BASSE,Mme BRISSI,AFRIC URBA,,Appel Téléphonique,Finance,Comptabilité Générale,Requêtes,Non renseigné,OBC Customer Support,Priorité 1,Terminé(e),2025-04-15 15:51,17/4/2025 18:23,2025-04-17 18:23,
OBCS-9461,OD-2532,AGRO: Génération des écritures comptables à l'enregistrement d'un bordereau de réception,AGRO: Génération des écritures comptables à l'enregistrement d'un bordereau de réception,EVA BASSE,,ECORIGINE,,En présentiel,Opérations,Achat,Requêtes,Non renseigné,OBC Customer Support,Priorité 1,Terminé(e),2025-04-15 15:50,2/5/2025 16:48,2025-05-02 16:48,
OBCS-9458,OD-2530,Coût de revient par Article : Revue de la formule du coût de revient par article en tenant compte du prix d'achat de chaque article.,"Supposons que nous avons acheté 3 articles à l’import. 

A1 : Quantité : 30, Prix : 2500

A2 : Quantité : 5, Prix : 10.000

A3 : Quantité : 1, Prix : 7500
  *1.* Nous allons calculer le coût total par article (Quantité*Prix unitaire)

CT A1 : 30*2500 = 75.000

CT A2 : 5*10.000 = 50.000

CT A3 : 1*7500 = 7.500

# Recherchons le coût total global 

CTG : 75.000 + 50.000 + 7.500

*CTG : 132.500*

# Déterminons le coefficient en fonction du poids monétaire : (CT/CTG)

A1: (75.000/132.500) = *0.57*

A2 : (50.000/132.500) = *0.38*

A3 : (7.500/132500) = *0.06*

Si on considère que nous avons les frais annexes tels que *Fret : 350.000*, *Droit de Douane : 500.000*

# a. Déterminons la clé de répartition en fonction du poids monétaire pour le fret : *Montant Fret * Coefficient Article*

A1 : 350.000 * 0.57 = 199.500

A2 : 350.000 * 0.38 = 133.000

A3 : 350.000 * 0.06 = 21.000

# b. Déterminons la clé de répartition en fonction du poids monétaire pour le fret : *Montant Douane * Coefficient Article*

A1 : 500.000 * 0.57 = 285.000

A2 : 500.000 * 0.38 = 190.000

A3 : 500.000 * 0.06 = 30.000

# a. Déterminons le coût de revient total en fonction du Fret : *CT + CRPM*

A1 : 75.000 + 199.500 = 274.500

A2 : 50.000 + 133.000 = 183.000

A3 : 7.500 + 21.000 = 28.500

# b. Calculons le coût de revient unitaire en fonction du Fret : *CRT/Quantité*

A1 : 274500/30 = 9.150

A2 : 183.000/5 = 36.600

A3 : 28.500/1 = 28.500

# a. Déterminons le coût de revient total en fonction de la Douane : *CT + CRPM*

A1 : 75.000 + 285.000 = 360.000

A2 : 50.000 + 190.000 = 240.000

A3 : 7.500 + 30.000 = 37.500

# b. Calculons le coût de revient unitaire en fonction de la douane : *CRT/Quantité*

A1 : 360.000/30 = 12.000

A2 : 240.000/5 = 48.000

A3 : 37.500/1 = 37.500

Déterminons le coût de revient unitaire par article : *Coût de revient Unitaire Fret + Coût de revient Unitaire Douane*

A1 : 9.150 + 12.000

*A1 = 21.150*

A2 : 36.600 + 48.000

*A2 = 84.600*

A3 : 28500 + 37.500

*A3 = 66.000*",Vivien DAKPOGAN,Fidel Benao,ARIC,,En présentiel,Opérations,Gestion de stock,Requêtes,Non renseigné,OBC Customer Support,Priorité 1,Terminé(e),2025-04-15 09:52,25/4/2025 15:59,2025-04-25 15:59,
OBCS-9457,OD-2529,Opération/Achat/Enregistrement Facture - Recherche par saisie d'une nature de prestation impossible,"Pendant l’enregistrement des factures, une fois toutes les mentions saisies, nous ne ne pouvons plus effectuer de recherche de numéro de compte dans la rubrique « Nature de prestation .",Edwige KOUASSI,Souleymane CISSE,ECORIGINE,,Appel Téléphonique,Opérations,Achat,Requêtes,Non renseigné,OBC Customer Support,Priorité 1,À faire,2025-04-14 17:14,14/4/2025 17:14,,
OBCS-9449,OD-2528,"CRM/Programme offre BTP: Impossible de modifier un ""Programme BTP"" (Voir capture)","!image-20250411-184116.png|width=1719,height=869,alt=""image-20250411-184116.png""!",EVA BASSE,,KOFFI & DIABATE,,En présentiel,CRM,Offres,Bug,Enregistrement impossible,OBC Customer Support,Priorité 1,Terminé(e),2025-04-11 18:42,14/8/2025 15:46,2025-08-14 15:46,
OBCS-9414,OD-2526,Agro /Identification du producteur,"Faire un lien entre un producteur et sa coopérative, i-e je ne peux pas utiliser des producteurs de la coopérative X pour effectuer des enregistrements de la coopératives Y.

Possibilité de modification des producteurs enregistré sur un numéro de connaissement",EVA BASSE,,ECORIGINE,,En présentiel,Opérations,Achat,Requêtes,Non renseigné,OBC Customer Support,Priorité 1,En cours,2025-04-09 10:17,9/4/2025 14:18,,
OBCS-9413,OD-2525,Logo et numéro RCCM: Ajuster le logo pour qu'il soi visible ; le numéro du registre de commerce  n'est pas visible,Utiliser N° CONNAISSEMENT en lieu et place de N° connaissement brousse/usine,EVA BASSE,,ECORIGINE,,En présentiel,Opérations,Achat,Requêtes,Non renseigné,OBC Customer Support,Priorité 1,En cours,2025-04-09 10:11,9/4/2025 14:18,,
OBCS-9412,OD-2524,Utiliser N° CONNAISSEMENT en lieu et place de N° connaissement brousse/usine,Utiliser N° CONNAISSEMENT en lieu et place de N° connaissement brousse/usine,EVA BASSE,,ECORIGINE,,En présentiel,Opérations,Achat,Requêtes,Non renseigné,OBC Customer Support,Priorité 1,En cours,2025-04-09 10:10,9/4/2025 14:18,,
OBCS-9411,OD-2523,"Remplacer ""connaissement usine"" par ""données livraisons""","Remplacer ""connaissement usine"" par ""données livraisons""",EVA BASSE,,ECORIGINE,,En présentiel,Opérations,Achat,Requêtes,Non renseigné,OBC Customer Support,Priorité 1,En cours,2025-04-09 10:08,9/4/2025 14:18,,
OBCS-9407,OD-2519,RH/Gestion des Employés/ Fichier du personnel - A l'enregistrement des données d'un nouvel employé renseigner automatiquement l'alias,"A l'enregistrement des données d'un nouvel employé renseigner automatiquement l'alias.

Ossature Alias fichier du personnel : Nom et premier prénom

Exemple 🧐 : 

Nom _ KOUASSI 

Prénoms _ Edwige Annick

Alias _ KOUASSI Edwige A || KOUASSI Edwige",Edwige KOUASSI,,CILAGRI,,Constat Interne,RH,Gestion employé,Requêtes,Non renseigné,OBC Customer Support,Priorité 2,Terminé(e),2025-04-07 15:04,14/4/2025 10:28,2025-04-09 17:15,
OBCS-9391,OD-2518,Feuille de temps: Les sous-projets devraient se déverser en fonction du projet choisi mais on constate qu'on a la possibilité de choisir des sous-projets et ensuite selectionner un projet,"!image-20250404-174723.png|width=1877,height=292,alt=""image-20250404-174723.png""!",EVA BASSE,Delphin Zoungrana,ONPOINT,,Appel Téléphonique,Projets,Feuille de temps,Bug,Mauvais déversement des données,OBC Customer Support,Priorité 1,Terminé(e),2025-04-04 17:50,15/4/2025 18:41,2025-04-14 10:26,
OBCS-9390,OD-2517,Finance/Comptabilité analytique - Paramétrage,"Affichage d’un message “Success false & true” sur toutes les opération lié aux paramétrages (Enregistrement / Suppression). 

Lors de l’enregistrement de données dans les paramétrages de comptabilité analytique 

plus précisément sur les fonctions : 

* [Plan analytique entité|https://onpointsunrise.com/PlanAnalytiqueEntite/Index]
* [Grille de répartition analytique|https://onpointsunrise.com/GrilleRepartitionAnalytique/Index]

Nous avons le message success true  suivi de validation multiple et actualisation de la page, au lieu d'être redirigé directement dans  l’historique.

!image-20250404-121305.png|width=1534,height=782,alt=""image-20250404-121305.png""!",Edwige KOUASSI,MICHEL TETE,ECORIGINE,,"Online (Google Meet, Teams...)",Finance,Comptabilité Générale,Bug,Autres,OBC Customer Support,Priorité 2,Terminé(e),2025-04-04 12:18,30/4/2025 10:55,2025-04-30 10:55,
OBCS-9389,OD-2516,Stock : Revue de la nomenclature des articles; en mettant en avant la référence avant le nom de l'article,Stock : Revue de la nomenclature des articles; en mettant en avant la référence avant le nom de l'article,Vivien DAKPOGAN,Fidel Benao,ARIC,,En présentiel,Opérations,Gestion de stock,Requêtes,Non renseigné,OBC Customer Support,Priorité 2,Terminé(e),2025-04-04 07:29,14/4/2025 06:52,2025-04-14 06:52,
OBCS-9381,OD-2515,Nous constatons que les écritures ne se déversent pas dans le grand livre du tiers BANQUE POPULAIRE,"Nous constatons que les écritures ne se déversent pas dans le grand livre du tiers BANQUE POPULAIRE .

Malgré les investigations menées avec le chef comptable, les écritures liées à la facture du 11  octobre 2024 ne se déverse pas dans le grand livre du tiers.",N'GBRA MOYE BERNICE DORIS,HILARION YAO,EGBV,,E-mail,Opérations,Comptabilité Générale,Bug,Mauvais déversement des données,OBC Customer Support,Priorité 1,Terminé(e),2025-04-03 09:51,3/4/2025 18:29,2025-04-03 18:29,
OBCS-9376,OD-2513,"Finance/Comptabilité générale/Historique des imputations comptable : Bien que le poste comptable client soit rattaché à la fiche client , le poste comptable du client ne se rattache pas lors de la génération des écritures","!image-20250403-084631.png|width=1831,height=354,alt=""image-20250403-084631.png""!",EVA BASSE,ZAGBAYOU ANNE,EDIPRESSE,,Appel Téléphonique,Finance,Comptabilité Générale,Bug,Mauvais déversement des données,OBC Customer Support,Priorité 1,Terminé(e),2025-04-03 08:57,3/4/2025 18:28,2025-04-03 18:28,
OBCS-9374,OD-2511,Programmation de paiement fournisseur/Onglet rattaché au bon de commande/Certains fournisseurs n'ont pas de liste de bon de commande qui se déversent,"Programmation de paiement fournisseur/Onglet rattaché au bon de commande/Certains fournisseurs n'ont pas de liste de bon de commande qui se déversent pourtant il y a des bons de commande validés en historique concernant le fournisseur ( ETS HERE, CIP, SLMA)",N'GBRA MOYE BERNICE DORIS,KONE Mariam,SIT BTP,,Appel Téléphonique,Opérations,Achat,Bug,Non affichage de pages/données,OBC Customer Support,Priorité 1,Terminé(e),2025-04-01 16:39,4/4/2025 10:54,2025-04-04 10:54,
OBCS-9375,OD-2512,Prise en compte des stagiaires dans les paies pour chaque mois,Prise en compte des stagiaires dans les paies pour chaque mois,Vivien DAKPOGAN,Sanankoua Mickaelle,ARIC,,Appel Téléphonique,RH,Salaire,Requêtes,Non renseigné,OBC Customer Support,Priorité 2,Terminé(e),2025-04-01 18:51,2/6/2025 06:52,2025-06-02 06:52,
OBCS-9373,OD-2510,Opération /Vente - Donner la possibilité d'avoir l'état des clients de façon groupé ou individuel,Donner la possibilité d'avoir l'état des clients de façon groupé ou individuel,Edwige KOUASSI,GAHI Lezou Jean,IVOIRE DEVELOPPEMENT,,En présentiel,Opérations,Vente,Requêtes,Non renseigné,OBC Customer Support,Priorité 1,En cours,2025-04-01 16:15,4/6/2025 07:12,,
OBCS-9372,OD-2509,Opération/Vente/Création compte client - Générer automatiquement les N° de poste comptable à la création de la fiche client,Générer automatiquement les Numéro de postes comptable tiers client à la création de la fiche client,Edwige KOUASSI,GAHI Lezou Jean,IVOIRE DEVELOPPEMENT,,En présentiel,Opérations,Vente,Requêtes,Non renseigné,OBC Customer Support,Priorité 1,À faire,2025-04-01 15:31,1/4/2025 15:31,,
OBCS-9371,OD-2508,Opération /Vente/Compte Client- Donner la possibilité d'enregistrer les clients par site,Donner la possibilité d'enregistrer les clients par site,Edwige KOUASSI,GAHI Lezou Jean,IVOIRE DEVELOPPEMENT,,En présentiel,Opérations,Vente,Requêtes,Non renseigné,OBC Customer Support,Priorité 1,À faire,2025-04-01 15:10,1/4/2025 15:10,,
OBCS-9370,OD-2507,Intégration modèle de facture Vente_ARIC,Intégration modèle de facture Vente_ARIC,Vivien DAKPOGAN,NADIA CISSE,ARIC,,"Online (Google Meet, Teams...)",Opérations,Vente,Requêtes,Non renseigné,OBC Customer Support,Priorité 1,Terminé(e),2025-04-01 15:10,4/4/2025 10:51,2025-04-04 10:51,
OBCS-9369,OD-2506,Opération /Vente/Encaissement Client - Donner la possibilité de gérer les encaissement par site,"Opération /Vente/Encaissement Client - Donner la possibilité de gérer les encaissement client par site

De sorte à ce que chaque caissière ai une vue de ses enregistrements sans visualiser ceux des autres.",Edwige KOUASSI,GAHI Lezou Jean,IVOIRE DEVELOPPEMENT,,En présentiel,Opérations,Vente,Requêtes,Non renseigné,OBC Customer Support,Priorité 1,À faire,2025-04-01 15:06,1/4/2025 15:06,,
OBCS-9368,OD-2505,Extraction CMU: à paramétrer suivant le modèle SAGE PAIE,*Extraction CMU:* à paramétrer suivant le modèle SAGE PAIE,Vivien DAKPOGAN,Sanankoua Mickaelle,ARIC,,Appel Téléphonique,RH,Documents,Requêtes,Non renseigné,OBC Customer Support,Priorité 1,Terminé(e),2025-04-01 10:54,14/4/2025 06:52,2025-04-14 06:52,
OBCS-9367,OD-2504,Intégration du journal de contrôle de paie,Intégration du journal de contrôle de paie,Vivien DAKPOGAN,Sanankoua Mickaelle,ARIC,,Appel Téléphonique,RH,Documents,Requêtes,Non renseigné,OBC Customer Support,Priorité 2,En cours,2025-04-01 10:52,9/4/2025 11:42,,
OBCS-9366,OD-2503,Mise à jour de l'état résumé des cotisations selon le modèle CI,Mise à jour de l'état résumé des cotisations selon le modèle CI,Vivien DAKPOGAN,Sanankoua Mickaelle,ARIC,,Appel Téléphonique,RH,Documents,Requêtes,Non renseigné,OBC Customer Support,Priorité 1,Terminé(e),2025-04-01 10:48,22/4/2025 07:41,2025-04-22 07:41,
OBCS-9365,OD-2502,Réinitialisation des variables à 0 avant toutes nouvelles paie en (option). Tout en gardant Nombre de jours travaillés à 30,Réinitialisation des variables à 0 avant toutes nouvelles paie en (option). Tout en gardant Nombre de jours travaillés à 30,Vivien DAKPOGAN,Sanankoua Mickaelle,ARIC,,Appel Téléphonique,Global,Global,Requêtes,Non renseigné,OBC Customer Support,Priorité 1,Terminé(e),2025-04-01 10:33,3/4/2025 18:03,2025-04-03 18:03,Global
OBCS-9317,OD-2500,"Rajouter colonne ""Nombre de jour d'absence"" au fichier d'export","Rajouter colonne ""Nombre de jour d'absence"" au fichier d'export",Vivien DAKPOGAN,Jean-Claude SAMPENNIE,S-TEL,,Appel Téléphonique,RH,Gestion employé,Requêtes,Non renseigné,OBC Customer Support,Priorité 1,Terminé(e),2025-03-25 12:37,26/3/2025 11:28,2025-03-26 11:28,
OBCS-9217,OD-2485,RH/Gestion Employé/Formulaire fichier du personnel - Enregistrement de données impossible pour le mode matricule auto,"Enregistrement fichier employé impossible pour le mode “Matricule auto“

!image-20250321-090555.png|width=1350,height=681,alt=""image-20250321-090555.png""!",Edwige KOUASSI,EHUI Inesse,CILAGRI,,E-mail,RH,Gestion employé,Bug,Enregistrement impossible,OBC Customer Support,Priorité 1,Terminé(e),2025-03-21 09:07,9/4/2025 16:40,2025-04-09 16:40,
OBCS-9158,OD-2432,"RH/Gestion employés/Portail employé : Quand Olivier clique sur la fonctionnalité portail employé, il a un message d'erreur ( voir capture)","* 
* 

!image (34).png|width=1136,height=442,alt=""image (34).png""!",EVA BASSE,Olivier Kacou,ONPOINT,,E-mail,RH,Gestion employé,Bug,Page d'erreur,OBC Customer Support,Priorité 1,Terminé(e),2025-03-19 11:16,14/4/2025 10:27,2025-04-14 10:27,
OBCS-9163,OD-2437,Changer Note de débit/Crédit par avis de Débit/Crédit,Changer Note de débit/Crédit par avis de Débit/Crédit,EVA BASSE,Kramo,ARIC,,En présentiel,Global,Global,Requêtes,Non renseigné,OBC Customer Support,Priorité 1,Terminé(e),2025-03-19 16:29,28/3/2025 09:04,2025-03-28 09:04,Global
OBCS-9155,OD-2429,RH/Fichier du Personnel/Importation - Importation de fichier du personnel Impossible,"!image-20250317-115548.png|width=1348,height=529,alt=""image-20250317-115548.png""!

Importation de fichier du personnel Impossible, du à la case vide du matricule.

Le matricule étant généré automatiquement  le fichier doit être importé.",Edwige KOUASSI,,CILAGRI,,Constat Interne,RH,Achat,Bug,Import de fichiers impossible,OBC Customer Support,Priorité 3,En cours,2025-03-19 02:33,25/3/2025 09:15,,
OBCS-9160,OD-2434,Finance/Comptabilité générale/Plan comptable générale entité : Afficher les comptes concernés par des doublons dans le plan comptable générale entité (voir capture) sur JOELKA,"# 


Afficher les comptes concernés par des doublons
dans le plan comptable générale entité (voir capture) sur JOELKA",EVA BASSE,,JOEL K PERFORMANCE,,En présentiel,Finance,Comptabilité Générale,Bug,Mauvais déversement des données,OBC Customer Support,Priorité 1,Terminé(e),2025-03-19 11:26,28/3/2025 15:33,2025-03-28 15:33,
OBCS-9316,OD-2499,Validation des frais de missions par le DG,# *Validation des frais de missions par le DG* : Fais en sorte que les coûts liés à un ordre de mission donné soit soumis à la validation du DG,N'GBRA MOYE BERNICE DORIS,KOUAME KONAN GUY ROGER,SIE-TRAVAUX,,E-mail,Global,Global,Requêtes,Non renseigné,OBC Customer Support,Priorité 2,À faire,2025-03-24 10:54,24/3/2025 10:54,,Global
OBCS-9315,OD-2498,Tableau de bord de suivi des bons de commande,"# *Tableau de bord de suivi des bons de commande* : Développer un dashboard accessible à la comptabilité et aux achats, affichant l’état des livraisons et la présence des factures pour chaque bon de commande émis.",N'GBRA MOYE BERNICE DORIS,KOUAME KONAN GUY ROGER,SIE-TRAVAUX,,E-mail,Global,Global,Requêtes,Non renseigné,OBC Customer Support,Priorité 2,À faire,2025-03-24 10:54,24/3/2025 10:54,,Global
OBCS-9314,OD-2497,Suivi des sous-traitances,"# *Suivi des sous-traitances* : Mettre en place une interface permettant de suivre les décomptes des sous-traitants, depuis l’avance de démarrage jusqu’à l’attachement final.",N'GBRA MOYE BERNICE DORIS,KOUAME KONAN GUY ROGER,SIE-TRAVAUX,,E-mail,Global,Global,Requêtes,Non renseigné,OBC Customer Support,Priorité 2,À faire,2025-03-24 10:53,24/3/2025 10:53,,Global
OBCS-9312,OD-2495,Rappel des échéances des contrats CDD,# *Rappel des échéances des contrats CDD* : Implémenter un rappel automatique des dates de fin de contrat pour une meilleure gestion des renouvellements,N'GBRA MOYE BERNICE DORIS,KOUAME KONAN GUY ROGER,SIE-TRAVAUX,,E-mail,Global,Global,Requêtes,Non renseigné,OBC Customer Support,Priorité 2,Terminé(e),2025-03-24 10:45,17/7/2025 15:34,2025-07-17 15:34,Global
OBCS-9311,OD-2494,Validation des demandes de sortie de caisse,# *Validation des demandes de sortie de caisse* : Soumettre les demandes de sortie de caisse d’un certain montant à l'approbation préalable du DG),N'GBRA MOYE BERNICE DORIS,KOUAME KONAN GUY ROGER,SIE-TRAVAUX,,E-mail,Global,Global,Requêtes,Non renseigné,OBC Customer Support,Priorité 2,À faire,2025-03-24 10:45,24/3/2025 10:45,,Global
OBCS-9310,OD-2493,Gestion des ordres de mission inter-entités,# *Gestion des ordres de mission inter-entités* : Permettre l’émission d’ordres de mission pour des employés affectés à une autre entité. C'est-à-dire permettre que des employés enregistrés sur SIE-TRAVAUX puisse effectuer des demandes de missions sur AQUIFÈRE FORAGE,N'GBRA MOYE BERNICE DORIS,KOUAME KONAN GUY ROGER,SIE-TRAVAUX,,E-mail,Global,Global,Requêtes,Non renseigné,OBC Customer Support,Priorité 2,Terminé(e),2025-03-24 10:45,17/7/2025 09:06,2025-07-17 09:06,Global
OBCS-9309,OD-2492,Conditions de règlement sur le bon de commande final,# *Conditions de règlement sur le bon de commande final* : Afficher systématiquement les conditions de règlement convenues avec le fournisseur sur le bon de commande imprimé.,N'GBRA MOYE BERNICE DORIS,KOUAME KONAN GUY ROGER,SIE-TRAVAUX,,E-mail,Global,Global,Requêtes,Non renseigné,OBC Customer Support,Priorité 2,À faire,2025-03-24 10:44,24/3/2025 10:44,,Global
OBCS-9308,OD-2491,Ajout de champs pertinents dans la synthèse de cotation,"# *Ajout de champs pertinents dans la synthèse de cotation* : Lors de l'enregistrement de la synthèse de cotation, Intégrer des éléments tels que la TVA, le mode de règlement et le délai de livraison pour faciliter un arbitrage optimal.",N'GBRA MOYE BERNICE DORIS,KOUAME KONAN GUY ROGER,SIE-TRAVAUX,,E-mail,Global,Global,Requêtes,Non renseigné,OBC Customer Support,Priorité 2,À faire,2025-03-24 10:43,24/3/2025 10:43,,Global
OBCS-9307,OD-2490,Affichage restreint des fournisseurs après arbitrage,"# *Affichage restreint des fournisseurs après arbitrage* : Lorsque plusieurs fournisseurs sont en concurrence sur une expression de besoin, limiter la liste déroulante aux seuls fournisseurs sélectionnés après arbitrage (Lors de l'établissement du bon de commande).",N'GBRA MOYE BERNICE DORIS,KOUAME KONAN GUY ROGER,SIE-TRAVAUX,,E-mail,Global,Global,Requêtes,Non renseigné,OBC Customer Support,Priorité 2,À faire,2025-03-24 10:43,24/3/2025 10:43,,Global
OBCS-9306,OD-2489,Automatisation des informations fournisseur et site projet,"# *Automatisation des informations fournisseur et site projet* : Lors de la sélection d’une expression de besoin pour l'élaboration d' un bon de commande (BC), ou du bon de commande pour l'établissement du bon de livraison ou d'une facture, afficher automatiquement le nom du fournisseur et le site projet associés.",N'GBRA MOYE BERNICE DORIS,KOUAME KONAN GUY ROGER,SIE-TRAVAUX,,E-mail,Global,Global,Requêtes,Non renseigné,OBC Customer Support,Priorité 2,À faire,2025-03-24 10:42,24/3/2025 10:42,,Global
OBCS-9305,OD-2488,"Supprimer la mention ""N°Téléphone""","# Supprimer la mention *""N°Téléphone""*",N'GBRA MOYE BERNICE DORIS,KOUAME KONAN GUY ROGER,SIE-TRAVAUX,,E-mail,Global,Global,Requêtes,Non renseigné,OBC Customer Support,Priorité 2,À faire,2025-03-24 10:41,24/3/2025 10:42,,Global
OBCS-9304,OD-2487,"Remplacer le terme ""Filial"" par ""Entité”","# Remplacer le terme *""Filial""* par *""Entité”*",N'GBRA MOYE BERNICE DORIS,KOUAME KONAN GUY ROGER,SIE-TRAVAUX,,E-mail,Global,Global,Requêtes,Non renseigné,OBC Customer Support,Priorité 2,À faire,2025-03-24 10:41,24/3/2025 10:41,,Global
OBCS-9303,OD-2486,Modifier la nomenclature du numéro du bon de commande comme suit : BC-[3 premières lettres du projet]-[2 chiffres de l'année en cours]-[Numéro séquentiel du bon]. Exemple : BC-PER 23-001.,# Modifier la nomenclature du numéro du bon de commande comme suit : BC-[3 premières lettres du projet]-[2 chiffres de l'année en cours]-[Numéro séquentiel du bon]. Exemple : BC-PER 23-001.,N'GBRA MOYE BERNICE DORIS,KOUAME KONAN GUY ROGER,SIE-TRAVAUX,,E-mail,Global,Global,Requêtes,Non renseigné,OBC Customer Support,Priorité 2,Terminé(e),2025-03-24 10:40,17/7/2025 11:45,2025-07-16 09:05,Global
OBCS-9154,OD-2428,Point des requêtes SIE TRAVAUX,"Point des requêtes SIE TRAVAUX

# Ajouter un code QR afin de confirmer la sincérité du document",N'GBRA MOYE BERNICE DORIS,KOUAME KONAN GUY ROGER,SIE-TRAVAUX,,Appel Téléphonique,Global,Global,Requêtes,Non renseigné,OBC Customer Support,Priorité 2,À faire,2025-03-17 17:31,24/3/2025 10:54,,Global
OBCS-9086,OD-2427,Opération/Agro/Enregistrement et Import Producteur - Amélioration Enregistrement Fiche import et formulaire Planteur,"Lever l’obligation sur les différents N° de matricule, car un planteur peut ne pas avoir de matricule 

Il est donc référencé par son code Fournisseur.",Edwige KOUASSI,Serge AMOUZOU,ECORIGINE,,Appel Téléphonique,Opérations,Achat,Requêtes,Non renseigné,OBC Customer Support,Priorité 1,En cours,2025-03-14 17:25,28/3/2025 08:58,,
OBCS-9065,OD-2426,RH/DOCUMENTS/LIVRE DE PAIE GENERAL/Nous constatons des incohérences lors de l'affichage du livre de paie,"RH/DOCUMENTS/LIVRE DE PAIE GENERAL/Nous constatons des incohérences lors de l'affichage du livre de paie tel que 😀 

# Non affichage du prénom des employés
# Non affichage de plusieurs employés dans le livre de paie
# Montants cumulés de certaines rubriques de paie comme  l’indemnité de transport  dans une seule colonne qui récupère que le nom de famille.",N'GBRA MOYE BERNICE DORIS,CHARLES IPO,FALCON,,Appel Téléphonique,RH,Documents,Bug,Mauvais déversement des données,OBC Customer Support,Priorité 1,Terminé(e),2025-03-10 17:30,21/3/2025 11:14,2025-03-21 11:14,
OBCS-8976,OD-2424,Récupération impôts et taxes (FDFP),"Récupération impôts et taxes (FDFP)

Transféré et traité au niveau du support technique",Edwige KOUASSI,Ousseyni Oumarou,EJARA,,Appel Téléphonique,Finance,Impôts et taxes,Bug,Mauvais déversement des données,OBC Customer Support,Priorité 1,Terminé(e),2025-03-09 01:20,28/3/2025 09:15,2025-03-28 09:15,
OBCS-8975,OD-2423,Nombre de Jours de congés non pris en compte sur le bulletin de paie,"Nombre de Jours de congés non pris en compte sur le bulletin de paie

Résolution - IT : correction de nombre de jour depuis la source via interface Dev",Edwige KOUASSI,Ousseyni Oumarou,EJARA,,Appel Téléphonique,RH,Documents,Bug,Erreur de calcul/Erreur sur Dashboard,OBC Customer Support,Priorité 1,Terminé(e),2025-03-09 01:18,28/3/2025 09:16,2025-03-28 09:16,
OBCS-8984,OD-2425,Projet/Note de Frais - Message d'erreur - Formulaire Note de frais,"Affichage d’un message d’erreur à l’entré du formulaire.

Message Complet : 

h2. Attention

Error : Exception error : Object reference not set to an instance of an object. // at ONPOINTBUSINESSCENTER.Controllers.ExpenseTimesheetController.<>c__DisplayClass22_3.<PointParAgentExpensesTshG1>b__12(ResultsCategorieRubriqueRh p) at System.Linq.Enumerable.WhereListIterator`1.MoveNext() at System.Linq.Buffer`1..ctor(IEnumerable`1 source) at System.Linq.OrderedEnumerable`1.<GetEnumerator>d__1.MoveNext() at System.Linq.Enumerable.WhereSelectEnumerableIterator`2.MoveNext() at Newtonsoft.Json.Linq.JContainer.TryAddInternal(Int32 index, Object content, Boolean skipParentCheck, Boolean copyAnnotations) at Newtonsoft.Json.Linq.JContainer.Add(Object content) at ONPOINTBUSINESSCENTER.Controllers.ExpenseTimesheetController.<>c__DisplayClass22_0.<PointParAgentExpensesTshG1>b__7(IGrouping`2 gnod) at System.Linq.Enumerable.WhereSelectEnumerableIterator`2.MoveNext() at Newtonsoft.Json.Linq.JContainer.TryAddInternal(Int32 index, Object content, Boolean skipParentCheck, Boolean copyAnnotations) at Newtonsoft.Json.Linq.JContainer.Add(Object content) at ONPOINTBUSINESSCENTER.Controllers.ExpenseTimesheetController.PointParAgentExpensesTshG1(String xAgent)

!image-20250309-014144.png|width=946,height=660,alt=""image-20250309-014144.png""!",Edwige KOUASSI,,ONPOINT,,Constat Interne,RH,Gestion employé,Bug,Page d'erreur,OBC Customer Support,Priorité 3,Terminé(e),2025-03-09 01:43,28/3/2025 09:25,2025-03-28 09:25,
OBCS-9188,OD-2462,AGRO/Sous Module Export - Facture définitive,AGRO/Sous Module Export - Facture définitive,EVA BASSE,,ECORIGINE,,En présentiel,Opérations,Achat,Requêtes,Non renseigné,OBC Customer Support,Priorité 1,À faire,2025-03-19 18:45,19/3/2025 18:46,,
OBCS-9187,OD-2461,AGRO/Sous Module Export - Facture proforma,AGRO/Sous Module Export - Facture proforma,EVA BASSE,,ECORIGINE,,En présentiel,Opérations,Achat,Requêtes,Non renseigné,OBC Customer Support,Priorité 1,À faire,2025-03-19 18:45,19/3/2025 18:45,,
OBCS-9186,OD-2460,AGRO/Sous Module Export - Ordre de transit,AGRO/Sous Module Export - Ordre de transit,EVA BASSE,,ECORIGINE,,En présentiel,Opérations,Achat,Requêtes,Non renseigné,OBC Customer Support,Priorité 1,À faire,2025-03-19 18:45,19/3/2025 18:45,,
OBCS-9185,OD-2459,AGRO/Sous Module Export - Contrat de vente,AGRO/Sous Module Export - Contrat de vente,EVA BASSE,,ECORIGINE,,En présentiel,Opérations,Achat,Requêtes,Non renseigné,OBC Customer Support,Priorité 1,Terminé(e),2025-03-19 18:45,15/9/2025 19:09,2025-09-15 19:09,
OBCS-9184,OD-2458,AGRO/Sous Module Export - Planification des embarquements,AGRO/Sous Module Export - Planification des embarquements,EVA BASSE,,ECORIGINE,,En présentiel,Opérations,Achat,Requêtes,Non renseigné,OBC Customer Support,Priorité 1,Terminé(e),2025-03-19 18:44,14/8/2025 10:44,2025-08-14 10:44,
OBCS-9182,OD-2456,Export du fichier de traçabilité planteur,Export du fichier de traçabilité planteur,EVA BASSE,,ECORIGINE,,En présentiel,Opérations,Achat,Requêtes,Non renseigné,OBC Customer Support,Priorité 1,À faire,2025-03-19 18:41,19/3/2025 18:41,,
OBCS-9181,OD-2455,Exécuter le règlement d'un bordereau de réception,Exécuter le règlement d'un bordereau de réception,EVA BASSE,,ECORIGINE,,En présentiel,Opérations,Achat,Requêtes,Non renseigné,OBC Customer Support,Priorité 1,En cours,2025-03-19 18:41,10/4/2025 10:43,,
OBCS-9180,OD-2454,"Programmation de règlement fournisseur : ajouter deux nouvelles natures de paiement ""Prefinancement"" et ""Bordereau de réception"" spécifiques aux fournisseurs de cacao","Programmation de règlement fournisseur : ajouter deux nouvelles natures de paiement ""Prefinancement"" et ""Bordereau de réception"" spécifiques aux fournisseurs de cacao",EVA BASSE,,ECORIGINE,,En présentiel,Opérations,Achat,Requêtes,Non renseigné,OBC Customer Support,Priorité 1,Terminé(e),2025-03-19 18:41,22/4/2025 07:40,2025-04-22 07:40,
OBCS-9179,OD-2453,Connaisement brousse : ajouter une fonction import,Connaisement brousse : ajouter une fonction import,EVA BASSE,,ECORIGINE,,En présentiel,Opérations,Achat,Requêtes,Non renseigné,OBC Customer Support,Priorité 1,Terminé(e),2025-03-19 18:40,28/3/2025 14:15,2025-03-28 14:15,
OBCS-9178,OD-2452,Identification des producteurs : ajouter une fonction import,Identification des producteurs : ajouter une fonction import,EVA BASSE,,ECORIGINE,,En présentiel,Opérations,Achat,Requêtes,Non renseigné,OBC Customer Support,Priorité 1,Terminé(e),2025-03-19 18:39,28/3/2025 14:15,2025-03-28 14:15,
OBCS-9177,OD-2451,Connaissement usine et Pesée brousse : Filtrer la liste des fournisseurs sur les coopératives et les societés d'achat,Connaissement usine et Pesée brousse : Filtrer la liste des fournisseurs sur les coopératives et les societés d'achat,EVA BASSE,,ECORIGINE,,En présentiel,Opérations,Achat,Requêtes,Non renseigné,OBC Customer Support,Priorité 1,Terminé(e),2025-03-19 18:38,2/4/2025 10:05,2025-04-02 10:05,
OBCS-9176,OD-2450,Fournisseur : ajouter un champ conditionnel Type fournisseur (Autre/Coopérative/Societé d'achat),Fournisseur : ajouter un champ conditionnel Type fournisseur (Autre/Coopérative/Societé d'achat),EVA BASSE,,ECORIGINE,,En présentiel,Opérations,Achat,Requêtes,Non renseigné,OBC Customer Support,Priorité 1,Terminé(e),2025-03-19 18:38,28/3/2025 17:01,2025-03-28 17:01,
OBCS-9175,OD-2449,Destinatons : limiter aux ports d'embarquement,Destinatons : limiter aux ports d'embarquement,EVA BASSE,,ECORIGINE,,En présentiel,Opérations,Achat,Requêtes,Non renseigné,OBC Customer Support,Priorité 1,Terminé(e),2025-03-19 18:37,29/4/2025 08:27,2025-04-29 08:27,
OBCS-9174,OD-2448,Renommer la fonctionnalité Nature Export en Type d'Embarquement,Renommer la fonctionnalité Nature Export en Type d'Embarquement,EVA BASSE,,ECORIGINE,,En présentiel,Opérations,Achat,Requêtes,Non renseigné,OBC Customer Support,Priorité 1,Terminé(e),2025-03-19 18:36,2/4/2025 10:03,2025-04-02 10:03,
OBCS-8906,OD-2422,"Finance/Comptabilité générale/Historique des imputations comptables : Le filtre des opérations ""comptabilisées ou non comptabilisées"" ne fonctionne pas","!image-20250213-092431.png|width=1778,height=679,alt=""image-20250213-092431.png""!",EVA BASSE,KONE Mariam,SIT BTP,,Appel Téléphonique,Finance,Comptabilité Générale,Bug,Dysfonctionnement des filtres,OBC Customer Support,Priorité 1,Terminé(e),2025-02-13 09:25,28/3/2025 15:19,2025-03-28 15:19,
OBCS-9170,OD-2444,Modèle de bulletin sans departement,Modèle de bulletin sans departement,EVA BASSE,CHRISTELLE NGBECHE,2AAZ,,E-mail,RH,Documents,Requêtes,Non renseigné,OBC Customer Support,Priorité 1,Terminé(e),2025-03-19 16:59,28/3/2025 09:07,2025-03-28 09:07,
OBCS-9197,OD-2471,Correction Bug Affichage Rappel List Activité,Correction Bug Affichage Rappel List Activité,EVA BASSE,FABIEN VATI,ONPOINT,,E-mail,CRM,Activités commerciales,Bug,Non affichage de pages/données,OBC Customer Support,Priorité 1,Terminé(e),2025-03-19 20:40,21/3/2025 11:11,2025-03-21 11:11,
OBCS-9198,OD-2472,Graphe CA par produit : Représenter plutôt sous forme de graphe cumulé. Graphe Suivi Mensuel Opportunité : Ajouter les montants cumulés des opportunités également dans les courbes,"Graphe CA par produit : Représenter plutôt sous forme de graphe cumulé.
Graphe Suivi Mensuel Opportunité : Ajouter les montants cumulés des opportunités également dans les courbes",EVA BASSE,FABIEN VATI,ONPOINT,,E-mail,CRM,Analytique,Requêtes,Non renseigné,OBC Customer Support,Priorité 1,Terminé(e),2025-03-19 20:41,21/3/2025 11:26,2025-03-21 11:26,
OBCS-9196,OD-2470,"Lorsque le formulaire contact est renseigné, enlever l'obligation sur le formulaire interlocuteur DANS PROSPECT","Lorsque le formulaire contact est renseigné, enlever l'obligation sur le formulaire interlocuteur DANS PROSPECT",EVA BASSE,FABIEN VATI,ONPOINT,,E-mail,CRM,Activités commerciales,Requêtes,Non renseigné,OBC Customer Support,Priorité 1,Terminé(e),2025-03-19 20:39,21/3/2025 11:22,2025-03-21 11:22,
OBCS-9195,OD-2469,"Dans la fonction rappel du CRM, nous souhaitons avoir  la possibilité de filtrer les rappels par: - Date de rappel, - Client, - Statut.","Dans la fonction rappel du CRM, nous souhaitons avoir  la possibilité de filtrer les rappels par: - Date de rappel, - Client, - Statut.",EVA BASSE,FABIEN VATI,ONPOINT,,E-mail,CRM,Activités commerciales,Requêtes,Non renseigné,OBC Customer Support,Priorité 1,Terminé(e),2025-03-19 20:38,21/3/2025 11:22,2025-03-21 11:22,
OBCS-9194,OD-2468,Dashboard CRM (filtrer les données selon la ou les bases de travail du user connecté) ;,Dashboard CRM (filtrer les données selon la ou les bases de travail du user connecté) ;,EVA BASSE,FABIEN VATI,ONPOINT,,E-mail,CRM,Analytique,Requêtes,Non renseigné,OBC Customer Support,Priorité 1,À faire,2025-03-19 20:37,19/3/2025 20:37,,
OBCS-9193,OD-2467,Modèle de facture vente à intégrer,Modèle de facture vente à intégrer,EVA BASSE,Jean-Jacques LIKANE,LABOGEM,,En présentiel,Opérations,Vente,Requêtes,Non renseigné,OBC Customer Support,Priorité 1,À faire,2025-03-19 20:34,19/3/2025 20:34,,
OBCS-8904,OD-2421,Agro - Analyse et structuration DASHBOARD,"Analyse, structuration et mise en place du tableau de bord Agro.",Edwige KOUASSI,Ismaël KONE,ECORIGINE,,En présentiel,Global,Global,Requêtes,Non renseigné,OBC Customer Support,Priorité 1,En cours,2025-02-11 10:06,13/2/2025 09:06,,Global
OBCS-8903,OD-2420,Agro - Paramétrage Fournisseurs cacao,"*Paramétrage des Fournisseurs de Cacao*

*1. Informations Fournisseurs*

* *Dénomination ou raison sociale au lieu* de nom fournisseur : Champ à renseigner.
* *Menu déroulant – Segment :* Ajouter à la liste « *Coopérative »* et « *Société d’achat »*.
* *Interlocuteur et personne ressource :* À renseigner pour chaque fournisseur de cacao.
* *BIC :*
** Mettre ce champ par défaut.
** Lever l’obligation de renseignement du BIC si une *pièce justificative* est jointe.

 ",Edwige KOUASSI,Ismaël KONE,ECORIGINE,,En présentiel,Global,Global,Requêtes,Non renseigné,OBC Customer Support,Priorité 1,Terminé(e),2025-02-11 09:42,23/4/2025 04:00,2025-03-28 15:22,Global
OBCS-8902,OD-2419,Agro - Formulaire Nature Export / Renommer le champ en type d'embarquement,"*Dans le formulaire Nature Export :*

* Renommer le champ en *Type d’embarquement*.",Edwige KOUASSI,Ismaël KONE,ECORIGINE,,En présentiel,Global,Global,Requêtes,Non renseigné,OBC Customer Support,Priorité 1,Terminé(e),2025-02-11 09:32,28/3/2025 15:31,2025-03-28 15:31,Global
OBCS-8901,OD-2418,"Agro - Création Fonctionnalité et Formulaire "" Bordereau de réception""","Création Fonctionnalité & Formulaire ""[Bordereau de réception|https://onpointsunrise.com/AgroAchatBordereauReception/Index]”",Edwige KOUASSI,Ismaël KONE,ECORIGINE,,En présentiel,Global,Global,Requêtes,Non renseigné,OBC Customer Support,Priorité 1,Terminé(e),2025-02-11 09:30,28/3/2025 14:15,2025-03-28 14:15,Global
OBCS-8899,OD-2416,"Agro - Création Fonctionnalité et Formulaire ""pesée""","Création Fonctionnalité & Formulaire ""[Pesée|https://onpointsunrise.com/AgroAchatPesee/Index]”",Edwige KOUASSI,Ismaël KONE,ECORIGINE,,En présentiel,Global,Global,Requêtes,Non renseigné,OBC Customer Support,Priorité 1,Terminé(e),2025-02-11 09:28,28/3/2025 14:14,2025-03-28 14:14,Global
OBCS-8887,OD-2414,paramétrage/ ADMINISTRATION DES PROFILES ET DES ROLES/ Dysfonctionnement accès fonctionnalité à partir de profil utilisateur,"Dysfonctionnement accès fonctionnalité à partir de profil utilisateur

Bien que tous les accès aux fonctionnalités, module, exercice comptable et entité soient coché 

Aucune fonctionnalité n’est lié au compte utilisateur.



1- Accès profil Responsable admin & Fin

!image-20250210-231652.png|width=1136,height=502,alt=""image-20250210-231652.png""!

2- Compte utilisateur concerné

!20250210-2317-17.9568692.mp4|width=1920,height=1030,alt=""20250210-2317-17.9568692.mp4""!",Edwige KOUASSI,Souleymane CISSE,ECORIGINE,,E-mail,Global,Global,Bug,Autres,OBC Customer Support,Priorité 1,Terminé(e),2025-02-10 23:19,14/4/2025 10:30,2025-04-14 10:30,Global
OBCS-8768,OD-2399,Finance/Comptabilité Générale/Plan Comptable Générale - Doublon à supprimer dans la base,Plan Comptable Générale - Doublon à supprimer dans la base,Edwige KOUASSI,Ousseyni Oumarou,CILAGRI,,Appel Téléphonique,Finance,Comptabilité Générale,Bug,Autres,OBC Customer Support,Priorité 1,En cours,2025-02-07 09:55,7/2/2025 10:57,,
OBCS-8819,OD-2407,Donner la possibilité d'afficher les données par site.,"Donner la possibilité d’afficher les données saisies par site.

Cilagri ayant deux sites et deux comptables chacun devrait pouvoir afficher la donnée en fonction des saisies de son site. Cela leur permettra d’avoir une vue sur l'ensemble des saisies effectué individuellement, puis sur toute les données consolidés.",Edwige KOUASSI,Aristide Kouadio,CILAGRI,,"Online (Google Meet, Teams...)",Global,Comptabilité Générale,Requêtes,Non renseigné,OBC Customer Support,Priorité 1,À faire,2025-02-07 18:31,7/2/2025 19:54,,
OBCS-8775,OD-2406,RH/Salaire/Formulaire - Verrouiller l'option en fonction du choix effectué pour le calcul salaire,"Lors du calcul de paie, nous avons la possibilité d’effectuer le calcul de paie soit par TimeSheet ou par Pointage.

Dans le cas ou la sélection est faite griser l’option non sélectionné",Edwige KOUASSI,,CILAGRI,,Constat Interne,RH,Salaire,Requêtes,Non renseigné,OBC Customer Support,Priorité 2,À faire,2025-02-07 15:56,7/2/2025 15:56,,
OBCS-8774,OD-2405,RH/Gestion Employé/Edition Attestation congé/ - Donnée incomplète sur l'attestation de congés,"Sur l’attestation de congés faire en sorte que : 

# Le nom et prénoms soient récupéré totalement
# Libellé Poste signataire

!image-20250207-141419.png|width=587,height=534,alt=""image-20250207-141419.png""!",Edwige KOUASSI,EHUI Inesse,CILAGRI,,Appel Téléphonique,RH,Documents,Requêtes,Non renseigné,OBC Customer Support,Priorité 1,En cours,2025-02-07 14:20,11/2/2025 10:04,,
OBCS-8772,OD-2403,"Opération/Sous module Agro - Création Fonctionnalité "" Création Transporteur""","Création Fonctionnalité ""Transporteur"",  Champ formulaire et paramétrages liés",Edwige KOUASSI,,ECORIGINE,,Constat Interne,Global,Global,Requêtes,Non renseigné,OBC Customer Support,Priorité 1,Terminé(e),2025-02-07 11:28,7/2/2025 15:03,2025-02-07 15:03,Global
OBCS-8771,OD-2402,"Opération/Sous module Agro - Création Fonctionnalité ""Connaissement brousse""","Création Fonctionnalité ""Connaissement Brousse""

Champ formulaire et paramétrages liés",Edwige KOUASSI,,ECORIGINE,,Constat Interne,Global,Global,Requêtes,Non renseigné,OBC Customer Support,Priorité 1,Terminé(e),2025-02-07 11:22,7/2/2025 15:02,2025-02-07 15:02,Global
OBCS-8770,OD-2401,"Opération/Sous module Agro - Création Fonctionnalité ""Des fournisseurs""","Création Fonctionnalité ""Des fournisseurs""

* Champ formulaire et paramétrages liés",Edwige KOUASSI,,ECORIGINE,,Constat Interne,Global,Global,Requêtes,Non renseigné,OBC Customer Support,Priorité 1,Terminé(e),2025-02-07 11:09,7/2/2025 15:03,2025-02-07 15:03,Global
OBCS-8769,OD-2400,"Opération/Sous module Agro - Création Fonctionnalité "" Identification des producteurs""","Création Fonctionnalité "" Identification des producteurs""

Champ formulaire et paramétrages liés",Edwige KOUASSI,,ECORIGINE,,Constat Interne,Global,Global,Requêtes,Non renseigné,OBC Customer Support,Priorité 1,Terminé(e),2025-02-07 11:07,7/2/2025 15:03,2025-02-07 15:03,Global
OBCS-8767,OD-2398,Finance/Comptabilité générale/ Ecritures Manuelle- Aucune données ne s'affiche dans la liste des comptes fournisseurs quand il s'agit des fournisseurs d'immo compte 404,"Dans la compta de l'entité EJARA WEST AFRICA, au niveau des écritures manuelles on n'arrive pas à choisir un compte de tiers lorsqu'on choisi comme compte générale un fournisseur d'immobilisation (404)



!20250207-0844-11.4343898.mp4|width=1920,height=914,alt=""20250207-0844-11.4343898.mp4""!",Edwige KOUASSI,Ousseyni Oumarou,EJARA,,Appel Téléphonique,Finance,Comptabilité Générale,Bug,Récupération de données impossible,OBC Customer Support,Priorité 1,Terminé(e),2025-02-07 08:47,7/2/2025 15:02,2025-02-07 15:02,
OBCS-8836,OD-2408,"Au changement d'une entité, le rapport hebdomadaire sur les timesheet prend en compte l'ancienne entité","Au changement d'une entité, le rapport hebdomadaire sur les timesheet prend en compte l'ancienne entité",EVA BASSE,CEDRIC EMMANUELLA,ONPOINT,,Appel Téléphonique,Projets,Feuille de temps,Bug,Autres,OBC Customer Support,Priorité 1,Terminé(e),2025-02-07 19:35,28/3/2025 09:10,2025-03-28 09:10,
OBCS-8766,OD-2397,"Quand on enregistre une facture d'achat, on a une page blanche avec un message","Quand on enregistre une facture d'achat, on a une page blanche avec un message",EVA BASSE,Brahima COULIBALY,KORI TRANSPORT,,E-mail,Opérations,Achat,Bug,Page d'erreur,OBC Customer Support,Priorité 1,Terminé(e),2025-02-05 17:23,7/2/2025 15:02,2025-02-07 15:02,
OBCS-8757,OD-2394,Le formulaire de rappel ne s'affiche pas,Le formulaire de rappel ne s'affiche pas,EVA BASSE,FABIEN VATI,ONPOINT,,E-mail,CRM,Activités commerciales,Bug,Formulaire indisponible,OBC Customer Support,Priorité 1,Terminé(e),2025-02-05 16:55,21/3/2025 10:26,2025-03-21 10:26,
OBCS-8754,OD-2393,Impôts et taxes/ Problèmes sur les écritures d'enregistrement et paiement d'impôts et taxes,"# Certains comptes d'impôts ne se déversent pas dans les grands livres comptables tel que : IS PATRONALE, FDFP.
# les paiements des impôts sur salaires ITS 447200 se déversent dans le 442800 en lieu et place du 447200",N'GBRA MOYE BERNICE DORIS,CHARLES IPO,FALCON,,Appel Téléphonique,Finance,Impôts et taxes,Bug,Mauvais déversement des données,OBC Customer Support,Priorité 1,Terminé(e),2025-02-05 09:46,14/2/2025 17:16,2025-02-14 17:16,
OBCS-8753,OD-2392,RH/SALAIRE/ Calcul OHADA sur 2024 : Nous constatons sur certains mois calculés les cotisations tel que FDFP ET IS PATROALES qui ne se déversent pas,"RH/SALAIRE/ Calcul OHADA sur 2024 : Nous constatons sur certains mois calculés les cotisations tel que FDFP ET IS PATROALES qui ne se déversent pas

C’est l’exemple de la paie de Mars 2024 où les cotisations citées sont calculées mais pour les mois de Avril,  janvier et autres les calculs n’ont pas été fait",N'GBRA MOYE BERNICE DORIS,CHARLES IPO,FALCON,,Appel Téléphonique,RH,Documents,Bug,Mauvais déversement des données,OBC Customer Support,Priorité 1,Terminé(e),2025-02-05 09:41,7/2/2025 15:02,2025-02-07 10:33,
OBCS-8759,OD-2396,Points des requêtes CRM à traiter sur le Dashboard pilotage commercial,"Points des requêtes CRM à traiter sur le Dashboard pilotage commercial

# Utiliser plutôt le montant cumulé des opportunités pour le graphe que les quantités
# Afficher les opportunités gagnés en lieu et place de opportunités closées.
# Représenter plutôt sous forme de graphe cumulé",N'GBRA MOYE BERNICE DORIS,KALOGO Nabarakissa,S-TEL,,Appel Téléphonique,CRM,Analytique,Requêtes,Non renseigné,OBC Customer Support,Priorité 1,À faire,2025-02-05 17:12,5/2/2025 17:12,,
OBCS-8749,OD-2391,RH/Salaire - Correction calcul de salaire dont le brut est >= 8 000 000,Correction calcul de salaire dont le brut est >= 8 000 000,Edwige KOUASSI,,CILAGRI,,Constat Interne,RH,Salaire,Bug,Dysfonctionnement sur le Calcul des salaires,OBC Customer Support,Priorité 1,Terminé(e),2025-02-04 15:21,5/2/2025 15:50,2025-02-05 15:50,
OBCS-8743,OD-2390,RH/Document/Attestation de travail - Données incomplète sur l'attestation de travail,Données incomplète sur l'attestation de travail,Edwige KOUASSI,EHUI Inesse,CILAGRI,,En présentiel,RH,Paramétrage,Bug,Enregistrement impossible,OBC Customer Support,Priorité 1,En cours,2025-02-03 16:31,5/2/2025 17:45,,
OBCS-8742,OD-2389,RH/Document - Attestation de Travail,Utiliser la date de début d’entré Sur l’attestation de travail,Edwige KOUASSI,EHUI Inesse,CILAGRI,,En présentiel,RH,Paramétrage,Bug,Enregistrement impossible,OBC Customer Support,Priorité 1,En cours,2025-02-03 15:39,3/2/2025 16:36,,
OBCS-8741,OD-2388,RH/Paramétrage Société/ Création Poste Employé - Impossible de Créer un poste employé quand le nombre de caractère est trop long,"Impossible de Créer un poste employé quand le nombre de caractère est trop long

Exemple de Poste Non pris en compte : Chef du Département des Affaires Juridiques du Contencieux et des Ressources Humaines

!image-20250203-152704.png|width=1347,height=604,alt=""image-20250203-152704.png""!",Edwige KOUASSI,EHUI Inesse,CILAGRI,,En présentiel,RH,Paramétrage,Bug,Enregistrement impossible,OBC Customer Support,Priorité 1,En cours,2025-02-03 15:28,3/2/2025 16:22,,
OBCS-8660,OD-2384,Opération /Achat & Finance/Comptabilité Générale - Formulaire de recherche Nature de prestation & Paramétrages de comptabilisation,"Impossible de faire une recherche en saisissant le numéro de poste comptable ou libellé de la nature d'opération / Prestation dans les formulaires suivant : 

1- Formulaire enregistrement facture achat

2-Formulaire de comptabilisation des natures de prestation",Edwige KOUASSI,MICHEL TETE,ECORIGINE,,Appel Téléphonique,Opérations,Paramétrage,Bug,Autres,OBC Customer Support,Priorité 1,Terminé(e),2025-01-31 11:05,5/2/2025 15:33,2025-02-05 15:33,
OBCS-8661,OD-2385,Finance /Comptabilité Général/ - Paramétrage Comptabilisation Nature de Prestation,"Dans le formulaire du paramétrage des comptabilisations des natures de prestation, fixer le numéro de poste comptable lorsque la nature de prestation est sélectionné",Edwige KOUASSI,MICHEL TETE,ECORIGINE,,Appel Téléphonique,Finance,Paramétrage,Requêtes,Non renseigné,OBC Customer Support,Priorité 1,À faire,2025-01-31 11:11,31/1/2025 11:11,,
OBCS-8648,OD-2373,CRM > DASHBOARD > ETAT DES DEALS : Corriger le bug lié à l'affichage de l'état des deals.,* CRM > DASHBOARD > ETAT DES DEALS : Corriger le bug lié à l'affichage de l'état des deals.,EVA BASSE,M. SANANKOUA,ONPOINT,,En présentiel,CRM,Analytique,Bug,Page d'erreur,OBC Customer Support,Priorité 1,Terminé(e),2025-01-29 10:10,5/2/2025 16:53,2025-02-05 16:53,
OBCS-8657,OD-2381,"CRM > DASHBOARD > ETAT DES DEALS : Dans le CRM, l'état des deals s'affiche uniquement après avoir renseigné le filtre et cliqué sur le bouton ""Rechercher"". Cependant, l'affichage est lent, et le nombre d'opportunités clôturées gagnées reste à 0.","CRM > DASHBOARD > ETAT DES DEALS : Dans le CRM, l'état des deals s'affiche uniquement après avoir renseigné le filtre et cliqué sur le bouton ""Rechercher"". Cependant, l'affichage est lent, et le nombre d'opportunités clôturées gagnées reste à 0.",EVA BASSE,M. SANANKOUA,ONPOINT,,En présentiel,CRM,Activités commerciales,Requêtes,Non renseigné,OBC Customer Support,Priorité 3,Terminé(e),2025-01-29 11:23,21/3/2025 11:23,2025-03-21 11:23,
OBCS-8655,OD-2380,CRM - Historique Gestion Opportunité : Ajouter une colonne affichant la probabilité de closing.,* *CRM - Historique Gestion Opportunité* : Ajouter une colonne affichant la probabilité de closing.,EVA BASSE,M. SANANKOUA,ONPOINT,,En présentiel,CRM,Activités commerciales,Requêtes,Non renseigné,OBC Customer Support,Priorité 3,Terminé(e),2025-01-29 10:15,5/2/2025 16:40,2025-02-05 16:40,
OBCS-8654,OD-2379,CRM - Historique Gestion Opportunité : Remplacer le nom complet du client par son sigle dans la colonne des clients.,* *CRM - Historique Gestion Opportunité* : Remplacer le nom complet du client par son sigle dans la colonne des clients.,EVA BASSE,M. SANANKOUA,ONPOINT,,En présentiel,CRM,Activités commerciales,Requêtes,Non renseigné,OBC Customer Support,Priorité 3,Terminé(e),2025-01-29 10:15,21/3/2025 11:00,2025-03-21 11:00,
OBCS-8653,OD-2378,"Supprimer l'affichage de l'heure dans le libellé des opportunités généré par défaut afin de réduire la largeur de la colonne ""Libellé Opportunité"".","* Supprimer l'affichage de l'heure dans le libellé des opportunités généré par défaut afin de réduire la largeur de la colonne ""Libellé Opportunité"".",EVA BASSE,M. SANANKOUA,ONPOINT,,En présentiel,CRM,Activités commerciales,Requêtes,Non renseigné,OBC Customer Support,Priorité 3,Terminé(e),2025-01-29 10:15,21/3/2025 10:46,2025-03-21 10:46,
OBCS-8651,OD-2376,"Ajouter une vue listant les raccourcis des formulaires de création des fonctionnalités : Prospect, Client, Activité et Gestion Opportunité. A l'instar de la vue ""Liens rapides"" qui est dans : Dashboard utilisateur de la page d'accueil de OBC.","* CRM > DASHBOARD >  ACTIVITÉ COMMERCIALE : Ajouter une vue listant les raccourcis des formulaires de création des fonctionnalités : Prospect, Client, Activité et Gestion Opportunité. A l'instar de la vue ""Liens rapides"" qui est dans : Dashboard utilisateur de la page d'accueil de OBC.",EVA BASSE,M. SANANKOUA,ONPOINT,,En présentiel,CRM,Analytique,Requêtes,Non renseigné,OBC Customer Support,Priorité 3,Terminé(e),2025-01-29 10:13,7/2/2025 09:44,2025-02-07 09:44,
OBCS-8650,OD-2375,"CRM > DASHBOARD > CLIENT : Ajouter le nombre de clients et de prospects dans le ""Dashboard Client (Map)"".","* CRM > DASHBOARD > CLIENT : Ajouter le nombre de clients et de prospects dans le ""Dashboard Client (Map)"".",EVA BASSE,M. SANANKOUA,ONPOINT,,En présentiel,CRM,Analytique,Requêtes,Non renseigné,OBC Customer Support,Priorité 3,Terminé(e),2025-01-29 10:12,31/1/2025 09:29,2025-01-31 09:29,
OBCS-8649,OD-2374,CRM > DASHBOARD > ACTIVITÉ COMMERCIALE : Ajouter un tableau affichant l'état des deals dans l'activité commerciale (destiné aux commerciaux).,* CRM > DASHBOARD > ACTIVITÉ COMMERCIALE : Ajouter un tableau affichant l'état des deals dans l'activité commerciale (destiné aux commerciaux).,EVA BASSE,M. SANANKOUA,ONPOINT,,En présentiel,CRM,Activités commerciales,Requêtes,Non renseigné,OBC Customer Support,Priorité 3,Terminé(e),2025-01-29 10:11,28/3/2025 14:57,2025-03-21 10:34,
OBCS-8647,OD-2372,"CRM > DASHBOARD > ACTIVITÉ COMMERCIALE : Ajouter un filtre ""Commercial"",  commun pour tous les graphiques de la page ""Dashboard Activité Commerciale"".","* CRM > DASHBOARD > ACTIVITÉ COMMERCIALE : Ajouter un filtre ""Commercial"",  commun pour tous les graphiques de la page ""Dashboard Activité Commerciale"".",EVA BASSE,M. SANANKOUA,ONPOINT,,En présentiel,CRM,Analytique,Requêtes,Non renseigné,OBC Customer Support,Priorité 3,Terminé(e),2025-01-29 10:09,3/2/2025 09:28,2025-02-03 09:28,
OBCS-8646,OD-2371,"CRM > DASHBOARD > ACTIVITÉ COMMERCIALE : Ajouter un ""title"" affichant les clients appelés ou visités dans le tableau de flux d'activité.","* CRM > DASHBOARD > ACTIVITÉ COMMERCIALE : Ajouter un ""title"" affichant les clients appelés ou visités dans le tableau de flux d'activité.",EVA BASSE,M. SANANKOUA,ONPOINT,,En présentiel,CRM,Activités commerciales,Requêtes,Non renseigné,OBC Customer Support,Priorité 3,Terminé(e),2025-01-29 10:09,31/1/2025 09:22,2025-01-31 09:22,
OBCS-8639,OD-2364,Finance/Budget - Doublon salaire journalier constaté dans le budget,Doublon salaire journalier constaté dans le budget,Edwige KOUASSI,Ursula YANGANGOUSSOU,ONPOINT,,Appel Téléphonique,Finance,Budget,Requêtes,Non renseigné,OBC Customer Support,Priorité 1,À faire,2025-01-27 13:16,27/1/2025 13:16,,
OBCS-8539,OD-2362,RH/Paramétrage/ - Mauvais déversement des grades,"Revoir processus d’importation des gardes et rajouter au filtre le champ “Entité”

!image-20250124-105235.png|width=1115,height=609,alt=""image-20250124-105235.png""!",Edwige KOUASSI,Ousseyni Oumarou,EJARA,,Appel Téléphonique,RH,Gestion employé,Bug,Duplication anormale,OBC Customer Support,Priorité 1,Terminé(e),2025-01-24 10:55,5/2/2025 15:48,2025-01-31 09:10,
OBCS-8535,OD-2361,RH/Gestion des Employés - Affectation Employé : Revoir le processus et l'interface d'enregistrement des affectations,Revoir le processus et l'interface d'enregistrement des affectations,Edwige KOUASSI,EHUI Inesse,CILAGRI,,Appel Téléphonique,RH,Gestion employé,Requêtes,Non renseigné,OBC Customer Support,Priorité 1,En cours,2025-01-23 16:10,27/1/2025 10:50,,
OBCS-8637,OD-2363,"RH/Gestion Employé/ Pointage permanant - Donner la possibilité de calculer la paie à partir d'un pointage, TimeSheet et autre","Donner la possibilité de calculer la paie à partir d'un pointage, TimeSheet et autre",Edwige KOUASSI,Léa N'GUESSAN,CILAGRI,,Appel Téléphonique,RH,Feuille de temps,Requêtes,Non renseigné,OBC Customer Support,Priorité 1,En cours,2025-01-27 09:49,27/1/2025 10:50,,
OBCS-8534,OD-2360,"Créer un filtre dans Fichier du personnel, qui permet juste d'avoir les employés : Dans l'effectif, Hors Effectif, Tout le personnel","Créer un filtre dans Fichier du personnel, qui permet juste d'avoir les employés : Dans l'effectif, Hors Effectif, Tout le personnel",Vivien DAKPOGAN,M. Traoré (SAEFI),KORI TRANSPORT,,Appel Téléphonique,RH,Gestion employé,Requêtes,Non renseigné,OBC Customer Support,Priorité 1,Terminé(e),2025-01-23 10:30,24/1/2025 08:31,2025-01-24 08:31,
OBCS-8532,OD-2358,Création du sous module achat dans AgrOBC,Création de Sous module Achat de Agro,Edwige KOUASSI,MICHEL TETE,ECORIGINE,,Appel Téléphonique,Opérations,Achat,Bug,Récupération de données impossible,OBC Customer Support,Priorité 1,En cours,2025-01-21 16:24,22/1/2025 08:08,,
OBCS-8531,OD-2357,Création Fournisseur - Rajout du type de prestation dans le fichier d'importation,"A l’importation d’une fiche fournisseur / client les éléments suivant ne sont pas pris en compte

1- Poste comptable (Bien que mentionné dans le fichier)

2- Type de prestation

!image-20250120-180920.png|width=1234,height=765,alt=""image-20250120-180920.png""!",Edwige KOUASSI,MICHEL TETE,ECORIGINE,,Appel Téléphonique,Opérations,Achat,Bug,Récupération de données impossible,OBC Customer Support,Priorité 1,Terminé(e),2025-01-21 16:23,28/3/2025 09:22,2025-03-28 09:22,
OBCS-8442,OD-2351,Intégration Formule : 10% du Brut Imposable,"Avoir la possibilité de créer des rubriques qui doivent récupérer les valeurs en fonction du paramétrage des formules.

Intégrer par exemple 10% du salaire brut pour des Rubriques : Indemnité de fonction/Indemnité de tenue",Vivien DAKPOGAN,Cabinet SAEFI,KORI TRANSPORT,,En présentiel,RH,Salaire,Requêtes,Non renseigné,OBC Customer Support,Priorité 2,Terminé(e),2025-01-16 09:21,21/1/2025 12:04,2025-01-21 12:04,
OBCS-8438,OD-2347,"CRM/Activités commerciale/Activités: Lorsqu'on clique sur ""Rappel activités"", la page reste vide (voir capture joint)","

!image-20250115-120238.png|width=1676,height=487,alt=""image-20250115-120238.png""!",EVA BASSE,FABIEN VATI,ONPOINT,,E-mail,CRM,Activités commerciales,Bug,Non affichage de pages/données,OBC Customer Support,Priorité 1,Terminé(e),2025-01-15 12:04,19/1/2025 16:06,2025-01-19 16:06,
OBCS-8427,OD-2344,"Finance/Comptabilité générale /Période comptable: Lorsqu'on enregistre une période comptable , on a une page blanche qui s'affiche (voir capture)","

!Capture d'écran messag 15 01 25.png|width=960,height=540,alt=""Capture d'écran messag 15 01 25.png""!",EVA BASSE,ZAGBAYOU ANNE,EDIPRESSE,,Appel Téléphonique,Finance,Comptabilité Générale,Bug,Autres,OBC Customer Support,Priorité 1,Terminé(e),2025-01-15 09:39,26/1/2025 14:06,2025-01-26 14:06,
OBCS-8428,OD-2345,Mise à niveau Dashboard RH1,Mise à niveau Dashboard RH1,EVA BASSE,M. SANANKOUA,ONPOINT,,Appel Téléphonique,RH,Analytique,Requêtes,Non renseigné,OBC Customer Support,Priorité 2,Terminé(e),2025-01-15 10:04,7/2/2025 15:03,2025-02-07 15:03,
OBCS-8424,OD-2342,L'affichage de la balance comptable met assez de temps,L'affichage de la balance comptable met assez de temps,EVA BASSE,Patrice KOUAO,KOFFI & DIABATE,,"Online (Google Meet, Teams...)",Finance,Comptabilité Générale,Bug,Lenteur Système,OBC Customer Support,Priorité 1,Terminé(e),2025-01-14 18:39,1/4/2025 10:47,2025-04-01 10:47,
OBCS-8422,OD-2340,RH/Gestion Employé/Historique Affectation employé - Les blocs s'imbriquent ou s'empilent,"Dans l’historique des affectation employé les blocs s’empilent.

_Doléance :_ Revoir l’affichage en prenant en compte les codes couleurs de l’affichage pointage.

!image-20250114-130853.png|width=1097,height=615,alt=""image-20250114-130853.png""!",Edwige KOUASSI,Léa DIABATE,CILAGRI,,En présentiel,RH,Feuille de temps,Bug,Autres,OBC Customer Support,Priorité 1,En cours,2025-01-14 13:43,16/1/2025 09:26,,
OBCS-8420,OD-2338,"Demande d'asence: Lorqu'on sélectionna congés de paternité, il affiche 4 jours au lieu de 2 jours.","Demande d'asence: Lorqu'on sélectionna congés de paternité, il affiche 4 jours au lieu de 2 jours.",JOEL SIE,Ursula YANGANGOUSSOU,ONPOINT,,Appel Téléphonique,RH,Gestion employé,Bug,Autres,OBC Customer Support,Priorité 1,En cours,2025-01-14 10:00,15/1/2025 08:27,,
OBCS-8439,OD-2348,Opération/Achat/Historique Expression de Besoin - Donner la possibilité de visualiser uniquement les demandes initié par l'utilisateur,Donner la possibilité de visualiser uniquement les demandes initiées par l'utilisateur.,Edwige KOUASSI,,CILAGRI,Tous les Chefs de service / Département,En présentiel,Opérations,Achat,Requêtes,Non renseigné,OBC Customer Support,Priorité 1,Terminé(e),2025-01-15 12:19,24/1/2025 15:30,2025-01-24 15:30,
OBCS-8423,OD-2341,"Ajouter des Dashboard sur les visites, call (voir image joint)","

!WhatsApp Image 2025-01-14 at 16.04.36.jpeg|width=1280,height=960,alt=""WhatsApp Image 2025-01-14 at 16.04.36.jpeg""!",EVA BASSE,M. SANANKOUA,ONPOINT,,En présentiel,CRM,Analytique,Requêtes,Non renseigné,OBC Customer Support,Priorité 3,Terminé(e),2025-01-14 18:37,31/1/2025 09:18,2025-01-31 09:18,
OBCS-8417,OD-2336,RH/Gestion Employé/Demande de Prêt - Rajouter un workflow sur la fonctionnalité demande de près,Rajouter un workflow sur la fonctionnalité demande de près,Edwige KOUASSI,Léa DIABATE,CILAGRI,,Appel Téléphonique,RH,Gestion employé,Requêtes,Non renseigné,OBC Customer Support,Priorité 1,Terminé(e),2025-01-13 11:23,22/4/2025 08:35,2025-04-22 08:35,
OBCS-8419,OD-2337,"Urgent : Toute les impressions sont impossibles (grand livre et balance comptables , bulletin de salaire, bon de commande))","Urgent : Toute les impressions sont impossibles (grand livre et balance comptables , bulletin de salaire, bon de commande))",EVA BASSE,Ousseyni Oumarou,EJARA,,Appel Téléphonique,Global,Global,Bug,Non affichage de pages/données,OBC Customer Support,Priorité 1,Terminé(e),2025-01-13 17:10,14/1/2025 10:22,2025-01-14 10:22,Global
OBCS-8416,OD-2335,Finance/Comptabilité/Sur toute les options action (Imprimer) -  Donner la possibilité d'envoyer les documents comptable à une adresse mail à partir d'OBC,Donner la possibilité d'envoyer les documents comptable à une adresse mail à partir d'OBC,Edwige KOUASSI,Nadia Jocelyn Bouazo,CILAGRI,,Appel Téléphonique,Finance,Comptabilité Générale,Requêtes,Non renseigné,OBC Customer Support,Priorité 1,À faire,2025-01-13 11:17,13/1/2025 11:17,,
OBCS-8342,OD-2331,Faire apparaitre le RIB de l'entité sur les factures ventes à transmettre aux clients,Faire apparaitre le RIB de l'entité sur les factures ventes à transmettre aux clients,N'GBRA MOYE BERNICE DORIS,MARCELLE AHOUSSOU,2AAZ,,Appel Téléphonique,Opérations,Vente,Requêtes,Non renseigné,OBC Customer Support,Priorité 1,Terminé(e),2025-01-10 17:23,4/4/2025 10:59,2025-04-04 10:59,
OBCS-8341,OD-2330,Opération/Expression de Besoin/ Formulaire - Importation des ligne de produit article et ... Dans le formulaire d'expression de Besoin,"Donner la possibilité d’importer des ligne dans le formulaire d’expression de besoin

avec sauvegarde avant réinitialisation des données saisie.

Cela leur permettra de faire des demandes en important les listes de leur besoin plus facilement

!image-20250110-120630.png|width=1105,height=559,alt=""image-20250110-120630.png""!",Edwige KOUASSI,Sanata Coulibaly,CILAGRI,,En présentiel,Opérations,Achat,Requêtes,Non renseigné,OBC Customer Support,Priorité 1,À faire,2025-01-10 12:08,10/1/2025 12:08,,
OBCS-8336,OD-2325,Paramétrage Agro Export,Paramétrage Agro Export,N'GBRA MOYE BERNICE DORIS,,ECORIGINE,,En présentiel,Opérations,Analytique,Requêtes,Non renseigné,OBC Customer Support,Priorité 1,En cours,2025-01-09 10:39,10/1/2025 06:58,,
OBCS-8335,OD-2324,Paramétrage Agro Achat,Paramétrage Agro Achat,N'GBRA MOYE BERNICE DORIS,,ECORIGINE,,En présentiel,Opérations,Achat,Requêtes,Non renseigné,OBC Customer Support,Priorité 1,En cours,2025-01-09 10:38,10/1/2025 06:58,,
OBCS-8333,OD-2322,"RH/Gestion Employé/Demande d'Absence - Sélectionner par défaut, la date à laquelle l’enregistrement de la demande d’absence est faite","Sélectionner par défaut, la date à laquelle l’enregistrement de la demande d’absence est faite",Edwige KOUASSI,Ursula YANGANGOUSSOU,ONPOINT,,En présentiel,RH,Gestion employé,Bug,Mauvais déversement des données,OBC Customer Support,Priorité 1,En cours,2025-01-08 18:16,10/1/2025 11:03,,
OBCS-8332,OD-2321,RH/Gestion Employé/Demande d'Absence - Sélectionner le nom de l’utilisateur par défaut dans le formulaire d'enregistrement,Sélectionner le nom de l’utilisateur par défaut dans le formulaire d’enregistrement,Edwige KOUASSI,Ursula YANGANGOUSSOU,ONPOINT,,En présentiel,RH,Gestion employé,Bug,Mauvais déversement des données,OBC Customer Support,Priorité 1,En cours,2025-01-08 18:15,10/1/2025 09:18,,
OBCS-8327,OD-2317,RH/GestionEmploye/Ordre d Mission - Modification Ordre de Mission Impossible,"Impossible de modifier un ordre de mission avec un petit

!image-20250107-183750.png|width=1591,height=814,alt=""image-20250107-183750.png""!

i message d’erreur généré",Edwige KOUASSI,EHUI Inesse,CILAGRI,,Appel Téléphonique,RH,Gestion employé,Bug,Edition impossible,OBC Customer Support,Priorité 1,En cours,2025-01-07 18:38,8/1/2025 19:42,,
OBCS-8330,OD-2319,Message Régulier à la Connexion Compte Utilisateur OBC,"Affichage Message d’erreur Régulier lors de la connexion d’un compte utilisateur.

Message non bloquant à l’utilisation mais gênant. Il disparait après actualisation de la page.

{color:#ff5630}*Warning ! 404 : NOT FOUND EXCEPTION*{color}

404 : NOT FOUND ERROR",Edwige KOUASSI,COULIBALY EVE,IVOIRE DEVELOPPEMENT,,Appel Téléphonique,Global,Global,Bug,Page d'erreur,OBC Customer Support,Priorité 1,En cours,2025-01-07 23:25,27/1/2025 06:12,,Global
OBCS-8321,OD-2316,RH/Salaire/ Calcul OHADA - Impossible de supprimer la paie d’un utilisateur,Impossible de supprimer la paie d’un utilisateur,Edwige KOUASSI,COULIBALY EVE,IVOIRE DEVELOPPEMENT,,Appel Téléphonique,RH,Salaire,Bug,Suppression impossible,OBC Customer Support,Priorité 1,En cours,2025-01-06 15:45,7/1/2025 17:07,,
OBCS-8319,OD-2315,AdminSystème/Gestion des Profils Utilisateurs - Conflit lors de l'assignation d'un profil à un utilisateur,"A l’assignation d’un profil Utilisateur, nous constatons certains dysfonctionnements.

Dysfonctionnement du à un conflit entre les accès précédemment octroyés à l’utilisateur à l’ancienne et l’attribution des fonctionnalités encapsuler dans un profil.",Edwige KOUASSI,,S-TEL,,Constat Interne,Support,Administration Système,Bug,Autres,OBC Customer Support,Priorité 1,En cours,2025-01-06 15:20,7/1/2025 16:37,,
OBCS-8275,OD-2313,Incohérence des données de la TVA.,Incohérence des données de la TVA.,JOEL SIE,Joël SIE,ONPOINT,,En présentiel,Finance,Impôts et taxes,Bug,Autres,OBC Customer Support,Priorité 1,Terminé(e),2025-01-03 19:12,10/1/2025 11:16,2025-01-10 11:16,
OBCS-8270,OD-2311,RH/Salaire/Calcul OHADA - Cas de deux entités sélectionnées dans la base de Travail : Prise en compte de tous les employés bien que dans le filtre une seule soit sélectionné.,"Dans le calcul de paie nous constatons que tous les employés de toutes les entités confondue des bases de travail sélectionnées sont pris en compte dans la paie alors que dans le champ “ENTREPRISE”, l’entité pour laquelle nous souhaitions effectuer le calcul à été spécifiée.

!videoFiltre_Entreprise_CalculPaie.png|width=1920,height=1080,alt=""videoFiltre_Entreprise_CalculPaie.png""!",Edwige KOUASSI,,CILAGRI,,Constat Interne,Projets,Gérer mes projets,Bug,Dysfonctionnement des filtres,OBC Customer Support,Priorité 1,En cours,2025-01-03 10:53,6/1/2025 12:23,,
OBCS-8267,OD-2310,Projet/Timesheet - Les projets sur l'année antérieur (2024) ne se déversent plus,Projet/Timesheet - Les projets sur l'année antérieur (2024) ne se déversent plus,Edwige KOUASSI,,ONPOINT,,Constat Interne,Projets,Gérer mes projets,Bug,Récupération de données impossible,OBC Customer Support,Priorité 1,Terminé(e),2025-01-03 09:05,7/1/2025 07:46,2025-01-07 07:46,
OBCS-8274,OD-2312,Historique paiement ajouer une colonne afin d'afficher le nom des founisseurs payés et donner la possibilité de faire le filtre par fournisseur.,Historique paiement ajouer une colonne afin d'afficher le nom des founisseurs payés et donner la possibilité de faire le filtre par fournisseur.,JOEL SIE,Joël SIE,ONPOINT,,En présentiel,Paiement,Centre de paiement,Requêtes,Non renseigné,OBC Customer Support,Priorité 1,À faire,2025-01-03 19:10,3/1/2025 19:10,,Exécuter un paiement
OBCS-8266,OD-2309,RH/Salaire/Calcul OHADA - Non prise en compte de tous les employés lors du calcul de salaire,"Tous les employés ayant un contrat en cours ne sont plus pris en compte lors d’une calcul de paie sur une année n-1 si la paie sur l’année en actuelle à été effectué.

*_Détaille :_* Le calcul de paie sur 2024 se faisait normalement avec tous les employés ayant un contrat en cours. Pour une vérification de données, un essaie (Calcul paie) à été effectué sur l’année 2025.

Après le calcul sur l’an 2025, 8 employés sont pris en compte pour le calcul de paie sur l’année 2024. 

{color:#ff5630}*_Cf Vidéo :_* {color}

!20250102-1240-12.1486957.mp4|width=1920,height=1080,alt=""20250102-1240-12.1486957.mp4""!



!20250102-1241-55.9421666.mp4|width=1298,height=916,alt=""Mail après calcul de paie sur année n-1""!",Edwige KOUASSI,,CILAGRI,,En présentiel,RH,Salaire,Bug,Autres,OBC Customer Support,Priorité 1,En cours,2025-01-02 12:37,6/1/2025 10:59,,
OBCS-8261,OD-2308,"Dette fournisseurs : Amélioration des reporting en tenant compte des paiements dettes antérieurs d'une année à une autre, afin d'avoir une meilleure lisibilité","Dette fournisseurs : Amélioration des reporting en tenant compte des paiements dettes antérieurs d'une année à une autre, afin d'avoir une meilleure lisibilité",Vivien DAKPOGAN,CISSOKO Mamadou,KORI TRANSPORT,,Appel Téléphonique,Opérations,Achat,Requêtes,Non renseigné,OBC Customer Support,Priorité 2,À faire,2024-12-30 08:24,30/12/2024 08:24,,
OBCS-8176,OD-2301,RH/Salaire/Document || Salaire - Nombre de jours dû et date de congés incorrecte,"*Bug signalé par Mme AKA ADDOU Joelka PM :* 

Je suis en train de signer les bulletins de paie mais je constate que les informations suivantes sur les bulletins ne sont pas à jour :

* {color:#ff5630}Date de conges{color}
* {color:#ff5630}Conges acquis{color}

Pour l’ensemble des employés de Joelka

*_Info++_*

_Capture de date de retour dernier congés et stock mis à_ *_0_* _au_ *_11/09/204_*

!image-20241220-131352.png|width=1145,height=276,alt=""image-20241220-131352.png""!

_Capture stock de congés et date sur le bulletin_

!image-20241220-131248.png|width=905,height=408,alt=""image-20241220-131248.png""!

_Stock congés Ivoire Dev idem_ 

!image-20241220-131934.png|width=851,height=369,alt=""image-20241220-131934.png""!",Edwige KOUASSI,Rachel AKA,JOEL K PROPERTIES,,E-mail,RH,Documents,Bug,Autres,OBC Customer Support,Priorité 1,Terminé(e),2024-12-20 13:12,22/4/2025 09:05,2025-04-22 09:05,
OBCS-8170,OD-2300,Réimputations comptable : les comptes tiers ne se déversent pas.,"Réimputations comptable : les comptes tiers ne se déversent pas.



!image-20241219-191851.png|width=100%,alt=""image-20241219-191851.png""!",JOEL SIE,,EDIPRESSE,,Constat Interne,Finance,Comptabilité Générale,Bug,Autres,OBC Customer Support,Priorité 1,Terminé(e),2024-12-19 19:15,22/12/2024 22:02,2024-12-22 22:02,
OBCS-8155,OD-2292,"Message d'erreur apparaissant lorsqu'on clique sur ""Gestion des opportunités""","

!Capture d’écran 2024-12-17 083408.png|width=1138,height=619,alt=""Capture d’écran 2024-12-17 083408.png""!",EVA BASSE,OLIVIA NGO,ONPOINT,,En présentiel,CRM,Pilotage commercial,Bug,Page d'erreur,OBC Customer Support,Priorité 1,Terminé(e),2024-12-17 09:21,15/1/2025 17:58,2025-01-15 17:58,
OBCS-8162,OD-2299,RH / Gestion Employé / Fichier du personnel - Donner la possibilité d'afficher l'historique du personnel en liste ou en box,Donner la possibilité d'afficher l'historique du personnel en liste.,Edwige KOUASSI,Estelle BOA,JOEL K PROPERTIES,,En présentiel,RH,Gestion employé,Requêtes,Non renseigné,OBC Customer Support,Priorité 1,Terminé(e),2024-12-18 10:16,30/12/2024 15:41,2024-12-30 15:41,
OBCS-8161,OD-2298,RH/GestionEmployé/Contrat - Création d'un Historique Groupé des contrats par employés.,"Donné la possibilité de visualité les contrats par employé.

Exemple : Lilou à 5 contrats, dans l’entreprise, la Rh voulant avoir une vision simple  et claire souhaite avoir une option dans les actions qui lui permettra d’avoir moins de ligne en regroupant les contrats par employé.

h3. Illustration : en cliquant sur une action “*+”; dérouler tous les contrats liés à x employé.*



!image-20241218-094943.png|width=1242,height=434,alt=""image-20241218-094943.png""!",Edwige KOUASSI,Estelle BOA,JOEL K PROPERTIES,,En présentiel,RH,Gestion employé,Requêtes,Non renseigné,OBC Customer Support,Priorité 3,En cours,2024-12-18 09:54,24/12/2024 09:24,,
OBCS-8157,OD-2294,"Note débit - Crédit : Intégration Type Axe et Axe analytique, afin de rattacher les frais bancaires au projet.","*Note débit - Crédit :* Intégration Type Axe et Axe analytique, afin de rattacher les frais bancaires au projet.

",Vivien DAKPOGAN,Jean-Claude SAMPENNIE,S-TEL,,Appel Téléphonique,Finance,Comptabilité Générale,Requêtes,Non renseigné,OBC Customer Support,Priorité 2,À faire,2024-12-17 18:38,17/12/2024 18:38,,
OBCS-8154,OD-2291,Suppression du journal NSIA 2024.,Suppression du journal NSIA 2024.,JOEL SIE,YAO épouse KOSSONOU N'Guessan Esterne Nattacha,EDIPRESSE,,Appel Téléphonique,Finance,Comptabilité Générale,Requêtes,Non renseigné,OBC Customer Support,Priorité 1,Terminé(e),2024-12-17 09:20,17/12/2024 16:10,2024-12-17 16:10,
OBCS-8149,OD-2290,CRM/Activités commerciales/Gestion des opportunités/ Aucun montant n'apparait lorsqu'on sélectionne dans les filtres opportunités perdues ou abandonnées,"CRM/Activités commerciales/Gestion des opportunités/ Aucun montant n'apparait lorsqu'on sélectionne dans les filtres opportunités perdues ou abandonnées

Ci-joint la capture



!image-20241216-104220.png|width=1667,height=895,alt=""image-20241216-104220.png""!",N'GBRA MOYE BERNICE DORIS,OLIVIER GUIZA,S-TEL,,E-mail,CRM,Activités commerciales,Bug,Non affichage de pages/données,OBC Customer Support,Priorité 1,Terminé(e),2024-12-16 10:37,19/12/2024 09:26,2024-12-19 09:26,
OBCS-8156,OD-2293,Opération/vente/ Devis / Facture - Intégrer le modèle de facture et devis import et Export - Cilagri Cajou,"Intégrer le modèle de facture et devis import et Export - Cilagri Cajou

[^LISTE DES PRODUITS CILAGRI.xlsx]

",Edwige KOUASSI,Eudes Yapi,CILAGRI,,Appel Téléphonique,Opérations,Vente,Requêtes,Non renseigné,OBC Customer Support,Priorité 1,À faire,2024-12-17 10:43,17/12/2024 10:43,,
OBCS-8147,OD-2289,"Opération/Vente || Achat/ Création fiche fournisseur || Client - Lors de la création d'un nouveau client ou fournisseur, proposer des Numéros de poste comptable automatique en tenant compte du dernier N° de poste et de la nomenclature.","Lors de la création d'un nouveau client ou fournisseur, proposer des Numéros de poste comptable automatique en tenant compte du dernier N° de poste et de la nomenclature.",Edwige KOUASSI,GAHI Lezou Jean,IVOIRE DEVELOPPEMENT,,En présentiel,Opérations,Achat,Requêtes,Non renseigné,OBC Customer Support,Priorité 1,À faire,2024-12-16 00:28,16/12/2024 00:28,,
OBCS-8146,OD-2288,"Opération/ Vente/ Devis || Contrat - Donner la possibilité de saisir un montant en lieu et place du pourcentage dans le champ ""libellé de condition""","À l'enregistrement d'un devis / Contrat, donner la possibilité de saisir un montant en lieu et place du pourcentage dans le champ ""libellé de condition""",Edwige KOUASSI,GAHI Lezou Jean,IVOIRE DEVELOPPEMENT,,En présentiel,Finance,Comptabilité Générale,Requêtes,Non renseigné,OBC Customer Support,Priorité 1,À faire,2024-12-16 00:26,16/12/2024 00:26,,
OBCS-8145,OD-2287,"Paramétrage/ Tréso/ Création compte caisse - Donner la possibilité d'assigner la caisse à une caissière par intérim, sur une période sans toucher aux paramétrages de base de la caisse","Donner la possibilité d'assigner la caisse à un(e) caissier(e) par intérim, sur une période sans modifier à chaque fois les paramétrages de base de la caisse",Edwige KOUASSI,GAHI Lezou Jean,IVOIRE DEVELOPPEMENT,,En présentiel,Finance,Comptabilité Générale,Requêtes,Non renseigné,OBC Customer Support,Priorité 1,À faire,2024-12-16 00:24,16/12/2024 00:24,,
OBCS-8144,OD-2286,"Finance/Comptabilité/ Opération de caisse : Faire apparaître sur un bon de caisse une nature d'opération unique (Soit  Appro, ou sortie de caisse)","Faire apparaître sur un bon versement une nature d'opération unique (Soit  Appro, ou sortie de caisse), pas les deux en même temps",Edwige KOUASSI,GAHI Lezou Jean,IVOIRE DEVELOPPEMENT,,En présentiel,Finance,Comptabilité Générale,Requêtes,Non renseigné,OBC Customer Support,Priorité 1,Terminé(e),2024-12-16 00:21,28/3/2025 09:10,2025-03-28 09:10,
OBCS-8143,OD-2285,"Finance/Comptabilité/Opération de caisse - Donner la possibilité d'avoir sur une feuille A4 deux bons de versement (Un à remettre au client, et un autre à archiver.","Donner la possibilité d'avoir sur une feuille A4 deux bons de versement (Un à remettre au client, et un autre à archiver.",Edwige KOUASSI,GAHI Lezou Jean,IVOIRE DEVELOPPEMENT,,En présentiel,Finance,Vente,Requêtes,Non renseigné,OBC Customer Support,Priorité 1,Terminé(e),2024-12-16 00:17,28/3/2025 09:15,2025-03-28 09:15,
OBCS-8142,OD-2284,"Finance/Comptabilité/Opération Caisse - A l'enregistrement d'une opération, avoir uniquement la liste des caisses en fonction des sites","A l'enregistrement d'une opération, avoir uniquement la liste des caisses en fonction du site sélectionné.",Edwige KOUASSI,GAHI Lezou Jean,IVOIRE DEVELOPPEMENT,,En présentiel,Finance,Comptabilité Générale,Requêtes,Non renseigné,OBC Customer Support,Priorité 1,À faire,2024-12-16 00:16,16/12/2024 00:29,,
OBCS-8061,OD-2280,Historique demande d'absence: Les heures et les dates de fin ont disparu.,Historique demande d'absence: Les heures et les dates de fin ont disparu.,JOEL SIE,Ursula YANGANGOUSSOU,ONPOINT,,En présentiel,RH,Gestion employé,Bug,Autres,OBC Customer Support,Priorité 1,Terminé(e),2024-12-12 16:06,19/12/2024 08:53,2024-12-19 08:53,
OBCS-8046,OD-2275,CRM/Activités commerciales/Gestion des opportunités/ Une page d'erreur apparait lorsqu'on clique sur gestion des opportunités,"CRM/Activités commerciales/Gestion des opportunités/ Une page d'erreur apparait lorsqu'on clique sur gestion des opportunités

Un seul utilisateur a ce soucis.",N'GBRA MOYE BERNICE DORIS,OLIVIER GUIZA,S-TEL,,Appel Téléphonique,CRM,Activités commerciales,Bug,Page d'erreur,OBC Customer Support,Priorité 1,Terminé(e),2024-12-11 09:43,11/12/2024 18:42,2024-12-11 18:42,
OBCS-8043,OD-2274,"Certaines factures enregistrées en opération, ne s'affiche pas sur le dashboard vente","Certaines factures enregistrées en opération, ne s'affiche pas sur le dashboard vente",EVA BASSE,M. SANANKOUA,ONPOINT,,En présentiel,Opérations,Analytique,Bug,Mauvais déversement des données,OBC Customer Support,Priorité 1,Terminé(e),2024-12-10 12:08,23/12/2024 11:43,2024-12-23 11:43,
OBCS-8042,OD-2273,"En historique des tâches, dans la colonne ""responsable"" , on a ""Inconnu or à l'édition, on remarque que des employés sont rattachés à chaque tâche (voir captures)","

!image (27).png|width=1893,height=868,alt=""image (27).png""!



!image (26).png|width=1902,height=876,alt=""image (26).png""!",EVA BASSE,Ursula YANGANGOUSSOU,ONPOINT,,En présentiel,Projets,Gérer mes tâches,Bug,Mauvais déversement des données,OBC Customer Support,Priorité 1,Terminé(e),2024-12-10 12:06,11/12/2024 19:17,2024-12-11 19:17,
OBCS-7963,OD-2265,A l'enregistrement d'un contrat journalier un message s'affiche disant que le signataire existe déjà alors qu'aucun signataire n'a été ajouté.,A l'enregistrement d'un contrat journalier un message s'affiche disant que le signataire existe déjà alors qu'aucun signataire n'a été ajouté.,JOEL SIE,Gaelle TOURE,ONPOINT,,Appel Téléphonique,RH,Gestion employé,Bug,Autres,OBC Customer Support,Priorité 1,Terminé(e),2024-12-06 08:42,15/12/2024 07:19,2024-12-15 07:19,
OBCS-7970,OD-2268,Rendre exportable le Dashboard de projets,"Rendre exportable le Dashboard de projets

",Vivien DAKPOGAN,Jean-Claude SAMPENNIE,S-TEL,,E-mail,Projets,Analytique,Requêtes,Non renseigné,OBC Customer Support,Priorité 2,Terminé(e),2024-12-06 14:52,17/12/2024 18:23,2024-12-17 18:23,
OBCS-7964,OD-2266,"Contrat journalier: la liste deroulante des signataire, afficher que le nom des personnes ayant un contrat permanent.","Contrat journalier: la liste deroulante des signataire, afficher que le nom des personnes ayant un contrat permanent.",JOEL SIE,Gaelle TOURE,ONPOINT,,Appel Téléphonique,RH,Gestion employé,Requêtes,Non renseigné,OBC Customer Support,Priorité 1,Terminé(e),2024-12-06 09:23,10/12/2024 11:14,2024-12-10 11:14,
OBCS-7962,OD-2264,Congés et autres absences : les congés enregistrés et validés ne sont pas déduits du stock congé.,Congés et autres absences : les congés enregistrés et validés ne sont pas déduits du stock congé.,JOEL SIE,Ousseyni Oumarou,EJARA,,Chat WhatsApp,RH,Gestion employé,Bug,Autres,OBC Customer Support,Priorité 1,Terminé(e),2024-12-05 18:55,16/12/2024 09:39,2024-12-10 11:15,
OBCS-7960,OD-2263,RH/SALAIRE/OPERATIONS DE PAIE/ les montants des charges salariales (6611...) sont détaillés au niveau de la comptabilisation de la paie,"RH/SALAIRE/OPERATIONS DE PAIE/ les montants des charges salariales (6611...) sont détaillés au niveau de la comptabilisation de la paie.

Exemple: 661100 = 4.500.000 fcfa 

Sur OBC, il apparait : 661100 = 200.000 employé A , 661100 = 150.000 employé B …





!image-20241204-180113.png|width=1453,height=748,alt=""image-20241204-180113.png""!",N'GBRA MOYE BERNICE DORIS,CHARLES IPO,FALCON,,Appel Téléphonique,RH,Salaire,Bug,Mauvais déversement des données,OBC Customer Support,Priorité 1,Terminé(e),2024-12-04 17:56,10/12/2024 17:37,2024-12-10 17:37,
OBCS-7956,OD-2259,harmoniser la liste de secteurs dans les champs de création de prospects ou de clients,"harmoniser la liste de secteurs dans les champs de création de prospects ou de clients.

Par exemple : commerce et distribution… qui apparait plus d’une fois dans le champ secteur.",N'GBRA MOYE BERNICE DORIS,MADAME ALAO,ONPOINT,,E-mail,CRM,Activités commerciales,Bug,Mauvais déversement des données,OBC Customer Support,Priorité 1,À faire,2024-12-02 19:01,19/8/2025 18:11,,
OBCS-7955,OD-2258,"La section pour l'ajout de nouvelle activité ne s'ouvre toujours pas correctement donc il est impossible d'enregistrer les activités; le champ attribué À n'es t pas ouvert, ni celui de la priorité.","La section pour l'ajout de nouvelle activité ne s'ouvre toujours pas correctement donc il est impossible d'enregistrer les activités; le champ attribué À n'es t pas ouvert, ni celui de la priorité.",N'GBRA MOYE BERNICE DORIS,MADAME ALAO,ONPOINT,,E-mail,CRM,Activités commerciales,Bug,Mauvais déversement des données,OBC Customer Support,Priorité 1,Terminé(e),2024-12-02 18:59,24/12/2024 09:47,2024-12-24 09:47,
OBCS-7954,OD-2257,"A l'ouverture de certaines opportunités, un message d'erreur apparait","A l'ouverture de certaines opportunités, un message d'erreur apparait

Ci-dessous le message 



!image (6).png|width=959,height=266,alt=""image (6).png""!",N'GBRA MOYE BERNICE DORIS,MADAME ALAO,ONPOINT,,E-mail,CRM,Activités commerciales,Bug,Erreur Ajax,OBC Customer Support,Priorité 1,Terminé(e),2024-12-02 18:57,10/1/2025 10:35,2025-01-10 10:35,
OBCS-7951,OD-2254,Impossible de joindre un fichier lors d'une demande d'absence (Voir capture),"

!image-20241202-095655.png|width=1707,height=785,alt=""image-20241202-095655.png""!",EVA BASSE,Ursula YANGANGOUSSOU,ONPOINT,,En présentiel,RH,Gestion employé,Bug,Mauvais déversement des données,OBC Customer Support,Priorité 1,Terminé(e),2024-12-02 09:57,5/12/2024 20:11,2024-12-05 20:11,
OBCS-7950,OD-2253,"A l'enregistrement des frais de mission, un message s'affiche demandant de renseigner un prix unitaire alors qu'il est renseigné.","A l'enregistrement des frais de mission, un message s'affiche demandant de renseigner un prix unitaire alors qu'il est renseigné.",JOEL SIE,Ursula YANGANGOUSSOU,ONPOINT,,En présentiel,RH,Gestion employé,Bug,Autres,OBC Customer Support,Priorité 1,Terminé(e),2024-12-02 09:55,10/12/2024 11:15,2024-12-10 11:15,
OBCS-7949,OD-2252,Bulletin de salaire - Bénin : Non affichage des bulletins de salaire,"Bulletin de salaire - Bénin : Non affichage des bulletins de salaire malgré que la paie aie été calculée et validée.
La page affiche aucune donnée disponible.",Vivien DAKPOGAN,Huberte ZOUNVO,KOFFI & DIABATE,,Appel WhatsApp,RH,Documents,Bug,Non affichage de pages/données,OBC Customer Support,Priorité 1,Terminé(e),2024-12-02 08:00,3/12/2024 06:26,2024-12-03 06:26,
OBCS-7968,OD-2267,Fixer le journal ou déverser la liste des journaux en lieu et place de la saisie a chaque paramétrage,"Fixer le journal ou déverser la liste des journaux, cela permettra d'éviter les erreurs ou les retours entre les journaux et le paramétrage des rubriques.

!image-20241206-105543.png|width=658,height=671,alt=""image-20241206-105543.png""!",Edwige KOUASSI,,ONPOINT,,Constat Interne,RH,Paramétrage,Requêtes,Non renseigné,OBC Customer Support,Priorité 1,Terminé(e),2024-12-06 10:56,28/3/2025 09:05,2025-03-28 09:05,
OBCS-7952,OD-2255,Intégrer le calcul de la gratification de K&D,"*1.* La gratification est calculé en Décembre et elle est égale à 100% du salaire brut de Novembre.

*2.*Définir les mois en élément variable en figeant 12 comme valeur par défaut et prendre en compte le calcul au prorata ",EVA BASSE,,KOFFI & DIABATE,,En présentiel,RH,Salaire,Requêtes,Non renseigné,OBC Customer Support,Priorité 1,Terminé(e),2024-12-02 12:44,3/12/2024 20:58,2024-12-03 20:58,
OBCS-7901,OD-2251,Nous constatons une page d'erreur lorsqu'on clique sur la fonctionnalité paramétrage compte client,"Nous constatons une page d'erreur lorsqu'on clique sur la fonctionnalité paramétrage compte client

Ci-dessous la capture 



!image-20241129-170536.png|width=1464,height=782,alt=""image-20241129-170536.png""!",N'GBRA MOYE BERNICE DORIS,ERIC KOUADIO,FALCON,,Appel Téléphonique,Opérations,Vente,Bug,Page d'erreur,OBC Customer Support,Priorité 1,Terminé(e),2024-11-29 17:00,29/11/2024 18:21,2024-11-29 18:21,
OBCS-7878,OD-2249,"Bien qu'un employé soit dans le workflow de demande d'absence, nous recevons un mail d'erreur (voir capture)","

!image-20241129-151449.png|width=1100,height=592,alt=""image-20241129-151449.png""!",EVA BASSE,,KOFFI & DIABATE,,En présentiel,RH,Gestion employé,Bug,Dysfonctionnement Workflow,OBC Customer Support,Priorité 1,Terminé(e),2024-11-29 15:15,3/12/2024 15:42,2024-12-03 15:42,
OBCS-7873,OD-2244,Encaissement client: Ajouter un onglet permettant de renseigner le montant du timbre et rattacher un poste comptable.,Encaissement client: Ajouter un onglet permettant de renseigner le montant du timbre et rattacher un poste comptable correspondant.,JOEL SIE,YAO épouse KOSSONOU N'Guessan Esterne Nattacha,EDIPRESSE,,Appel Téléphonique,Opérations,Vente,Requêtes,Non renseigné,OBC Customer Support,Priorité 1,Terminé(e),2024-11-28 09:07,10/12/2024 08:33,2024-12-10 08:33,
OBCS-7872,OD-2243,Grand-Livre Analytique : Mise à jour avec rajout des comptes généraux,Grand-Livre Analytique : Mise à jour avec rajout des comptes généraux,Vivien DAKPOGAN,Jean-Claude SAMPENNIE,S-TEL,,Appel Téléphonique,Finance,Comptabilité Générale,Requêtes,Non renseigné,OBC Customer Support,Priorité 2,Terminé(e),2024-11-28 05:47,29/11/2024 15:29,2024-11-29 15:29,
OBCS-7875,OD-2247,RH/Gestion de personnel /Demande d'ABS et congés - Lorsqu’une demande d’absence est édité pour modification les heures et dates disparaissent,"Lorsqu’une demande d’absence est édité pour modification les heures et dates disparaissent

!image-20241128-093440.png|width=1918,height=967,alt=""image-20241128-093440.png""!",Edwige KOUASSI,EHUI Inesse,CILAGRI,,En présentiel,RH,Gestion employé,Bug,Non affichage de pages/données,OBC Customer Support,Priorité 1,Terminé(e),2024-11-28 09:37,5/12/2024 20:07,2024-12-05 20:07,
OBCS-7866,OD-2239,Ajouter des totaux dans le rapport de paiement de salaire et des filtres par employés,Ajouter des totaux dans le rapport de paiement de salaire et des filtres par employés,EVA BASSE,Jean-Claude SAMPENNIE,S-TEL,,Appel Téléphonique,Paiement,Analytique,Requêtes,Non renseigné,OBC Customer Support,Priorité 1,Terminé(e),2024-11-27 11:24,27/11/2024 14:45,2024-11-27 14:45,
OBCS-7865,OD-2238,Stock-Budget : Possibilité d'avoir un Select All afin de déverser tous les articles stockables au lieu de le faire un à un,"Stock-Budget : Possibilité d'avoir un Select All afin de déverser tous les articles stockables au lieu de le faire un à un

",Vivien DAKPOGAN,KALOGO Nabarakissa,S-TEL,,Appel Téléphonique,Opérations,Gestion de stock,Requêtes,Non renseigné,OBC Customer Support,Priorité 1,Terminé(e),2024-11-27 07:46,29/11/2024 14:35,2024-11-29 14:35,
OBCS-7864,OD-2237,Nous constatons un doublon de l'impôt CN qui empêche le déversement des autres impôts dans le formulaire d'enregistrement des impôts et taxes,"Nous constatons un doublon de l'impôt CN qui empêche le déversement des autres impôts dans le formulaire d'enregistrement des impôts et taxes.

Ci-dessous la capture



!image-20241126-170310.png|width=1500,height=787,alt=""image-20241126-170310.png""!",N'GBRA MOYE BERNICE DORIS,CHARLES IPO,FALCON,,Appel Téléphonique,Finance,Impôts et taxes,Bug,Mauvais déversement des données,OBC Customer Support,Priorité 1,Terminé(e),2024-11-26 16:58,28/11/2024 21:57,2024-11-28 21:57,
OBCS-7862,OD-2235,Duplication salaire par personne + Suppression impossible,"# On la récap de la paie qui pointe en double les salariés.
# Impossible de supprimer une paie.

",Vivien DAKPOGAN,Auguste QUENUM,KOFFI & DIABATE,,Appel WhatsApp,RH,Salaire,Bug,Duplication anormale,OBC Customer Support,Priorité 1,Terminé(e),2024-11-26 09:17,28/11/2024 09:36,2024-11-28 09:36,
OBCS-7861,OD-2234,Journalier apparaissant dans les éléments variables,"Au moment de définir un élément variable sur une paie, on a la liste des journaliers qui affichent au lieu de garder que le personnel permanent",Vivien DAKPOGAN,Huberte ZOUNVO,KOFFI & DIABATE,,Chat WhatsApp,RH,Salaire,Bug,Mauvais déversement des données,OBC Customer Support,Priorité 1,Terminé(e),2024-11-26 09:14,28/11/2024 09:37,2024-11-28 09:37,
OBCS-7867,OD-2240,Paramétrage Site - Suppression de site / CILAGRI,Paramétrage Site - Demande de suppression de site,Edwige KOUASSI,EHUI Inesse,CILAGRI,,En présentiel,Support,Administration Système,Requêtes,Non renseigné,OBC Customer Support,Priorité 1,Terminé(e),2024-11-27 12:26,11/12/2024 09:23,2024-12-11 09:02,
OBCS-7854,OD-2227,"Page d'erreur à l'ouverture des fonctionnalités suivantes : Fichier du personnel, congés et autres absences, prêts salariés","Page d'erreur à l'ouverture des fonctionnalités suivantes : Fichier du personnel, congés et autres absences, prêts salariés",N'GBRA MOYE BERNICE DORIS,KALOGO Nabarakissa,S-TEL,,Appel Téléphonique,RH,Gestion employé,Bug,Page d'erreur,OBC Customer Support,Priorité 1,Terminé(e),2024-11-25 14:33,26/11/2024 08:38,2024-11-26 08:38,
OBCS-7747,OD-2220,Non affichage du nom des employés dans le livre de paie général,"Non affichage du nom des employés dans le livre de paie général

Ci-dessous la capture 



!CAPTURE STEL LIVRE DE PAIE  GENERAL.png|width=976,height=553,alt=""CAPTURE STEL LIVRE DE PAIE  GENERAL.png""!",N'GBRA MOYE BERNICE DORIS,FRANCIS AURELIEN KOUTOU,S-TEL,,Appel Téléphonique,RH,Documents,Bug,Non affichage de pages/données,OBC Customer Support,Priorité 1,Terminé(e),2024-11-22 09:04,28/11/2024 09:41,2024-11-28 09:41,
OBCS-7751,OD-2224,Intégration Bon d'enlèvement,Possibilité d’intégrer le bon d’enlèvement qui retrace le parcours d’un camion avec tous ses BL livrés,Vivien DAKPOGAN,CISSOKO Mamadou,KORI TRANSPORT,,En présentiel,Opérations,Vente,Requêtes,Non renseigné,OBC Customer Support,Priorité 2,Terminé(e),2024-11-22 10:26,5/12/2024 19:10,2024-12-05 19:10,
OBCS-7744,OD-2217,RH/DOC/Attestation de Congés - Donner la possibilité au Responsable des RH de signer les attestation de congés,Donner la possibilité au Responsable des RH de signer les attestation de congés,Edwige KOUASSI,EHUI Inesse,CILAGRI,,Appel WhatsApp,RH,Documents,Requêtes,Non renseigné,OBC Customer Support,Priorité 1,Terminé(e),2024-11-21 14:29,1/4/2025 09:31,2025-04-01 09:31,
OBCS-7739,OD-2211,Gérer les absences en heures,Gérer les absences en heures,EVA BASSE,KALOGO Nabarakissa,S-TEL,,Appel Téléphonique,RH,Gestion employé,Requêtes,Non renseigné,OBC Customer Support,Priorité 1,Terminé(e),2024-11-21 10:26,19/12/2024 08:53,2024-12-19 08:53,
OBCS-7737,OD-2209,"Qaund on passe les écritures manuelles et qu'on atteint environ 40 lignes, OBC devient très lent et il est difficile de poursuivre l'enregistrement","Qaund on passe les écritures manuelles et qu'on atteint environ 40 lignes, OBC devient très lent et il est difficile de poursuivre l'enregistrement",EVA BASSE,Patrice KOUAO,KOFFI & DIABATE,,Appel Téléphonique,Finance,Comptabilité Générale,Bug,Lenteur Système,OBC Customer Support,Priorité 1,En cours,2024-11-20 15:39,22/11/2024 07:52,,
OBCS-7733,OD-2205,RH/Gestion Employé/Demande d'absence - Rajouter dans la checklist les absences rejetées,"RH/Gestion Employé/Demande d'absence - Dans le filtre plus précisément  {color:#ff5630}*id=""txtcode_filtreApprouve""* {color}Rajouter ou remplacer le *doublon absence approuvé* par *Absence rejeté* 



!20241120-1131-29.5310662.mp4|width=1632,height=466,alt=""20241120-1131-29.5310662.mp4""!",Edwige KOUASSI,,JOEL K PROPERTIES,,Constat Interne,RH,Gestion employé,Bug,Duplication anormale,OBC Customer Support,Priorité 1,Terminé(e),2024-11-20 11:39,21/11/2024 09:37,2024-11-21 09:37,
OBCS-7736,OD-2208,"Préciser dans le message ""un numéro de poste comptable""","Préciser dans le message ""un numéro de poste comptable""

!image-20241120-150434.png|width=902,height=723,alt=""image-20241120-150434.png""!",EVA BASSE,Patrice KOUAO,KOFFI & DIABATE,,Appel Téléphonique,Paiement,Centre de paiement,Requêtes,Non renseigné,OBC Customer Support,Priorité 1,Terminé(e),2024-11-20 15:07,28/3/2025 09:05,2025-03-28 09:05,
OBCS-7725,OD-2202,Module AGRO,Module AGRO,EVA BASSE,Ismaël KONE,ECORIGINE,,En présentiel,Global,Global,Requêtes,Non renseigné,OBC Customer Support,Priorité 1,En cours,2024-11-20 10:54,17/12/2024 09:48,,Global
OBCS-7721,OD-2198,RH / Gestion Employé / Fichier du personnel - Mise à jour du service Non pris en compte dans le fichier du personnel,"Mise à jour service non pris en compte dans le fichier du personnel.

Ex: Le service de Mlle ABBE a été modifiée dans le contrat, elle fait partie des ouvriers de la section cuisson  par contre dans le fichier du personnel l’actualisation ne s’est pas effectuée en fonction de la valeur mentionnée dans le contrat.

!20241119-1626-33.6578350.mp4|width=1920,height=1080,alt=""20241119-1626-33.6578350.mp4""!",Edwige KOUASSI,EHUI Inesse,CILAGRI,,Appel Téléphonique,RH,Gestion employé,Bug,Récupération de données impossible,OBC Customer Support,Priorité 1,Terminé(e),2024-11-19 16:33,19/11/2024 19:27,2024-11-19 19:27,
OBCS-7722,OD-2199,Gestion de visibilité des demande d'absences,"Permettre que chaque utilisateur puisse voir ses demandes d'absences enregistrés et portant son  nom

Aussi prendre en compte une vue admin.",EVA BASSE,HERVE GERARD YOH,FIRST CAPITAL,,Appel Téléphonique,RH,Gestion employé,Requêtes,Non renseigné,OBC Customer Support,Priorité 1,Terminé(e),2024-11-19 19:16,20/11/2024 15:27,2024-11-20 15:27,
OBCS-7717,OD-2194,Une message d'erreur à l'enregistrement des timesheet (error success: Undefined),"Une message d'erreur à l'enregistrement des timesheet (error success: Undefined)

!image-20241118-145425.png|width=100%,alt=""image-20241118-145425.png""!",JOEL SIE,M. SIE KONAN,ONPOINT,,En présentiel,Projets,Feuille de temps,Bug,Enregistrement impossible,OBC Customer Support,Priorité 1,Terminé(e),2024-11-18 14:51,20/11/2024 15:11,2024-11-20 15:11,
OBCS-7719,OD-2196,Export Fichier du personnel - Mise à jour des données,"* Rajouter au fichier export les informations suivante : Email, date de naissance, Date d’embauche, N° CNPS, N° CMU
* Réordonner l’affichage des données

",Vivien DAKPOGAN,Jean-Claude SAMPENNIE,S-TEL,,Appel Téléphonique,RH,Gestion employé,Requêtes,Non renseigné,OBC Customer Support,Priorité 1,Terminé(e),2024-11-18 18:26,20/11/2024 17:34,2024-11-20 17:34,
OBCS-7655,OD-2192,"Au calcul de la paie des journaliers, certains journaliers n'apparaissent pas","Au calcul de la paie des journaliers, certains journaliers n'apparaissent pas",EVA BASSE,Ursula YANGANGOUSSOU,ONPOINT,,En présentiel,RH,Salaire,Bug,Mauvais déversement des données,OBC Customer Support,Priorité 1,Terminé(e),2024-11-14 16:04,14/11/2024 18:07,2024-11-14 18:07,
OBCS-7647,OD-2188,Dysfonctionnement Grade - ECORIGINE,"Dysfonctionnement Grade - ECORIGINE 

Paramétrage salaire de base / Socio catégoriel & déversement contrat

!20241114-1243-32.0168984.mp4|width=1920,height=1080,alt=""20241114-1243-32.0168984.mp4""!",Edwige KOUASSI,MICHEL TETE,ECORIGINE,,En présentiel,RH,Gestion employé,Bug,Dysfonctionnement sur le Calcul des salaires,OBC Customer Support,Priorité 1,Terminé(e),2024-11-14 12:50,20/11/2024 17:33,2024-11-20 17:33,
OBCS-7645,OD-2186,Impossible d'enregistrer un staffing quand un projet a plusieurs sous-projet,Impossible d'enregistrer un staffing quand un projet a plusieurs sous-projet,EVA BASSE,LYDIE N'GUESSAN,KOFFI & DIABATE,,Appel Téléphonique,Projets,Gérer mes projets,Bug,Mauvais déversement des données,OBC Customer Support,Priorité 1,Terminé(e),2024-11-14 09:09,14/11/2024 17:06,2024-11-14 17:06,
OBCS-7649,OD-2190,Comptabilité Générale - Donner la possibilité d'appliquer des filtres sur chaque Champ du formulaire,"Comptabilité Générale - Donner la possibilité d'appliquer des filtres sur chaque Champ du formulaire .

Exemple de Filtre d’ordonnancement  Historique Paies

!image-20241114-143626.png|width=1081,height=392,alt=""image-20241114-143626.png""!

Tableau sur lesquels appliquer : 

!image-20241114-143930.png|width=1322,height=504,alt=""image-20241114-143930.png""!",Edwige KOUASSI,Eudes Yapi,CILAGRI,,Appel Téléphonique,Finance,Comptabilité Générale,Requêtes,Non renseigné,OBC Customer Support,Priorité 3,En cours,2024-11-14 14:40,13/12/2024 07:45,,
OBCS-7648,OD-2189,RH/Paramétrage Société/Organigramme / Donner la possibilité d'intégrer plusieurs type d'organigramme - ECORIGINE,"Donner la possibilité d'intégrer plusieurs type d'organigramme

# L'*organigramme* hiérarchique (en pyramide)
# L'*organigramme* plat/horizontal
# La structure divisionnelle
# La structure matricielle
# L'*organigramme* fonctionnel classique",Edwige KOUASSI,MICHEL TETE,ECORIGINE,,En présentiel,RH,Paramétrage,Requêtes,Non renseigné,OBC Customer Support,Priorité 1,Terminé(e),2024-11-14 12:53,19/11/2024 19:36,2024-11-19 19:36,
OBCS-7636,OD-2181,"Sur le formulaire d'expression de besoin , les employés ne se déverse pas (voir capture joint","

!image-20241111-095937.png|width=1653,height=646,alt=""image-20241111-095937.png""!",EVA BASSE,Jeronime GBAGUIDI,KOFFI & DIABATE,,Chat WhatsApp,Opérations,Achat,Bug,Mauvais déversement des données,OBC Customer Support,Priorité 1,Terminé(e),2024-11-11 09:59,13/11/2024 11:39,2024-11-13 11:39,
OBCS-7640,OD-2184,Inclure le RAN à l'édition d'une balance à 4 colonnes.,Inclure le RAN à l'édition d'une balance à 4 colonnes.,JOEL SIE,Brahima COULIBALY,KORI TRANSPORT,,E-mail,Finance,Comptabilité Générale,Requêtes,Non renseigné,OBC Customer Support,Priorité 1,Terminé(e),2024-11-11 17:40,21/11/2024 11:04,2024-11-21 11:04,
OBCS-7639,OD-2183,"Modèle de grand livre général et tiers avec total général débit, total général crédit et le solde global.","Modèle de grand livre général et tiers avec total général débit, total général crédit et le solde global.",JOEL SIE,Jean-Jacques LIKANE,LABOGEM,,Appel Téléphonique,Finance,Comptabilité Générale,Requêtes,Non renseigné,OBC Customer Support,Priorité 1,À faire,2024-11-11 16:35,11/11/2024 16:35,,
OBCS-7601,OD-2179,"RH/Gestion Employé/Fichier_Personnel - Bien que les employés aient un contrat, il marque dans le fichier impossible contrat indisponible avec l'icone Rouge au lieu de bleu","RH/Gestion Employé/Fichier Personnel - Bien que les employés aient un contrat, il marque dans le fichier du personnel contrat ou poste introuvable avec l'icone du contrat Rouge pour tout les employés.



!image-20241109-111125.png|width=373,height=482,alt=""image-20241109-111125.png""!



Cas employé KOUAKOU Othniel, dans la base des contrats il à belle et bien un contrat en cours, Cependant il est impossible d’atteindre son contrat à partir du fichier du personnel avec l’icone des contrats disponible (Bleu) qui ne figure sur aucun fichier du personnel.



!20241109-1100-44.8995622.mp4|width=1920,height=1080,alt=""20241109-1100-44.8995622.mp4""!",Edwige KOUASSI,EHUI Inesse,CILAGRI,,En présentiel,RH,Gestion employé,Bug,Dysfonctionnement des liens d'accès,OBC Customer Support,Priorité 1,En cours,2024-11-09 11:12,11/11/2024 09:35,,
OBCS-7567,OD-2178,Le décompte du nombre de jour de congé acquis qui s'affiche sur le bulletin est depuis la date d'embauche à date malgré le stock de congé enregistré.,Le décompte du nombre de jour de congé acquis qui s'affiche sur le bulletin est depuis la date d'embauche à date malgré le stock de congé enregistré.,JOEL SIE,YAO épouse KOSSONOU N'Guessan Esterne Nattacha,EDIPRESSE,,En présentiel,RH,Documents,Bug,Autres,OBC Customer Support,Priorité 1,Terminé(e),2024-11-08 17:28,3/12/2024 08:38,2024-12-03 08:38,
OBCS-7537,OD-2176,Quand un utilisateur enregistre une expression de besoin les autres demandeurs reçoivent la notification par mail,"Quand un utilisateur enregistre une expression de besoin les autres demandeurs reçoivent la notification par mail.

Un test a été fait sur la base preprod",N'GBRA MOYE BERNICE DORIS,KALOGO Nabarakissa,S-TEL,,Appel Téléphonique,Opérations,Achat,Bug,Dysfonctionnement Workflow,OBC Customer Support,Priorité 1,Terminé(e),2024-11-07 17:31,12/11/2024 11:07,2024-11-12 11:07,
OBCS-7535,OD-2174,Faire en sorte que au rechargement de l'historique Gestion Opportunité on puisse rester sur l'historique et non sur le formulaire de création,Faire en sorte que au rechargement de l'historique Gestion Opportunité on puisse rester sur l'historique et non sur le formulaire de création,EVA BASSE,FABIEN VATI,ONPOINT,,En présentiel,CRM,Activités commerciales,Requêtes,Non renseigné,OBC Customer Support,Priorité 1,Terminé(e),2024-11-07 12:46,11/11/2024 09:31,2024-11-11 09:31,
OBCS-7534,OD-2173,"Rendre cliquable les badges ""Etape Encours par nombre opportunité"" de sorte à filtrer l'historique en fonction de l'étape","Rendre cliquable les badges ""Etape Encours par nombre opportunité"" de sorte à filtrer l'historique en fonction de l'étape",EVA BASSE,FABIEN VATI,ONPOINT,,En présentiel,CRM,Activités commerciales,Requêtes,Non renseigné,OBC Customer Support,Priorité 1,Terminé(e),2024-11-07 12:45,22/11/2024 14:28,2024-11-22 14:28,
OBCS-7519,OD-2164,"Lorsqu'on lance la paie sur OCB(Bénin), le sursalaire d'un employé reste à 0","Lorsqu'on lance la paie sur OCB(Bénin), le sursalaire d'un employé reste à 0",EVA BASSE,Huberte ZOUNVO,KOFFI & DIABATE,,Appel Téléphonique,RH,Salaire,Bug,Dysfonctionnement sur le Calcul des salaires,OBC Customer Support,Priorité 1,Terminé(e),2024-11-06 15:37,7/11/2024 06:15,2024-11-07 06:15,
OBCS-7518,OD-2163,Impossible de programmer et modifier la paie des journaliers ou paie Occasionnel,{color:#ff5630}*URGENT :*{color} Impossible de programmer et modifier la paie des journaliers ou paie Occasionnel,Edwige KOUASSI,Ursula YANGANGOUSSOU,ONPOINT,,Appel Téléphonique,Projets,Note de frais,Bug,Dysfonctionnement sur le Calcul des salaires,OBC Customer Support,Priorité 1,Terminé(e),2024-11-06 14:12,14/11/2024 18:08,2024-11-14 18:08,
OBCS-7533,OD-2172,Modèle affichage facture vente Kori Transport,"Apporter une amélioration dans la facture à imprimer 



# Faire redescendre l’encart de l’info client pour mieux placer le sticker
# Ne pas répliquer l’entête quand on est à 2 ou plusieurs pages

",Vivien DAKPOGAN,Brahima COULIBALY,KORI TRANSPORT,,E-mail,Opérations,Vente,Requêtes,Non renseigné,OBC Customer Support,Priorité 3,Terminé(e),2024-11-07 10:22,11/12/2024 09:14,2024-12-11 09:14,
OBCS-7527,OD-2168,Modification de la ville sur les documents Bénin,"Mettre Cotonou à la place de Abidjan  pour : 

# Attestation de travail
# Certificat de Travail

",Vivien DAKPOGAN,Huberte ZOUNVO,KOFFI & DIABATE,,Appel Téléphonique,RH,Documents,Requêtes,Non renseigné,OBC Customer Support,Priorité 1,Terminé(e),2024-11-07 08:37,21/3/2025 10:26,2025-03-21 10:26,
OBCS-7513,OD-2158,"Lorsque j'enregistre une note dans CRM, le message ci-joint apparaît et ne me permets pas de réaliser l'enregistrement. ","

!REQUETE ENREGISTREMENT NOTE (1).png|width=953,height=501,alt=""REQUETE ENREGISTREMENT NOTE (1).png""!",EVA BASSE,FABIEN VATI,ONPOINT,,E-mail,CRM,Activités commerciales,Bug,Enregistrement impossible,OBC Customer Support,Priorité 1,Terminé(e),2024-11-05 14:57,29/11/2024 14:52,2024-11-29 14:52,
OBCS-7517,OD-2162,Absence de rubrique enregistré dans les notes de frais - Avec Edition impossible,"Absence de rubrique enregistré dans les notes de frais - Avec Edition impossible.

Donnez-la possibilité de modifier les notes de frais de M. SANANKOUA

!image-20241105-135312.png|width=1915,height=919,alt=""image-20241105-135312.png""!",Edwige KOUASSI,Ursula YANGANGOUSSOU,ONPOINT,,Appel Téléphonique,Projets,Note de frais,Bug,Dysfonctionnement des liens d'accès,OBC Customer Support,Priorité 3,Terminé(e),2024-11-06 09:04,6/11/2024 17:17,2024-11-06 17:17,
OBCS-7511,OD-2156,Supprimer les doublons au niveau des comptes tiers,"Supprimer les doublons au niveau des comptes tiers



!image (4).png|width=982,height=505,alt=""image (4).png""!",N'GBRA MOYE BERNICE DORIS,ERIC KOUADIO,FALCON,,Appel Téléphonique,Finance,Comptabilité Générale,Bug,Autres,OBC Customer Support,Priorité 1,Terminé(e),2024-11-04 19:48,5/11/2024 18:51,2024-11-05 18:51,
OBCS-7476,OD-2145,Un message d'erreur apparaît lorsqu'on sélectionne un bon de commande à l'enregistrement d'un bon d'une facture achat,"Un message d'erreur apparaît lorsqu'on sélectionne un bon de commande à l'enregistrement d'un bon d'une facture achat.

!Enregistrement 2024-10-31 152127 Message d'erreur facture achat.mp4|width=75%,alt=""Enregistrement 2024-10-31 152127 Message d'erreur facture achat.mp4""!",JOEL SIE,KONE Mariam,SIT BTP,,Appel Téléphonique,Opérations,Achat,Bug,Autres,OBC Customer Support,Priorité 1,Terminé(e),2024-10-31 15:26,6/11/2024 18:56,2024-11-06 18:56,
OBCS-7453,OD-2142,Affichage des valeurs décimales à l'impression d'un bon de commande,"Nous arrivons à saisir les valeurs décimales à l’enregistrement d’un bon de commande mais au moment d’imprimer le BC, ce ne sont que les valeurs entières qui affichent. Mise à jour de colonne Quantité sur tous les modèles de rapport bon de commande.",Vivien DAKPOGAN,MODESTE PRODJINOTHO,KOFFI & DIABATE,,Chat WhatsApp,Opérations,Achat,Bug,Mauvais déversement des données,OBC Customer Support,Priorité 1,Terminé(e),2024-10-31 06:22,5/11/2024 18:59,2024-10-31 08:11,
OBCS-7444,OD-2141,Amélioration extraction,"* Mettre le format date dans la colonne date au niveau des extractions des timesheet.
* Réduire le poids du fichier au nombre de ligne existantes.
* Rajouter les matricules dans les extractions correspondant où le nom d’employé .
* Uniformiser les noms des employés (soit alias soit le nom complet) dans les extractions.",N'GBRA MOYE BERNICE DORIS,Delphin Zoungrana,ONPOINT,,En présentiel,Projets,Feuille de temps,Requêtes,Non renseigné,OBC Customer Support,Priorité 1,À faire,2024-10-30 18:12,30/10/2024 18:13,,
OBCS-7428,OD-2130,Export Fichier du personnel : Ajouter la colonne n° de téléphone,Export Fichier du personnel : Ajouter la colonne n° de téléphone,EVA BASSE,Ursula YANGANGOUSSOU,ONPOINT,,En présentiel,RH,Gestion employé,Requêtes,Non renseigné,OBC Customer Support,Priorité 2,Terminé(e),2024-10-29 09:41,31/10/2024 13:43,2024-10-31 13:43,
OBCS-7427,OD-2129,Correction Bug CRM Activité Historique : impossible d'éditer une activité lorsqu'une note est enregistré,Correction Bug CRM Activité Historique : impossible d'éditer une activité lorsqu'une note est enregistré,EVA BASSE,FABIEN VATI,ONPOINT,,En présentiel,CRM,Activités commerciales,Requêtes,Non renseigné,OBC Customer Support,Priorité 2,Terminé(e),2024-10-29 09:40,4/11/2024 10:29,2024-11-04 10:29,
OBCS-7426,OD-2128,enlever le filtre du milieu des filtres historique opportunités (cela occupe assez d'espace),enlever le filtre du milieu des filtres historique opportunités (cela occupe assez d'espace),EVA BASSE,M. SANANKOUA,ONPOINT,,En présentiel,CRM,Activités commerciales,Requêtes,Non renseigné,OBC Customer Support,Priorité 2,Terminé(e),2024-10-29 09:40,4/11/2024 10:18,2024-11-04 10:18,
OBCS-7425,OD-2127,"Sur le Dashboard CRM, Graphes Suivi Mensuel Opportunités : rendre cumulatif le graphe suivi mensuel opportunités selon les statuts (ils ne doivent pas revenir au point zéro)","Sur le Dashboard CRM, Graphes Suivi Mensuel Opportunités : rendre cumulatif le graphe suivi mensuel opportunités selon les statuts (ils ne doivent pas revenir au point zéro)",EVA BASSE,M. SANANKOUA,ONPOINT,,En présentiel,CRM,Activités commerciales,Requêtes,Non renseigné,OBC Customer Support,Priorité 2,Terminé(e),2024-10-29 09:39,19/12/2024 09:00,2024-12-19 09:00,
OBCS-7424,OD-2126,filtrer activité par date réel début plutôt que par date d'enregistrement réel,filtrer activité par date réel début plutôt que par date d'enregistrement réel,EVA BASSE,M. SANANKOUA,ONPOINT,,En présentiel,CRM,Activités commerciales,Requêtes,Non renseigné,OBC Customer Support,Priorité 2,Terminé(e),2024-10-29 09:39,4/11/2024 10:27,2024-11-04 10:27,
OBCS-7423,OD-2125,RH / Salaire / Document - Rubrique inconnu sur le bulletin,"Provenance de la dernière ligne, rubrique 142 sur le bulletin inconnu.

!image-20241028-172110.png|width=1918,height=940,alt=""image-20241028-172110.png""!",Edwige KOUASSI,,CILAGRI,,Constat Interne,RH,Documents,Bug,Mauvais déversement des données,OBC Customer Support,Priorité 1,Terminé(e),2024-10-28 18:01,14/11/2024 17:44,2024-11-14 17:44,
OBCS-7422,OD-2124,Possibilité d'utiliser les rubriques retenues dans la colonne retenue même si elle vient avant le salaire brut. (Calcul de salaire et bulletin),Possibilité d'utiliser les rubriques retenues dans la colonne retenue même si elle vient avant le salaire brut. (Calcul de salaire et bulletin),JOEL SIE,Jean-Jacques LIKANE,LABOGEM,,Appel Téléphonique,RH,Salaire,Requêtes,Non renseigné,OBC Customer Support,Priorité 1,Terminé(e),2024-10-28 16:31,28/3/2025 09:11,2025-03-28 09:11,
OBCS-7357,OD-2121,"A l'enregistrement du bon de livraison, lorqu'on sélection le bon de commande les lignes ne respectent pas le même ordre du bon de commande ","A l'enregistrement du bon de livraison, lorqu'on sélection le bon de commande les lignes ne respectent pas le même ordre du bon de commande.",JOEL SIE,KONE Mariam,SIT BTP,,Appel Téléphonique,Opérations,Achat,Bug,Mauvais déversement des données,OBC Customer Support,Priorité 1,Terminé(e),2024-10-25 09:28,22/12/2024 16:28,2024-12-22 16:28,
OBCS-7351,OD-2120,A l'édition du bulletin de salaire lorsque le montant de la rubrique est négatif il ne s'affiche pas sur le bulletin,A l'édition du bulletin de salaire lorsque le montant de la rubrique est négatif il ne s'affiche pas sur le bulletin,JOEL SIE,Jean-Jacques LIKANE,LABOGEM,,Appel Téléphonique,RH,Documents,Bug,Autres,OBC Customer Support,Priorité 1,Terminé(e),2024-10-24 17:21,25/10/2024 16:30,2024-10-25 16:30,
OBCS-7350,OD-2119,Interrogation de compte - Affichage de récapitulatif,"En sélectionnant les opérations Débit - Crédit, le petit tableau récap n’affiche plus les valeurs

",Vivien DAKPOGAN,Brahima COULIBALY,KORI TRANSPORT,,Appel Téléphonique,Finance,Comptabilité Générale,Bug,Non affichage de pages/données,OBC Customer Support,Priorité 1,Terminé(e),2024-10-24 15:25,24/10/2024 17:53,2024-10-24 17:53,
OBCS-7342,OD-2111,(Urgent) Un bon de commande qui existe en historique ne se déverse pas sur le formulaire de facture pourtant on a plusieurs factures déjà édité à parti de ce bon de commande,(Urgent) Un bon de commande qui existe en historique ne se déverse pas sur le formulaire de facture pourtant on a plusieurs factures déjà édité à parti de ce bon de commande (urgence),EVA BASSE,EMMANUEL KOUKPOLOU,KOFFI & DIABATE,,Appel Téléphonique,Opérations,Achat,Bug,Mauvais déversement des données,OBC Customer Support,Priorité 1,Terminé(e),2024-10-22 11:37,23/10/2024 10:22,2024-10-23 10:22,
OBCS-7291,OD-2109,Modification de date fin de congés avant impression d'attestation de retour de congés,Modification de date fin de congés avant impression d'attestation de retour de congés,N'GBRA MOYE BERNICE DORIS,KALOGO Nabarakissa,S-TEL,,Appel Téléphonique,RH,Gestion employé,Requêtes,Non renseigné,OBC Customer Support,Priorité 1,Terminé(e),2024-10-17 21:21,25/10/2024 19:35,2024-10-25 19:35,
OBCS-7262,OD-2108,Nous avons constaté que le récapitulatif des stock n’apparait plus lorsqu’on choisi “stock” comme nature du besoin (voir capture),"Nous avons constaté que le récapitulatif des stock n’apparait plus lorsqu’on choisi “stock” comme nature du besoin (voir capture)

!image-20241016-164447.png|width=1653,height=702,alt=""image-20241016-164447.png""!",EVA BASSE,WILLANE DAN,KOFFI & DIABATE,,Appel Téléphonique,Opérations,Achat,Bug,Autres,OBC Customer Support,Priorité 1,Terminé(e),2024-10-16 17:12,21/10/2024 09:41,2024-10-21 09:41,
OBCS-7261,OD-2107,RH/Gestion Employé/Contrat ... - Affichage de département Inconnu dans les données du client,RH/Gestion Employé/Contrat ... - Affichage de département Inconnu dans les données du client,Edwige KOUASSI,EHUI Inesse,CILAGRI,,Chat WhatsApp,RH,Gestion employé,Bug,Autres,OBC Customer Support,Priorité 1,Terminé(e),2024-10-16 15:34,22/10/2024 07:52,2024-10-22 07:52,
OBCS-7260,OD-2106,"les Etats financiers : lorsque je sélectionne une période à supprimer, il supprime tout les états générés de l’exercice comptable","les Etats financiers : lorsque je sélectionne une période à supprimer, il supprime tout les états générés de l’exercice comptable.",JOEL SIE,Ousseyni Oumarou,EJARA,,Appel Téléphonique,Finance,Comptabilité Générale,Bug,Autres,OBC Customer Support,Priorité 1,En cours,2024-10-16 15:22,16/10/2024 17:25,,
OBCS-7258,OD-2104,Nous constatons qu'un bon de commande enregistré n'apparait pas dans le workflow pour validation,"Nous constatons qu'un bon de commande enregistré n'apparait pas dans le workflow pour validation



!image-20241016-103251.png|width=1294,height=684,alt=""image-20241016-103251.png""!",N'GBRA MOYE BERNICE DORIS,KALOGO Nabarakissa,S-TEL,,Appel Téléphonique,Opérations,Achat,Bug,Dysfonctionnement Workflow,OBC Customer Support,Priorité 1,Terminé(e),2024-10-16 10:29,17/10/2024 09:07,2024-10-17 09:07,
OBCS-7255,OD-2101,Intégration d'attestation type CSCTICAO,"Intégration d'attestation type CSCTICAO 

Se servir des corrections apportées sur le fichier de OBC pour faire pour CSCTICAO

[^Attestation de travail OBC_20241010105850.pdf]
[^Model d'attestation de travail.pdf]

",N'GBRA MOYE BERNICE DORIS,SERGE ARIKO,CSCTICAO,,E-mail,RH,Documents,Requêtes,Non renseigné,OBC Customer Support,Priorité 2,Terminé(e),2024-10-14 12:40,29/10/2024 14:27,2024-10-29 14:27,
OBCS-7252,OD-2099,"A l'enregistrement d'un bordereau d'entré en stock, le prix unitaire récupéré est le prix d'achat au lieu du coût de revient de l'article.","A l'enregistrement d'un bordereau d'entré en stock, le prix unitaire récupéré est le prix d'achat au lieu du coût de revient de l'article.",JOEL SIE,KALOGO Nabarakissa,S-TEL,,Appel Téléphonique,Opérations,Gestion de stock,Requêtes,Non renseigné,OBC Customer Support,Priorité 1,À faire,2024-10-14 10:02,7/4/2025 10:55,,
OBCS-7155,OD-2094,Ecritures à suprimer journal vente. Lorsqu'on veut supprimer un méssage disant qu'elle est liée à une avance alors que la facture été modifiée et générée une nouvelle écriture.,"Ecritures à suprimer journal vente. Lorsqu'on veut supprimer un méssage disant qu'elle est liée à une avance alors que la facture été modifiée et générée une nouvelle écriture.

!image-20241010-132816.png|width=100%,alt=""image-20241010-132816.png""!",JOEL SIE,Jean-Jacques LIKANE,LABOGEM,,Appel Téléphonique,Finance,Comptabilité Générale,Bug,Autres,OBC Customer Support,Priorité 1,Terminé(e),2024-10-10 13:25,11/10/2024 14:36,2024-10-11 14:36,
OBCS-7153,OD-2092,"Sur le formulaire de gestion des projets, lorsqu'on utilise le bouton ""utiliser toute les phases"", et qu'on défini les informations que quelques phases, OBC exige qu'on remplisse les autres champs vide","Sur le formulaire de gestion des projets, lorsqu'on utilise le bouton ""utiliser toute les phases"", et qu'on défini les informations que quelques phases, OBC exige qu'on remplisse les autres champs vide",EVA BASSE,Georges KOFFI,KOFFI & DIABATE,,En présentiel,Projets,Gérer mes projets,Bug,Page d'erreur,OBC Customer Support,Priorité 1,Terminé(e),2024-10-10 09:30,11/10/2024 15:16,2024-10-11 15:16,
OBCS-7152,OD-2091,"Impossible d'enregistrer des tâches sur un projets, on a un message d'erreur qui apparaitv(voir pièce jointe)","

!image (24).png|width=946,height=378,alt=""image (24).png""!",EVA BASSE,LYDIE N'GUESSAN,KOFFI & DIABATE,,En présentiel,Projets,Gérer mes projets,Bug,Page d'erreur,OBC Customer Support,Priorité 1,Terminé(e),2024-10-10 09:28,11/10/2024 11:04,2024-10-11 11:04,
OBCS-7154,OD-2093,Amélioration formulaire Duplication Budget,Amélioration formulaire Duplication Budget,Vivien DAKPOGAN,,KORI TRANSPORT,,En présentiel,Finance,Budget,Requêtes,Non renseigné,OBC Customer Support,Priorité 2,Terminé(e),2024-10-10 11:40,23/10/2024 10:23,2024-10-23 10:23,
OBCS-7149,OD-2089,la base de travail d'un compte utilisateur n'affiche pas le nom de l'entité,"

!EGBV INTER.PNG|width=975,height=617,alt=""EGBV INTER.PNG""!

Malgré avoir décocher l’accès entité et recocher pour l’utilisateur [sanckatse@egbvinter.com|mailto:sanckatse@egbvinter.com] la base de travail reste vide.",N'GBRA MOYE BERNICE DORIS,ERIC ATSE,EGBV,,Appel Téléphonique,Global,Global,Bug,Non affichage de pages/données,OBC Customer Support,Priorité 1,Terminé(e),2024-10-09 11:03,11/10/2024 09:02,2024-10-11 09:02,Global
OBCS-7141,OD-2082,Mauvais déversement des écritures de paie OHADA dans les opérations de paie qui affichent un écart qui ne correspond à aucun compte paramétré dans leur base,"Mauvais déversement des écritures de paie OHADA dans les opérations de paie qui affichent un écart qui ne correspond à aucun compte paramétré dans leur base



!image-20241007-174503.png|width=1294,height=730,alt=""image-20241007-174503.png""!",N'GBRA MOYE BERNICE DORIS,CHARLES IPO,FALCON,,Appel Téléphonique,RH,Comptabilité Générale,Bug,Mauvais déversement des données,OBC Customer Support,Priorité 1,Terminé(e),2024-10-07 17:45,11/10/2024 11:14,2024-10-11 11:14,
OBCS-7140,OD-2081,Impossible d'ajouter une deuxième ligne de prestation sur le formulaire de facture vente (voir capture,"!20241007-1424-19.1825621.mp4|width=1660,height=840,alt=""20241007-1424-19.1825621.mp4""!

euxième ligne de prestation sur le formulaire ",EVA BASSE,Aude KOFFI,OTOMASYS,,Appel Téléphonique,Opérations,Vente,Bug,Mauvais déversement des données,OBC Customer Support,Priorité 1,Terminé(e),2024-10-07 14:25,7/10/2024 15:54,2024-10-07 15:54,
OBCS-7138,OD-2079,Des comptes tiers clients s'affichent sur la balnce générale.,Des comptes tiers clients s'affichent sur la balnce générale.,JOEL SIE,Jean-Jacques LIKANE,LABOGEM,,Appel Téléphonique,Finance,Comptabilité Générale,Bug,Autres,OBC Customer Support,Priorité 1,Terminé(e),2024-10-07 12:34,7/10/2024 17:53,2024-10-07 17:53,
OBCS-7146,OD-2086,RH - Document / Intégration modèle de livre de paie,"RH - Document / Intégration modèle de livre de paie

Modèle standard sage utilisé par la plus part des clients

Sur la dernière page du livre de paie nous avons le récapitulatif des rubriques cotisations, part salariale & patronale",Edwige KOUASSI,COULIBALY EVE,IVOIRE DEVELOPPEMENT,,Appel Téléphonique,RH,Documents,Requêtes,Non renseigné,OBC Customer Support,Priorité 1,Terminé(e),2024-10-07 19:36,25/10/2024 10:02,2024-10-25 10:02,
OBCS-7137,OD-2078,Ajouter une colonne dans l'historique du plan comptable tiers affichant le compte général auquel les comptes tiers sont ratacchés.,Ajouter une colonne dans l'historique du plan comptable tiers affichant le compte général auquel les comptes tiers sont ratacchés.,JOEL SIE,Jean-Jacques LIKANE,LABOGEM,,Appel Téléphonique,Finance,Comptabilité Générale,Requêtes,Non renseigné,OBC Customer Support,Priorité 1,Terminé(e),2024-10-07 12:32,22/12/2024 16:29,2024-12-22 16:29,
OBCS-7077,OD-2074,"Lors des opérations d'interco, le numéro de compte général généré par l'entité bénéficiaire est le numéro de compte général de l'entité émetrice.","Lors des opérations d'interco, le numéro de compte général généré par l'entité bénéficiaire est le numéro de compte général de l'entité émetrice.",JOEL SIE,Ousseyni Oumarou,EJARA,,Appel Téléphonique,Finance,Comptabilité Générale,Bug,Autres,OBC Customer Support,Priorité 1,Terminé(e),2024-10-04 14:03,9/10/2024 09:28,2024-10-09 09:28,
OBCS-7076,OD-2073,Un message d'erreur à l'enregistrement d'une facture achat,"

!image-20241004-112444.png|width=1534,height=737,alt=""image-20241004-112444.png""!",JOEL SIE,,ONPOINT,TEAM SUPPORT,Constat Interne,Opérations,Achat,Bug,Page d'erreur,OBC Customer Support,Priorité 1,Terminé(e),2024-10-04 11:24,7/10/2024 15:56,2024-10-07 15:56,
OBCS-7057,OD-2069,Le compte tiers client a été modifié mais les écritures demeurent sur l'ancien compte et s'affichent sur le grand livre.,"Une le compte tiers client a été modifié mais les écritures demeurent sur l'ancien compte et s'affichent sur le grand livre. A supprimer 

!image-20241003-161547.png|width=100%,alt=""image-20241003-161547.png""!",JOEL SIE,Jean-Jacques LIKANE,LABOGEM,,Appel Téléphonique,Finance,Comptabilité Générale,Bug,Autres,OBC Customer Support,Priorité 1,Terminé(e),2024-10-03 16:13,7/10/2024 15:39,2024-10-07 15:39,
OBCS-7051,OD-2067,Ranger par ordre alphabétique les éléments variables qui apparaissent dans le formulaire du calcul de paie OHADA,Ranger par ordre alphabétique les éléments variables qui apparaissent dans le formulaire du calcul de paie OHADA,N'GBRA MOYE BERNICE DORIS,Jean-Claude SAMPENNIE,S-TEL,,Appel Téléphonique,RH,Salaire,Requêtes,Non renseigné,OBC Customer Support,Priorité 1,Terminé(e),2024-10-02 11:02,4/10/2024 09:06,2024-10-04 09:06,
OBCS-7080,OD-2077,Ajouter colonne date début ou réelle de l’activité dans historique de activité CRM,Ajouter colonne date début ou réelle de l’activité dans historique de activité CRM,JOEL SIE,M. SANANKOUA,ONPOINT,,En présentiel,CRM,Activités commerciales,Requêtes,Non renseigné,OBC Customer Support,Priorité 1,Terminé(e),2024-10-04 16:11,11/10/2024 10:06,2024-10-11 10:06,
OBCS-7044,OD-2062,Avoir le numéro d'imputation d'une saisie comptable,Avoir le numéro d'imputation d'une saisie comptable,EVA BASSE,LYTA KENA-RABE,KOFFI & DIABATE,,En présentiel,Finance,Comptabilité Générale,Requêtes,Non renseigné,OBC Customer Support,Priorité 1,Terminé(e),2024-10-01 10:16,2/10/2024 18:51,2024-10-02 18:51,
OBCS-7043,OD-2061,Ne pas rendre unique les numéros de références à la saisie manuelle des écritures comptables,Ne pas rendre unique les numéros de références à la saisie manuelle des écritures comptables,EVA BASSE,LYTA KENA-RABE,KOFFI & DIABATE,,En présentiel,Finance,Comptabilité Générale,Requêtes,Non renseigné,OBC Customer Support,Priorité 1,Terminé(e),2024-10-01 10:16,7/10/2024 15:53,2024-10-07 15:53,
OBCS-7042,OD-2060,Erreur Ajax à la modification ou à la suppression d'une ligne dans un bordereau de sortie de stock,Erreur Ajax à la modification ou à la suppression d'une ligne dans un bordereau de sortie de stock,JOEL SIE,Joël SIE,SIS,,Appel Téléphonique,Opérations,Gestion de stock,Bug,Erreur Ajax,OBC Customer Support,Priorité 1,Terminé(e),2024-09-30 19:21,3/10/2024 11:09,2024-10-03 11:09,
OBCS-7037,OD-2057,"Le formulaire de ""Nouvelle Paie ""/""Calcul OHADA"" s'affiche difficilement (après environ 5 minutes ou plus)","Le formulaire de ""Nouvelle Paie ""/""Calcul OHADA"" s'affiche difficilement (après environ 5 minutes ou plus)",EVA BASSE,Auguste QUENUM,KOFFI & DIABATE,,"Online (Google Meet, Teams...)",RH,Salaire,Bug,Autres,OBC Customer Support,Priorité 1,Terminé(e),2024-09-30 11:44,4/10/2024 12:04,2024-10-04 12:04,
OBCS-7041,OD-2059,TVA/achat de service exigible au décaissement,TVA/achat de service exigible au décaissement,JOEL SIE,Kramo,ARIC,,En présentiel,Finance,Impôts et taxes,Requêtes,Non renseigné,OBC Customer Support,Priorité 1,Terminé(e),2024-09-30 18:15,9/10/2024 08:51,2024-10-09 08:51,
OBCS-6963,OD-2055,Montant de l'impôt total nouveau régime différent dans les déclarations ITS et le livre de paie,Montant de l'impôt total nouveau régime différent dans les déclarations ITS et le livre de paie,N'GBRA MOYE BERNICE DORIS,CHARLES IPO,FALCON,,Appel Téléphonique,RH,Documents,Bug,Mauvais déversement des données,OBC Customer Support,Priorité 1,Terminé(e),2024-09-27 12:06,21/11/2024 09:44,2024-11-21 09:44,
OBCS-6958,OD-2051,Un compte client créé dans le sous module vente n'apparaît pas dans l'historique par contre il s'affiche à l'exportation et à l'enregistrement d'une facture,Un compte client créé dans le sous module vente n'apparaît pas dans l'historique par contre il s'affiche à l'exportation et à l'enregistrement d'une facture,JOEL SIE,KALOGO Nabarakissa,S-TEL,,Appel Téléphonique,Opérations,Vente,Bug,Autres,OBC Customer Support,Priorité 1,Terminé(e),2024-09-26 17:40,1/10/2024 18:06,2024-10-01 18:06,
OBCS-6954,OD-2048,"Lorsque le calcul de salaire est au prorata, il affiche le montant entier sur le bulletin par contre le calcul est fait au prorata. Il doit afficher les montants au prorata","Lorsque le calcul de salaire est au prorata, il affiche le montant entier sur le bulletin par contre le calcul est fait au prorata. Il doit afficher les montants au prorata",JOEL SIE,Ousseyni Oumarou,EJARA,,Appel Téléphonique,RH,Documents,Bug,Autres,OBC Customer Support,Priorité 1,Terminé(e),2024-09-26 17:25,11/10/2024 14:30,2024-10-11 14:30,
OBCS-6949,OD-2045,"Sur les bulletins de salaire de KDA BENIN, tous les montants en ""gains"" de la colonne part salariale sont déverser en ""retenue"" dans la partie part patronale( Voir capture)","

!image (19).png|width=535,height=382,alt=""image (19).png""!",EVA BASSE,Auguste QUENUM,KOFFI & DIABATE,,"Online (Google Meet, Teams...)",RH,Documents,Bug,Mauvais déversement des données,OBC Customer Support,Priorité 1,Terminé(e),2024-09-26 11:29,26/9/2024 15:15,2024-09-26 15:15,
OBCS-6941,OD-2038,Impossible de faire une nouvelle paie sur OCB ( une entité du Bénin),Impossible de faire une nouvelle paie sur OCB ( une entité du Bénin),EVA BASSE,Huberte ZOUNVO,KOFFI & DIABATE,,"Online (Google Meet, Teams...)",RH,Salaire,Bug,Autres,OBC Customer Support,Priorité 1,Terminé(e),2024-09-25 10:38,7/10/2024 16:48,2024-10-07 16:48,
OBCS-6940,OD-2037,Paramétrer les rubriques de la paie par entité et non par pays. (Urgence signalé),{color:#ff991f}Paramétrer les rubriques de la paie par entité et non par pays.{color},EVA BASSE,Huberte ZOUNVO,KOFFI & DIABATE,,"Online (Google Meet, Teams...)",RH,Salaire,Requêtes,Non renseigné,OBC Customer Support,Priorité 1,Terminé(e),2024-09-25 10:29,19/6/2025 15:45,2025-06-19 15:45,
OBCS-6939,OD-2036,Problème de conversion lors d'un enregistrement de bon de commande,"Problème de conversion lors d'un enregistrement de bon de commande





!WhatsApp Image 2024-09-24 at 15.33.38 (1)-20240924-174628.jpeg|width=747,height=421,alt=""WhatsApp Image 2024-09-24 at 15.33.38 (1)-20240924-174628.jpeg""!",N'GBRA MOYE BERNICE DORIS,KALOGO Nabarakissa,S-TEL,,Appel Téléphonique,Opérations,Achat,Bug,Mauvais déversement des données,OBC Customer Support,Priorité 1,En cours,2024-09-24 17:47,25/9/2024 09:43,,
OBCS-6938,OD-2035,A l'imprinssion d'un bon de commande l'odre dans lequel le bon de commande a été enregistrement n'est pas respecté. Aussi les n°de réference s'affichant sur le bon de ne sont pas ordonnés. Paginer les bon ex: 1/1,"A l'imprinssion d'un bon de commande l'odre dans lequel le bon de commande a été enregistrement n'est pas respecté. Aussi les n°de réference s'affichant sur le bon de ne sont pas ordonnés. 

!L'ordre sur le bon de commande.png|width=426,height=343,alt=""L'ordre sur le bon de commande.png""!",JOEL SIE,KOUAME KONAN GUY ROGER,SIT BTP,,Appel Téléphonique,Global,Global,Bug,Autres,OBC Customer Support,Priorité 1,Terminé(e),2024-09-24 11:53,26/9/2024 10:33,2024-09-26 10:33,Global
OBCS-6937,OD-2034,Dysfonctionnement lien d'accès - RH / Fichier du personnel,"Lorsqu’on clique sur certain lien dans l’historique des fichier du personnel rien ne s’affiche.

La redirection ramène a une page blanche.

Cas Client Cilagri Cajou : Contrat de indisponible

!20240924-1009-30.2455902.mp4|width=1920,height=1080,alt=""20240924-1009-30.2455902.mp4""!",Edwige KOUASSI,,CILAGRI,,Constat Interne,RH,Gestion employé,Bug,Dysfonctionnement des liens d'accès,OBC Customer Support,Priorité 1,En cours,2024-09-24 10:14,25/9/2024 16:42,,
OBCS-6935,OD-2032,Bon de commande - Récupération de la valeur,"Bien qu’en axe analytique on ai sélectionné flotte auto et le véhicule, sur le bon de commande la valeur n’est pas récupéré.





!image-20240923-125044.png|width=1527,height=525,alt=""image-20240923-125044.png""!



!image-20240923-124539.png|width=950,height=446,alt=""image-20240923-124539.png""!",Edwige KOUASSI,Jonathan N'DOUBA,CIP,,"Online (Google Meet, Teams...)",Opérations,Achat,Bug,Mauvais déversement des données,OBC Customer Support,Priorité 1,En cours,2024-09-23 12:51,25/9/2024 18:34,,
OBCS-6934,OD-2031,Opération / Achat ( Bon de commande) - Peut importe le type d'achat sélectionné - Les articles en stock se déversent,Peut importe le type d'achat sélectionné - Les articles en stock se déversent,Edwige KOUASSI,Jonathan N'DOUBA,CIP,,"Online (Google Meet, Teams...)",Opérations,Achat,Bug,Mauvais déversement des données,OBC Customer Support,Priorité 1,En cours,2024-09-23 12:37,25/9/2024 18:34,,
OBCS-6951,OD-2047,Bordereau d'entrée et sortie: Possibilité de modifier ou supprimer une ligne et actualiser automatiquement le CUMP,Bordereau d'entrée et sortie: Possibilité de modifier ou supprimer une ligne et actualiser automatiquement le CUMP.,JOEL SIE,KONE HASSANE,SIS,,Appel Téléphonique,Opérations,Gestion de stock,Requêtes,Non renseigné,OBC Customer Support,Priorité 1,Terminé(e),2024-09-26 11:42,23/10/2024 18:31,2024-10-23 18:31,
OBCS-6933,OD-2030,Création d'un onglet permettant de faire le récapitulatif des mouvements d'articles,Création d'un onglet permettant de faire le récapitulatif des mouvements d'articles.,JOEL SIE,KONE HASSANE,SIS,,Appel Téléphonique,Opérations,Gestion de stock,Requêtes,Non renseigné,OBC Customer Support,Priorité 1,Terminé(e),2024-09-23 12:34,30/9/2024 09:04,2024-09-30 09:04,
OBCS-6868,OD-2024,"La colonne action ne s'affiche plus dans l'historique du calcul de la paie. Du coup il est impossible de supprimer, valider ou visualiser la paie déjà calculée","La colonne action ne s'affiche plus dans l'historique du calcul de la paie. Du coup il est impossible de supprimer, valider ou visualiser la paie déjà calculée.",JOEL SIE,YAO épouse KOSSONOU N'Guessan Esterne Nattacha,EDIPRESSE,,Appel Téléphonique,RH,Salaire,Bug,Autres,OBC Customer Support,Priorité 1,Terminé(e),2024-09-20 10:44,24/9/2024 09:09,2024-09-24 09:09,
OBCS-6866,OD-2022,"A l'édition d'un contrat, on constate que l'onglet des grades est vide","A l'édition d’un contrat, on constate que l'onglet des grades est vide",JOEL SIE,Joël SIE,ARIC,,Appel Téléphonique,RH,Gestion employé,Bug,Autres,OBC Customer Support,Priorité 1,Terminé(e),2024-09-19 15:51,23/10/2024 17:51,2024-10-23 17:51,
OBCS-6860,OD-2017,"En historique des contrats de stage, il n'y a aucune différence entre les contrats en cours et les contrats échus comme pour les contrats OHADA","En historique des contrats de stage, il n'y a aucune différence entre les contrats en cours et les contrats échus comme pour les contrats OHADA",EVA BASSE,Diane N'GBLA,KOFFI & DIABATE,,En présentiel,RH,Salaire,Bug,Mauvais déversement des données,OBC Customer Support,Priorité 2,Terminé(e),2024-09-18 12:14,9/10/2024 09:22,2024-10-09 09:22,
OBCS-6849,OD-2011,Mettre la CMU à zéro lorsque le salaire brut égale à zéro,Mettre la CMU à zéro lorsque le salaire brut égale à zéro,JOEL SIE,Ousseyni Oumarou,EJARA,,Appel Téléphonique,RH,Salaire,Bug,Autres,OBC Customer Support,Priorité 1,Terminé(e),2024-09-16 14:17,11/10/2024 11:50,2024-10-11 11:50,
OBCS-6864,OD-2021,Créer une fonctionalité permettant d'afficher les mouvements par article et donner la possibilité de visualiser les bordereaux liés à ceux-ci,Créer une fonctionalité permettant d'afficher les mouvements par article et donner la possibilité de visualiser les bordereaux liés à ceux-ci.,JOEL SIE,KONE HASSANE,SIS,,Appel Téléphonique,Opérations,Gestion de stock,Requêtes,Non renseigné,OBC Customer Support,Priorité 1,Terminé(e),2024-09-19 08:20,19/9/2024 20:05,2024-09-19 20:05,
OBCS-6850,OD-2012,Amélioration Filtre dans Activité / CRM,"Dans Activité : Positionner la colonne client au début de l'historique avec la possibilité de chercher sur les filtres, choisir le nombre de ligne qui doit s'afficher dans l'historique et enfin récupérer uniquement les commerciaux et non tous les employés",Edwige KOUASSI,,ONPOINT,,Constat Interne,CRM,Activités commerciales,Requêtes,Non renseigné,OBC Customer Support,Priorité 1,Terminé(e),2024-09-16 19:09,11/10/2024 09:38,2024-10-11 09:38,
OBCS-6756,OD-2010,Impossible d'imprimer une attestation de congés - RH/Congés & autres absences,"Impossible d'imprimer une attestation de congés - RH/Congés & autres absences

!image-20240913-141017.png|width=1903,height=920,alt=""image-20240913-141017.png""!",Edwige KOUASSI,Raïssa CAMARA,JOEL K PROPERTIES,,Appel Téléphonique,RH,Documents,Bug,Impression impossible,OBC Customer Support,Priorité 1,En cours,2024-09-13 14:10,13/9/2024 15:24,,
OBCS-6755,OD-2009,"En plus de la validation groupée, donner la possibilité de valider le stock initial par ligne","En plus de la validation groupée, donner la possibilité de valider le stock initial par ligne",JOEL SIE,Marius Coffi,EDIPRESSE,,En présentiel,Opérations,Gestion de stock,Requêtes,Non renseigné,OBC Customer Support,Priorité 1,À faire,2024-09-13 13:38,13/9/2024 13:38,,
OBCS-6751,OD-2007,RH/Fichier personnel/Filtre - Duplication de page lors d'un filtre sur une donnée,"Lorsqu'on filtre sur une information, lors de l'affichage nous constatons deux pages qui nous renvoie le même résultat",Edwige KOUASSI,EHUI Inesse,CILAGRI,,En présentiel,RH,Gestion employé,Bug,Dysfonctionnement des filtres,OBC Customer Support,Priorité 1,En cours,2024-09-11 11:27,11/9/2024 15:16,,
OBCS-6749,OD-2005,Impossible de travailler pour cause de lenteur,Impossible de travailler pour cause de lenteur,Edwige KOUASSI,EHUI Inesse,CILAGRI,,En présentiel,RH,Gestion employé,Bug,Lenteur Système,OBC Customer Support,Priorité 1,Terminé(e),2024-09-11 10:14,29/10/2024 09:56,2024-10-29 09:56,
OBCS-6750,OD-2006,Prévoir le calcul de salaire par rendement pour certain salarié,Prévoir le calcul de salaire par rendement pour certain salarié,Edwige KOUASSI,Léa N'GUESSAN,CILAGRI,,En présentiel,RH,Salaire,Requêtes,Non renseigné,OBC Customer Support,Priorité 2,À faire,2024-09-11 10:48,11/9/2024 10:48,,
OBCS-6741,OD-2001,Intégrer un rapport type EGBV pour mieux exploiter la balance analytique à leur niveau,"Intégrer un rapport type EGBV pour mieux exploiter la balance analytique à leur niveau

Les champs et la disposition que nous souhaités

!https://mail.google.com/mail/u/0?ui=2&ik=9dbece79f0&attid=0.1&permmsgid=msg-f:1809822134048681501&th=191dc7a45e9c6e1d&view=fimg&fur=ip&sz=s0-l75-ft&attbid=ANGjdJ-VklwvAKqYjI7dE-avrHt7dr2dx7fAVeTMXEksJ4aYUdbbs9f6iYTvurVIXhxHVK4LcAqmPQIZ5X5D6XLHkydr9FBEGV6O0DOZQzr-DIQ7hkm95vfDmd5sQS4&disp=emb|width=1200,height=70!",N'GBRA MOYE BERNICE DORIS,MONSIEUR ADOU,EGBV,,Appel Téléphonique,Finance,Comptabilité Générale,Requêtes,Non renseigné,OBC Customer Support,Priorité 2,Terminé(e),2024-09-11 08:50,12/9/2024 15:16,2024-09-12 15:16,
OBCS-6737,OD-1997,Faire la mise à jour des fiches articles en associant le magasin et l'emplacement,Faire la mise à jour des fiches articles en associant le magasin et l'emplacement,JOEL SIE,,EDIPRESSE,,Constat Interne,Opérations,Gestion de stock,Bug,Autres,OBC Customer Support,Priorité 1,En cours,2024-09-09 19:40,9/9/2024 20:18,,
OBCS-6738,OD-1998,Faire la mise à jour du fichier import des articles en ajoutant la colonne emplacement,Faire la mise à jour du fichier import des articles en ajoutant la colonne emplacement,JOEL SIE,,EDIPRESSE,,Constat Interne,Opérations,Gestion de stock,Requêtes,Non renseigné,OBC Customer Support,Priorité 1,En cours,2024-09-09 19:43,9/9/2024 20:16,,
OBCS-6672,OD-1993,Avoir la possibilité d'envoyer un mail en cliquant sur le mail du contact,Avoir la possibilité d'envoyer un mail en cliquant sur le mail du contact,EVA BASSE,FABIEN VATI,ONPOINT,,En présentiel,CRM,Activités commerciales,Requêtes,Non renseigné,OBC Customer Support,Priorité 2,Terminé(e),2024-09-06 10:57,21/3/2025 11:10,2025-03-21 11:10,
OBCS-6671,OD-1992,"Ajouter ""n'a pas repondu"" , ""a repondu"" (ajouter deux checkbox lorsqu'on sélectionne phoning et un bouton + pour le nombre d'appels pour chaque checkbox)","Ajouter ""n'a pas repondu"" , ""a repondu"" (ajouter deux checkbox lorsqu'on sélectionne phoning et un bouton + pour le nombre d'appels pour chaque checkbox)",EVA BASSE,FABIEN VATI,ONPOINT,,En présentiel,CRM,Activités commerciales,Requêtes,Non renseigné,OBC Customer Support,Priorité 2,Terminé(e),2024-09-06 10:56,9/9/2024 16:00,2024-09-09 16:00,
OBCS-6670,OD-1991,"Module RH/Paramétrage/Organigramme - Donner la possibilité à, l'utilisateur de modifier la position de ses départements","Rajouter au formulaire de création des départements un Numéro d’ordre qui permettra de donner une position exacte. 

En effet, la modification d’un organigramme devient un peut fastidieuse parce que la position des départements change après modification, Si la position importe peu c’est prenable sinon l’utilisateur se retrouve obligé de déplacer tous les blocs pour obtenir l’ordre souhaité.

!image-20240906-020208.png|width=1918,height=1078,alt=""image-20240906-020208.png""!",Edwige KOUASSI,,CILAGRI,,Constat Interne,RH,Paramétrage,Requêtes,Non renseigné,OBC Customer Support,Priorité 3,À faire,2024-09-06 02:09,6/9/2024 02:09,,
OBCS-6662,OD-1987,Empêcher la saisie de plusieurs stock initiaux pour le même article dans le même magasin. Il est aussi impossible de supprimer une ligne sur le bordereau du stock initial quand bien même qu'il n'est pas encore validé.,Empêcher la saisie de plusieurs stock initiaux pour le même article dans le même magasin. Il est aussi impossible de supprimer une ligne sur le bordereau du stock initial quand bien même qu'il n'est pas encore validé.,JOEL SIE,,EDIPRESSE,,Constat Interne,Opérations,Gestion de stock,Bug,Autres,OBC Customer Support,Priorité 1,Terminé(e),2024-09-04 19:21,9/9/2024 12:12,2024-09-09 12:12,
OBCS-6661,OD-1986,Liste des véhicules vide lors de création des flottes,"Bien que des véhicules soient créé, la Liste des véhicules vide lors de création des flottes",Edwige KOUASSI,Jonathan N'DOUBA,CIP,,"Online (Google Meet, Teams...)",Opérations,Parc Automobile,Bug,Non affichage de pages/données,OBC Customer Support,Priorité 1,En cours,2024-09-04 16:28,9/9/2024 14:43,,
OBCS-6660,OD-1985,Message d'Erreur ParcAuto Achat par Carte,"Message d'Erreur ParcAuto Achat par Carte

!image-20240904-162109.png|width=1918,height=1023,alt=""image-20240904-162109.png""!",Edwige KOUASSI,Jonathan N'DOUBA,CIP,,"Online (Google Meet, Teams...)",Opérations,Parc automobile,Bug,Page d'erreur,OBC Customer Support,Priorité 1,En cours,2024-09-04 16:25,9/9/2024 14:43,,
OBCS-6658,OD-1983,Un message d'erreur s'affiche lorsqu'on clique sur fichier du personnel ARIC.,"Un message d'erreur s'affiche lorsqu'on clique sur fichier du personnel ARIC. 

!Capture d’écran 2024-09-04 124921.png|width=976,height=342,alt=""Capture d’écran 2024-09-04 124921.png""!",JOEL SIE,,ARIC,,Constat Interne,RH,Gestion employé,Bug,Autres,OBC Customer Support,Priorité 1,Terminé(e),2024-09-04 12:46,19/9/2024 19:10,2024-09-19 19:10,
OBCS-6655,OD-1980,Un message d'erreur s'affiche lorsqu'on clique sur journal général.,Un message d'erreur s'affiche lorsqu'on clique sur journal général.,JOEL SIE,,ARIC,,Constat Interne,Finance,Comptabilité Générale,Bug,Autres,OBC Customer Support,Priorité 1,Terminé(e),2024-09-03 10:02,4/9/2024 10:43,2024-09-04 10:43,
OBCS-6653,OD-1978,Un bulletin de salaire s'affiche avec le salaire net zéro pour un salarié qui ne fait pas partir de la paie du mois concerné.,Un bulletin de salaire s'affiche avec le salaire net zéro pour un salarié qui ne fait pas partir de la paie du mois concerné.,JOEL SIE,Ousseyni Oumarou,EJARA,,Appel Téléphonique,RH,Documents,Bug,Autres,OBC Customer Support,Priorité 1,Terminé(e),2024-09-03 09:53,4/9/2024 16:30,2024-09-04 16:30,
OBCS-6639,OD-1972,Un message d'erreur s'affiche à l'édition d'un accès utilisateur.,"Un message d'erreur s'affiche à l'édition d'un accès utilisateur.

!Capture d’écran 2024-09-02 101918.png|width=991,height=400,alt=""Capture d’écran 2024-09-02 101918.png""!",JOEL SIE,KALOGO Nabarakissa,S-TEL,,Appel Téléphonique,Support,Administration Système,Bug,Autres,OBC Customer Support,Priorité 1,Terminé(e),2024-09-02 10:16,4/9/2024 10:24,2024-09-04 10:24,
OBCS-6648,OD-1977,"Dans le processus de Paie des journalier, prendre en compte d'autre rubrique tel que : congés mensuel, gratification ....","Dans le processus de Paie des journaliers, prendre en compte d'autre rubrique tel que : congés journalier, gratification jour, prime ….

Et générer des bulletin avec le détail de la paie.



[^BULLETINS AVRIL 2024 - Copie (1).xls]

",Edwige KOUASSI,OURAGA Edwige,CIP,,Appel Téléphonique,RH,Gestion employé,Requêtes,Non renseigné,OBC Customer Support,Priorité 1,En cours,2024-09-02 14:45,30/12/2024 15:21,,
OBCS-6625,OD-1971,"Impossible d'enregistrer un bon de livraison : Bien que le bon de commande soit validée, il ne se déverse pas au moment de faire le bon de livraison","Impossible d'enregistrer un bon de livraison : Bien que le bon de commande soit validée, il ne se déverse pas au moment de faire le bon de livraison",Vivien DAKPOGAN,Bénédicte ZONTODJI,KORI TRANSPORT,,Appel Téléphonique,Opérations,Achat,Bug,Non affichage de pages/données,OBC Customer Support,Priorité 1,Terminé(e),2024-08-31 17:43,3/9/2024 09:02,2024-09-03 09:02,
OBCS-6599,OD-1970,Les catégories de sous-projets ne se déverse pas en fonction de l'entité selectionnée,"Les catégories de sous-projets ne se déverse pas en fonction de l'entité selectionnée

!image-20240830-122817.png|width=1464,height=705,alt=""image-20240830-122817.png""!



!image-20240830-122906.png|width=1468,height=695,alt=""image-20240830-122906.png""!",EVA BASSE,,KOFFI & DIABATE,,En présentiel,Projets,Gérer mes projets,Bug,Mauvais déversement des données,OBC Customer Support,Priorité 2,Terminé(e),2024-08-30 12:29,1/9/2024 17:47,2024-09-01 17:47,
OBCS-7040,OD-2058,"ajouter dans la colonne ""action"" du paramétrage de paie OHADA l'activation et la désactivation de CALCULER AU PRORATA","ajouter dans la colonne action du paramétrage de paie OHADA l'activation et la désactivation de CALCULER AU PRORATA

Faire pareil que le bouton activation et désactivation dans la colonne action qui permet de ne plus aller modifier chaque rubrique.

!image-20240930-181114.png|width=1262,height=714,alt=""image-20240930-181114.png""!",N'GBRA MOYE BERNICE DORIS,Jean-Claude SAMPENNIE,S-TEL,,Appel Téléphonique,RH,Paramétrage,Requêtes,Non renseigné,OBC Customer Support,Priorité 1,Terminé(e),2024-09-30 18:13,26/12/2024 08:44,2024-12-26 08:44,
OBCS-6593,OD-1967,Filtrer sur les clients à rappeler,Filtrer sur les clients à rappeler,EVA BASSE,FABIEN VATI,ONPOINT,Team commercial,En présentiel,CRM,Activités commerciales,Requêtes,Non renseigné,OBC Customer Support,Priorité 3,Terminé(e),2024-08-29 10:25,10/1/2025 10:51,2025-01-10 10:51,
OBCS-6592,OD-1966,Identifier les clients à rappeler et marquer la date et l’heure de rappel,Identifier les clients à rappeler et marquer la date et l’heure de rappel,EVA BASSE,FABIEN VATI,ONPOINT,Team commercial,En présentiel,CRM,Activités commerciales,Requêtes,Non renseigné,OBC Customer Support,Priorité 3,Terminé(e),2024-08-29 10:25,24/12/2024 09:37,2024-12-24 09:37,
OBCS-6590,OD-1964,Rendre paramétrable les champs du formulaire de création d'un nouveau contact,Rendre paramétrable les champs du formulaire de création d'un nouveau contact,EVA BASSE,FABIEN VATI,ONPOINT,Team commercial,En présentiel,CRM,Activités commerciales,Requêtes,Non renseigné,OBC Customer Support,Priorité 3,À faire,2024-08-29 10:24,29/8/2024 10:24,,
OBCS-6589,OD-1963,Simplifier l'ergonomie (mise en page) de l'historique des contacts,Simplifier l'ergonomie (mise en page) de l'historique des contacts,EVA BASSE,FABIEN VATI,ONPOINT,Team commercial,En présentiel,CRM,Activités commerciales,Requêtes,Non renseigné,OBC Customer Support,Priorité 3,Terminé(e),2024-08-29 10:24,1/9/2024 17:43,2024-09-01 17:43,
OBCS-6588,OD-1962,Rendre paramétrable les champs du formulaire de création d'un nouveau prospect,Rendre paramétrable les champs du formulaire de création d'un nouveau prospect,EVA BASSE,FABIEN VATI,ONPOINT,Team commercial,En présentiel,CRM,Activités commerciales,Requêtes,Non renseigné,OBC Customer Support,Priorité 3,À faire,2024-08-29 10:24,29/8/2024 10:24,,
OBCS-6586,OD-1960,Ajouter une colonne fonction dans le champ interlocuteur dans le formulaire de création d'un prospect,Ajouter une colonne fonction dans le champ interlocuteur dans le formulaire de création d'un prospect,EVA BASSE,FABIEN VATI,ONPOINT,Team commercial,En présentiel,CRM,Activités commerciales,Requêtes,Non renseigné,OBC Customer Support,Priorité 3,Terminé(e),2024-08-29 10:23,15/1/2025 17:45,2025-01-15 17:45,
OBCS-6585,OD-1959,Corriger les doublons dans la liste des secteurs dans le champ Secteur d'activité dans le formulaire de création d'un prospect,Corriger les doublons dans la liste des secteurs dans le champ Secteur d'activité dans le formulaire de création d'un prospect,EVA BASSE,FABIEN VATI,ONPOINT,Team commercial,En présentiel,CRM,Activités commerciales,Requêtes,Non renseigné,OBC Customer Support,Priorité 3,Terminé(e),2024-08-29 10:22,20/1/2025 18:01,2025-01-20 18:01,
OBCS-6584,OD-1958,Mettre un espace entre taille de l'entreprise et source dans le formulaire de création d'un prospect,Mettre un espace entre taille de l'entreprise et source dans le formulaire de création d'un prospect,EVA BASSE,FABIEN VATI,ONPOINT,Team commercial,En présentiel,CRM,Activités commerciales,Requêtes,Non renseigné,OBC Customer Support,Priorité 3,Terminé(e),2024-08-29 10:22,2/9/2024 09:25,2024-09-02 09:25,
OBCS-6582,OD-1956,"Agrandir l'espace d'enregistrement des notes dans ""Activité Etape"" dans la gestion des opportunités","Agrandir l'espace d'enregistrement des notes dans ""Activité Etape"" dans la gestion des opportunités",EVA BASSE,FABIEN VATI,ONPOINT,Team commercial,En présentiel,CRM,Activités commerciales,Requêtes,Non renseigné,OBC Customer Support,Priorité 3,Terminé(e),2024-08-29 10:21,4/9/2024 10:22,2024-09-04 10:22,
OBCS-6581,OD-1955,"Ajouter ""Mailing"" dans le champ Type d'intéraction","Ajouter ""Mailing"" dans le champ Type d'intéraction",EVA BASSE,FABIEN VATI,ONPOINT,Team commercial,En présentiel,CRM,Activités commerciales,Requêtes,Non renseigné,OBC Customer Support,Priorité 3,Terminé(e),2024-08-29 10:21,29/8/2024 18:07,2024-08-29 18:07,
OBCS-6580,OD-1954,Ajouter une nouvelle note dans le formulaire de création d'une activité,|Ajouter une nouvelle note dans le formulaire de création d'une activité|,EVA BASSE,FABIEN VATI,ONPOINT,Team commercial,En présentiel,CRM,Activités commerciales,Requêtes,Non renseigné,OBC Customer Support,Priorité 3,Terminé(e),2024-08-29 10:21,11/10/2024 09:53,2024-10-11 09:53,
OBCS-6579,OD-1953,Enlever le champ Échéance lorsque Type d'activité n'est pas Tâches ni Evenement. Rendre le champ facultatif,|Enlever le champ Échéance lorsque Type d'activité n'est pas Tâches ni Evenement. Rendre le champ facultatif|,EVA BASSE,FABIEN VATI,ONPOINT,Team commercial,En présentiel,CRM,Activités commerciales,Requêtes,Non renseigné,OBC Customer Support,Priorité 3,Terminé(e),2024-08-29 10:20,4/9/2024 10:20,2024-09-04 10:20,
OBCS-6578,OD-1952,Enlever les champs Progrès et Priorité lorsque le Type d'activité n'est pas Tâches,|Enlever les champs Progrès et Priorité lorsque le Type d'activité n'est pas Tâches|,EVA BASSE,FABIEN VATI,ONPOINT,Team commercial,En présentiel,CRM,Activités commerciales,Requêtes,Non renseigné,OBC Customer Support,Priorité 3,Terminé(e),2024-08-29 10:20,29/8/2024 18:09,2024-08-29 18:09,
OBCS-6577,OD-1951,Enlever le champ quand activité est phoning,Enlever le champ quand activité est phoning,EVA BASSE,FABIEN VATI,ONPOINT,Team commercial,En présentiel,CRM,Activités commerciales,Requêtes,Non renseigné,OBC Customer Support,Priorité 3,Terminé(e),2024-08-29 10:20,29/8/2024 18:08,2024-08-29 18:08,
OBCS-6576,OD-1950,Supprimer le champ catégorie dans le formulaire de création d'une activité,Supprimer le champ catégorie dans le formulaire de création d'une activité,EVA BASSE,FABIEN VATI,ONPOINT,Team commercial,En présentiel,CRM,Activités commerciales,Requêtes,Non renseigné,OBC Customer Support,Priorité 3,Terminé(e),2024-08-29 10:19,1/9/2024 17:45,2024-09-01 17:45,
OBCS-6575,OD-1949,Lier le calendrier des activités/Tâches à son calendrier Google/Outlook…,Lier le calendrier des activités/Tâches à son calendrier Google/Outlook…,EVA BASSE,FABIEN VATI,ONPOINT,Team commercial,En présentiel,CRM,Paramétrage,Requêtes,Non renseigné,OBC Customer Support,Priorité 3,À faire,2024-08-29 10:19,29/8/2024 10:19,,
OBCS-6574,OD-1948,Donner la possibilité de voir la photo sur le formulaire de contact et dans la liste des contacts,Donner la possibilité de voir la photo sur le formulaire de contact et dans la liste des contacts,EVA BASSE,FABIEN VATI,ONPOINT,Team commercial,En présentiel,CRM,Paramétrage,Requêtes,Non renseigné,OBC Customer Support,Priorité 3,Terminé(e),2024-08-29 10:19,29/8/2024 17:52,2024-08-29 17:52,
OBCS-6573,OD-1947,"Enlever le champ ""TYPE"" dans le formulaire de création d'un nouveau contact","Enlever le champ ""TYPE"" dans le formulaire de création d'un nouveau contact",EVA BASSE,FABIEN VATI,ONPOINT,Team commercial,En présentiel,CRM,Paramétrage,Requêtes,Non renseigné,OBC Customer Support,Priorité 3,Terminé(e),2024-08-29 10:18,29/8/2024 17:51,2024-08-29 17:51,
OBCS-6572,OD-1946,Impossible d'enregistre un fichier du personnel - Message d'erreur,"Impossible d'enregistre un fichier du personnel - Message d'erreur

{noformat}ModelState pas valide. Données non enregistrées.

Veuillez vérifier les informations saisies.

The details_poste_comptable_id field is required.{noformat}

!image-20240828-171134.png|width=1918,height=912,alt=""image-20240828-171134.png""!



Liste des numéros de poste comptable vide

!image-20240828-171356.png|width=1642,height=851,alt=""image-20240828-171356.png""!",Edwige KOUASSI,EHUI Inesse,CILAGRI,,Appel Téléphonique,RH,Gestion employé,Bug,Enregistrement impossible,OBC Customer Support,Priorité 1,Terminé(e),2024-08-28 17:15,29/8/2024 18:12,2024-08-29 18:12,
OBCS-6571,OD-1945,Génération des rapports sur les Véhicules & flottes,Faire ressortir dans un rapport détaillé les dépense effectuées sur un véhicule ou un ensemble de véhicule (Flottes),Edwige KOUASSI,OURAGA Edwige,CIP,,Appel Téléphonique,Opérations,Parc automobile,Requêtes,Non renseigné,OBC Customer Support,Priorité 1,À faire,2024-08-28 17:06,28/8/2024 17:06,,
OBCS-6570,OD-1944,"A l'enregistrement d'une opération liée à la comptabilité, afficher systématiquement le numéro d'imputation à l'affichage du message ''enregistrement effectué avec succès''","A l'enregistrement d'une opération liée à la comptabilité, afficher systématiquement le numéro d'imputation à l'affichage du message ''enregistrement effectué avec succès''",JOEL SIE,Jean-Jacques LIKANE,LABOGEM,,En présentiel,Global,Global,Requêtes,Non renseigné,OBC Customer Support,Priorité 1,Terminé(e),2024-08-28 15:53,22/12/2024 16:27,2024-12-22 16:27,Global
OBCS-6569,OD-1943,Intégrer des sous totaux par faimille d'immobilisation à l'exportation du tableau d'amortissement.,Intégrer des sous totaux par faimille d'immobilisation à l'exportation du tableau d'amortissement.,JOEL SIE,Jean-Jacques LIKANE,LABOGEM,,En présentiel,Opérations,Immobilisations,Requêtes,Non renseigné,OBC Customer Support,Priorité 1,Terminé(e),2024-08-28 15:43,7/8/2025 16:51,2025-08-07 16:51,
OBCS-6565,OD-1940,Erreur Ajax lors de l'importation de prospects dans le CRM,Un message d’erreur s’affiche à la fin du processus d’importation de prospects. Lors de l’enregistrement des prospects importés via le fichier csv.,CHARLEY KOUAME,,ONPOINT,,Constat Interne,CRM,Client,Bug,Erreur Ajax,OBC Customer Support,Priorité 1,Terminé(e),2024-08-26 19:14,4/9/2024 16:41,2024-09-04 16:41,
OBCS-6564,OD-1939,Créer la fonctionnalité import pour le stock initial.,Créer la fonctionnalité import pour le stock initial.,JOEL SIE,YAO épouse KOSSONOU N'Guessan Esterne Nattacha,EDIPRESSE,,Appel Téléphonique,Opérations,Gestion de stock,Requêtes,Non renseigné,OBC Customer Support,Priorité 1,Terminé(e),2024-08-26 17:24,6/8/2025 17:01,2025-07-17 16:40,
OBCS-6511,OD-1935,Un message d'erreur apparait lors de la programmation de salaire,Un message d'erreur apparait lors de la programmation de salaire,N'GBRA MOYE BERNICE DORIS,SERGE ARIKO,CSCTICAO,,En présentiel,RH,Salaire,Bug,Page d'erreur,OBC Customer Support,Priorité 1,Terminé(e),2024-08-22 17:01,15/9/2024 08:51,2024-09-15 08:51,
OBCS-6494,OD-1923,Message d'erreur - Affichage fichier du personnel,"Un message d’erreur s’affiche lorsqu’on clique sur la fonctionnalité fichier du personnel



!image-20240819-180543.png|width=1534,height=824,alt=""image-20240819-180543.png""!",Edwige KOUASSI,,CIP,,Constat Interne,RH,Gestion employé,Bug,Page d'erreur,OBC Customer Support,Priorité 1,Terminé(e),2024-08-19 18:06,30/8/2024 10:20,2024-08-30 10:20,
OBCS-6492,OD-1921,Absence de données pointage,"Après avoir supprimé les pointages pour les reprendre.

En actualisant je me suis rendu compte que la semaine 28 avait disparu. Et dans le détail du pointage tous les employés ne sont pas pris en compte",Edwige KOUASSI,,CIP,,Constat Interne,RH,Salaire,Bug,Dysfonctionnement sur le Calcul des salaires,OBC Customer Support,Priorité 1,Terminé(e),2024-08-19 13:33,20/8/2024 09:21,2024-08-20 09:21,
OBCS-6491,OD-1920,Dysfonctionnement Pointage journalier,"Dans l’historique des  pointages de la semaine 27 par exemple, pour les 5 jours, tous les employés on travaillé 8H / Jour en principe le total devrait être égale à 40H. Mais dans notre cas le total d’heure est égale à 20H.

Voir la capture ci-après : 

!image-20240819-130942.png|width=332,height=322,alt=""image-20240819-130942.png""!",Edwige KOUASSI,,CIP,,Constat Interne,RH,Salaire,Bug,Dysfonctionnement sur le Calcul des salaires,OBC Customer Support,Priorité 1,Terminé(e),2024-08-19 13:22,29/8/2024 09:12,2024-08-20 09:21,
OBCS-6441,OD-1915,Liaison de plusieurs factures à un bon de commande impossible !,Liaison de plusieurs factures à un bon de commande impossible,Edwige KOUASSI,EMMANUEL KOUKPOLOU,KOFFI & DIABATE,,Appel WhatsApp,Opérations,Achat,Bug,Enregistrement impossible,OBC Customer Support,Priorité 1,Terminé(e),2024-08-16 10:42,13/9/2024 09:44,2024-09-13 09:44,
OBCS-6440,OD-1914,Mauvais déversement de la liste des employés lors du staffing,"Lors de l'enregistrement du staffing, bien qu’une seul catégorie d’employé soit sélectionné, toute la liste des employés se déversent

Dans ce cas de figure, bien que les journaliers soit sélectionnés la liste de tous les employés de l’entreprise se déverse



!image-20240816-094029.png|width=1911,height=968,alt=""image-20240816-094029.png""!",Edwige KOUASSI,,CIP,,Constat Interne,Projets,Gérer mes projets,Bug,Mauvais déversement des données,OBC Customer Support,Priorité 1,Terminé(e),2024-08-16 09:40,30/8/2024 10:20,2024-08-30 10:20,
OBCS-6439,OD-1912,Suppression pointage Impossible,Suppression pointage Impossible,Edwige KOUASSI,,CIP,,Constat Interne,RH,Gestion employé,Bug,Suppression impossible,OBC Customer Support,Priorité 1,Terminé(e),2024-08-14 19:04,30/8/2024 10:20,2024-08-30 10:20,
OBCS-6433,OD-1908,Un message d'erreur s'affiche à l'enregistrement d'une programmation de règlement de facture fournisseur,Un message d'erreur s'affiche à l'enregistrement d'une programmation de règlement de facture fournisseur,JOEL SIE,Mme SOPPI,EJARA,,Chat WhatsApp,Opérations,Achat,Bug,Autres,OBC Customer Support,Priorité 1,Terminé(e),2024-08-14 09:50,14/8/2024 18:38,2024-08-14 18:38,
OBCS-6430,OD-1907,Temps de chargement de données long,"Lors du calcul de la paie on constate une lenteur avant le chargement des variable.

*Bien qu’un seul département soit sélectionné pour le calcul de la paie, nous constatons que tous les employés se déversent dans la liste pour la définition des variables.*",Edwige KOUASSI,,CILAGRI,,En présentiel,RH,Salaire,Bug,Lenteur Système,OBC Customer Support,Priorité 1,Terminé(e),2024-08-14 03:38,30/8/2024 10:21,2024-08-30 10:21,
OBCS-6436,OD-1911,Importer le modèle d'ordre de virement en Vrac,"Donner la possibilité d'importer le modèle d'ordre de virement en vrac, bien que le format actuel soit exploitable 

Il demandera des traitements supplémentaire à l’utilisateur.

Donner la possibilité d’exporter en Vrac de sorte a limiter les traitements externe.



* *_Le Modèle Actuel à toutes les données récupérées à l’exception de la mise en forme._*



!image-20240814-185010.png|width=1366,height=681,alt=""Modèle Ovirement OBC.png""!

*Modèle Ordre de Virement OBC*



!image-20240814-185243.png|width=1462,height=623,alt=""image-20240814-185243.png""!

*Modèle Ordre de Banque*",Edwige KOUASSI,,CILAGRI,,Constat Interne,Paiement,Centre de paiement,Requêtes,Non renseigné,OBC Customer Support,Priorité 1,En cours,2024-08-14 18:37,17/8/2024 16:55,,
OBCS-6435,OD-1910,Donner la possibilité de sélectionner plusieurs employés pour l'ordre de virement,"Donner la possibilité de sélectionner plusieurs employés lors de l’exécution de règlement, la sélection unique n’est pas pratique quand l’utilisateurs à plusieurs employés pour qui l’ordre de virement doit être édité.



!20240814-1315-35.8590155.mp4|width=1908,height=1080,alt=""20240814-1315-35.8590155.mp4""!",Edwige KOUASSI,,CILAGRI,,En présentiel,Global,Global,Requêtes,Non renseigné,OBC Customer Support,Priorité 1,Terminé(e),2024-08-14 13:20,16/8/2024 10:46,2024-08-16 10:46,Global
OBCS-6509,OD-1933,Impossible d'extraire les Timesheet,Impossible d’extraire les TimeSheet des journaliers,Edwige KOUASSI,Ursula YANGANGOUSSOU,ONPOINT,,En présentiel,Projets,Gérer mes projets,Bug,Export de données impossible,OBC Customer Support,Priorité 1,En cours,2024-08-22 13:00,22/8/2024 16:24,,
OBCS-6429,OD-1906,L'article amorti et ou au rebus n'apparait plus dans le tableau d'amortissement,L'article amorti et ou au rebus n'apparait plus dans le tableau d'amortissement,N'GBRA MOYE BERNICE DORIS,Jean-Claude SAMPENNIE,S-TEL,,Appel Téléphonique,Opérations,Immobilisations,Bug,Mauvais déversement des données,OBC Customer Support,Priorité 1,Terminé(e),2024-08-13 16:26,17/10/2024 20:24,2024-10-17 20:24,
OBCS-6425,OD-1900,Impossible de modifier et de supprimer une affectation,Impossible de modifier une affectation,Edwige KOUASSI,,CIP,,Constat Interne,RH,Gestion employé,Bug,Suppression impossible,OBC Customer Support,Priorité 1,Terminé(e),2024-08-12 18:55,30/8/2024 10:21,2024-08-30 10:21,
OBCS-6424,OD-1899,Duplication Type staffing,Duplication Type staffing,Edwige KOUASSI,,CIP,,Constat Interne,Projets,Gérer mes projets,Bug,Duplication anormale,OBC Customer Support,Priorité 1,Terminé(e),2024-08-12 18:05,30/8/2024 10:21,2024-08-30 10:21,
OBCS-6423,OD-1898,"Le prix unitaire récupéré pour les articles à afficher dans l'analytique ""Audit projet (état stock)"" est différent du récapitulatif du suivi de stock dans le module opérations gestion de stock","Le prix unitaire récupéré pour les articles à afficher dans l'analytique ""*Audit projet (état stock)*"" est différent du récapitulatif du suivi de stock dans le module “*Opérations (gestion de stock)*”",N'GBRA MOYE BERNICE DORIS,KALOGO Nabarakissa,S-TEL,,Appel Téléphonique,Opérations,Gestion de stock,Bug,Mauvais déversement des données,OBC Customer Support,Priorité 1,Terminé(e),2024-08-12 17:28,2/10/2024 10:52,2024-10-02 10:52,
OBCS-6418,OD-1893,Type pipeline à lier à OACI,Type pipeline à lier à OACI,N'GBRA MOYE BERNICE DORIS,MADAME ALAO,ONPOINT,,Appel Téléphonique,CRM,Paramétrage,Bug,Mauvais déversement des données,OBC Customer Support,Priorité 1,Terminé(e),2024-08-12 17:03,13/8/2024 09:31,2024-08-13 09:31,
OBCS-6415,OD-1892,Lenteur édition et enregistrement absence,Lenteur constatée à l'édition et à l'enregistrement d’une absence,Edwige KOUASSI,Ursula YANGANGOUSSOU,ONPOINT,,En présentiel,RH,Gestion employé,Bug,Lenteur Système,OBC Customer Support,Priorité 1,Terminé(e),2024-08-12 10:31,26/8/2024 06:51,2024-08-26 06:51,
OBCS-6455,OD-1918,Donner la possibilité de calculer la paie pour un et un seul employé.,"Dans les filtres de la paie, rajouter le champ employé afin de permettre à l'utilisateur de calculer la paie pour un employé en fonction du département sélectionné.",Edwige KOUASSI,Léa DIABATE,CILAGRI,,Appel Téléphonique,RH,Salaire,Requêtes,Non renseigné,OBC Customer Support,Priorité 1,En cours,2024-08-16 16:36,22/8/2024 16:46,,
OBCS-6422,OD-1897,"A l'enregistrement d'une opportunité, alerter sur la non définition des étapes d'un type de pipeline","A l'enregistrement d'une opportunité, alerter sur la non définition des étapes d'un type de pipeline",N'GBRA MOYE BERNICE DORIS,MADAME ALAO,ONPOINT,,En présentiel,CRM,Activités commerciales,Requêtes,Non renseigné,OBC Customer Support,Priorité 1,Terminé(e),2024-08-12 17:10,13/8/2024 09:32,2024-08-13 09:32,
OBCS-6421,OD-1896,Un séparateur de milliers à mettre dans les fonctionnalités avec des montants à renseigner et/ou à récupérer,"Un séparateur de milliers à mettre dans les fonctionnalités avec des montants à renseigner et/ou à récupérer 

Exemple:

 Offre = 20000000 plutôt mettre {color:#ff5630}*20.000.000*{color}",N'GBRA MOYE BERNICE DORIS,MADAME ALAO,ONPOINT,,En présentiel,CRM,Activités commerciales,Requêtes,Non renseigné,OBC Customer Support,Priorité 1,Terminé(e),2024-08-12 17:08,19/1/2025 16:08,2025-01-19 16:08,
OBCS-6420,OD-1895,Changer l'emplacement de l'entité et du type pipeline,Changer l'emplacement de l'entité et du type pipeline,N'GBRA MOYE BERNICE DORIS,MADAME ALAO,ONPOINT,,En présentiel,CRM,Activités commerciales,Requêtes,Non renseigné,OBC Customer Support,Priorité 1,Terminé(e),2024-08-12 17:05,13/8/2024 09:32,2024-08-13 09:32,
OBCS-6419,OD-1894,Filtrer par entité au niveau de l'historique et du formulaire de création,Filtrer par entité au niveau de l'historique et du formulaire de création,N'GBRA MOYE BERNICE DORIS,MADAME ALAO,ONPOINT,,En présentiel,CRM,Activités commerciales,Requêtes,Non renseigné,OBC Customer Support,Priorité 1,Terminé(e),2024-08-12 17:05,13/8/2024 09:31,2024-08-13 09:31,
OBCS-6412,OD-1891,Mauvais Affichage quand on clique sur le bouton fermer,"Mauvais Affichage quand on clique sur le bouton fermer

!image-20240810-223753.png|width=1918,height=911,alt=""image-20240810-223753.png""!",Edwige KOUASSI,,CIP,,Constat Interne,RH,Feuille de temps,Bug,Autres,OBC Customer Support,Priorité 1,Terminé(e),2024-08-10 22:40,30/8/2024 10:21,2024-08-30 10:21,
OBCS-6378,OD-1890,La prime d'ancienneté n'est pas calculé sur la paie du mois de Juillet. Alors qu'il avait été calculé en Juin,La prime d'ancienneté n'est pas calculé sur la paie du mois de Juillet. Alors qu'il avait été calculé en Juin,JOEL SIE,Ousseyni Oumarou,EJARA,,Appel Téléphonique,RH,Salaire,Bug,Autres,OBC Customer Support,Priorité 1,Terminé(e),2024-08-09 17:10,13/8/2024 09:31,2024-08-13 09:31,
OBCS-6377,OD-1887,Lorsqu’on modifie une facture on constate la mise à jour des écritures dans l’historique des imputations. Par contre l’ancienne écriture demeure sur le grand livre en plus de la modification.,Lorsqu’on modifie une facture on constate la mise à jour des écritures dans l’historique des imputations. Par contre l’ancienne écriture demeure sur le grand livre en plus de la modification.,JOEL SIE,Jean-Jacques LIKANE,LABOGEM,,Appel Téléphonique,Finance,Comptabilité Générale,Bug,Autres,OBC Customer Support,Priorité 1,Terminé(e),2024-08-08 17:39,14/8/2024 09:53,2024-08-14 09:53,
OBCS-6376,OD-1886,"Page d'erreur lors du chargement de la fonctionnalité ""Gestion des tâches""","Page d'erreur lors du chargement de la fonctionnalité ""Gestion des tâches""",N'GBRA MOYE BERNICE DORIS,Amary TCHOTCHE,EGBV,,"Online (Google Meet, Teams...)",Projets,Gérer mes tâches,Bug,Page d'erreur,OBC Customer Support,Priorité 1,Terminé(e),2024-08-08 17:36,12/8/2024 15:08,2024-08-09 10:02,
OBCS-6375,OD-1885,Edition de contrat Impossible,Edition de contrat Impossible,Edwige KOUASSI,,CSCTICAO,,En présentiel,RH,Gestion employé,Bug,Edition impossible,OBC Customer Support,Priorité 1,Terminé(e),2024-08-08 17:07,9/8/2024 09:57,2024-08-09 09:57,
OBCS-6371,OD-1882,"Champ renseigné vide à l'édition dans ""contrats des journaliers""","Lors de l'édition d’un contrat journalier, le champ poste employé est vide.

Cependant en historique les postes sont bien visible.

Les postes utilisés sont bien créé et présent dans les paramétrages RH.",Edwige KOUASSI,,CIP,,Constat Interne,RH,Gestion employé,Bug,Récupération de données impossible,OBC Customer Support,Priorité 1,Terminé(e),2024-08-08 11:05,9/8/2024 11:16,2024-08-09 11:16,
OBCS-6370,OD-1881,Aucune donnée enregistrée dans l'historique des heures travaillées des journaliers,Aucune donnée dans l'historique lors de l'enregistrement les heures travaillées des journaliers,Edwige KOUASSI,,CIP,,Constat Interne,RH,Feuille de temps,Bug,Historique vide/non exhaustif,OBC Customer Support,Priorité 1,Terminé(e),2024-08-08 10:57,9/8/2024 11:12,2024-08-09 11:12,
OBCS-6372,OD-1883,Possibilité de faire un filtre sur les paiements en attente par entité lorsque plusieurs entités sont activées.,Possibilité de faire un filtre sur les paiements en attente par entité lorsque plusieurs entités sont activées.,JOEL SIE,Ousseyni Oumarou,EJARA,,E-mail,Paiement,Centre de paiement,Requêtes,Non renseigné,OBC Customer Support,Priorité 2,Terminé(e),2024-08-08 11:46,16/8/2024 10:45,2024-08-16 10:45,Exécuter un paiement
OBCS-6368,OD-1880,Lenteur lors de l'édition d'une expression de besoin,"Lenteur lors de l'édition d'une expression de besoin

Délai d'édition 2 à 3 minutes pour une expression de 30 lignes",Edwige KOUASSI,EMMANUEL KOUKPOLOU,KOFFI & DIABATE,,"Online (Google Meet, Teams...)",Opérations,Achat,Bug,Lenteur Système,OBC Customer Support,Priorité 1,Terminé(e),2024-08-06 15:42,14/8/2024 09:54,2024-08-14 09:54,
OBCS-6363,OD-1878,A l'édition d'un livre de paie sur plusieurs mois RICF est multiplié par le nombre de mois sans tenir compte des mois auquels le salarié a été considéré dans la paie.,A l'édition d'un livre de paie sur plusieurs mois RICF est multiplié par le nombre de mois sans tenir compte des mois auquels le salarié a été considéré dans la paie.,JOEL SIE,Ousseyni Oumarou,EJARA,,Appel Téléphonique,RH,Documents,Bug,Autres,OBC Customer Support,Priorité 1,Terminé(e),2024-08-06 08:41,3/9/2024 09:42,2024-09-03 09:42,
OBCS-6367,OD-1879,Intégration de modèle d'ordre de virement,"Pour les ordres de virements, intégrer le modèle communiquer par la banque.

{adf:display=block}
{""type"":""table"",""attrs"":{""isNumberColumnEnabled"":false,""layout"":""default"",""localId"":""45e3bd7a-43ca-4699-bdb8-572fd4834888""},""content"":[{""type"":""tableRow"",""content"":[{""type"":""tableCell"",""attrs"":{},""content"":[{""type"":""paragraph"",""content"":[{""type"":""text"",""text"":""NOM DU DONNEUR D'ORDRE""}]}]},{""type"":""tableCell"",""attrs"":{},""content"":[{""type"":""paragraph"",""content"":[{""type"":""text"",""text"":""CILAGRI CAJOU""}]}]},{""type"":""tableCell"",""attrs"":{},""content"":[{""type"":""paragraph"",""content"":[]}]},{""type"":""tableCell"",""attrs"":{},""content"":[{""type"":""mediaSingle"",""attrs"":{""layout"":""center""},""content"":[{""type"":""media"",""attrs"":{""type"":""external"",""alt"":""GENERER"",""url"":""file:///C:/Users/datko/AppData/Local/Temp/msohtmlclip1/01/clip_image001.png""}}]}]},{""type"":""tableCell"",""attrs"":{},""content"":[{""type"":""paragraph"",""content"":[]}]}]},{""type"":""tableRow"",""content"":[{""type"":""tableCell"",""attrs"":{},""content"":[{""type"":""paragraph"",""content"":[{""type"":""text"",""text"":""RIB DU DONNEUR D'ORDRE""}]}]},{""type"":""tableCell"",""attrs"":{},""content"":[{""type"":""paragraph"",""content"":[{""type"":""text"",""text"":""CI2110100100010021656368""}]}]},{""type"":""tableCell"",""attrs"":{},""content"":[{""type"":""paragraph"",""content"":[]}]},{""type"":""tableCell"",""attrs"":{},""content"":[{""type"":""paragraph"",""content"":[]}]},{""type"":""tableCell"",""attrs"":{},""content"":[{""type"":""paragraph"",""content"":[]}]}]},{""type"":""tableRow"",""content"":[{""type"":""tableCell"",""attrs"":{},""content"":[{""type"":""paragraph"",""content"":[{""type"":""text"",""text"":""TOTAL DES VIREMENTS""}]}]},{""type"":""tableCell"",""attrs"":{},""content"":[{""type"":""paragraph"",""content"":[{""type"":""text"",""text"":""                                                                             25 817 500,00  ""}]}]},{""type"":""tableCell"",""attrs"":{},""content"":[{""type"":""paragraph"",""content"":[]}]},{""type"":""tableCell"",""attrs"":{},""content"":[{""type"":""paragraph"",""content"":[]}]},{""type"":""tableCell"",""attrs"":{},""content"":[{""type"":""paragraph"",""content"":[]}]}]},{""type"":""tableRow"",""content"":[{""type"":""tableCell"",""attrs"":{},""content"":[{""type"":""paragraph"",""content"":[{""type"":""text"",""text"":""MOTIF DU DONNEUR D'ODRE""}]}]},{""type"":""tableCell"",""attrs"":{},""content"":[{""type"":""paragraph"",""content"":[{""type"":""text"",""text"":"" ""}]}]},{""type"":""tableCell"",""attrs"":{""colspan"":3},""content"":[{""type"":""paragraph"",""content"":[{""type"":""text"",""text"":""Par le débit de notre compte N°CI2110100100010021656368, nous vous prions d'effectuer le/les virement(s) ci-dessous libellé(s):""}]}]}]},{""type"":""tableRow"",""content"":[{""type"":""tableCell"",""attrs"":{},""content"":[{""type"":""paragraph"",""content"":[]}]},{""type"":""tableCell"",""attrs"":{},""content"":[{""type"":""paragraph"",""content"":[]}]},{""type"":""tableCell"",""attrs"":{},""content"":[{""type"":""paragraph"",""content"":[]}]},{""type"":""tableCell"",""attrs"":{},""content"":[{""type"":""paragraph"",""content"":[]}]},{""type"":""tableCell"",""attrs"":{},""content"":[{""type"":""paragraph"",""content"":[]}]}]},{""type"":""tableRow"",""content"":[{""type"":""tableCell"",""attrs"":{},""content"":[{""type"":""paragraph"",""content"":[{""type"":""text"",""text"":""RIB DU BENEFICIAIRE""}]}]},{""type"":""tableCell"",""attrs"":{},""content"":[{""type"":""paragraph"",""content"":[{""type"":""text"",""text"":""NOM BENEFICIAIRE""}]}]},{""type"":""tableCell"",""attrs"":{},""content"":[{""type"":""paragraph"",""content"":[{""type"":""text"",""text"":""MONTANT""}]}]},{""type"":""tableCell"",""attrs"":{},""content"":[{""type"":""paragraph"",""content"":[{""type"":""text"",""text"":""DEVISE DU VIREMENT""}]}]},{""type"":""tableCell"",""attrs"":{},""content"":[{""type"":""paragraph"",""content"":[{""type"":""text"",""text"":""MOTIF""}]}]}]},{""type"":""tableRow"",""content"":[{""type"":""tableCell"",""attrs"":{},""content"":[{""type"":""paragraph"",""content"":[{""type"":""text"",""text"":""CI0320200100451423000891""}]}]},{""type"":""tableCell"",""attrs"":{},""content"":[{""type"":""paragraph"",""content"":[{""type"":""text"",""text"":""KONAN ARMAND PATRICE""}]}]},{""type"":""tableCell"",""attrs"":{},""content"":[{""type"":""paragraph"",""content"":[{""type"":""text"",""text"":""800 000""}]}]},{""type"":""tableCell"",""attrs"":{},""content"":[{""type"":""paragraph"",""content"":[{""type"":""text"",""text"":""XOF""}]}]},{""type"":""tableCell"",""attrs"":{},""content"":[{""type"":""paragraph"",""content"":[{""type"":""text"",""text"":""SALAIRE AVRIL 2024""}]}]}]},{""type"":""tableRow"",""content"":[{""type"":""tableCell"",""attrs"":{},""content"":[{""type"":""paragraph"",""content"":[{""type"":""text"",""text"":""CI0320100500205427000049""}]}]},{""type"":""tableCell"",""attrs"":{},""content"":[{""type"":""paragraph"",""content"":[{""type"":""text"",""text"":""TSHE FORTUNE""}]}]},{""type"":""tableCell"",""attrs"":{},""content"":[{""type"":""paragraph"",""content"":[{""type"":""text"",""text"":""400 000""}]}]},{""type"":""tableCell"",""attrs"":{},""content"":[{""type"":""paragraph"",""content"":[{""type"":""text"",""text"":""XOF""}]}]},{""type"":""tableCell"",""attrs"":{},""content"":[{""type"":""paragraph"",""content"":[{""type"":""text"",""text"":""SALAIRE AVRIL 2024""}]}]}]},{""type"":""tableRow"",""content"":[{""type"":""tableCell"",""attrs"":{},""content"":[{""type"":""paragraph"",""content"":[{""type"":""text"",""text"":""CI0080112601264499851986""}]}]},{""type"":""tableCell"",""attrs"":{},""content"":[{""type"":""paragraph"",""content"":[{""type"":""text"",""text"":""KONATE SAKARIA""}]}]},{""type"":""tableCell"",""attrs"":{},""content"":[{""type"":""paragraph"",""content"":[{""type"":""text"",""text"":""465 000""}]}]},{""type"":""tableCell"",""attrs"":{},""content"":[{""type"":""paragraph"",""content"":[{""type"":""text"",""text"":""XOF""}]}]},{""type"":""tableCell"",""attrs"":{},""content"":[{""type"":""paragraph"",""content"":[{""type"":""text"",""text"":""SALAIRE AVRIL 2024""}]}]}]},{""type"":""tableRow"",""content"":[{""type"":""tableCell"",""attrs"":{},""content"":[{""type"":""paragraph"",""content"":[{""type"":""text"",""text"":""CI0420223202984110400172""}]}]},{""type"":""tableCell"",""attrs"":{},""content"":[{""type"":""paragraph"",""content"":[{""type"":""text"",""text"":""AZIAN HOUSSOU""}]}]},{""type"":""tableCell"",""attrs"":{},""content"":[{""type"":""paragraph"",""content"":[{""type"":""text"",""text"":""450 000""}]}]},{""type"":""tableCell"",""attrs"":{},""content"":[{""type"":""paragraph"",""content"":[{""type"":""text"",""text"":""XOF""}]}]},{""type"":""tableCell"",""attrs"":{},""content"":[{""type"":""paragraph"",""content"":[{""type"":""text"",""text"":""SALAIRE AVRIL 2024""}]}]}]},{""type"":""tableRow"",""content"":[{""type"":""tableCell"",""attrs"":{},""content"":[{""type"":""paragraph"",""content"":[{""type"":""text"",""text"":""CI0920101900956888000755""}]}]},{""type"":""tableCell"",""attrs"":{},""content"":[{""type"":""paragraph"",""content"":[{""type"":""text"",""text"":""BROU KOUAME PACOME""}]}]},{""type"":""tableCell"",""attrs"":{},""content"":[{""type"":""paragraph"",""content"":[{""type"":""text"",""text"":""300 000""}]}]},{""type"":""tableCell"",""attrs"":{},""content"":[{""type"":""paragraph"",""content"":[{""type"":""text"",""text"":""XOF""}]}]},{""type"":""tableCell"",""attrs"":{},""content"":[{""type"":""paragraph"",""content"":[{""type"":""text"",""text"":""SALAIRE AVRIL 2024""}]}]}]},{""type"":""tableRow"",""content"":[{""type"":""tableCell"",""attrs"":{},""content"":[{""type"":""paragraph"",""content"":[{""type"":""text"",""text"":""CI0080111601169082687361""}]}]},{""type"":""tableCell"",""attrs"":{},""content"":[{""type"":""paragraph"",""content"":[{""type"":""text"",""text"":""AIKPA ZOKO PACOME""}]}]},{""type"":""tableCell"",""attrs"":{},""content"":[{""type"":""paragraph"",""content"":[{""type"":""text"",""text"":""250 000""}]}]},{""type"":""tableCell"",""attrs"":{},""content"":[{""type"":""paragraph"",""content"":[{""type"":""text"",""text"":""XOF""}]}]},{""type"":""tableCell"",""attrs"":{},""content"":[{""type"":""paragraph"",""content"":[{""type"":""text"",""text"":""SALAIRE AVRIL 2024""}]}]}]},{""type"":""tableRow"",""content"":[{""type"":""tableCell"",""attrs"":{},""content"":[{""type"":""paragraph"",""content"":[{""type"":""text"",""text"":""CI0080111601169082707537""}]}]},{""type"":""tableCell"",""attrs"":{},""content"":[{""type"":""paragraph"",""content"":[{""type"":""text"",""text"":""THIAM YEDESS TIERNO""}]}]},{""type"":""tableCell"",""attrs"":{},""content"":[{""type"":""paragraph"",""content"":[{""type"":""text"",""text"":""250 000""}]}]},{""type"":""tableCell"",""attrs"":{},""content"":[{""type"":""paragraph"",""content"":[{""type"":""text"",""text"":""XOF""}]}]},{""type"":""tableCell"",""attrs"":{},""content"":[{""type"":""paragraph"",""content"":[{""type"":""text"",""text"":""SALAIRE AVRIL 2024""}]}]}]},{""type"":""tableRow"",""content"":[{""type"":""tableCell"",""attrs"":{},""content"":[{""type"":""paragraph"",""content"":[{""type"":""text"",""text"":""CI0080111601169080959403""}]}]},{""type"":""tableCell"",""attrs"":{},""content"":[{""type"":""paragraph"",""content"":[{""type"":""text"",""text"":""KOMENAN KOMENAN""}]}]},{""type"":""tableCell"",""attrs"":{},""content"":[{""type"":""paragraph"",""content"":[{""type"":""text"",""text"":""400 000""}]}]},{""type"":""tableCell"",""attrs"":{},""content"":[{""type"":""paragraph"",""content"":[{""type"":""text"",""text"":""XOF""}]}]},{""type"":""tableCell"",""attrs"":{},""content"":[{""type"":""paragraph"",""content"":[{""type"":""text"",""text"":""SALAIRE AVRIL 2024""}]}]}]},{""type"":""tableRow"",""content"":[{""type"":""tableCell"",""attrs"":{},""content"":[{""type"":""paragraph"",""content"":[{""type"":""text"",""text"":""CI0320100500205608000109""}]}]},{""type"":""tableCell"",""attrs"":{},""content"":[{""type"":""paragraph"",""content"":[{""type"":""text"",""text"":""DIOMANDE PIEGADE FERNAND""}]}]},{""type"":""tableCell"",""attrs"":{},""content"":[{""type"":""paragraph"",""content"":[{""type"":""text"",""text"":""250 000""}]}]},{""type"":""tableCell"",""attrs"":{},""content"":[{""type"":""paragraph"",""content"":[{""type"":""text"",""text"":""XOF""}]}]},{""type"":""tableCell"",""attrs"":{},""content"":[{""type"":""paragraph"",""content"":[{""type"":""text"",""text"":""SALAIRE AVRIL 2024""}]}]}]},{""type"":""tableRow"",""content"":[{""type"":""tableCell"",""attrs"":{},""content"":[{""type"":""paragraph"",""content"":[{""type"":""text"",""text"":""CI0420122906307900250149""}]}]},{""type"":""tableCell"",""attrs"":{},""content"":[{""type"":""paragraph"",""content"":[{""type"":""text"",""text"":""BAMBA ZOUMANA""}]}]},{""type"":""tableCell"",""attrs"":{},""content"":[{""type"":""paragraph"",""content"":[{""type"":""text"",""text"":""450 000""}]}]},{""type"":""tableCell"",""attrs"":{},""content"":[{""type"":""paragraph"",""content"":[{""type"":""text"",""text"":""XOF""}]}]},{""type"":""tableCell"",""attrs"":{},""content"":[{""type"":""paragraph"",""content"":[{""type"":""text"",""text"":""SALAIRE AVRIL 2024""}]}]}]},{""type"":""tableRow"",""content"":[{""type"":""tableCell"",""attrs"":{},""content"":[{""type"":""paragraph"",""content"":[{""type"":""text"",""text"":""CI0080111601169084415222""}]}]},{""type"":""tableCell"",""attrs"":{},""content"":[{""type"":""paragraph"",""content"":[{""type"":""text"",""text"":""DOUME CHANTAL""}]}]},{""type"":""tableCell"",""attrs"":{},""content"":[{""type"":""paragraph"",""content"":[{""type"":""text"",""text"":""220 000""}]}]},{""type"":""tableCell"",""attrs"":{},""content"":[{""type"":""paragraph"",""content"":[{""type"":""text"",""text"":""XOF""}]}]},{""type"":""tableCell"",""attrs"":{},""content"":[{""type"":""paragraph"",""content"":[{""type"":""text"",""text"":""SALAIRE AVRIL 2024""}]}]}]},{""type"":""tableRow"",""content"":[{""type"":""tableCell"",""attrs"":{},""content"":[{""type"":""paragraph"",""content"":[{""type"":""text"",""text"":""CI0080112601264492374741""}]}]},{""type"":""tableCell"",""attrs"":{},""content"":[{""type"":""paragraph"",""content"":[{""type"":""text"",""text"":""MADOU WASSIA SYLVIE HONORINE""}]}]},{""type"":""tableCell"",""attrs"":{},""content"":[{""type"":""paragraph"",""content"":[{""type"":""text"",""text"":""200 000""}]}]},{""type"":""tableCell"",""attrs"":{},""content"":[{""type"":""paragraph"",""content"":[{""type"":""text"",""text"":""XOF""}]}]},{""type"":""tableCell"",""attrs"":{},""content"":[{""type"":""paragraph"",""content"":[{""type"":""text"",""text"":""SALAIRE AVRIL 2024""}]}]}]},{""type"":""tableRow"",""content"":[{""type"":""tableCell"",""attrs"":{},""content"":[{""type"":""paragraph"",""content"":[{""type"":""text"",""text"":""CI0080112601264501619811""}]}]},{""type"":""tableCell"",""attrs"":{},""content"":[{""type"":""paragraph"",""content"":[{""type"":""text"",""text"":""N'GUESSAN KOUADIO SIMON""}]}]},{""type"":""tableCell"",""attrs"":{},""content"":[{""type"":""paragraph"",""content"":[{""type"":""text"",""text"":""225 000""}]}]},{""type"":""tableCell"",""attrs"":{},""content"":[{""type"":""paragraph"",""content"":[{""type"":""text"",""text"":""XOF""}]}]},{""type"":""tableCell"",""attrs"":{},""content"":[{""type"":""paragraph"",""content"":[{""type"":""text"",""text"":""SALAIRE AVRIL 2024""}]}]}]},{""type"":""tableRow"",""content"":[{""type"":""tableCell"",""attrs"":{},""content"":[{""type"":""paragraph"",""content"":[{""type"":""text"",""text"":""CI0070107390000383096073""}]}]},{""type"":""tableCell"",""attrs"":{},""content"":[{""type"":""paragraph"",""content"":[{""type"":""text"",""text"":""KACOU AYA EMMA CYNTHIA MIREILLE""}]}]},{""type"":""tableCell"",""attrs"":{},""content"":[{""type"":""paragraph"",""content"":[{""type"":""text"",""text"":""200 000""}]}]},{""type"":""tableCell"",""attrs"":{},""content"":[{""type"":""paragraph"",""content"":[{""type"":""text"",""text"":""XOF""}]}]},{""type"":""tableCell"",""attrs"":{},""content"":[{""type"":""paragraph"",""content"":[{""type"":""text"",""text"":""SALAIRE AVRIL 2024""}]}]}]},{""type"":""tableRow"",""content"":[{""type"":""tableCell"",""attrs"":{},""content"":[{""type"":""paragraph"",""content"":[{""type"":""text"",""text"":""CI0420122906524230250191""}]}]},{""type"":""tableCell"",""attrs"":{},""content"":[{""type"":""paragraph"",""content"":[{""type"":""text"",""text"":""KOFFI KONAN JEAN DIBY SERGE""}]}]},{""type"":""tableCell"",""attrs"":{},""content"":[{""type"":""paragraph"",""content"":[{""type"":""text"",""text"":""400 000""}]}]},{""type"":""tableCell"",""attrs"":{},""content"":[{""type"":""paragraph"",""content"":[{""type"":""text"",""text"":""XOF""}]}]},{""type"":""tableCell"",""attrs"":{},""content"":[{""type"":""paragraph"",""content"":[{""type"":""text"",""text"":""SALAIRE AVRIL 2024""}]}]}]},{""type"":""tableRow"",""content"":[{""type"":""tableCell"",""attrs"":{},""content"":[{""type"":""paragraph"",""content"":[{""type"":""text"",""text"":""CI0320200100451461001417""}]}]},{""type"":""tableCell"",""attrs"":{},""content"":[{""type"":""paragraph"",""content"":[{""type"":""text"",""text"":""N'GORAN KONAN ERIC""}]}]},{""type"":""tableCell"",""attrs"":{},""content"":[{""type"":""paragraph"",""content"":[{""type"":""text"",""text"":""350 000""}]}]},{""type"":""tableCell"",""attrs"":{},""content"":[{""type"":""paragraph"",""content"":[{""type"":""text"",""text"":""XOF""}]}]},{""type"":""tableCell"",""attrs"":{},""content"":[{""type"":""paragraph"",""content"":[{""type"":""text"",""text"":""SALAIRE AVRIL 2024""}]}]}]},{""type"":""tableRow"",""content"":[{""type"":""tableCell"",""attrs"":{},""content"":[{""type"":""paragraph"",""content"":[{""type"":""text"",""text"":""CI0320100500205796000077""}]}]},{""type"":""tableCell"",""attrs"":{},""content"":[{""type"":""paragraph"",""content"":[{""type"":""text"",""text"":""YAO ZAHOU MINGANDJOLE TOUSSAINT""}]}]},{""type"":""tableCell"",""attrs"":{},""content"":[{""type"":""paragraph"",""content"":[{""type"":""text"",""text"":""250 000""}]}]},{""type"":""tableCell"",""attrs"":{},""content"":[{""type"":""paragraph"",""content"":[{""type"":""text"",""text"":""XOF""}]}]},{""type"":""tableCell"",""attrs"":{},""content"":[{""type"":""paragraph"",""content"":[{""type"":""text"",""text"":""SALAIRE AVRIL 2024""}]}]}]},{""type"":""tableRow"",""content"":[{""type"":""tableCell"",""attrs"":{},""content"":[{""type"":""paragraph"",""content"":[{""type"":""text"",""text"":""CI0060173801043490007303""}]}]},{""type"":""tableCell"",""attrs"":{},""content"":[{""type"":""paragraph"",""content"":[{""type"":""text"",""text"":""TAHI N'GUESSAN ETCHI SERGE""}]}]},{""type"":""tableCell"",""attrs"":{},""content"":[{""type"":""paragraph"",""content"":[{""type"":""text"",""text"":""500 000""}]}]},{""type"":""tableCell"",""attrs"":{},""content"":[{""type"":""paragraph"",""content"":[{""type"":""text"",""text"":""XOF""}]}]},{""type"":""tableCell"",""attrs"":{},""content"":[{""type"":""paragraph"",""content"":[{""type"":""text"",""text"":""SALAIRE AVRIL 2024""}]}]}]},{""type"":""tableRow"",""content"":[{""type"":""tableCell"",""attrs"":{},""content"":[{""type"":""paragraph"",""content"":[{""type"":""text"",""text"":""CI0080112601264483856880""}]}]},{""type"":""tableCell"",""attrs"":{},""content"":[{""type"":""paragraph"",""content"":[{""type"":""text"",""text"":""DIABATE EPSE N'GUESSAN FERIMA LEA""}]}]},{""type"":""tableCell"",""attrs"":{},""content"":[{""type"":""paragraph"",""content"":[{""type"":""text"",""text"":""800 000""}]}]},{""type"":""tableCell"",""attrs"":{},""content"":[{""type"":""paragraph"",""content"":[{""type"":""text"",""text"":""XOF""}]}]},{""type"":""tableCell"",""attrs"":{},""content"":[{""type"":""paragraph"",""content"":[{""type"":""text"",""text"":""SALAIRE AVRIL 2024""}]}]}]},{""type"":""tableRow"",""content"":[{""type"":""tableCell"",""attrs"":{},""content"":[{""type"":""paragraph"",""content"":[{""type"":""text"",""text"":""CI0080108100814101383001""}]}]},{""type"":""tableCell"",""attrs"":{},""content"":[{""type"":""paragraph"",""content"":[{""type"":""text"",""text"":""KOUTOUA ADOUENI FIAN HERMAN""}]}]},{""type"":""tableCell"",""attrs"":{},""content"":[{""type"":""paragraph"",""content"":[{""type"":""text"",""text"":""100 000""}]}]},{""type"":""tableCell"",""attrs"":{},""content"":[{""type"":""paragraph"",""content"":[{""type"":""text"",""text"":""XOF""}]}]},{""type"":""tableCell"",""attrs"":{},""content"":[{""type"":""paragraph"",""content"":[{""type"":""text"",""text"":""SALAIRE AVRIL 2024""}]}]}]},{""type"":""tableRow"",""content"":[{""type"":""tableCell"",""attrs"":{},""content"":[{""type"":""paragraph"",""content"":[{""type"":""text"",""text"":""CI0080110101016471911775""}]}]},{""type"":""tableCell"",""attrs"":{},""content"":[{""type"":""paragraph"",""content"":[{""type"":""text"",""text"":""AKPATOU KOUAKOU GUY SERGE KEVIN""}]}]},{""type"":""tableCell"",""attrs"":{},""content"":[{""type"":""paragraph"",""content"":[{""type"":""text"",""text"":""200 000""}]}]},{""type"":""tableCell"",""attrs"":{},""content"":[{""type"":""paragraph"",""content"":[{""type"":""text"",""text"":""XOF""}]}]},{""type"":""tableCell"",""attrs"":{},""content"":[{""type"":""paragraph"",""content"":[{""type"":""text"",""text"":""SALAIRE AVRIL 2024""}]}]}]},{""type"":""tableRow"",""content"":[{""type"":""tableCell"",""attrs"":{},""content"":[{""type"":""paragraph"",""content"":[{""type"":""text"",""text"":""CI0080107500754054267415""}]}]},{""type"":""tableCell"",""attrs"":{},""content"":[{""type"":""paragraph"",""content"":[{""type"":""text"",""text"":"" NIAMOUTIE EPSE AMEMATEKPO AMA JENIFER CYNTHIA""}]}]},{""type"":""tableCell"",""attrs"":{},""content"":[{""type"":""paragraph"",""content"":[{""type"":""text"",""text"":""4 000 000""}]}]},{""type"":""tableCell"",""attrs"":{},""content"":[{""type"":""paragraph"",""content"":[{""type"":""text"",""text"":""XOF""}]}]},{""type"":""tableCell"",""attrs"":{},""content"":[{""type"":""paragraph"",""content"":[{""type"":""text"",""text"":""SALAIRE AVRIL 2024""}]}]}]},{""type"":""tableRow"",""content"":[{""type"":""tableCell"",""attrs"":{},""content"":[{""type"":""paragraph"",""content"":[{""type"":""text"",""text"":""CI0080112601264492405005""}]}]},{""type"":""tableCell"",""attrs"":{},""content"":[{""type"":""paragraph"",""content"":[{""type"":""text"",""text"":""NIAMOUTIE AMA EDITH NATACHA EPSE SERI""}]}]},{""type"":""tableCell"",""attrs"":{},""content"":[{""type"":""paragraph"",""content"":[{""type"":""text"",""text"":""1 000 000""}]}]},{""type"":""tableCell"",""attrs"":{},""content"":[{""type"":""paragraph"",""content"":[{""type"":""text"",""text"":""XOF""}]}]},{""type"":""tableCell"",""attrs"":{},""content"":[{""type"":""paragraph"",""content"":[{""type"":""text"",""text"":""SALAIRE AVRIL 2024""}]}]}]},{""type"":""tableRow"",""content"":[{""type"":""tableCell"",""attrs"":{},""content"":[{""type"":""paragraph"",""content"":[{""type"":""text"",""text"":""CI0080112601264492384829""}]}]},{""type"":""tableCell"",""attrs"":{},""content"":[{""type"":""paragraph"",""content"":[{""type"":""text"",""text"":""KAMBOU YERI ANGE MARIE CHRISTELLE""}]}]},{""type"":""tableCell"",""attrs"":{},""content"":[{""type"":""paragraph"",""content"":[{""type"":""text"",""text"":""700 000""}]}]},{""type"":""tableCell"",""attrs"":{},""content"":[{""type"":""paragraph"",""content"":[{""type"":""text"",""text"":""XOF""}]}]},{""type"":""tableCell"",""attrs"":{},""content"":[{""type"":""paragraph"",""content"":[{""type"":""text"",""text"":""SALAIRE AVRIL 2024""}]}]}]},{""type"":""tableRow"",""content"":[{""type"":""tableCell"",""attrs"":{},""content"":[{""type"":""paragraph"",""content"":[{""type"":""text"",""text"":""CI0080111601169193540416""}]}]},{""type"":""tableCell"",""attrs"":{},""content"":[{""type"":""paragraph"",""content"":[{""type"":""text"",""text"":""KANGAH RENEE-GISELE""}]}]},{""type"":""tableCell"",""attrs"":{},""content"":[{""type"":""paragraph"",""content"":[{""type"":""text"",""text"":""1 717 500""}]}]},{""type"":""tableCell"",""attrs"":{},""content"":[{""type"":""paragraph"",""content"":[{""type"":""text"",""text"":""XOF""}]}]},{""type"":""tableCell"",""attrs"":{},""content"":[{""type"":""paragraph"",""content"":[{""type"":""text"",""text"":""SALAIRE AVRIL 2024""}]}]}]},{""type"":""tableRow"",""content"":[{""type"":""tableCell"",""attrs"":{},""content"":[{""type"":""paragraph"",""content"":[{""type"":""text"",""text"":""CI0070106790000011914057""}]}]},{""type"":""tableCell"",""attrs"":{},""content"":[{""type"":""paragraph"",""content"":[{""type"":""text"",""text"":""KOFFI ABALEYTY NARCISSE""}]}]},{""type"":""tableCell"",""attrs"":{},""content"":[{""type"":""paragraph"",""content"":[{""type"":""text"",""text"":""1 350 000""}]}]},{""type"":""tableCell"",""attrs"":{},""content"":[{""type"":""paragraph"",""content"":[{""type"":""text"",""text"":""XOF""}]}]},{""type"":""tableCell"",""attrs"":{},""content"":[{""type"":""paragraph"",""content"":[{""type"":""text"",""text"":""SALAIRE AVRIL 2024""}]}]}]},{""type"":""tableRow"",""content"":[{""type"":""tableCell"",""attrs"":{},""content"":[{""type"":""paragraph"",""content"":[{""type"":""text"",""text"":""CI0420128308335000260544""}]}]},{""type"":""tableCell"",""attrs"":{},""content"":[{""type"":""paragraph"",""content"":[{""type"":""text"",""text"":""KOUAME EHOUMAN DORGELES""}]}]},{""type"":""tableCell"",""attrs"":{},""content"":[{""type"":""paragraph"",""content"":[{""type"":""text"",""text"":""1 320 000""}]}]},{""type"":""tableCell"",""attrs"":{},""content"":[{""type"":""paragraph"",""content"":[{""type"":""text"",""text"":""XOF""}]}]},{""type"":""tableCell"",""attrs"":{},""content"":[{""type"":""paragraph"",""content"":[{""type"":""text"",""text"":""SALAIRE AVRIL 2024""}]}]}]},{""type"":""tableRow"",""content"":[{""type"":""tableCell"",""attrs"":{},""content"":[{""type"":""paragraph"",""content"":[{""type"":""text"",""text"":""CI0080109900994007374779""}]}]},{""type"":""tableCell"",""attrs"":{},""content"":[{""type"":""paragraph"",""content"":[{""type"":""text"",""text"":""GNENAGO ALICE""}]}]},{""type"":""tableCell"",""attrs"":{},""content"":[{""type"":""paragraph"",""content"":[{""type"":""text"",""text"":""2 000 000""}]}]},{""type"":""tableCell"",""attrs"":{},""content"":[{""type"":""paragraph"",""content"":[{""type"":""text"",""text"":""XOF""}]}]},{""type"":""tableCell"",""attrs"":{},""content"":[{""type"":""paragraph"",""content"":[{""type"":""text"",""text"":""SALAIRE AVRIL 2024""}]}]}]},{""type"":""tableRow"",""content"":[{""type"":""tableCell"",""attrs"":{},""content"":[{""type"":""paragraph"",""content"":[{""type"":""text"",""text"":""CI0080107500754066058929""}]}]},{""type"":""tableCell"",""attrs"":{},""content"":[{""type"":""paragraph"",""content"":[{""type"":""text"",""text"":""YOBO GOSSE FRANCK HERMANN""}]}]},{""type"":""tableCell"",""attrs"":{},""content"":[{""type"":""paragraph"",""content"":[{""type"":""text"",""text"":""3000000""}]}]},{""type"":""tableCell"",""attrs"":{},""content"":[{""type"":""paragraph"",""content"":[{""type"":""text"",""text"":""XOF""}]}]},{""type"":""tableCell"",""attrs"":{},""content"":[{""type"":""paragraph"",""content"":[{""type"":""text"",""text"":""SALAIRE AVRIL 2024""}]}]}]},{""type"":""tableRow"",""content"":[{""type"":""tableCell"",""attrs"":{},""content"":[{""type"":""paragraph"",""content"":[{""type"":""text"",""text"":""CI0080112601264512906343""}]}]},{""type"":""tableCell"",""attrs"":{},""content"":[{""type"":""paragraph"",""content"":[{""type"":""text"",""text"":""DJORO epse EHUI DJOAMAN INES CELESTINE YVANNE""}]}]},{""type"":""tableCell"",""attrs"":{},""content"":[{""type"":""paragraph"",""content"":[{""type"":""text"",""text"":""350 000""}]}]},{""type"":""tableCell"",""attrs"":{},""content"":[{""type"":""paragraph"",""content"":[{""type"":""text"",""text"":""XOF""}]}]},{""type"":""tableCell"",""attrs"":{},""content"":[{""type"":""paragraph"",""content"":[{""type"":""text"",""text"":""SALAIRE AVRIL 2024""}]}]}]},{""type"":""tableRow"",""content"":[{""type"":""tableCell"",""attrs"":{},""content"":[{""type"":""paragraph"",""content"":[{""type"":""text"",""text"":""CI0060457201057110001327""}]}]},{""type"":""tableCell"",""attrs"":{},""content"":[{""type"":""paragraph"",""content"":[{""type"":""text"",""text"":""KOUADIO KOUASSI ARISTIDE""}]}]},{""type"":""tableCell"",""attrs"":{},""content"":[{""type"":""paragraph"",""content"":[{""type"":""text"",""text"":""300 000""}]}]},{""type"":""tableCell"",""attrs"":{},""content"":[{""type"":""paragraph"",""content"":[{""type"":""text"",""text"":""XOF""}]}]},{""type"":""tableCell"",""attrs"":{},""content"":[{""type"":""paragraph"",""content"":[{""type"":""text"",""text"":""SALAIRE AVRIL 2024""}]}]}]},{""type"":""tableRow"",""content"":[{""type"":""tableCell"",""attrs"":{},""content"":[{""type"":""paragraph"",""content"":[{""type"":""text"",""text"":""CI1550420101384210000177""}]}]},{""type"":""tableCell"",""attrs"":{},""content"":[{""type"":""paragraph"",""content"":[{""type"":""text"",""text"":""ZIRE JOSIAS PASCAL ZADI ""}]}]},{""type"":""tableCell"",""attrs"":{},""content"":[{""type"":""paragraph"",""content"":[{""type"":""text"",""text"":""250 000""}]}]},{""type"":""tableCell"",""attrs"":{},""content"":[{""type"":""paragraph"",""content"":[{""type"":""text"",""text"":""XOF""}]}]},{""type"":""tableCell"",""attrs"":{},""content"":[{""type"":""paragraph"",""content"":[{""type"":""text"",""text"":""SALAIRE AVRIL 2024""}]}]}]},{""type"":""tableRow"",""content"":[{""type"":""tableCell"",""attrs"":{},""content"":[{""type"":""paragraph"",""content"":[{""type"":""text"",""text"":""CI0080111101118635001734""}]}]},{""type"":""tableCell"",""attrs"":{},""content"":[{""type"":""paragraph"",""content"":[{""type"":""text"",""text"":""DIASSO AISSATA DESIREE""}]}]},{""type"":""tableCell"",""attrs"":{},""content"":[{""type"":""paragraph"",""content"":[{""type"":""text"",""text"":""450 000""}]}]},{""type"":""tableCell"",""attrs"":{},""content"":[{""type"":""paragraph"",""content"":[{""type"":""text"",""text"":""XOF""}]}]},{""type"":""tableCell"",""attrs"":{},""content"":[{""type"":""paragraph"",""content"":[{""type"":""text"",""text"":""SALAIRE AVRIL 2024""}]}]}]},{""type"":""tableRow"",""content"":[{""type"":""tableCell"",""attrs"":{},""content"":[{""type"":""paragraph"",""content"":[{""type"":""text"",""text"":""CI0970100110011739440021""}]}]},{""type"":""tableCell"",""attrs"":{},""content"":[{""type"":""paragraph"",""content"":[{""type"":""text"",""text"":""GUEI FREDERIQUE SEYNABOU""}]}]},{""type"":""tableCell"",""attrs"":{},""content"":[{""type"":""paragraph"",""content"":[{""type"":""text"",""text"":""1000000""}]}]},{""type"":""tableCell"",""attrs"":{},""content"":[{""type"":""paragraph"",""content"":[{""type"":""text"",""text"":""XOF""}]}]},{""type"":""tableCell"",""attrs"":{},""content"":[{""type"":""paragraph"",""content"":[{""type"":""text"",""text"":""SALAIRE AVRIL 2024""}]}]}]},{""type"":""tableRow"",""content"":[{""type"":""tableCell"",""attrs"":{},""content"":[{""type"":""paragraph"",""content"":[{""type"":""text"",""text"":""CI0340103301281623000111""}]}]},{""type"":""tableCell"",""attrs"":{},""content"":[{""type"":""paragraph"",""content"":[{""type"":""text"",""text"":""COULIBALY GNELE SANATA""}]}]},{""type"":""tableCell"",""attrs"":{},""content"":[{""type"":""paragraph"",""content"":[{""type"":""text"",""text"":""600000""}]}]},{""type"":""tableCell"",""attrs"":{},""content"":[{""type"":""paragraph"",""content"":[{""type"":""text"",""text"":""XOF""}]}]},{""type"":""tableCell"",""attrs"":{},""content"":[{""type"":""paragraph"",""content"":[{""type"":""text"",""text"":""SALAIRE AVRIL 2024""}]}]}]},{""type"":""tableRow"",""content"":[{""type"":""tableCell"",""attrs"":{},""content"":[{""type"":""paragraph"",""content"":[{""type"":""text"",""text"":""CI0080112301234417229535""}]}]},{""type"":""tableCell"",""attrs"":{},""content"":[{""type"":""paragraph"",""content"":[{""type"":""text"",""text"":""DIARRASSOUBA FANTA MARIE GUILENE ""}]}]},{""type"":""tableCell"",""attrs"":{},""content"":[{""type"":""paragraph"",""content"":[{""type"":""text"",""text"":""320000""}]}]},{""type"":""tableCell"",""attrs"":{},""content"":[{""type"":""paragraph"",""content"":[{""type"":""text"",""text"":""XOF""}]}]},{""type"":""tableCell"",""attrs"":{},""content"":[{""type"":""paragraph"",""content"":[{""type"":""text"",""text"":""SALAIRE MARS 2024""}]}]}]}]}
{adf}",Edwige KOUASSI,Léa DIABATE,CILAGRI,,E-mail,Paiement,Centre de paiement,Requêtes,Non renseigné,OBC Customer Support,Priorité 1,Terminé(e),2024-08-06 11:18,14/8/2024 18:32,2024-08-14 18:32,Exécuter un paiement
OBCS-6329,OD-1875,Possibilité de lier la factures annexe à plusieurs factures cibles pour le calcul du cout de revient,Possibilité de lier la factures annexe à plusieurs factures cibles pour le calcul du cout de revient,N'GBRA MOYE BERNICE DORIS,KALOGO Nabarakissa,S-TEL,,Appel Téléphonique,Opérations,Achat,Requêtes,Non renseigné,OBC Customer Support,Priorité 1,Terminé(e),2024-08-02 11:09,14/9/2025 16:09,2025-09-14 16:03,
OBCS-6323,OD-1872,Reprise des données des phases et tâches,Reprise des données des phases et tâches,EVA BASSE,Jacob N'DJAN,KOFFI & DIABATE,,Appel Téléphonique,Projets,Gérer mes projets,Bug,Mauvais déversement des données,OBC Customer Support,Priorité 1,Terminé(e),2024-08-01 11:28,2/8/2024 18:59,2024-08-02 18:59,
OBCS-6322,OD-1871,Donner la possibilité de filtrer par salaire net / Montant,Donner la possibilité de filtrer par salaire net / Montant,Edwige KOUASSI,,CILAGRI,,Constat Interne,RH,Gestion employé,Requêtes,Non renseigné,OBC Customer Support,Priorité 1,Terminé(e),2024-08-01 09:57,5/8/2024 12:14,2024-08-05 12:14,
OBCS-6321,OD-1870,Automatisation des majorations de stock de congés dans le stock de congés calculé,"Prise en compte des majorations de stock de congés qui doit courir de l’année de constatation jusqu'à la prochaine majoration .

# Pour 5 ans d’ancienneté ça fait 1 en plus sur le stock de congés
# Pour 10 ans d’ancienneté ça fait 2 en plus sur le stock de congés
# Pour 15 ans d’ancienneté ça fait 3 en plus sur le stock de congés

Exemple : Pour employé qui a 5 ans d’ancienneté on aura 

1.83*12 = 21.96 +1 = 22.96

Jusqu'à la neuvième année il doit avoir 1.83*12= 21.96 + 1 = 22.96",N'GBRA MOYE BERNICE DORIS,Jean-Claude SAMPENNIE,S-TEL,,Appel Téléphonique,RH,Documents,Bug,Mauvais déversement des données,OBC Customer Support,Priorité 1,Terminé(e),2024-07-31 10:26,9/8/2024 10:00,2024-08-09 10:00,
OBCS-6320,OD-1869,Automatisation des immobilisations,"Intégrer les immobilisations aux factures achats

# Intégrer un onglet qui permettrait de lier l’axe immobilisation au tableau d’amortissements.
# Possibilité d’une liaison entre le tableau d’amortissement et les achats.",N'GBRA MOYE BERNICE DORIS,FRANCIS AURELIEN KOUTOU,S-TEL,,Appel Téléphonique,Opérations,Immobilisations,Requêtes,Non renseigné,OBC Customer Support,Priorité 1,À faire,2024-07-30 18:13,30/7/2024 18:13,,
OBCS-6306,OD-1867,Possibilité de voir la liste des personnes cochées dans un workflow afin de pouvoir cocher les cases vides disponibles,Possibilité de voir la liste des personnes cochés dans un workflow afin de pouvoir cocher les cases vides ce qui permettra d'éviter les doublons.,N'GBRA MOYE BERNICE DORIS,KALOGO Nabarakissa,S-TEL,,Appel Téléphonique,Global,Global,Requêtes,Non renseigné,OBC Customer Support,Priorité 1,Terminé(e),2024-07-30 11:14,9/8/2024 09:59,2024-08-09 09:59,Global
OBCS-6296,OD-1866,"A l'enregistrement d'une opportunité, la liste déroulante des offres propose des offres différentes de celles existantes en historique de la fonctionnalité ""offre""","A l'enregistrement d'une opportunité, la liste déroulante des offres propose des offres différentes de celles existantes en historique de la fonctionnalité ""offre”",EVA BASSE,Mme EBEQUOI,ONPOINT,,En présentiel,CRM,Activités commerciales,Bug,Page d'erreur,OBC Customer Support,Priorité 1,Terminé(e),2024-07-29 14:51,5/8/2024 12:42,2024-08-05 12:42,
OBCS-6295,OD-1865,"A l'enregistrement d'une nouvelle opportunité , aucun type de pipeline ne se déverse","A l'enregistrement d'une nouvelle opportunité ,aucun le type de pipeline ne se déverse",EVA BASSE,Mme EBEQUOI,ONPOINT,,En présentiel,CRM,Activités commerciales,Bug,Page d'erreur,OBC Customer Support,Priorité 1,Terminé(e),2024-07-29 14:46,30/7/2024 09:30,2024-07-30 09:30,
OBCS-6280,OD-1859,Corriger/Enlever les alertes 444/222 quand on édite une opportunité,Corriger/Enlever les alertes 444/222 quand on édite une opportunité,EVA BASSE,FABIEN VATI,ONPOINT,,En présentiel,CRM,Activités commerciales,Bug,Page d'erreur,OBC Customer Support,Priorité 2,Terminé(e),2024-07-26 17:16,26/7/2024 19:43,2024-07-26 19:43,
OBCS-6289,OD-1864,"Enlever ""Phoning"" de la liste déroulante ""Catégorie"" sur le formulaire 'activité""","Enlever ""Phoning"" de la liste déroulante ""Catégorie"" sur le formulaire 'activité""",EVA BASSE,FABIEN VATI,ONPOINT,,En présentiel,CRM,Activités commerciales,Requêtes,Non renseigné,OBC Customer Support,Priorité 3,Terminé(e),2024-07-26 17:19,11/12/2024 09:29,2024-12-11 09:29,
OBCS-6286,OD-1863,"Annuler l'affichage popup des interfaces dans ""Gestion des portefeuilles""","Annuler l'affichage popup des interfaces dans ""Gestion des portefeuilles""",EVA BASSE,FABIEN VATI,ONPOINT,,En présentiel,CRM,Activités commerciales,Requêtes,Non renseigné,OBC Customer Support,Priorité 3,Terminé(e),2024-07-26 17:18,27/7/2024 18:56,2024-07-27 18:56,
OBCS-6285,OD-1862,Rendre plus visible le bouton (+) sur les filtres,Rendre plus visible le bouton (+) sur les filtres,EVA BASSE,FABIEN VATI,ONPOINT,,En présentiel,CRM,Activités commerciales,Requêtes,Non renseigné,OBC Customer Support,Priorité 3,Terminé(e),2024-07-26 17:18,26/7/2024 18:45,2024-07-26 18:45,
OBCS-6284,OD-1861,"Enlever les accès ""contrat de réservation BTP"" aux commerciaux de Onpoint","Enlever les accès ""contrat de réservation BTP"" aux commerciaux de Onpoint",EVA BASSE,FABIEN VATI,ONPOINT,,En présentiel,CRM,Activités commerciales,Requêtes,Non renseigné,OBC Customer Support,Priorité 3,Terminé(e),2024-07-26 17:18,5/8/2024 15:44,2024-08-05 15:44,
OBCS-6282,OD-1860,Permettre que l'actualisation des onglets ne change pas l'interface des utilisateurs,Permettre que l'actualisation des onglets ne change pas l'interface des utilisateurs,EVA BASSE,FABIEN VATI,ONPOINT,,En présentiel,CRM,Activités commerciales,Requêtes,Non renseigné,OBC Customer Support,Priorité 3,Terminé(e),2024-07-26 17:17,4/4/2025 11:24,2025-04-04 11:24,
OBCS-6279,OD-1858,"Filtrer les clients par entité dans ""Gestion des portefeuilles""","Filtrer les clients par entité dans ""Gestion des portefeuilles""",EVA BASSE,FABIEN VATI,ONPOINT,,En présentiel,CRM,Activités commerciales,Requêtes,Non renseigné,OBC Customer Support,Priorité 3,Terminé(e),2024-07-26 17:15,5/8/2024 12:43,2024-08-05 12:43,
OBCS-6277,OD-1857,"Déplacer la fonctionnalité ""Nouvelle activité"" du sous-module ""Paramétrage"" vers le sous-module ""Activité commerciale""","Corriger les dDéplacer la fonctionnalité ""Nouvelle activité"" du sous-module ""Paramétrage"" vers le sous-module ""Activité commerciale""oublons existants sur sur le formulaire ""Détail de l'étape",EVA BASSE,FABIEN VATI,ONPOINT,,En présentiel,CRM,Activités commerciales,Requêtes,Non renseigné,OBC Customer Support,Priorité 3,Terminé(e),2024-07-26 17:15,26/7/2024 18:45,2024-07-26 18:45,
OBCS-6276,OD-1856,"Corriger les doublons existants sur sur le formulaire ""Détail de l'étape","Corriger les doublons existants sur sur le formulaire ""Détail de l'étape",EVA BASSE,FABIEN VATI,ONPOINT,,En présentiel,CRM,Activités commerciales,Requêtes,Non renseigné,OBC Customer Support,Priorité 1,Terminé(e),2024-07-26 17:15,27/7/2024 19:02,2024-07-27 19:02,
OBCS-6275,OD-1855,"Rendre possible la modification des étapes du SPANCO sans forcément arriver à ""ORDER""","Rendre possible la modification des étapes du SPANCO sans forcément arriver à ""ORDER""",EVA BASSE,ESTHER ALIDJA,ONPOINT,,En présentiel,CRM,Activités commerciales,Requêtes,Non renseigné,OBC Customer Support,Priorité 1,À faire,2024-07-26 17:13,21/1/2025 20:14,,
OBCS-6239,OD-1854,Impossible d'enregistrer un bon de commande avec pour type achat frais généraux sans choisir un article,Impossible d'enregistrer un bon de commande avec pour type achat frais généraux sans choisir un article,N'GBRA MOYE BERNICE DORIS,KALOGO Nabarakissa,S-TEL,,Appel Téléphonique,Opérations,Achat,Bug,Page d'erreur,OBC Customer Support,Priorité 1,Terminé(e),2024-07-25 16:39,26/7/2024 16:37,2024-07-26 16:37,
OBCS-6232,OD-1852,Prise en compte Non effective des recherches via le filtre dans détails de validation du calcul de paie,"Prise en compte Non effective des recherches via le filtre



!image-20240724-132521.png|width=1282,height=831,alt=""image-20240724-132521.png""!

!image-20240724-132025.png|width=1445,height=647,alt=""image-20240724-132025.png""!",Edwige KOUASSI,,IVOIRE DEVELOPPEMENT,,En présentiel,RH,Salaire,Bug,Dysfonctionnement des filtres,OBC Customer Support,Priorité 1,Terminé(e),2024-07-24 13:27,26/7/2024 10:30,2024-07-26 10:30,
OBCS-6222,OD-1849,"A l'enregistrement d'un prospect à partir du formulaire de nouvelle opportunité, on a un message d'erreur","A l'enregistrement d'un prospect à partir du formulaire de nouvelle opportunité, on a un message d'erreur",EVA BASSE,M. SANANKOUA,ONPOINT,,E-mail,CRM,Activités commerciales,Bug,Page d'erreur,OBC Customer Support,Priorité 2,Terminé(e),2024-07-23 12:26,27/8/2024 09:40,2024-08-27 09:40,
OBCS-6218,OD-1848,Suppression impossible - Opération de caisse,"Suppression Opération de caisse impossible

Doublon Constaté lors de l’enregistrement",Edwige KOUASSI,Marina NATCHIA,CIP,,Appel Téléphonique,Finance,Comptabilité Générale,Bug,Suppression impossible,OBC Customer Support,Priorité 3,Terminé(e),2024-07-23 09:40,25/7/2024 17:52,2024-07-25 17:52,
OBCS-6217,OD-1847,"A l'édition d'une fiche offre, lorsqu'on clique sur ""fermer"", il y a une page blanche qui apparait ( voir capture)","!image-20240722-202047.png|width=1462,height=311,alt=""image-20240722-202047.png""!",EVA BASSE,Mme EBEQUOI,ONPOINT,,En présentiel,CRM,Activités commerciales,Bug,Page d'erreur,OBC Customer Support,Priorité 3,Terminé(e),2024-07-22 20:21,27/7/2024 18:54,2024-07-27 18:54,
OBCS-6215,OD-1845,"A l'enregistrement d'une opportunité dont le type de pipeline est ""vente directe"", on a un message d'erreur(voir pièce jointe)","

!image (17).png|width=1141,height=538,alt=""image (17).png""!",EVA BASSE,Mme EBEQUOI,ONPOINT,,En présentiel,CRM,Activités commerciales,Bug,Page d'erreur,OBC Customer Support,Priorité 2,Terminé(e),2024-07-22 20:13,27/8/2024 17:48,2024-08-27 17:48,
OBCS-6214,OD-1844,"A l'édition d'une fiche offre, la page ne charge pas correctement (voir pièce jointe)","Doublon de la pagination (voir capture joint)

!image (16).png|width=544,height=553,alt=""image (16).png""!",EVA BASSE,Mme EBEQUOI,ONPOINT,,En présentiel,CRM,Offres,Bug,Non affichage de pages/données,OBC Customer Support,Priorité 2,Terminé(e),2024-07-22 20:10,26/7/2024 19:43,2024-07-26 19:43,
OBCS-6213,OD-1843,Doublon de la pagination (voir capture joint),"Doublon de la pagination (voir capture joint)



!image (15).png|width=967,height=513,alt=""image (15).png""!",EVA BASSE,Mme EBEQUOI,ONPOINT,,En présentiel,CRM,Offres,Bug,Mauvais déversement des données,OBC Customer Support,Priorité 2,Terminé(e),2024-07-22 20:08,26/7/2024 18:45,2024-07-26 18:45,
OBCS-6216,OD-1846,"Sur le formulaire de ""opportunité"" ,les informations de la liste déroulante du champs ""offre"" ne sont pas ordonnées","Sur le formulaire de ""opportunité"" ,les informations de la liste déroulante du champs ""offre"" ne sont pas ordonnées",EVA BASSE,Mme EBEQUOI,ONPOINT,,En présentiel,CRM,Activités commerciales,Requêtes,Non renseigné,OBC Customer Support,Priorité 4,Terminé(e),2024-07-22 20:17,27/7/2024 19:36,2024-07-27 19:36,
OBCS-6211,OD-1842,Avoir des alertes sur les timesheets,Avoir des alertes sur les timesheets,EVA BASSE,M. SANANKOUA,ONPOINT,,En présentiel,Global,Global,Requêtes,Non renseigné,OBC Customer Support,Priorité 2,Terminé(e),2024-07-22 14:59,25/7/2024 09:33,2024-07-25 09:33,Global
OBCS-6210,OD-1841,Rapport d'activité OBC,Rapport d'activité OBC,EVA BASSE,M. SANANKOUA,ONPOINT,,En présentiel,Global,Global,Requêtes,Non renseigné,OBC Customer Support,Priorité 2,Terminé(e),2024-07-22 14:56,19/12/2024 09:02,2024-12-19 09:02,Global
OBCS-6206,OD-1840,Mise à jour des stocks de congés pour l'année 2023,Mise à jour des stocks de congés pour l'année 2023,N'GBRA MOYE BERNICE DORIS,Jean-Claude SAMPENNIE,S-TEL,,Appel Téléphonique,RH,Documents,Requêtes,Non renseigné,OBC Customer Support,Priorité 1,Terminé(e),2024-07-22 12:29,26/7/2024 16:34,2024-07-26 16:34,
OBCS-6205,OD-1839,Intégration de format de bon de commande,Intégration de format de bon de commande,N'GBRA MOYE BERNICE DORIS,KOUAME KONAN GUY ROGER,SIT BTP,,Appel Téléphonique,Opérations,Achat,Requêtes,Non renseigné,OBC Customer Support,Priorité 1,Terminé(e),2024-07-22 12:22,31/7/2024 17:25,2024-07-31 17:25,
OBCS-6191,OD-1838,Impossible d'enregistrer les TimeSheet,Impossible d’enregistrer [mes heures travaillées|https://www.onpointsunrise.com/TempsTimesheet/Index],Edwige KOUASSI,,ONPOINT,,Constat Interne,Projets,Feuille de temps,Bug,Enregistrement impossible,OBC Customer Support,Priorité 1,Terminé(e),2024-07-21 00:42,25/7/2024 09:39,2024-07-25 09:39,
OBCS-6154,OD-1836,Non affichage de l'arrondi dans le détail de la paie,"L’arrondi de paie, bien que paramétré ne s’affiche pas dans le détaille de la paie.

*NB :* Les arrondis sont bien pris en compte dans la paie, ainsi que dans les bulletins.

*_Cf:_* Capture, Paramétrage arrondi | Affichage détail de paie | Affichage bulletin



!image-20240719-160945.png|width=455,height=797,alt=""image-20240719-160945.png""!





!image-20240719-160853.png|width=1037,height=621,alt=""image-20240719-160853.png""!

!image-20240719-161110.png|width=1512,height=508,alt=""image-20240719-161110.png""!",Edwige KOUASSI,GAHI Lezou Jean,IVOIRE DEVELOPPEMENT,,En présentiel,RH,Salaire,Bug,Non affichage de pages/données,OBC Customer Support,Priorité 1,Terminé(e),2024-07-19 16:12,30/8/2024 10:21,2024-08-30 10:21,
OBCS-6155,OD-1837,Automatiser les processus de correction de la paie,"Pour des modifications à effectuer sur un seul employé, on se retrouve a refaire tous les processus.

Donner la possibilité de faire des corrections sur une paie en cliquant uniquement sur le salarié.

Exemple : Pour Mr X, la prime de balade doit être rajouter, en lieu et place de toutes la procédure, donner la possibilité de sélectionner uniquement Mr X d’apporter toutes les modification sur sa paie et de la calculer sans suivre tout le processus classique. En gros ajouter des raccourcis pour faciliter la tache a l’utilisateur.",Edwige KOUASSI,GAHI Lezou Jean,IVOIRE DEVELOPPEMENT,,En présentiel,RH,Salaire,Requêtes,Non renseigné,OBC Customer Support,Priorité 1,À faire,2024-07-19 16:20,19/7/2024 16:20,,
OBCS-6153,OD-1835,Trier les données de la balance comptable par journaux,"Donner la possibilité d'Imprimer, d’afficher la balance comptable par journaux",Edwige KOUASSI,GAHI Lezou Jean,IVOIRE DEVELOPPEMENT,,En présentiel,Finance,Comptabilité Générale,Requêtes,Non renseigné,OBC Customer Support,Priorité 1,À faire,2024-07-19 13:32,19/7/2024 13:32,,
OBCS-6103,OD-1826,Intégration de la formule Etat tva due tenant compte des encaissements clients et non des factures ventes,Intégration des la formule Etat tva due tenant compte des encaissements clients et non des factures ventes,N'GBRA MOYE BERNICE DORIS,FRANCIS AURELIEN KOUTOU,S-TEL,,"Online (Google Meet, Teams...)",Finance,Impôts et taxes,Requêtes,Non renseigné,OBC Customer Support,Priorité 1,Terminé(e),2024-07-17 12:24,1/10/2024 18:05,2024-10-01 18:05,
OBCS-6094,OD-1818,Les types de staffing se déversent avec des doublons par phases,Les types de staffing se déversent avec des doublons par phases.,EVA BASSE,,KOFFI & DIABATE,,En présentiel,Projets,Gérer mes projets,Bug,Mauvais déversement des données,OBC Customer Support,Priorité 1,Terminé(e),2024-07-16 08:17,17/7/2024 16:25,2024-07-17 16:25,
OBCS-6102,OD-1825,Permettre l'impression des workflows de tous les processus,Permettre l'impression des workflows de tous les processus,EVA BASSE,Ursula YANGANGOUSSOU,ONPOINT,,En présentiel,Finance,Trésorerie,Requêtes,Non renseigné,OBC Customer Support,Priorité 2,À faire,2024-07-16 16:13,16/7/2024 16:13,,
OBCS-6101,OD-1824,Corriger la date des attestations de travail et prendre en compte le dernier poste occupé par l'employé,Corriger la date des attestations de travail et prendre en compte le dernier poste occupé par l'employé,EVA BASSE,Ursula YANGANGOUSSOU,ONPOINT,,En présentiel,Finance,Trésorerie,Requêtes,Non renseigné,OBC Customer Support,Priorité 2,En cours,2024-07-16 16:13,14/2/2025 12:17,,
OBCS-6100,OD-1823,Avoir la possibilité de saisir des mots clés lors du choix des natures de prestations sur les formulaires,Avoir la possibilité de saisir des mots clés lors du choix des natures de prestations sur les formulaires,EVA BASSE,Gaelle TOURE,ONPOINT,,En présentiel,Finance,Trésorerie,Requêtes,Non renseigné,OBC Customer Support,Priorité 2,À faire,2024-07-16 16:12,16/7/2024 16:12,,
OBCS-6099,OD-1822,Corriger les doublons dans la récupération des salaires journaliers,Corriger les doublons dans la récupération des salaires journaliers,EVA BASSE,Ursula YANGANGOUSSOU,ONPOINT,,En présentiel,Finance,Trésorerie,Requêtes,Non renseigné,OBC Customer Support,Priorité 2,À faire,2024-07-16 16:12,16/7/2024 16:12,,
OBCS-6098,OD-1821,Filtrer par journal l'interrogation des comptes,Filtrer par journal l'interrogation des comptes,EVA BASSE,KOFFI MARIUS,ONPOINT,,En présentiel,Finance,Trésorerie,Requêtes,Non renseigné,OBC Customer Support,Priorité 2,En cours,2024-07-16 16:11,19/11/2024 05:29,,
OBCS-6097,OD-1820,Rendre impossible la suppression des écritures déjà lettrées,Rendre impossible la suppression des écritures déjà lettrées,EVA BASSE,KOFFI MARIUS,ONPOINT,,En présentiel,Finance,Trésorerie,Requêtes,Non renseigné,OBC Customer Support,Priorité 1,À faire,2024-07-16 16:10,16/7/2024 16:10,,
OBCS-6096,OD-1819,"Intégrer l'option ""Approvisionnement"" des cartes électroniques","Intégrer l'option ""Approvisionnement"" des cartes électroniques",EVA BASSE,KOFFI MARIUS,ONPOINT,,En présentiel,Finance,Trésorerie,Requêtes,Non renseigné,OBC Customer Support,Priorité 1,Terminé(e),2024-07-16 16:10,26/7/2024 18:45,2024-07-26 18:45,
OBCS-5990,OD-1816,Message d'erreur à l'enregistrement d'un compte client après modification de ce compte client,Message d'erreur à l'enregistrement d'un compte client après modification de ce compte client,N'GBRA MOYE BERNICE DORIS,ERIC KOUADIO,FALCON,,Appel Téléphonique,Opérations,Vente,Bug,Page d'erreur,OBC Customer Support,Priorité 1,Terminé(e),2024-07-12 12:06,12/7/2024 16:16,2024-07-12 16:16,
OBCS-5989,OD-1815,"Lorsqu'on veut rattacher le type de staffing à un projet et qu'on clique sur ""Utiliser les phases"", aucune donnée ne se déverse se déverse.","Lorsqu'on veut rattacher le type de staffing à un projet et qu'on clique sur ""Utiliser les phases"", aucune donnée ne se déverse se déverse.",EVA BASSE,,KOFFI & DIABATE,,En présentiel,Projets,Gérer mes projets,Bug,Mauvais déversement des données,OBC Customer Support,Priorité 1,Terminé(e),2024-07-12 11:59,12/7/2024 17:58,2024-07-12 17:58,
OBCS-5991,OD-1817,Suppression de tous les journaux 2023,Suppression de tous les journaux 2023,JOEL SIE,Jean-Jacques LIKANE,LABOGEM,,Appel Téléphonique,Finance,Comptabilité Générale,Requêtes,Non renseigné,OBC Customer Support,Priorité 1,Terminé(e),2024-07-12 14:27,12/7/2024 17:22,2024-07-12 17:22,
OBCS-5986,OD-1813,Automatiser les numéros de pièces - Encaissement client,Automatiser les numéros de pièces - Encaissement client lorsque la caisse est sélectionné.,Edwige KOUASSI,GAHI Lezou Jean,IVOIRE DEVELOPPEMENT,,En présentiel,Opérations,Vente,Bug,Autres,OBC Customer Support,Priorité 1,Terminé(e),2024-07-10 16:40,26/7/2024 11:03,2024-07-26 11:01,
OBCS-5984,OD-1811,Duplication secteur d'activité - Fichier Client,Duplication secteur d'activité - Fichier Client,Edwige KOUASSI,,IVOIRE DEVELOPPEMENT,,En présentiel,Opérations,Vente,Bug,Duplication anormale,OBC Customer Support,Priorité 1,Terminé(e),2024-07-10 16:22,26/7/2024 11:53,2024-07-26 11:53,
OBCS-5979,OD-1810,Absence de données enregistré,"Bien que le fichier exporté ai 305 clients

Dans l’historique des clients seul un fichier s’affiche

!image-20240710-150453.png|width=1537,height=887,alt=""image-20240710-150453.png""!",Edwige KOUASSI,,IVOIRE DEVELOPPEMENT,,En présentiel,Opérations,Vente,Bug,Historique vide/non exhaustif,OBC Customer Support,Priorité 1,Terminé(e),2024-07-10 15:10,30/8/2024 10:21,2024-08-30 10:21,
OBCS-5978,OD-1809,Impossible de valider les expressions de besoins et bons de commande,Impossible de valider les expressions de besoins et bons de commande car les tickets ne sont pas générés après enregistrement d’une expression de soin ou bon de commande,N'GBRA MOYE BERNICE DORIS,KALOGO Nabarakissa,S-TEL,,Appel Téléphonique,Opérations,Achat,Bug,Autres,OBC Customer Support,Priorité 1,Terminé(e),2024-07-10 12:00,12/7/2024 08:49,2024-07-12 08:49,
OBCS-5987,OD-1814,Afficher le Numéro de Contrat sur le reçu d'encaissement,Afficher le Numéro de Contrat sur le reçu d'encaissement,Edwige KOUASSI,GAHI Lezou Jean,IVOIRE DEVELOPPEMENT,,En présentiel,Opérations,Vente,Requêtes,Non renseigné,OBC Customer Support,Priorité 1,Terminé(e),2024-07-10 16:43,13/12/2024 15:34,2024-12-13 15:34,
OBCS-5985,OD-1812,Automatiser les numéros de pièces de paiement,Générer les références dans le formulaire pièce de paiement quand le mode de règlement choisit est la *caisse*.,Edwige KOUASSI,GAHI Lezou Jean,IVOIRE DEVELOPPEMENT,,Appel Téléphonique,Opérations,Vente,Requêtes,Non renseigné,OBC Customer Support,Priorité 1,Terminé(e),2024-07-10 16:26,13/12/2024 15:34,2024-12-13 15:34,
OBCS-5976,OD-1807,Impossible de supprimer un compte client,On constate un message d’erreur à la suppression d’un compte client.,N'GBRA MOYE BERNICE DORIS,KONATE TAYOU,VENUS DISTRIBUTION,,Appel Téléphonique,Opérations,Vente,Bug,Page d'erreur,OBC Customer Support,Priorité 1,Terminé(e),2024-07-09 17:31,12/7/2024 06:53,2024-07-12 06:53,
OBCS-5975,OD-1806,Non affichage de certaines rubriques de salaire dans la visualisation du livre de paie,Non affichage de certaines rubriques de salaire dans la visualisation du livre de paie comme les rubriques de solde de tout compte,N'GBRA MOYE BERNICE DORIS,Jean-Claude SAMPENNIE,S-TEL,,Appel Téléphonique,RH,Documents,Bug,Mauvais déversement des données,OBC Customer Support,Priorité 1,Terminé(e),2024-07-09 14:44,12/7/2024 08:49,2024-07-12 08:49,
OBCS-5974,OD-1805,Importation des sous famille article - Le formulaire ne correspond pas au données à importer,"Importation des sous famille article - Paramétrages Gestion de stock 

Le formulaire ne correspond pas aux données à importées",Edwige KOUASSI,,CILAGRI,,En présentiel,Opérations,Gestion de stock,Bug,Import de fichiers impossible,OBC Customer Support,Priorité 1,Terminé(e),2024-07-09 12:26,12/7/2024 07:02,2024-07-12 07:02,
OBCS-5972,OD-1804,Impossible de calculer la paie,Impossible de calculer la paie. Message d’erreur référence variable dans les éléments fixe,Edwige KOUASSI,COULIBALY EVE,IVOIRE DEVELOPPEMENT,,Chat WhatsApp,RH,Gestion employé,Requêtes,Non renseigné,OBC Customer Support,Priorité 1,Terminé(e),2024-07-08 18:16,15/7/2024 09:27,2024-07-15 09:27,
OBCS-5868,OD-1803,Modèle de document : Enlever les entêtes et pieds de page,Enlever les entêtes et pieds de page : Les Documents concernant sont Certificat de Travail et Solde de tout compte.,Vivien DAKPOGAN,Brahima COULIBALY,KORI TRANSPORT,,Appel Téléphonique,RH,Documents,Requêtes,Non renseigné,OBC Customer Support,Priorité 2,Terminé(e),2024-07-05 18:04,29/7/2024 15:13,2024-07-29 15:13,
OBCS-5829,OD-1801,Aucune donnée n'apparait à l’enregistrement des impôts et taxes d'un mois à cause de la CN qui a été enregistrée plusieurs fois de suite,Aucune donnée n'apparait à l’enregistrement des impôts et taxes d'un mois à cause de la CN qui a été enregistrée plusieurs fois de suite,N'GBRA MOYE BERNICE DORIS,FRANCIS AURELIEN KOUTOU,S-TEL,,Appel Téléphonique,Finance,Impôts et taxes,Bug,Non affichage de pages/données,OBC Customer Support,Priorité 1,Terminé(e),2024-07-05 08:35,11/7/2024 09:32,2024-07-11 09:32,
OBCS-5827,OD-1800,Réinitialisation des valeurs stocké dans les variables,h1. Réinitialisation des valeurs stocké dans les variables après chaque calcul de paie.,Edwige KOUASSI,COULIBALY EVE,IVOIRE DEVELOPPEMENT,,Appel Téléphonique,RH,Salaire,Requêtes,Non renseigné,OBC Customer Support,Priorité 3,Terminé(e),2024-07-04 15:21,5/8/2024 12:11,2024-08-05 12:11,
OBCS-5812,OD-1797,Impossible d'enregistrer une programmation lorsqu'un employé a un salaire avec le signe moins (-),Impossible d'enregistrer une programmation lorsqu'un employé a un salaire avec le signe moins (-),N'GBRA MOYE BERNICE DORIS,CHARLES IPO,FALCON,,Appel Téléphonique,RH,Salaire,Bug,Page d'erreur,OBC Customer Support,Priorité 1,Terminé(e),2024-07-04 08:59,9/7/2024 09:55,2024-07-09 09:55,
OBCS-5810,OD-1795,Non affichage des comptes clients dans le paramétrage compte client malgré les factures enregistrées,Non affichage des comptes clients dans le paramétrage compte client malgré les factures enregistrées,N'GBRA MOYE BERNICE DORIS,ERIC KOUADIO,FALCON,,Appel Téléphonique,Opérations,Vente,Bug,Non affichage de pages/données,OBC Customer Support,Priorité 1,Terminé(e),2024-07-04 08:53,4/7/2024 19:27,2024-07-04 19:27,
OBCS-5805,OD-1793,Modèle contrat à intégrer,Modèle contrat à intégrer,JOEL SIE,SERIGNE DIOME,ARIC,,En présentiel,CRM,Activités commerciales,Requêtes,Non renseigné,OBC Customer Support,Priorité 1,À faire,2024-07-03 10:13,3/7/2024 10:13,,
OBCS-5804,OD-1792,Le filtre au niveau des prospects ne fonctionne pas,Le filtre au niveau des prospects ne fonctionne pas,JOEL SIE,SERIGNE DIOME,ARIC,,En présentiel,CRM,Client,Requêtes,Non renseigné,OBC Customer Support,Priorité 1,Terminé(e),2024-07-03 10:08,19/7/2024 09:25,2024-07-19 09:25,
OBCS-5811,OD-1796,Aucune donnée n'apparait à l'enregistrement des impôts et taxes d'un mois,Aucune donnée n'apparait à l’enregistrement des impôts et taxes d'un mois à cause de la CN qui a été enregistrée trois fois de suite,N'GBRA MOYE BERNICE DORIS,CHARLES IPO,FALCON,,Appel Téléphonique,Finance,Impôts et taxes,Bug,Enregistrement impossible,OBC Customer Support,Priorité 1,Terminé(e),2024-07-04 08:56,5/7/2024 08:31,2024-07-05 08:31,
OBCS-5801,OD-1791,"Lorsqu'on enregistre une nouvelle activité dans CRM chez un prospect dans gestion des opportunités,on reçois 4 mails provenant de OBC Support pour la même activité. ","Lorsqu'on enregistre une nouvelle activité dans CRM chez un prospect dans gestion des opportunités,on reçois 4 mails provenant de OBC Support pour la même activité. ",EVA BASSE,FABIEN VATI,ONPOINT,,E-mail,CRM,Activités commerciales,Bug,Mauvais déversement des données,OBC Customer Support,Priorité 2,Terminé(e),2024-07-02 16:09,12/7/2024 08:40,2024-07-12 08:40,
OBCS-5793,OD-1788,Impossible d'enregistrer un paiement fournisseur car les factures ne se déversent pas,Impossible d'enregistrer un paiement fournisseur car les factures ne se déversent pas,N'GBRA MOYE BERNICE DORIS,KONATE TAYOU,VENUS DISTRIBUTION,,Chat WhatsApp,Paiement,Centre de paiement,Bug,Mauvais déversement des données,OBC Customer Support,Priorité 1,Terminé(e),2024-07-01 15:06,2/7/2024 18:42,2024-07-02 18:41,
OBCS-5795,OD-1789,Sur formulaire de l'offre ajouter dans la liste déroulante périodicité ''ONE SHORT'',Sur formulaire de l'offre ajouter dans la liste déroulante périodicité ''ONE SHORT'',JOEL SIE,Mme MICHELLE,ONPOINT,,En présentiel,CRM,Offres,Requêtes,Non renseigné,OBC Customer Support,Priorité 1,Terminé(e),2024-07-01 17:49,3/7/2024 09:55,2024-07-03 09:55,
OBCS-5789,OD-1786,Edition compte client impossible,Impossible d'éditer les comptes clients déjà enregistrés. En cliquant sur le bouton “Edité” le formulaire ne s’affiche pas,Vivien DAKPOGAN,CHARLES IPO,FALCON,,Appel Téléphonique,Opérations,Vente,Bug,Edition impossible,OBC Customer Support,Priorité 1,Terminé(e),2024-06-28 08:48,1/7/2024 08:44,2024-07-01 08:44,
OBCS-5788,OD-1785,Factures enregistrées ne s'affichant sur dettes fournisseurs,"# Non affichage des factures dans dettes fournisseurs
# Les factures déjà programmées  apparaissent dans la liste des factures à programmer

",Vivien DAKPOGAN,DAF Venus,VENUS DISTRIBUTION,,En présentiel,Opérations,Achat,Bug,Non affichage de pages/données,OBC Customer Support,Priorité 1,Terminé(e),2024-06-28 08:45,1/7/2024 08:41,2024-07-01 08:41,
OBCS-5787,OD-1784,Le livre de paie charge pendant longtemps et ne s'affiche pas,Le livre de paie charge pendant longtemps et ne s'affiche pas,EVA BASSE,CHARLES IPO,FALCON,,Chat WhatsApp,RH,Documents,Bug,Récupération de données impossible,OBC Customer Support,Priorité 1,Terminé(e),2024-06-28 08:43,22/8/2024 09:12,2024-08-22 09:12,
OBCS-5441,OD-1783,Possibilité de transformer le debours en budget,"Possibilité de transformer le debours en budget. Lorsque le debours est enregitré, donner la possibilité de le deverser dans le budget.",JOEL SIE,KOUAME KONAN GUY ROGER,SIT BTP,,En présentiel,Opérations,Vente,Requêtes,Non renseigné,OBC Customer Support,Priorité 2,À faire,2024-06-27 14:08,23/8/2024 17:26,,Gestion de débours
OBCS-5440,OD-1782,Dans le prévu-réalisé du budget ajouter une colonne appelé engagé qui va afficher les données des bons de commande de chaque ligne budgetaire.,Dans le prévu-réalisé du budget ajouter une colonne appelé engagé qui va afficher les données des bons de commande de chaque ligne budgetaire. Cette colonne permettra de suivre les commandes engagées sur chaque ligne budgetaire.,JOEL SIE,KOUAME KONAN GUY ROGER,SIT BTP,,En présentiel,Finance,Budget,Requêtes,Non renseigné,OBC Customer Support,Priorité 1,À faire,2024-06-27 14:02,27/6/2024 15:39,,
OBCS-5439,OD-1781,"Intégrer dans le fichier import des prospects: Segment, Secteur d'activité, Latitude et Longitude","Intégrer dans le fichier import des prospects: Segment, Secteur d'activité, Latitude et Longitude",JOEL SIE,SERIGNE DIOME,ARIC,,En présentiel,CRM,Client,Requêtes,Non renseigné,OBC Customer Support,Priorité 1,Terminé(e),2024-06-27 12:12,3/7/2024 09:55,2024-07-03 09:55,
OBCS-5800,OD-1790,Dysfonctionnement lors de la Modification d'un groupe employé,"A la modification d’un groupe employé, le libellé n’apparait plus dans l’historique.

Bien que le groupe employé apparaisse dans le fichier du personnel.",Edwige KOUASSI,EHUI Inesse,CILAGRI,,En présentiel,RH,Paramétrage,Bug,Autres,OBC Customer Support,Priorité 1,Terminé(e),2024-07-02 16:03,4/7/2024 19:04,2024-07-02 18:30,
OBCS-5411,OD-1774,L'impôt brut avant RICF a disparu sur la paie de tous les employés,L'impôt brut avant RICF a disparu sur la paie de tous les employés,EVA BASSE,Marius Coffi,EDIPRESSE,,Appel Téléphonique,RH,Documents,Bug,Mauvais déversement des données,OBC Customer Support,Priorité 1,Terminé(e),2024-06-21 10:05,21/6/2024 12:27,2024-06-21 12:27,
OBCS-5410,OD-1773,Incohérence des données sur le nombre d'absence,Incohérence des données sur le nombre d'absence,EVA BASSE,M. SANANKOUA,ONPOINT,,E-mail,RH,Analytique,Bug,Mauvais déversement des données,OBC Customer Support,Priorité 3,Terminé(e),2024-06-21 09:26,29/11/2024 16:14,2024-11-29 16:14,
OBCS-5418,OD-1780,Intégration Paiement par carte électronique,Avoir la possibilité de faire les paiements par carte électronique à partir du module Paiement,Vivien DAKPOGAN,M. SANANKOUA,ONPOINT,,En présentiel,Paiement,Centre de paiement,Requêtes,Non renseigné,OBC Customer Support,Priorité 2,Terminé(e),2024-06-25 17:49,28/6/2024 10:33,2024-06-28 10:33,Exécuter un paiement
OBCS-5417,OD-1779,Possibilité de retrancher des mois sur le mois d'ancienneté d'un Salarié,"Avoir la possibilité de retrancher 1 ou plusieurs mois, sur l’ancienneté d’un salarié et que cela ait un impact sur la prime d’ancienneté.
Ex : Pour un salarié qui a 4 ans 1 Mois au mois de Juin normalement, je dois être capable de le ramener à 4 ans 0 mois.",Vivien DAKPOGAN,BAKARY NDIAYE,SERTEM,,Appel Téléphonique,RH,Salaire,Requêtes,Non renseigné,OBC Customer Support,Priorité 1,Terminé(e),2024-06-25 17:43,27/6/2024 07:54,2024-06-27 07:54,
OBCS-5409,OD-1772,Etats financiers: Le compte materiel de transport ayant solde final debiteur n'affiche pas le montant au bilan,Etats financiers: Le compte materiel de transport ayant solde final debiteur n'affiche pas le montant au bilan,JOEL SIE,Ousseyni Oumarou,EJARA,,Appel Téléphonique,Finance,Comptabilité Générale,Bug,Autres,OBC Customer Support,Priorité 1,Terminé(e),2024-06-20 18:36,23/6/2024 13:04,2024-06-23 13:04,
OBCS-5407,OD-1770,"Un message d'erreur apparait lorsqu'on clique sur la fonctionnalité ""Enregistrer un décompte (voir capture)","Un message d'erreur apparait lorsqu'on clique sur la fonctionnalité ""Enregistrer un décompte (voir capture)",EVA BASSE,,MATRELEC,,En présentiel,Opérations,Vente,Bug,Page d'erreur,OBC Customer Support,Priorité 1,Terminé(e),2024-06-20 10:54,25/6/2024 17:00,2024-06-25 17:00,Gestion de débours
OBCS-5405,OD-1768,Impossible de supprimer des encaissements,Impossible de supprimer des encaissements effectué à partir des contrats de vente,Edwige KOUASSI,,IVOIRE DEVELOPPEMENT,,Constat Interne,Opérations,Vente,Bug,Suppression impossible,OBC Customer Support,Priorité 1,Terminé(e),2024-06-19 12:28,8/7/2024 12:15,2024-06-20 17:33,
OBCS-3519,OD-1766,Modèle de facture à intégrer,Modèle de facture à intégrer. Deux pièces jointes,JOEL SIE,KOUAME KONAN GUY ROGER,SIT BTP,,E-mail,Opérations,Vente,Requêtes,Non renseigné,OBC Customer Support,Priorité 1,À faire,2024-06-19 10:59,27/6/2024 15:39,,
OBCS-1933,OD-1765,Suppression des données de la base en déhors du paramétrage,Suppression des données de la base en déhors du paramétrage de base,JOEL SIE,KOUAME KONAN GUY ROGER,SIT BTP,,Appel Téléphonique,Global,Global,Requêtes,Non renseigné,OBC Customer Support,Priorité 1,Terminé(e),2024-06-19 09:52,11/7/2024 08:09,2024-07-11 08:09,Global
OBCS-5416,OD-1778,"Rajouter dans le formulaire Fichier employé, les champs tels que : Qualification, Nom du père et de la mère ...","Dans le formulaire Fichier employé, rajouter des champs pour les : 

1- Qualification / Diplôme / Niveau d'étude

2- Nom du père

3- Nom de la mère",Edwige KOUASSI,EHUI Inesse,CILAGRI,,Appel Téléphonique,RH,Gestion employé,Requêtes,Non renseigné,OBC Customer Support,Priorité 1,Terminé(e),2024-06-25 11:47,13/12/2024 15:34,2024-12-13 15:34,
OBCS-1381,OD-1761,La masse salariale s'affichant en historique du calcul ohada est différent du cumul des salaires bruts,La masse salariale s'affichant en historique du calcul ohada est différent du cumul des salaires bruts,JOEL SIE,Jean-Jacques LIKANE,LABOGEM,,"Online (Google Meet, Teams...)",RH,Salaire,Bug,Autres,OBC Customer Support,Priorité 1,Terminé(e),2024-06-14 10:50,19/6/2024 15:35,2024-06-19 15:35,
OBCS-1380,OD-1760,"Fabien n'a pas accès à  ""Ajouter une activité"" (voir la pièce jointe) et il ne peux non plus rajouter de tâche.",Ajouter une activité,EVA BASSE,FABIEN VATI,ONPOINT,,E-mail,CRM,Activités commerciales,Bug,Dysfonctionnement des liens d'accès,OBC Customer Support,Priorité 1,Terminé(e),2024-06-13 16:57,11/7/2024 09:53,2024-07-11 09:53,
OBCS-1379,OD-1759,"Lorsqu'on modifie une note dans une étape du SPANCO, on a le message d'erreur ""erreur ajax"" (voir pièce jointe)","Lorsqu'on modifie une note dans une étape du SPANCO, on a le message d'erreur ""erreur ajax"" (voir pièce jointe)",EVA BASSE,FABIEN VATI,ONPOINT,,E-mail,CRM,Activités commerciales,Bug,Erreur Ajax,OBC Customer Support,Priorité 1,Terminé(e),2024-06-13 16:53,12/7/2024 08:39,2024-07-12 08:39,
OBCS-1378,OD-1758,"Lorsqu'on termine l'enregistrement de toute la donnée pour un compte au moment de valider la donnée, on a l'apparition d'un message d'erreur (Voir pièces jointes)","*PS: Au niveau de la base test, on a pas ce message.*",EVA BASSE,ESTHER ALIDJA,ONPOINT,,E-mail,CRM,Activités commerciales,Bug,Page d'erreur,OBC Customer Support,Priorité 1,Terminé(e),2024-06-13 16:40,12/7/2024 08:40,2024-07-12 08:40,
OBCS-1377,OD-1757,Automatisation des paramétrages RH de Journaliers par pays,"Déverser les rubriques de base, dans les paramétrage pour tous les comptes par pays",Edwige KOUASSI,,CIP,,En présentiel,RH,Paramétrage,Requêtes,Non renseigné,OBC Customer Support,Priorité 1,Terminé(e),2024-06-13 12:26,20/8/2024 12:20,2024-08-20 12:20,
OBCS-1369,OD-1749,Un doublon est constaté dans la saisie analytique,"Un doublon est constaté dans la saisie analytique d’une facture 

Capture jointe",N'GBRA MOYE BERNICE DORIS,ERIC KOUADIO,FALCON,,Appel Téléphonique,Finance,Comptabilité Générale,Bug,Mauvais déversement des données,OBC Customer Support,Priorité 1,Terminé(e),2024-06-12 10:01,1/7/2024 08:41,2024-07-01 08:41,
OBCS-1368,OD-1748,Le montant total récupéré pour une facture import saisie se déverse dans le prévu réalisé du budget avec la devise étrangère et non locale,"Le montant total récupéré pour une facture import saisie se déverse dans le prévu réalisé du budget avec la devise étrangère et non locale

Exemple : Facture import : 8131£ = 5333331 FCFA

Montant déversé dans le budget est 8131£",N'GBRA MOYE BERNICE DORIS,KALOGO Nabarakissa,S-TEL,,Appel Téléphonique,Finance,Budget,Bug,Mauvais déversement des données,OBC Customer Support,Priorité 1,Terminé(e),2024-06-12 09:56,20/6/2024 12:30,2024-06-20 12:30,
OBCS-1375,OD-1755,Donner la possibilité d'effectuer un encaissement client à partir d'un contrat,"Donner la possibilité d'effectuer un encaissement client à partir d'un contrat enregistrer dans OBC.

L’objectif ici est de permettre a ce client d'effectuer des encaissements des apporteurs sans enregistrer de facture tout ",Edwige KOUASSI,GAHI Lezou Jean,IVOIRE DEVELOPPEMENT,,En présentiel,Opérations,Vente,Requêtes,Non renseigné,OBC Customer Support,Priorité 1,Terminé(e),2024-06-12 17:56,8/7/2024 12:15,2024-06-20 17:53,
OBCS-1374,OD-1754,Stock de congés : Médaille d'honneur,"Intégration de l’option médaille d’honneur dans le fichier du personnel, qui sera par défaut décoché.

Si l’employé en question a reçu une médaille d’honneur, on devra rajouté automatiquement *1 jour de congé sur son stock de congé chaque année.*

PS : Par exemple, si l’employé, reçoit une médaille d’honneur au mois de Décembre 2024, on rajoutera 1 jour sur son ancienneté de la même année. A janvier 2025, 1 jour ainsi de suite pour chaque année.
",Vivien DAKPOGAN,,KOFFI & DIABATE,,En présentiel,RH,Gestion employé,Requêtes,Non renseigné,OBC Customer Support,Priorité 1,À faire,2024-06-12 10:35,12/6/2024 10:35,,
OBCS-1362,OD-1743,Export Journal général,"Une page blanche apparait lorsqu’on veut exporter un journal général

",Vivien DAKPOGAN,Brahima COULIBALY,KORI TRANSPORT,,Appel Téléphonique,Finance,Comptabilité Générale,Bug,Export de données impossible,OBC Customer Support,Priorité 3,Terminé(e),2024-06-10 17:20,11/6/2024 09:49,2024-06-11 09:49,
OBCS-1358,OD-1739,Impossible d'enregistrer un bordereau d'entrée car le code de bon affiché est un code ayant été déjà utilisé,Impossible d'enregistrer un bordereau d'entrée car le code de bon affiché est un code ayant été déjà utilisé,N'GBRA MOYE BERNICE DORIS,KALOGO Nabarakissa,S-TEL,,Chat WhatsApp,Opérations,Gestion de stock,Bug,Enregistrement impossible,OBC Customer Support,Priorité 1,Terminé(e),2024-06-10 11:05,4/7/2024 08:35,2024-07-04 08:35,
OBCS-1361,OD-1742,"Ne pas arrondi les montants des valeurs étrangères lors de l'édition des bons de commandes,factures.....","Ne pas arrondi les montants des valeurs étrangères lors de l'édition des bons de commandes,factures.....",EVA BASSE,Constant KINDOHO,KOFFI & DIABATE,,Appel Téléphonique,Opérations,Achat,Requêtes,Non renseigné,OBC Customer Support,Priorité 1,À faire,2024-06-10 15:55,10/6/2024 15:55,,
OBCS-1360,OD-1741,Assigner le personnel par type de staffing et attribuer automatiquement les tâches selon ce staffing,"Assigner le personnel par type de staffing et attribuer automatiquement les tâches selon ce staffing

",EVA BASSE,,KOFFI & DIABATE,Team Projet,En présentiel,Projets,Gérer mes projets,Requêtes,Non renseigné,OBC Customer Support,Priorité 1,Terminé(e),2024-06-10 15:42,28/6/2024 10:38,2024-06-28 10:38,
OBCS-1359,OD-1740,Facture client avec la TVA exonéré à intégrer sur OBC,Facture client avec la TVA exonéré à intégrer sur OBC,N'GBRA MOYE BERNICE DORIS,ERIC KOUADIO,FALCON,,Appel Téléphonique,Opérations,Vente,Requêtes,Non renseigné,OBC Customer Support,Priorité 1,Terminé(e),2024-06-10 11:12,18/6/2024 06:49,2024-06-18 06:49,
OBCS-1313,OD-1736,"Sur le formulaire de Phases, on a le libellé ""Phase"" en lieu et place de ""Tâche""","Sur le formulaire de Phases, on a le libellé ""Phase"" en lieu et place de ""Tâche""",EVA BASSE,,KOFFI & DIABATE,,En présentiel,Projets,Gérer mes projets,Bug,Mauvais déversement des données,OBC Customer Support,Priorité 2,Terminé(e),2024-06-07 12:15,8/6/2024 15:47,2024-06-08 15:47,
OBCS-1307,OD-1729,"Quand on modifie un projet, les sous-traitants rattachés au projet sont différents de ceux apparaissant quand on clique sur ""détail"" (voir CAPTURE)","Quand on modifie un projet, les sous-traitants rattachés au projet sont différents de ceux apparaissant quand on clique sur ""détail"" (voir CAPTURE)",EVA BASSE,EMMANUEL KOUKPOLOU,KOFFI & DIABATE,,Appel Téléphonique,Projets,Gérer mes projets,Bug,Mauvais déversement des données,OBC Customer Support,Priorité 1,Terminé(e),2024-06-06 10:23,8/6/2024 15:51,2024-06-08 15:51,
OBCS-1308,OD-1730,Griser la ligne description lorqu'il s'agit du Type Achat ou Type de vente Stock,"Pour des mesures de sécurité et de cohérence, il est préférable de griser la ligne description.

Le constat est que généralement, les utilisateurs saisissent les articles au lieu de les sélectionner.

",Vivien DAKPOGAN,,KOFFI & DIABATE,,En présentiel,Opérations,Achat,Requêtes,Non renseigné,OBC Customer Support,Priorité 1,Terminé(e),2024-06-06 10:28,5/7/2024 08:39,2024-07-05 08:39,
OBCS-1304,OD-1728,Calcul des Arrondis automatique & Affichage dans le bulletin,"Bien que les paramétrages liés aux arrondies de paie soient définit dans l’entité du client, la rubrique n’apparait pas sur le bulletin.

*NB*: L’ajout ou le retrait des valeurs sont bien pris en compte avec un impacte sur le net de l’employé

",Edwige KOUASSI,,CIP,,Constat Interne,RH,Salaire,Bug,Dysfonctionnement sur le Calcul des salaires,OBC Customer Support,Priorité 1,Terminé(e),2024-06-05 18:40,8/7/2024 12:15,2024-06-12 19:07,
OBCS-1298,OD-1722,Ne pas rendre obligatoire la date fin réelle du projet à la création de celui-ci. Mais il peut être obligatoire lorsque le taux de réalisation est à 100%,"Ne pas rendre obligatoire la date fin réelle du projet à la création de celui-ci. Mais il peut être obligatoire lorsque le taux de réalisation est à 100%

",JOEL SIE,KALOGO Nabarakissa,S-TEL,,Appel Téléphonique,Projets,Identification des projets,Requêtes,Non renseigné,OBC Customer Support,Priorité 1,Terminé(e),2024-06-05 11:08,10/6/2024 19:50,2024-06-10 19:50,
OBCS-1297,OD-1721,Donner la possibilité de faire des filtres au niveau d'audit projet,"Mettre des filtres 

1- Achat: par montant, date

2- Opération de caisse: par montant, date

3- Etats stock: par montant, date",JOEL SIE,KALOGO Nabarakissa,S-TEL,,Appel Téléphonique,Projets,Analytique,Requêtes,Non renseigné,OBC Customer Support,Priorité 2,Terminé(e),2024-06-05 10:55,25/6/2024 08:55,2024-06-25 08:55,
OBCS-1290,OD-1715,"Lorsqu'on selectionne sur la bas de travail l'exercice 20219, 2020, 2021 et 2022 aucune donnée ne s'affiche dans l'historique des factures achats. Entité OCG","Lorsqu'on selectionne sur la bas de travail l'exercice 20219, 2020, 2021 et 2022 aucune donnée ne s'affiche dans l'historique des factures achats.",JOEL SIE,Ursula YANGANGOUSSOU,ONPOINT,,En présentiel,Support,Administration Système,Bug,Autres,OBC Customer Support,Priorité 1,Terminé(e),2024-06-03 11:15,5/6/2024 16:28,2024-06-05 16:28,
OBCS-1289,OD-1714,"En historique des projets, le filtre ""type de projet "" ne fais pas apparaitre les informations (voir capture)","En historique des projets, le filtre ""type de projet "" ne fais pas apparaitre les informations (voir capture)",EVA BASSE,Jacob N'DJAN,KOFFI & DIABATE,,Appel Téléphonique,Projets,Gérer mes projets,Bug,Mauvais déversement des données,OBC Customer Support,Priorité 2,Terminé(e),2024-06-03 10:29,6/6/2024 15:53,2024-06-06 15:53,
OBCS-1288,OD-1713,"A la modification d'une demande d'absence, un message d'erreur apparait (voir capture)","A la modification, d'une demande d'absence, un message d'erreur apparait (voir capture)",EVA BASSE,,KOFFI & DIABATE,,En présentiel,RH,Gestion employé,Bug,Page d'erreur,OBC Customer Support,Priorité 2,Terminé(e),2024-06-03 10:16,5/6/2024 17:45,2024-06-05 17:45,
OBCS-1285,OD-1711,L'historique de congés et autres absences affiche des employés non enregistrés et à la modification l'employé sensé être enregistré réapparait,L'historique de congés et autres absences affiche des employés non enregistrés et à la modification l'employé sensé être enregistré réapparait,N'GBRA MOYE BERNICE DORIS,Ursula YANGANGOUSSOU,ONPOINT,,En présentiel,RH,Gestion employé,Bug,Mauvais déversement des données,OBC Customer Support,Priorité 1,Terminé(e),2024-06-03 09:51,5/6/2024 16:30,2024-06-05 16:30,
OBCS-1281,OD-1707,"L'orsqu'on édite plusieurs comptes de resultats et plusieurs bilans, Il récupère que le resultat le resultat du premier compte de résultat calculé quelque soit le bilan que l'on veut éditer","L'orsqu'on édite plusieurs comptes de resultats et plusieurs bilans, Il récupère que le resultat le resultat du premier compte de résultat calculé quelque soit le bilan que l'on veut éditer.

Permettre la récupération du résultat selon la période du bilan",JOEL SIE,Ousseyni Oumarou,EJARA,,Appel Téléphonique,Finance,Comptabilité Générale,Bug,Autres,OBC Customer Support,Priorité 1,Terminé(e),2024-05-31 10:40,31/5/2024 12:49,2024-05-31 12:49,
OBCS-1268,OD-1696,Lorsque je clique sur une opportunité (CRM > Gestion des opportunités) il est impossible de voir l'onglet offre (type général) et le formulaire de devis (onglet devis) dans les opportunités créées avec mes rôles.,"* Lorsque je clique sur une opportunité (CRM > Gestion des opportunités) il est impossible de voir l'onglet offre (type général) et le formulaire de devis (onglet devis) dans les opportunités créées avec mes rôles. 

",JOEL SIE,FABIEN VATI,ONPOINT,,E-mail,CRM,Activités commerciales,Bug,Autres,OBC Customer Support,Priorité 1,Terminé(e),2024-05-29 15:34,17/7/2024 17:54,2024-07-17 17:54,
OBCS-1265,OD-1693,Impossible d'enregistrer un projet,Impossible d'enregistrer un projet,EVA BASSE,Jacob N'DJAN,KOFFI & DIABATE,,Appel Téléphonique,Projets,Gérer mes projets,Bug,Enregistrement impossible,OBC Customer Support,Priorité 1,Terminé(e),2024-05-29 11:25,31/5/2024 17:59,2024-05-31 17:59,
OBCS-1276,OD-1702,Ajouter une adresse LinkedIn cliquable pour chaque contact afin de faciliter la redirection vers leur contenu LinkedIn. (CRM>Gestion des contacts>Historique),"* Ajouter une adresse LinkedIn cliquable pour chaque contact afin de faciliter la redirection vers leur contenu LinkedIn. (CRM>Gestion des contacts>Historique)

",JOEL SIE,FABIEN VATI,ONPOINT,,E-mail,CRM,Client,Requêtes,Non renseigné,OBC Customer Support,Priorité 1,Terminé(e),2024-05-30 18:48,31/5/2024 17:29,2024-05-31 17:29,
OBCS-1275,OD-1701,"Dans la fonctionnalité ""CRM > gestion des contacts > historique"", donner la possibilité de savoir directement à quel client appartient un contact.","* Dans la fonctionnalité ""CRM > gestion des contacts > historique"", donner la possibilité de savoir directement à quel client appartient un contact.

",JOEL SIE,FABIEN VATI,ONPOINT,,E-mail,CRM,Client,Requêtes,Non renseigné,OBC Customer Support,Priorité 1,Terminé(e),2024-05-30 18:46,31/5/2024 17:30,2024-05-31 17:30,
OBCS-1274,OD-1700,"Il est impossible de différencier les prospects des clients sur la carte (map) dans ""CRM > Analytique > Onglet CLIENT"".","* Il est impossible de différencier les prospects des clients sur la carte (map) dans ""CRM > Analytique > Onglet CLIENT"".

",JOEL SIE,FABIEN VATI,ONPOINT,,E-mail,CRM,Client,Requêtes,Non renseigné,OBC Customer Support,Priorité 1,Terminé(e),2024-05-30 18:44,31/5/2024 17:31,2024-05-31 17:31,
OBCS-1264,OD-1692,Données non récupérées (Export + historique),"Sur l’historique des articles, la référence interne n’affiche pas. A l’export des données Excel, la référence reste vide.

",Vivien DAKPOGAN,,KOFFI & DIABATE,,En présentiel,Opérations,Gestion de stock,Bug,Historique vide/non exhaustif,OBC Customer Support,Priorité 1,Terminé(e),2024-05-28 12:14,28/5/2024 17:03,2024-05-28 17:03,
OBCS-1263,OD-1691,Faire la mise à jour du calcul ITS (Paie BENIN) selon le nouveau barème.,"{adf:display=block}
{""type"":""table"",""attrs"":{""isNumberColumnEnabled"":false,""layout"":""default"",""localId"":""860213b7-7a90-4730-8146-c743a66b5e68""},""content"":[{""type"":""tableRow"",""content"":[{""type"":""tableCell"",""attrs"":{""colspan"":2},""content"":[{""type"":""paragraph"",""content"":[{""type"":""text"",""text"":"" SALAIRE BRUT NON ARRONDI (""},{""type"":""text"",""text"":""Exemple"",""marks"":[{""type"":""textColor"",""attrs"":{""color"":""#ff5630""}}]},{""type"":""text"",""text"":"")""}]}]},{""type"":""tableCell"",""attrs"":{},""content"":[{""type"":""paragraph"",""content"":[{""type"":""text"",""text"":""                   2 848 829  ""}]}]},{""type"":""tableCell"",""attrs"":{},""content"":[{""type"":""paragraph"",""content"":[]}]}]},{""type"":""tableRow"",""content"":[{""type"":""tableCell"",""attrs"":{},""content"":[{""type"":""paragraph"",""content"":[{""type"":""text"",""text"":"" SALAIRE BRUT ARRONDI ""}]}]},{""type"":""tableCell"",""attrs"":{},""content"":[{""type"":""paragraph"",""content"":[{""type"":""text"",""text"":""              2 848 000  ""}]}]},{""type"":""tableCell"",""attrs"":{},""content"":[{""type"":""paragraph"",""content"":[]}]},{""type"":""tableCell"",""attrs"":{},""content"":[{""type"":""paragraph"",""content"":[]}]}]},{""type"":""tableRow"",""content"":[{""type"":""tableCell"",""attrs"":{},""content"":[{""type"":""paragraph"",""content"":[]}]},{""type"":""tableCell"",""attrs"":{},""content"":[{""type"":""paragraph"",""content"":[]}]},{""type"":""tableCell"",""attrs"":{},""content"":[{""type"":""paragraph"",""content"":[]}]},{""type"":""tableCell"",""attrs"":{},""content"":[{""type"":""paragraph"",""content"":[]}]}]},{""type"":""tableRow"",""content"":[{""type"":""tableCell"",""attrs"":{""colspan"":2},""content"":[{""type"":""paragraph"",""content"":[{""type"":""text"",""text"":"" DETERMINATION DE L'IPTS BRUT ""}]}]},{""type"":""tableCell"",""attrs"":{},""content"":[{""type"":""paragraph"",""content"":[]}]},{""type"":""tableCell"",""attrs"":{},""content"":[{""type"":""paragraph"",""content"":[]}]}]},{""type"":""tableRow"",""content"":[{""type"":""tableCell"",""attrs"":{},""content"":[{""type"":""paragraph"",""content"":[]}]},{""type"":""tableCell"",""attrs"":{},""content"":[{""type"":""paragraph"",""content"":[]}]},{""type"":""tableCell"",""attrs"":{},""content"":[{""type"":""paragraph"",""content"":[]}]},{""type"":""tableCell"",""attrs"":{},""content"":[{""type"":""paragraph"",""content"":[]}]}]},{""type"":""tableRow"",""content"":[{""type"":""tableCell"",""attrs"":{},""content"":[{""type"":""paragraph"",""content"":[{""type"":""text"",""text"":"" Tranches ""}]}]},{""type"":""tableCell"",""attrs"":{},""content"":[{""type"":""paragraph"",""content"":[{""type"":""text"",""text"":"" Base de calcul ""}]}]},{""type"":""tableCell"",""attrs"":{},""content"":[{""type"":""paragraph"",""content"":[{""type"":""text"",""text"":"" Taux ""}]}]},{""type"":""tableCell"",""attrs"":{},""content"":[{""type"":""paragraph"",""content"":[{""type"":""text"",""text"":"" IPTS brut ""}]}]}]},{""type"":""tableRow"",""content"":[{""type"":""tableCell"",""attrs"":{},""content"":[{""type"":""paragraph"",""content"":[{""type"":""text"",""text"":"" 0 à 60000 ""}]}]},{""type"":""tableCell"",""attrs"":{},""content"":[{""type"":""paragraph"",""content"":[{""type"":""text"",""text"":""                   60 000  ""}]}]},{""type"":""tableCell"",""attrs"":{},""content"":[{""type"":""paragraph"",""content"":[{""type"":""text"",""text"":""0%""}]}]},{""type"":""tableCell"",""attrs"":{},""content"":[{""type"":""bulletList"",""content"":[{""type"":""listItem"",""content"":[{""type"":""paragraph"",""content"":[]}]}]}]}]},{""type"":""tableRow"",""content"":[{""type"":""tableCell"",""attrs"":{},""content"":[{""type"":""paragraph"",""content"":[{""type"":""text"",""text"":"" 60001 à 150000 ""}]}]},{""type"":""tableCell"",""attrs"":{},""content"":[{""type"":""paragraph"",""content"":[{""type"":""text"",""text"":""                   90 000  ""}]}]},{""type"":""tableCell"",""attrs"":{},""content"":[{""type"":""paragraph"",""content"":[{""type"":""text"",""text"":""10%""}]}]},{""type"":""tableCell"",""attrs"":{},""content"":[{""type"":""paragraph"",""content"":[{""type"":""text"",""text"":""                     9 000  ""}]}]}]},{""type"":""tableRow"",""content"":[{""type"":""tableCell"",""attrs"":{},""content"":[{""type"":""paragraph"",""content"":[{""type"":""text"",""text"":"" 150001 à 250000 ""}]}]},{""type"":""tableCell"",""attrs"":{},""content"":[{""type"":""paragraph"",""content"":[{""type"":""text"",""text"":""                 100 000  ""}]}]},{""type"":""tableCell"",""attrs"":{},""content"":[{""type"":""paragraph"",""content"":[{""type"":""text"",""text"":""15%""}]}]},{""type"":""tableCell"",""attrs"":{},""content"":[{""type"":""paragraph"",""content"":[{""type"":""text"",""text"":""                   15 000  ""}]}]}]},{""type"":""tableRow"",""content"":[{""type"":""tableCell"",""attrs"":{},""content"":[{""type"":""paragraph"",""content"":[{""type"":""text"",""text"":"" 250001 à 500000 ""}]}]},{""type"":""tableCell"",""attrs"":{},""content"":[{""type"":""paragraph"",""content"":[{""type"":""text"",""text"":""                 250 000  ""}]}]},{""type"":""tableCell"",""attrs"":{},""content"":[{""type"":""paragraph"",""content"":[{""type"":""text"",""text"":""20%""}]}]},{""type"":""tableCell"",""attrs"":{},""content"":[{""type"":""paragraph"",""content"":[{""type"":""text"",""text"":""                   50 000  ""}]}]}]},{""type"":""tableRow"",""content"":[{""type"":""tableCell"",""attrs"":{},""content"":[{""type"":""paragraph"",""content"":[{""type"":""text"",""text"":"" Plus de 500001 ""}]}]},{""type"":""tableCell"",""attrs"":{},""content"":[{""type"":""paragraph"",""content"":[{""type"":""text"",""text"":""              2 348 000  ""}]}]},{""type"":""tableCell"",""attrs"":{},""content"":[{""type"":""paragraph"",""content"":[{""type"":""text"",""text"":""30%""}]}]},{""type"":""tableCell"",""attrs"":{},""content"":[{""type"":""paragraph"",""content"":[{""type"":""text"",""text"":""                 704 400  ""}]}]}]},{""type"":""tableRow"",""content"":[{""type"":""tableCell"",""attrs"":{},""content"":[{""type"":""paragraph"",""content"":[{""type"":""text"",""text"":"" TOTAL ""}]}]},{""type"":""tableCell"",""attrs"":{},""content"":[{""type"":""paragraph"",""content"":[{""type"":""text"",""text"":""   2 848 000  ""}]}]},{""type"":""tableCell"",""attrs"":{},""content"":[{""type"":""paragraph"",""content"":[{""type"":""text"",""text"":"" ""}]}]},{""type"":""tableCell"",""attrs"":{},""content"":[{""type"":""paragraph"",""content"":[{""type"":""text"",""text"":""               778 400  ""}]}]}]}]}
{adf}

",EVA BASSE,Auguste QUENUM,KOFFI & DIABATE,,"Online (Google Meet, Teams...)",RH,Salaire,Requêtes,Non renseigné,OBC Customer Support,Priorité 1,Terminé(e),2024-05-28 11:40,30/5/2024 20:14,2024-05-30 20:14,
OBCS-1261,OD-1689,Message d'erreur - Enregistrement bordereau d'entrée lié à un stock initial,"A l’enregistrement d’un stock initial, il apparait un message d’erreur.
",Vivien DAKPOGAN,,KOFFI & DIABATE,,En présentiel,Opérations,Gestion de stock,Bug,Enregistrement impossible,OBC Customer Support,Priorité 1,Terminé(e),2024-05-27 19:29,29/5/2024 10:16,2024-05-29 10:16,
OBCS-1260,OD-1688,"Sur certaines listes, le filtre et les tris par ordre ne s’appliquent que par page d’affichage. ","Sur certaines listes, le filtre et les tris par ordre ne s’appliquent que par page d’affichage.
Ainsi lorsqu’on effectue un filtre, seuls les éléments de la page affichée sont pris en compte.

Exemple listing suivi stock",N'GBRA MOYE BERNICE DORIS,KALOGO Nabarakissa,S-TEL,,E-mail,Global,Global,Bug,Dysfonctionnement des filtres,OBC Customer Support,Priorité 2,Terminé(e),2024-05-27 11:22,4/9/2024 10:09,2024-09-04 10:09,Global
OBCS-1259,OD-1687,Impossible de procéder à la validation d’un bordereau de retour,Impossible de procéder à la validation d’un bordereau de retour,N'GBRA MOYE BERNICE DORIS,KALOGO Nabarakissa,S-TEL,,E-mail,Opérations,Gestion de stock,Bug,Dysfonctionnement des filtres,OBC Customer Support,Priorité 1,Terminé(e),2024-05-27 11:15,11/9/2024 09:27,2024-09-11 09:27,
OBCS-1258,OD-1686,Le magasin ne s’affiche pas dans l’historique des bordereaux de sortie,Le magasin ne s’affiche pas dans l’historique des bordereaux de sortie,N'GBRA MOYE BERNICE DORIS,KALOGO Nabarakissa,S-TEL,,E-mail,Opérations,Gestion de stock,Bug,Dysfonctionnement des filtres,OBC Customer Support,Priorité 1,Terminé(e),2024-05-27 11:13,22/8/2024 09:12,2024-08-22 09:12,
OBCS-1253,OD-1681,Les bons de livraison déjà entièrement rentrés dans le système figurent toujours dans la liste pour l’entrée dans le stock.,"Les bons de livraison déjà entièrement rentrés dans le système figurent toujours dans la liste pour l’entrée dans le stock.

",N'GBRA MOYE BERNICE DORIS,KALOGO Nabarakissa,S-TEL,,E-mail,Opérations,Gestion de stock,Bug,Mauvais déversement des données,OBC Customer Support,Priorité 3,Terminé(e),2024-05-27 10:59,4/7/2024 08:34,2024-07-04 08:34,
OBCS-1252,OD-1680,"Sur le calcul de la paie lorsqu'on veut definir les éléments variable par reférence, aucun employé ne s'affiche","Sur le calcul de la paie lorsqu'on veut definir les éléments variable par reférence, aucun employé ne s'affiche",JOEL SIE,Jean-Jacques LIKANE,LABOGEM,,Appel Téléphonique,RH,Salaire,Bug,Autres,OBC Customer Support,Priorité 1,En cours,2024-05-27 09:09,27/6/2024 15:39,,
OBCS-1257,OD-1685,Produire un état imprimable dans l’onglet rapport des sorties et entrées par type axe et axe analytique.,Produire un état imprimable dans l’onglet rapport des sorties et entrées par type axe et axe analytique.,N'GBRA MOYE BERNICE DORIS,KALOGO Nabarakissa,S-TEL,,E-mail,Opérations,Gestion de stock,Requêtes,Non renseigné,OBC Customer Support,Priorité 2,Terminé(e),2024-05-27 11:09,14/9/2025 16:02,2025-09-14 16:02,
OBCS-1256,OD-1684,Permettre le filtrage des demande de sortie par type axe et axe analytique.,Permettre le filtrage des demandes de sortie par type axe et axe analytique.,N'GBRA MOYE BERNICE DORIS,KALOGO Nabarakissa,S-TEL,,E-mail,Opérations,Gestion de stock,Requêtes,Non renseigné,OBC Customer Support,Priorité 2,Terminé(e),2024-05-27 11:07,5/2/2025 15:43,2025-02-05 15:43,
OBCS-1255,OD-1683,Ajouter ‘’Projet ‘’ dans la liste des motifs de sorties. Si possible inclure dans la nomenclature de la demande de sortie le code projet,Ajouter ‘’Projet ‘’ dans la liste des motifs de sorties. Si possible inclure dans la nomenclature de la demande de sortie le code projet,N'GBRA MOYE BERNICE DORIS,KALOGO Nabarakissa,S-TEL,,E-mail,Opérations,Gestion de stock,Requêtes,Non renseigné,OBC Customer Support,Priorité 2,Terminé(e),2024-05-27 11:04,4/7/2024 15:47,2024-07-04 15:47,
OBCS-1254,OD-1682,Etablir un workflow pour la validation de demande de sortie avec deux étapes (une première par le Responsable et l’autre par le gestionnaire de stock),Etablir un workflow pour la validation de demande de sortie avec deux étapes (une première par le Responsable et l’autre par le gestionnaire de stock),N'GBRA MOYE BERNICE DORIS,KALOGO Nabarakissa,S-TEL,,Appel Téléphonique,Opérations,Gestion de stock,Requêtes,Non renseigné,OBC Customer Support,Priorité 2,Terminé(e),2024-05-27 11:03,30/9/2024 09:41,2024-09-30 09:41,
OBCS-1251,OD-1679,Tous les secteurs d'activité se deverses dans le parametrage des grades en en plus ils sont dupliqué plusieurs fois,Tous les secteurs d'activité se deverses dans le parametrage des grades en en plus ils sont dupliqué plusieurs fois,JOEL SIE,M. ECARE,KORI TRANSPORT,,Appel Téléphonique,RH,Paramétrage,Bug,Duplication anormale,OBC Customer Support,Priorité 1,Terminé(e),2024-05-24 18:04,11/6/2024 09:47,2024-06-11 09:47,
OBCS-1249,OD-1677,Sénégal - Heure Supplémentaire : Revue de la formule,"La bonne formule est: taux horaire HS = (salaire de base + sursalaire + prime d'ancienneté) / 173.33 .


*PS : C'est aussi proratiser. Le taux horaire HS ainsi trouvé est majoré à 15%; 40%; 60% et à 100% suivant la plage horaire concernée.*",Vivien DAKPOGAN,BAKARY NDIAYE,SERTEM,,Chat WhatsApp,RH,Salaire,Requêtes,Non renseigné,OBC Customer Support,Priorité 1,Terminé(e),2024-05-21 18:58,13/6/2024 17:06,2024-06-13 17:06,
OBCS-1247,OD-1675,Les filtres au niveau du journal général présente un dysfonctionnement,Les filtres au niveau du journal général présente un dysfonctionnement,N'GBRA MOYE BERNICE DORIS,ERIC KOUADIO,FALCON,,Appel Téléphonique,Finance,Comptabilité Générale,Bug,Dysfonctionnement des filtres,OBC Customer Support,Priorité 1,Terminé(e),2024-05-17 19:19,23/5/2024 19:34,2024-05-23 19:34,
OBCS-1248,OD-1676,Rajouter une fonction box pour faire apparaitre le solde de caisse sur dashboard projet,Rajouter une fonction box pour faire apparaitre le solde de caisse c’est à dire Montant sorti -montant entré,N'GBRA MOYE BERNICE DORIS,KALOGO Nabarakissa,S-TEL,,Appel Téléphonique,Projets,Analytique,Requêtes,Non renseigné,OBC Customer Support,Priorité 2,Terminé(e),2024-05-17 19:22,23/5/2024 19:01,2024-05-23 19:01,
OBCS-1243,OD-1671,Possibilité de mondifier un encaissement client sur l'option ''Autre'' et prendre l'option facture,Possibilité de mondifier un encaissement client sur l'option ''Autre'' et prendre l'option facture,JOEL SIE,SEU ERIC,LABOGEM,,Appel Téléphonique,Opérations,Vente,Requêtes,Non renseigné,OBC Customer Support,Priorité 3,Terminé(e),2024-05-17 09:42,11/12/2024 09:17,2024-12-11 09:17,
OBCS-1242,OD-1670,Ne pas pas afficher toute la paie lorsque la paie est recalculée que pour certains employés mais afficher que ceux dont leur paie a été annulée et recalculée.,"Lorqu’on annule la paie d’une ou plusieurs personnes sur un mois et qu’on récalcul, à l’affichage il affiche toutes la paie au lieu d’afficher que le/les salaires annulés",JOEL SIE,Jean-Jacques LIKANE,LABOGEM,,En présentiel,RH,Salaire,Requêtes,Non renseigné,OBC Customer Support,Priorité 1,Terminé(e),2024-05-17 09:34,22/8/2024 11:46,2024-08-22 11:46,
OBCS-1245,OD-1673,Un message d'erreur apparait lors de la validation d'un bordereau de retour,Un message d'erreur apparait lors de la validation d'un bordereau de retour,N'GBRA MOYE BERNICE DORIS,KALOGO Nabarakissa,S-TEL,,Appel Téléphonique,Opérations,Gestion de stock,Bug,Page d'erreur,OBC Customer Support,Priorité 1,Terminé(e),2024-05-17 17:27,11/9/2024 09:18,2024-09-11 09:18,
OBCS-1241,OD-1668,"Rajout colonne ""Unité"" dans le fichier d'import","Mettre à jour le fichier d’import généré en intégrant la colonne “Unité”. Car sinon l’utilisateur doit à éditer chaque article et défini l’unité.

*PS : Décocher par défaut “Monnaie électronique” dans l’historique des articles après import.*",Vivien DAKPOGAN,,KOFFI & DIABATE,,En présentiel,Opérations,Gestion de stock,Requêtes,Non renseigné,OBC Customer Support,Priorité 1,Terminé(e),2024-05-16 11:16,29/8/2024 09:27,2024-08-29 09:27,
OBCS-1240,OD-1667,Sénégal : Revue récupération salaire de base pour heure supplémentaire,Nous avons un écart au niveau du montant des heures supplémentaires à cause du salaire de base qui est récupérée sur l’ancien et non sur le nouveau salaire de base revalorisé.,Vivien DAKPOGAN,BAKARY NDIAYE,SERTEM,,Chat WhatsApp,RH,Salaire,Bug,Erreur de calcul/Erreur sur Dashboard,OBC Customer Support,Priorité 3,Terminé(e),2024-05-15 19:15,16/5/2024 16:52,2024-05-16 16:52,
OBCS-1239,OD-1666,La liste de demande de sortie disponible dans le formulaire de bordereau de sortie fait apparaitre les demandes déjà utilisés,La liste de demande de sortie disponible dans le formulaire de bordereau de sortie fait apparaitre les demandes déjà utilisés,N'GBRA MOYE BERNICE DORIS,KALOGO Nabarakissa,S-TEL,,"Online (Google Meet, Teams...)",Opérations,Gestion de stock,Bug,Dysfonctionnement des filtres,OBC Customer Support,Priorité 1,Terminé(e),2024-05-15 16:16,16/5/2024 17:53,2024-05-16 17:53,
OBCS-1237,OD-1664,Les informations du bordereau de sortie et autres borderaux ne se déversent que lorsque le site est décoché et recoché a nouveau,Les informations du bordereau de sortie et autres bordereaux ne se déversent que lorsque le site est décoché et recoché a nouveau,N'GBRA MOYE BERNICE DORIS,KALOGO Nabarakissa,S-TEL,,"Online (Google Meet, Teams...)",Opérations,Gestion de stock,Bug,Mauvais déversement des données,OBC Customer Support,Priorité 1,Terminé(e),2024-05-15 15:58,5/6/2024 10:00,2024-06-05 10:00,
OBCS-1236,OD-1663,"Dans le formulaire de bon de livraison, lorsqu'on choisi le bon de commande, le montant récupéré est HT","Dans le formulaire de bon de livraison, lorsqu'on choisi le bon de commande, le montant récupéré est HT",EVA BASSE,Brahima COULIBALY,KORI TRANSPORT,,Appel Téléphonique,Opérations,Achat,Bug,Mauvais déversement des données,OBC Customer Support,Priorité 1,Terminé(e),2024-05-15 13:53,31/12/2024 07:53,2024-12-31 07:53,
OBCS-1234,OD-1661,Mauvais déversement des données au niveau des PMUP récupérés à chaque sortie d'articles,"Mauvais déversement des données au niveau des PMUP récupérés à chaque sortie d'articles

Exemple : L’article panneaux solaires se retrouve ave différents PMUP.",N'GBRA MOYE BERNICE DORIS,KALOGO Nabarakissa,S-TEL,,Appel Téléphonique,Opérations,Gestion de stock,Bug,Mauvais déversement des données,OBC Customer Support,Priorité 1,Terminé(e),2024-05-15 08:59,12/8/2024 10:13,2024-08-12 10:13,
OBCS-1233,OD-1660,Le type de construction change après enregistrement d'un programme btp,"Le type de construction change après enregistrement d'un programme btp

Exemple : Pour un type terrain nu choisit après l’enregistrement il devient gros oeuvre ",N'GBRA MOYE BERNICE DORIS,Amary TCHOTCHE,EGBV,,Appel Téléphonique,CRM,Offres,Bug,Mauvais déversement des données,OBC Customer Support,Priorité 1,Terminé(e),2024-05-14 17:14,17/5/2024 17:39,2024-05-17 17:39,
OBCS-1231,OD-1658,Intégration des reporting de KD,Intégration des reporting de KD,EVA BASSE,Natasha DELAGE,KOFFI & DIABATE,,En présentiel,CRM,Analytique,Requêtes,Non renseigné,OBC Customer Support,Priorité 1,À faire,2024-05-13 17:31,13/5/2024 17:31,,
OBCS-1230,OD-1657,Intégrer tous les documents CRM de KD,Intégrer tous les documents CRM de KD,EVA BASSE,Marilyne SINAMA,KOFFI & DIABATE,,En présentiel,CRM,Activités commerciales,Requêtes,Non renseigné,OBC Customer Support,Priorité 1,À faire,2024-05-13 17:27,19/8/2025 18:11,,
OBCS-1229,OD-1656,"Donner la possibilité de catégoriser les clients ( clients chauds,froids...)","Donner la possibilité de catégoriser les clients ( clients chauds,froids...)",EVA BASSE,Marilyne SINAMA,KOFFI & DIABATE,,En présentiel,CRM,Client,Requêtes,Non renseigné,OBC Customer Support,Priorité 1,Terminé(e),2024-05-13 17:25,31/1/2025 09:26,2025-01-31 09:26,
OBCS-1226,OD-1653,Afficher les prix et les libelles des programmes au niveau du choix à faire lors de l'enregistrement d'une offre BTP,Afficher les prix et les libelles des programmes au niveau du choix à faire lors de l'enregistrement d'une offre BTP,N'GBRA MOYE BERNICE DORIS,MADAME CISSE,EGBV,,En présentiel,CRM,Offres,Requêtes,Non renseigné,OBC Customer Support,Priorité 1,À faire,2024-05-13 16:05,27/6/2024 10:25,,
OBCS-1224,OD-1651,La conversion des heures travaillées n'est pas cohérente. Certaines personnes ayant plus de 8 heures de travail il met moins d'un jour de travail,La conversion des heures travaillées n'est pas cohérente. Certaines personnes ayant plus de 8 heures de travail il met moins d'un jour de travail,JOEL SIE,Delphin Zoungrana,ONPOINT,,En présentiel,RH,Gestion employé,Bug,Autres,OBC Customer Support,Priorité 1,Terminé(e),2024-05-10 12:20,9/7/2024 09:37,2024-07-09 09:37,
OBCS-1218,OD-1645,"Aucune donnée ne se déverse dans les fonctionnalités ""poste du compte de résultat"" et ""poste du bilan""","Aucune donnée ne se déverse dans les fonctionnalités ""poste du compte de résultat"" et ""poste du bilan""",EVA BASSE,Auguste QUENUM,KOFFI & DIABATE,,Appel WhatsApp,Finance,Comptabilité Générale,Bug,Mauvais déversement des données,OBC Customer Support,Priorité 1,Terminé(e),2024-05-10 11:27,10/5/2024 21:08,2024-05-10 21:08,
OBCS-1217,OD-1644,"Lors de la validation des Bons de commande, les conditions de règlements ne s'affichent pas dans la partie (Voir détail)",Lors de la validation des Bons de commande le validateur ne voit pas les conditions de règlements dans la partie Voir détail,N'GBRA MOYE BERNICE DORIS,KALOGO Nabarakissa,S-TEL,,Chat SMS,Opérations,Achat,Bug,Mauvais déversement des données,OBC Customer Support,Priorité 1,Terminé(e),2024-05-10 10:50,13/5/2024 08:53,2024-05-13 08:53,
OBCS-1225,OD-1652,Impossible de lancer la paie avec 0 jour travaillé. (Point très urgent pour le client),Impossible de lancer la paie avec 0 jour travaillé.,JOEL SIE,M. ECARE,KORI TRANSPORT,,Appel Téléphonique,RH,Salaire,Requêtes,Non renseigné,OBC Customer Support,Priorité 1,Terminé(e),2024-05-10 14:52,19/6/2024 11:27,2024-06-19 11:27,
OBCS-1223,OD-1650,"Avoir date de fin ajustée"" qui matérialisera le date de fin réelle du projet","Avoir date de fin ajustée"" qui matérialisera le date de fin réelle du projet",EVA BASSE,,KOFFI & DIABATE,Team Projet,En présentiel,Projets,Gérer mes projets,Requêtes,Non renseigné,OBC Customer Support,Priorité 2,Terminé(e),2024-05-10 12:16,30/5/2024 20:14,2024-05-30 20:14,
OBCS-1222,OD-1649,Avoir la possibilité d'intégrer les modèles de factures ventes ci-joint,Avoir la possibilité d'intégrer les modèles de factures ventes ci-joint,EVA BASSE,LYTA KENA-RABE,KOFFI & DIABATE,,En présentiel,Opérations,Vente,Requêtes,Non renseigné,OBC Customer Support,Priorité 3,À faire,2024-05-10 12:11,10/5/2024 12:11,,
OBCS-1221,OD-1648,Avoir la possibilité de sélectionner plusieurs années afin d'avoir les infos cumulées de ces années,Avoir la possibilité de sélectionner plusieurs années afin d'avoir les infos cumulées de ces années,EVA BASSE,KADIA KOFFI,KOFFI & DIABATE,,En présentiel,Projets,Analytique,Requêtes,Non renseigné,OBC Customer Support,Priorité 2,À faire,2024-05-10 11:41,10/5/2024 11:42,,
OBCS-1215,OD-1642,Duplication Régime - Contrat Journalier,Duplication des régimes dans les contrats journaliers,Edwige KOUASSI,,CIP,,Constat Interne,RH,Gestion employé,Bug,Duplication anormale,OBC Customer Support,Priorité 1,Terminé(e),2024-05-08 17:51,8/7/2024 12:15,2024-05-17 17:17,
OBCS-1213,OD-1640,"Il est impossible de rajouter des tâches sur des projets pour lesquelles on avait déjà des tâches enregistrer (Fonctionnalité ""gestion des projets"")","Il est impossible de rajouter des tâches sur des projets pour lesquelles on avait déjà des tâches enregistrer (Fonctionnalité ""gestion des projets"")",EVA BASSE,LYDIE N'GUESSAN,KOFFI & DIABATE,,En présentiel,Projets,Gérer mes projets,Bug,Mauvais déversement des données,OBC Customer Support,Priorité 1,Terminé(e),2024-05-08 11:48,10/5/2024 10:44,2024-05-10 10:44,
OBCS-1212,OD-1639,Impossible de supprimer un projet,Impossible de supprimer un projet,EVA BASSE,Jacob N'DJAN,KOFFI & DIABATE,,En présentiel,Projets,Gérer mes projets,Bug,Page d'erreur,OBC Customer Support,Priorité 1,Terminé(e),2024-05-08 11:42,15/5/2024 08:05,2024-05-10 10:45,
OBCS-1210,OD-1637,La correction de l’onglet d’ajout de sous projet ( ajout impossibles depuis certains jours ),"*La correction de l’onglet d’ajout de sous projet* ( ajout impossibles depuis certains jours )

",N'GBRA MOYE BERNICE DORIS,KALOGO Nabarakissa,S-TEL,,Appel Téléphonique,Projets,Gérer mes projets,Bug,Edition impossible,OBC Customer Support,Priorité 1,Terminé(e),2024-05-08 09:05,13/5/2024 17:31,2024-05-13 17:31,
OBCS-1208,OD-1635,Les corrections de l’onglet engagement sous-traitant,"*Les corrections de l’onglet engagement sous-traitant*

",N'GBRA MOYE BERNICE DORIS,KALOGO Nabarakissa,S-TEL,,Appel Téléphonique,Projets,Analytique,Bug,Mauvais déversement des données,OBC Customer Support,Priorité 2,Terminé(e),2024-05-08 09:02,14/5/2024 10:47,2024-05-14 10:47,
OBCS-1214,OD-1641,Avoir la possibilité de dupliquer un projet d'une entité à une autre comme pour les phases,Avoir la possibilité de dupliquer un projet d'une entité à une autre comme pour les phases,EVA BASSE,Jacob N'DJAN,KOFFI & DIABATE,,En présentiel,Projets,Gérer mes projets,Requêtes,Non renseigné,OBC Customer Support,Priorité 2,Terminé(e),2024-05-08 12:51,15/5/2024 09:52,2024-05-15 09:52,
OBCS-1211,OD-1638,Documents RH : Intégration des Documents RH,Intégration des Documents RH des entités K&D,Vivien DAKPOGAN,Corinne LADJI,KOFFI & DIABATE,,En présentiel,RH,Documents,Requêtes,Non renseigné,OBC Customer Support,Priorité 1,À faire,2024-05-08 10:34,8/5/2024 10:34,,
OBCS-1209,OD-1636,La prise en compte des opérations de retour de caisse dans le point des opérations de caisses sur projet,"*La prise en compte des opérations de retour de caisse dans le point des opérations de caisses sur projet*

",N'GBRA MOYE BERNICE DORIS,KALOGO Nabarakissa,S-TEL,,Appel Téléphonique,Projets,Analytique,Requêtes,Non renseigné,OBC Customer Support,Priorité 2,Terminé(e),2024-05-08 09:04,14/5/2024 10:46,2024-05-14 10:46,
OBCS-1197,OD-1624,Impossible d'exporter les timesheets,A l’export des timesheets aucune feuille excel n’est générée,N'GBRA MOYE BERNICE DORIS,Ursula YANGANGOUSSOU,ONPOINT,,En présentiel,Projets,Feuille de temps,Bug,Mauvais déversement des données,OBC Customer Support,Priorité 2,Terminé(e),2024-05-07 10:00,17/5/2024 15:57,2024-05-15 07:45,
OBCS-1194,OD-1621,"L'utilisateur n'ayant pas les accès ""admis"", ne voit rien dans l'historique des opportunités. Même ses propres opportunités crées","L'utilisateur n'ayant pas les accès ""admis"", ne voit rien dans l'historique des opportunités. Même ses propres opportunités crées",EVA BASSE,FABIEN VATI,ONPOINT,,En présentiel,CRM,Pilotage commercial,Bug,Historique vide/non exhaustif,OBC Customer Support,Priorité 2,Terminé(e),2024-05-06 19:13,8/5/2024 10:07,2024-05-08 10:07,
OBCS-1190,OD-1617,Impossible de calculer les salaires occasionnel sans les heures supplementaires,Impossible de calculer les salaires occasionnel sans les heures supplementaires,JOEL SIE,Ursula YANGANGOUSSOU,ONPOINT,,E-mail,RH,Salaire,Bug,Autres,OBC Customer Support,Priorité 1,Terminé(e),2024-05-06 11:33,10/5/2024 21:21,2024-05-10 21:21,
OBCS-1196,OD-1623,Avoir la possibilité d'accorder une année d'ancienneté de plus à un employé le 12ème mois d'exercice de fonction,"Exemple:

Si on commence à compter à partir de Janvier, en décembre l’ancienneté sera accordé à l’employé et non en Janvier de l’année N+1",EVA BASSE,,FIRST CAPITAL,,En présentiel,RH,Salaire,Requêtes,Non renseigné,OBC Customer Support,Priorité 3,Terminé(e),2024-05-06 19:32,10/5/2024 21:16,2024-05-10 21:16,
OBCS-1191,OD-1618,Donner la possibilité de modifier les écritures importé,"Donner la possibilité de modifier les écritures importé.

",Edwige KOUASSI,Marius KOFFI; GAHI lezou,ONPOINT,,Appel Téléphonique,Finance,Comptabilité Générale,Requêtes,Non renseigné,OBC Customer Support,Priorité 1,Terminé(e),2024-05-06 12:15,8/7/2024 12:15,2024-05-10 21:06,
OBCS-1192,OD-1619,"Lorsque clique sur ""utiliser les phases"" dans gestion de projets, les phases ne se déversent pas en ordre","Lorsque clique sur ""utiliser les phases"" dans gestion de projets, les phases ne se déversent pas en ordre",EVA BASSE,,KOFFI & DIABATE,Team Projet,En présentiel,Projets,Gérer mes projets,Bug,Mauvais déversement des données,OBC Customer Support,Priorité 2,Terminé(e),2024-05-06 16:55,7/5/2024 18:27,2024-05-07 18:27,
OBCS-1188,OD-1615,La demande de sortie validée n'apparait pas dans la liste au niveau de la saisie de bordereau de sortie,La demande de sortie validée n'apparait pas dans la liste au niveau de la saisie de bordereau de sortie,N'GBRA MOYE BERNICE DORIS,MONSIEUR ADOU,EGBV,,Appel Téléphonique,Opérations,Gestion de stock,Bug,Enregistrement impossible,OBC Customer Support,Priorité 2,Terminé(e),2024-05-03 18:24,21/5/2024 08:33,2024-05-21 08:33,
OBCS-1187,OD-1614,La ventilation analytique de certaines factures est impossible car au niveau des montants apparait NAN,La ventilation analytique de certaines factures est impossible car au niveau des montants apparait NAN,N'GBRA MOYE BERNICE DORIS,MONSIEUR KOUASSI,FALCON,,Appel Téléphonique,Finance,Comptabilité Générale,Bug,Enregistrement impossible,OBC Customer Support,Priorité 2,Terminé(e),2024-05-03 17:42,29/5/2024 16:21,2024-05-29 16:21,
OBCS-1193,OD-1620,Export Gant Chart,Export Gant Chart,EVA BASSE,,KOFFI & DIABATE,Team Projet,En présentiel,Projets,Gérer mes projets,Requêtes,Non renseigné,OBC Customer Support,Priorité 3,Terminé(e),2024-05-06 16:58,13/5/2024 19:52,2024-05-08 09:17,
OBCS-1189,OD-1616,Matricule Grisé - Fichier du personnel,Impossible d’enregistrer un fichier du personnel pour les agents enquêteurs. Donnez la main pour saisir le matricule,Vivien DAKPOGAN,Gaelle TOURE,ONPOINT,,E-mail,RH,Gestion employé,Requêtes,Non renseigné,OBC Customer Support,Priorité 1,Terminé(e),2024-05-03 19:15,3/5/2024 19:27,2024-05-03 19:27,
OBCS-1186,OD-1613,Fonctionnalité Suivi Planning Projets,"Avoir la possibilité d’avoir un lien dédié au suivi du planning Projets en générant un Gannt Chart.

",Vivien DAKPOGAN,,KOFFI & DIABATE,,En présentiel,Projets,Gérer mes projets,Requêtes,Non renseigné,OBC Customer Support,Priorité 2,Terminé(e),2024-05-03 08:08,13/5/2024 18:16,2024-05-13 18:16,
OBCS-1181,OD-1608,Sénégal : Mauvais Récupération Ancienneté :,"Malgré le Paramétrage avec pour choix : Après Date d’anniversaire, on constate que pour un salarié qui a 4 ans d’ancienneté en Avril. Déjà en avril il prend en compte les 4 ans, au lieu de le récupéré plutôt dans le mois de Mai

",Vivien DAKPOGAN,BAKARY NDIAYE,SERTEM,,Chat WhatsApp,RH,Documents,Bug,Erreur de calcul/Erreur sur Dashboard,OBC Customer Support,Priorité 3,Terminé(e),2024-05-02 17:50,7/5/2024 18:46,2024-05-03 18:21,
OBCS-1184,OD-1611,Trimf : Mise à jour calcul,"Il faut ajouter dans la formule de calcul de la trimf que *si le brut mensuel est supérieur à 5millions prendre la trimf correspondant à un brut de 5millions.*

",Vivien DAKPOGAN,BAKARY NDIAYE,SERTEM,,Chat WhatsApp,RH,Salaire,Requêtes,Non renseigné,OBC Customer Support,Priorité 1,Terminé(e),2024-05-03 07:42,7/5/2024 11:04,2024-05-03 19:18,
OBCS-1180,OD-1607,Possibilité de récupérer le réalisé de la paie des journaliers à partir des timeshit dès l'enregistrement de leurs enregistrement sans attentdre le lancement de la paie,Possibilité de récupérer le réalisé de la paie des journaliers à partir des timeshit dès l'enregistrement de leurs enregistrement sans attentdre le lancement de la paie.,JOEL SIE,Delphin Zoungrana,ONPOINT,,En présentiel,Finance,Budget,Requêtes,Non renseigné,OBC Customer Support,Priorité 2,À faire,2024-05-02 11:01,27/6/2024 15:39,,
OBCS-1179,OD-1606,Possibilité de récupérer les expenses dans le réalisé du budget avant le paiement,Les expenses sont payés à une date ultérieur alors que la charge doit être constatée d’avance. De ce fait il faut pouvoir récupérer les expenses dès leurs enregistrement.,JOEL SIE,Delphin Zoungrana,ONPOINT,,En présentiel,Finance,Budget,Requêtes,Non renseigné,OBC Customer Support,Priorité 1,À faire,2024-05-02 10:55,27/6/2024 15:39,,
OBCS-1178,OD-1605,Lorsqu'on enregistre une opération d'approvisionnement ou de nivellement la contrepartie de l'écriture générée à la banque utilise le même numéro d'imputation de la caisse sans tenir compte des numéros d'imputation existant dans le journal banque.,Lorsqu'on enregistre une opération d'approvisionnement ou de nivellement la contrepartie de l'écriture générée à la banque utilise le même numéro d'imputation de la caisse sans tenir compte des numéros d'imputation existant dans le journal banque. De ce fait les numéros d’imputation dans le journal banque ne se suivent pas. Donc tenir compte du dernier numéro d’imputation pour générer le numéro d’imputation et non utiliser le même que la caisse,JOEL SIE,Brahima COULIBALY,KORI TRANSPORT,,En présentiel,Finance,Comptabilité Générale,Bug,Autres,OBC Customer Support,Priorité 1,Terminé(e),2024-04-30 18:36,17/5/2024 09:45,2024-05-17 09:45,
OBCS-1167,OD-1594,Mauvais déversement des données dans le bordereau de sortie lorsqu'on sélectionne une demande de sortie de certains articles,Mauvais déversement des données dans le bordereau de sortie lorsqu'on sélectionne une demande de sortie de certains articles,N'GBRA MOYE BERNICE DORIS,MONSIEUR ADOU,EGBV,,Appel Téléphonique,Opérations,Gestion de stock,Bug,Mauvais déversement des données,OBC Customer Support,Priorité 1,Terminé(e),2024-04-30 09:23,7/5/2024 19:22,2024-05-07 19:22,
OBCS-1185,OD-1612,Permettre que la description du projet soit le Titre du projet + Code projet,Permettre que la description du projet soit le Titre du projet + Code projet,EVA BASSE,KADIA KOFFI,KOFFI & DIABATE,,"Online (Google Meet, Teams...)",Projets,Gérer mes projets,Requêtes,Non renseigné,OBC Customer Support,Priorité 1,Terminé(e),2024-05-03 08:08,3/5/2024 08:18,2024-05-03 08:18,
OBCS-1177,OD-1604,Possibilité d'ajouter des lignes à l'enregistrement des notes de debit/Crédit,A l’enregistrement des notes de débit ou de crédit il n’est possible d’ajouter plusieurs lignes dans le même formulaire avant d’enregistrer,JOEL SIE,Brahima COULIBALY,KORI TRANSPORT,,En présentiel,Finance,Comptabilité Générale,Requêtes,Non renseigné,OBC Customer Support,Priorité 2,À faire,2024-04-30 18:19,27/6/2024 15:39,,
OBCS-1174,OD-1601,"Pour la définition de l'état d'avancement des tâches, donner la possibilité aux employés de ne voir que les tâches des projets sur lesquels ils ont été staffé et rendre impossible l'édition des tâches sur lesquels ils ne sont pas staffés","Pour la définition de l'état d'avancement des tâches, donner la possibilité aux employés de ne voir que les tâches des projets sur lesquels ils ont été staffé et rendre impossible l'édition des tâches sur lesquels ils ne sont pas staffés",EVA BASSE,,KOFFI & DIABATE,Team Projet,En présentiel,Projets,Gérer mes tâches,Requêtes,Non renseigné,OBC Customer Support,Priorité 1,Terminé(e),2024-04-30 14:45,30/5/2024 20:14,2024-05-30 20:14,
OBCS-1171,OD-1598,"Ajouter dans le formulaire ""objectif commerciaux"" le nombre d'appels effectué par un commercial","Ajouter dans le formulaire ""objectif commerciaux"" le nombre d'appels effectué par un commercial",N'GBRA MOYE BERNICE DORIS,Madame ADJA,EGBV,,En présentiel,CRM,Pilotage commercial,Requêtes,Non renseigné,OBC Customer Support,Priorité 2,À faire,2024-04-30 09:32,27/6/2024 10:25,,
OBCS-1170,OD-1597,"Ajouter dans le formulaire ""objectif commerciaux"" le nombre d'adhésion effectué par un commercial","Ajouter dans le formulaire ""objectif commerciaux"" le nombre d'adhésion effectué par un commercial",N'GBRA MOYE BERNICE DORIS,Madame ADJA,EGBV,,En présentiel,CRM,Pilotage commercial,Requêtes,Non renseigné,OBC Customer Support,Priorité 2,À faire,2024-04-30 09:31,27/6/2024 10:25,,
OBCS-1172,OD-1599,"Lorsqu'on choisi défini une tâche dans la feuille de temps, après l'enregistrement on constate que la tâche disparait. Et cela persiste même après plusieurs mise à jour.","Lorsqu'on choisi défini une tâche dans la feuille de temps, après l'enregistrement on constate que la tâche disparait. Et cela persiste même après plusieurs mise à jour.",EVA BASSE,Thierno DIALLO,KOFFI & DIABATE,,"Online (Google Meet, Teams...)",Projets,Feuille de temps,Bug,Mauvais déversement des données,OBC Customer Support,Priorité 1,Terminé(e),2024-04-30 14:38,3/5/2024 07:55,2024-05-03 07:55,
OBCS-1173,OD-1600,"Lorsqu'on défini les responsables de tâche dans la fonctionnalité ""Gestion de projet"", faudrait que toute les informations se déversent par défaut dans la fonctionnalité ""staffing"" et qu'on ai la possibilité de rajouter du personnel au besoin","Lorsqu'on défini les responsables de tâche dans la fonctionnalité ""Gestion de projet"", faudrait que toute les informations se déversent par défaut dans la fonctionnalité ""staffing"" et qu'on ai la possibilité de rajouter du personnel au besoin",EVA BASSE,,KOFFI & DIABATE,,Constat Interne,Projets,Gérer mes projets,Requêtes,Non renseigné,OBC Customer Support,Priorité 1,Terminé(e),2024-04-30 14:43,3/6/2024 18:06,2024-06-03 18:06,
OBCS-1166,OD-1593,"Lorsqu'on effectue le staffing des employés, il faut impérativement choisir le calendrier pour définir la périodicité sinon il est impossible d'effectuer le staffing","Lorsqu'on effectue le staffing des employés, il faut impérativement choisir le calendrier pour définir la périodicité sinon il est impossible d'effectuer le staffing",EVA BASSE,Jeronime GBAGUIDI,KOFFI & DIABATE,,"Online (Google Meet, Teams...)",Projets,Gérer mes projets,Bug,Enregistrement impossible,OBC Customer Support,Priorité 3,Terminé(e),2024-04-26 16:00,30/4/2024 18:33,2024-04-30 18:33,
OBCS-1165,OD-1592,"Impossible d'enregistrer une demande d'absence. A la saisie de la date de début, on a un message qui s'affiche (voir capture joint)","Impossible d'enregistrer une demande d'absence. A la saisie de la date de début, on a un message qui s'affiche (voir capture joint)",EVA BASSE,Jeronime GBAGUIDI,KOFFI & DIABATE,,Chat WhatsApp,RH,Gestion employé,Bug,Enregistrement impossible,OBC Customer Support,Priorité 3,Terminé(e),2024-04-26 08:51,30/4/2024 18:10,2024-04-30 18:10,
OBCS-1161,OD-1586,Bénin : Intégration et Récupérations des Impôts - Journaliers/Prestataires,Intégration de la fiche de déclaration des cotisations d'impôt AIB pour les salariés journaliers/prestaires,Vivien DAKPOGAN,,KOFFI & DIABATE,,En présentiel,RH,Documents,Requêtes,Non renseigné,OBC Customer Support,Priorité 3,À faire,2024-04-25 10:02,26/8/2024 10:18,,
OBCS-1160,OD-1585,Intégration et Récupérations des Impôts - Salariés Permanents,Intégration de la fiche de déclaration des cotisations d'impôts pour les salariés permanents.,Vivien DAKPOGAN,,KOFFI & DIABATE,,En présentiel,RH,Documents,Requêtes,Non renseigné,OBC Customer Support,Priorité 3,À faire,2024-04-25 09:58,10/5/2024 17:05,,
OBCS-1156,OD-1581,Disparition des  Date de fin de contrat de certains employés,"En lançant la paie de Consulting ce matin, j'ai constaté que la date de fin de contrat de certains salariés qui ont démissionné a sauté.

Ce qui fait qu’ils C

NB : Leur date de sortie de l’effectif est également mentionné dans le fichier du personnel.

Point très urgent à résoudre.",Edwige KOUASSI,KOFFI MARIUS,ONPOINT,,En présentiel,RH,Salaire,Bug,Dysfonctionnement sur le Calcul des salaires,OBC Customer Support,Priorité 3,Terminé(e),2024-04-24 11:27,8/7/2024 12:15,2024-05-06 06:53,
OBCS-1155,OD-1580,L'historique de congés et autres absences n'affiche qu'une page,L'historique de congés et autres absences n'affiche qu'une page au lieu de toutes les pages,N'GBRA MOYE BERNICE DORIS,Ursula YANGANGOUSSOU,ONPOINT,,En présentiel,RH,Gestion employé,Bug,Historique vide/non exhaustif,OBC Customer Support,Priorité 3,Terminé(e),2024-04-24 10:31,17/5/2024 17:38,2024-05-17 17:38,
OBCS-1147,OD-1572,"A l'enregistrement d'une facture vente, lorqu'on lie des bons de livraison avant de sélectionner la nature de l'opération le montant HT disparait.","A l'enregistrement d'une facture vente, lorqu'on lie des bons de livraison avant de sélectionner la nature de l'opération le montant HT disparait.",JOEL SIE,CHEICK SANGARE,KORI TRANSPORT,,Appel Téléphonique,Opérations,Vente,Bug,Autres,OBC Customer Support,Priorité 3,Terminé(e),2024-04-23 10:04,16/5/2024 17:07,2024-05-16 17:07,
OBCS-1150,OD-1575,A l'impression d'un bon de commande les conditions de règlement ne s'affichent pas sur le bon.,A l'impression d'un bon de commande les conditions de règlement ne s'affichent pas sur le bon.,JOEL SIE,M. SIABA,SIT BTP,,Appel Téléphonique,Opérations,Achat,Requêtes,Non renseigné,OBC Customer Support,Priorité 3,Terminé(e),2024-04-23 15:17,24/4/2024 09:13,2024-04-24 09:13,
OBCS-1144,OD-1569,Avance Fournisseur - écritures comptable incorrecte lors de la liaison des factures,Génération des écritures lors de la liaison des avances incorrecte.,Edwige KOUASSI,Matogoma SAGANOGO,ETRAKOM-CI,,En présentiel,Opérations,Comptabilité Générale,Bug,Autres,OBC Customer Support,Priorité 3,Terminé(e),2024-04-23 08:30,8/7/2024 12:15,2024-04-24 19:07,
OBCS-1145,OD-1570,Correction écritures en fonction du modèle communiqué,Correction écritures en fonction du modèle communiqué,Edwige KOUASSI,Matogoma SAGANOGO,ETRAKOM-CI,,En présentiel,Finance,Impôts et taxes,Requêtes,Non renseigné,OBC Customer Support,Priorité 3,Terminé(e),2024-04-23 08:39,12/7/2024 19:42,2024-07-12 19:42,
OBCS-1140,OD-1565,"Sur le livre de paie, l'heure d'impression est celui d'Abidjan (GMT)","Sur le livre de paie, l'heure d'impression est celui d'Abidjan (GMT)",EVA BASSE,Faiz Deen AMINOU,KOFFI & DIABATE,,En présentiel,RH,Documents,Bug,Mauvais déversement des données,OBC Customer Support,Priorité 2,Terminé(e),2024-04-21 13:48,22/10/2024 07:57,2024-10-22 07:57,
OBCS-1159,OD-1584,Avoir le nom du projet et de la phase dans le mail automatique que les utilisateurs reçoivent quand on leur assigne des tâches,Avoir le nom du projet et de la phase dans le mail automatique que les utilisateurs reçoivent quand on leur assigne des tâches,EVA BASSE,Oscar BOKOVO,KOFFI & DIABATE,,"Online (Google Meet, Teams...)",Projets,Gérer mes projets,Requêtes,Non renseigné,OBC Customer Support,Priorité 3,Terminé(e),2024-04-24 19:40,2/5/2024 13:02,2024-05-02 13:02,
OBCS-1141,OD-1566,"Pour tous les formulaires sur lesquels on applique des taxes (bons de commande, factures, devis...), permettre d'appliquer les taxes par lignes de prestations","Pour tous les formulaires sur lesquels on applique des taxes (bons de commande, factures, devis...), permettre d'appliquer les taxes par lignes de prestations",EVA BASSE,,KOFFI & DIABATE,Team Comptabilité,En présentiel,Global,Global,Requêtes,Non renseigné,OBC Customer Support,Priorité 2,À faire,2024-04-21 13:51,21/4/2024 13:51,,Global
OBCS-1139,OD-1564,"Sur le livre de paie, faire apparaitre les employés par ordre de matricule","Sur le livre de paie, faire apparaitre les employés par ordre de matricule",EVA BASSE,Auguste QUENUM,KOFFI & DIABATE,,En présentiel,RH,Documents,Requêtes,Non renseigné,OBC Customer Support,Priorité 2,Terminé(e),2024-04-21 13:46,21/3/2025 09:45,2025-03-21 09:45,
OBCS-1138,OD-1563,Erreur Lors de l'importation des journaux - Ivoire Dev,"Message D’erreur Importation Journal - Ivoire Developpement



h2. Erreur ajax :

<!DOCTYPE html>

<html>
<head>
    <meta charset=""utf-8"">
    <meta http-equiv=""X-UA-Compatible"" content=""IE=edge"">
    <link rel=""icon"" href=""/Images/obc-Symbol-5-OBC-bleu_ini.png"" />
    <title>OBC</title>
    <!-- Tell the browser to be responsive to screen width -->
    <meta content=""width=device-width, initial-scale=1, maximum-scale=1, user-scalable=no"" name=""viewport"">
    <!-- Bootstrap 3.3.7 -->
    <link rel=""stylesheet"" href=""/Content/adminLTE24/bower_components/bootstrap/dist/css/bootstrap.min.css"">
    <!-- Font Awesome -->
    <link rel=""stylesheet"" href=""/Content/adminLTE24/bower_components/font-awesome/css/font-awesome.min.css"">
    <!-- Ionicons -->
    <link rel=""stylesheet"" href=""/Content/adminLTE24/bower_components/Ionicons/css/ionicons.min.css"">
    <!-- jvectormap -->
    <link rel=""stylesheet"" href=""/Content/adminLTE24/bower_components/jvectormap/jquery-jvectormap.css"">
    <!-- bootstrap datepicker -->
    <link rel=""stylesheet"" href=""/Content/adminLTE24/bower_components/bootstrap-datepicker/dist/css/bootstrap-datepicker.min.css"">
    <!-- color picker -->
    <link rel=""stylesheet"" href=""/Content/adminLTE24/bower_components/bootstrap-colorpicker/dist/css/bootstrap-colorpicker.min.css"">
    <!-- Select2 -->
    <link rel=""stylesheet"" href=""/Content/adminLTE24/bower_components/select2/dist/css/select2.min.css"">
    <!-- bootstrap-select CSS -->
    <link rel=""stylesheet"" href=""/Content/bootstrap-select.css"" />
    <!-- DataTables -->

{noformat}<link rel=""stylesheet"" href=""/Content/adminLTE24/bower_components/datatables.net/css/jquery.dataTables.min.css"">
<link rel=""stylesheet"" href=""/Content/adminLTE24/bower_components/datatables.net/css/buttons.dataTables.min.css"">
<link rel=""stylesheet"" href=""/Content/adminLTE24/bower_components/datatables.net-bs/css/dataTables.bootstrap.min.css"">

<!-- Full calendar -->



<!-- Gantt chart css-->
<link rel=""stylesheet"" type=""text/css"" href=""<https://cdn3.devexpress.com/jslib/22.2.3/css/dx.light.css""> />
<link rel=""stylesheet"" href=""/Content/GanttLibs/dx-gantt.min.css"" />

<!-- WebDataRocks -->
<link rel=""stylesheet"" href=""/Content/WebDataRock_1_3_3/css/webdatarocks.min.css"" />
<!-- Theme style .min -->
<link rel=""stylesheet"" href=""/Content/adminLTE24/dist/css/AdminLTE.css"">
<link rel=""stylesheet"" href=""/Content/AdminLTE32/plugins/daterangepicker/daterangepicker.css"">

<!-- AdminLTE Skins. Choose a skin from the css/skins
     folder instead of downloading all of them to reduce the load. -->
<link rel=""stylesheet"" href=""/Content/adminLTE24/dist/css/skins/_all-skins.min.css"">
<!-- HTML5 Shim and Respond.js IE8 support of HTML5 elements and media queries -->
<link rel=""stylesheet"" href=""/Content/obc_loading.css"">
<!-- WARNING: Respond.js doesn't work if you view the page via file:// -->
<!--[if lt IE 9]>
<script src=""<https://oss.maxcdn.com/html5shiv/3.7.3/html5shiv.min.js""></script>>
<script src=""<https://oss.maxcdn.com/respond/1.4.2/respond.min.js""></script>>
<![endif]-->
<!-- Google Font -->
<link href=""<https://cdnjs.cloudflare.com/ajax/libs/flag-icon-css/3.5.0/css/flag-icon.min.css""> rel=""stylesheet"" />
<link rel=""stylesheet"" href=""<https://fonts.googleapis.com/css?family=Source+Sans+Pro:300,400,600,700,300italic,400italic,600italic"">>

<!-- Typeahead CSS -->
<link rel=""stylesheet"" href=""/Content/typeahead.css"" />
<link rel=""stylesheet"" href=""/Content/myTypeahead.css"" />

<!-- NVD3 CSS -->
<link href=""/Scripts/Nvd3/nv.d3.css"" rel=""stylesheet"" />

<!-- ChartJS -->
<link rel=""stylesheet"" href=""/Content/adminLTE24/bower_components/chart.js/dist/Chart.css"">

<!-- jQuery 3 -->
<script src=""/Content/adminLTE24/bower_components/jquery/dist/jquery.min.js""></script>
<script src=""<https://cdn.datatables.net/1.13.4/js/jquery.dataTables.min.js""></script>>


<!-- Global site tag (gtag.js) - Google Analytics -->
<script async src=""<https://www.googletagmanager.com/gtag/js?id=G-H7N2DLGHM3""></script>>
<script>
    window.dataLayer = window.dataLayer || [];
    function gtag() { dataLayer.push(arguments); }
    gtag('js', new Date());

    gtag('config', 'G-H7N2DLGHM3');
</script>
<link href=""/Content/ObcLayoutCss?v=JHT7B3b4Tki6BkZybnOrGMYibavjXPvZwR3_Y1vWqpk1"" rel=""stylesheet""/>{noformat}

</head>
<style>
    input[type=search] {
        width: 300px !important;
    }
    .form-control {

{noformat}    border: 1px solid #ccc;
    border-radius: 4px;
    box-sizing: border-box;
}
input[type=checkbox], input[type=radio] {
    width: 20px;
    height: 20px;
}{noformat}

</style>
<body class=""hold-transition skin-blue fixed sidebar-mini"" id=""bodyAppMain"">
    <div class=""wrapper"">
        <header class=""main-header"">
            <!-- Logo -->
            <a href=""/Application/applicationmenu"" class=""logo"">
                <!-- mini logo for sidebar mini 50x50 pixels -->
                <span class=""logo-mini""><b>O</b>BC</span>
                <!-- logo for regular state and mobile devices -->
                <span class=""logo-lg""><img src=""/Images/obc-logo-5-OBC-white.png"" alt=""OBC logo""></span>
            </a>
            <!-- Header Navbar: style can be found in header.less   /// navbar-fixed-top  -->
            <nav class=""navbar navbar-static-top"">
                <!-- Sidebar toggle button-->
                <a href=""#"" class=""sidebar-toggle"" data-toggle=""push-menu"" role=""button"">
                    <span class=""sr-only"">Toggle navigation</span>
                </a>

{noformat}            <div class=""navbar-header"">
                

                <p class=""navbar-text"" style=""color: #f5f5f5; font-weight: bold;"">
                    
                    Client : IVOIRE DEVELOPPEMENT
                    &nbsp; &nbsp;
                    <a href=""/ParametrageAccesEntiteEnCours/MaJUtilisateurEntiteEnCours"" id=""btnMaJUtilisateurEntiteEnCoursLayout"" title=""Base(s) de travail"">
                        <span style=""color: #ffca28;"">Base(s) de travail : &nbsp; ID</span>
                    </a>
                </p>

            </div>

            <!-- Navbar Right Menu -->
            <div class=""navbar-custom-menu"">
                <ul class=""nav navbar-nav"">

                    <!-- href=""../ManuelUserDoc/Details/0/?search=""  -->
                    <li>
                        <a href=""/ManuelUserDoc/Details/0?search=#&isAccueil=1"" id=""btnObcUserManual"" title=""Manuel utilisateur OBC"">
                            <span><i class=""fa fa-newspaper-o fa-fw""></i></span>
                        </a>
                    </li>


                    <!-- Notifications: style can be found in dropdown.less -->
                    <li class=""dropdown notifications-menu"">
                        <a href=""#"" class=""dropdown-toggle"" data-toggle=""dropdown"">
                            <i class=""fa fa-bell-o""></i>
                            <span id=""messagesNotifs"" class=""label label-warning"">0</span>
                        </a>
                        <ul class=""dropdown-menu"">
                            <li id=""messagesNotifsLi"" class=""header""></li>
                            
                        </ul>
                    </li>

                    

                    

                    

                    <!-- User Account: style can be found in dropdown.less -->
                    <li class=""dropdown user user-menu"">

                        <a href=""#"" class=""dropdown-toggle"" data-toggle=""dropdown"">
                            <img id=""rhxPhotoMenu"" src=""/Images/Photos/Unknown_Image.jpg"" class=""user-image"" alt=""User Image"">
                            <span id=""rhxNameMenu"" class=""hidden-xs""></span>
                        </a>
                        <ul class=""dropdown-menu"">
                            <!-- User image -->
                            <li class=""user-header"">
                                <img id=""rhxPhotoMenu2"" src=""/Images/Photos/Unknown_Image.jpg"" class=""img-circle"" alt=""User Image"">
                                <p>
                                    <span id=""rhxNameMenu2""></span>
                                    <small id=""rhxDateMembreMenu2"">Member since Nov. 2015</small>
                                </p>
                            </li>
                            <!-- Menu Body
                            <li class=""user-body"">
                                <div class=""row"">
                                    <div class=""col-xs-4 text-center"">
                                        <a href=""#"">Followers</a>
                                    </div>
                                    <div class=""col-xs-4 text-center"">
                                        <a href=""#"">Sales</a>
                                    </div>
                                    <div class=""col-xs-4 text-center"">
                                        <a href=""#"">Friends</a>
                                    </div>
                                </div>
                                <!-- /.row -->
                            <!--</li>-->
                            <!-- Menu Footer-->
                            <li class=""user-footer"">
                                <div class=""pull-left"">
                                    <a href=""/Manage/Index"" class=""dropdown-toggle"" data-toggle=""dropdown"" id=""btnGestionXXXCompteUser"">Profil Utilisateur</a>
                                </div>
                                <div class=""pull-right"">{noformat}

<form action=""/Account/LogOff"" id=""logoutForm"" method=""post""><i

",Edwige KOUASSI,GAHI Lezou Jean,IVOIRE DEVELOPPEMENT,,En présentiel,Finance,Comptabilité Générale,Requêtes,Non renseigné,OBC Customer Support,Priorité 2,Terminé(e),2024-04-19 11:21,8/7/2024 12:15,2024-05-06 07:43,
OBCS-1134,OD-1559,Affichage des données d'une autre entité dans la base sélectionné,"Dissocier les données par entité de sorte a ce que soit visibles les données de l’entité sélectionné.

Bien que je sois sur OCG, j’ai dans l’historique les données enregistré sur OACI.",Edwige KOUASSI,,ONPOINT,,Constat Interne,RH,Gestion employé,Bug,Mauvais déversement des données,OBC Customer Support,Priorité 2,Terminé(e),2024-04-18 10:31,8/7/2024 12:15,2024-04-25 12:28,Mission
OBCS-1133,OD-1558,Numéro de lot enregistré plusieurs fois lors de l création d'une offre ou d'un programme,Lorsqu’on enregistre un lot le numéro peut être utilisé plusieurs fois pourtant le numéro doit être unique par programme.,N'GBRA MOYE BERNICE DORIS,Roselin Tiecoura,EGBV,,En présentiel,CRM,Offres,Bug,Mauvais déversement des données,OBC Customer Support,Priorité 2,Terminé(e),2024-04-18 09:49,3/5/2024 14:26,2024-05-03 14:26,
OBCS-1154,OD-1579,"Sur le formulaire de ""activité commerciale"" , réadapter le formulaire pour le client","Supprimer les champs suivants:

# Nom de l’activité
# Catégorie (en ajoutant les éléments dans “type d’activité” en fonction de l’itération.

",EVA BASSE,Natasha DELAGE,KOFFI & DIABATE,,En présentiel,CRM,Activités commerciales,Requêtes,Non renseigné,OBC Customer Support,Priorité 3,Terminé(e),2024-04-24 10:27,16/5/2024 16:57,2024-05-15 16:41,
OBCS-1151,OD-1576,Ne pas faire apparaitre le champ “filiale” sur les bons de commande à l’impression,Ne pas faire apparaitre le champ “filiale” sur les bons de commande à l’impression,EVA BASSE,BENJAMIN KOFFI,KOFFI & DIABATE,,En présentiel,Opérations,Achat,Requêtes,Non renseigné,OBC Customer Support,Priorité 3,Terminé(e),2024-04-24 09:02,25/4/2024 09:43,2024-04-25 09:43,
OBCS-1131,OD-1556,Perte de données dans les timesheet,J’ai perdu les informations que j’avais renseignées dans mes timesheets ce matin. Alors que j’ai pu bien enregistrer après la modification ce matin.,CHARLEY KOUAME,,ONPOINT,,Constat Interne,RH,Feuille de temps,Bug,Autres,OBC Customer Support,Priorité 2,Terminé(e),2024-04-17 18:16,18/4/2024 11:10,2024-04-18 11:10,
OBCS-1135,OD-1560,Etats Financiers V1 - Update,"*1-* A la validation des soldes périodique afficher *total solde compte de gestion et total soldes compte du bilan*

*2-* A l'enregistrement du bilan ou du compte de résultat, déverser les périodes sur lesquelles les soldes sont validés et permettre l'enregistrement de plusieurs états (Bilan et compte de résultat) sur un même exercice comptable selon les périodes souhaitées.

*3-* Une correction à porter sur l'exercice N-1. Nous avons constaté un montant sur le compte de la trésorerie passif alors qu'aucun compte de la trésorerie n'a été créditeur dans le RAN.

",JOEL SIE,Ousseyni Oumarou,EJARA,,En présentiel,Finance,Comptabilité Générale,Requêtes,Non renseigné,OBC Customer Support,Priorité 2,Terminé(e),2024-04-18 10:39,16/5/2024 17:02,2024-05-16 17:02,
OBCS-1153,OD-1578,"Lorsqu'on édite un projet, la description disparait et lorsqu'on modifie une donnée et qu'on clique sur enregistrer, on le message ""undefined""","Lorsqu'on édite un projet, la description disparait et lorsqu'on modifie une donnée et qu'on clique sur enregistrer, on le message ""undefined""",EVA BASSE,Jeronime GBAGUIDI,KOFFI & DIABATE,,En présentiel,Projets,Gérer mes projets,Bug,Mauvais déversement des données,OBC Customer Support,Priorité 3,Terminé(e),2024-04-24 10:00,30/4/2024 18:45,2024-04-30 18:45,
OBCS-1130,OD-1555,HTTP Error 404. The requested resource is not found.,"Impossible de poursuivre les test sur la base de PréPod

Affichage erreur 404



",Edwige KOUASSI,,ONPOINT,,Constat Interne,Global,Global,Bug,Page d'erreur,OBC Customer Support,Priorité 2,Terminé(e),2024-04-16 18:49,8/7/2024 12:15,2024-05-10 18:51,Global
OBCS-1123,OD-1548,"Lorsqu'on fait une extraction de donnée sur une entité, on a le cumul de tout le personne présent sur toute les entités","Lorsqu'on fait une extraction de donnée sur une entité, on a le cumul de tout le personne présent sur toute les entités",EVA BASSE,Auguste QUENUM,KOFFI & DIABATE,,En présentiel,RH,Gestion employé,Bug,Autres,OBC Customer Support,Priorité 2,Terminé(e),2024-04-16 09:28,26/4/2024 08:28,2024-04-26 08:28,
OBCS-1129,OD-1554,Bénin : Importation Contrats de Travails,"Avoir la possibilité d’importer les contrats de travails

# Contrat de travail Journaliers
# Contrat de travail Prestaires
# Contrat de travail des Permanents

",Vivien DAKPOGAN,,KOFFI & DIABATE,,En présentiel,RH,Gestion employé,Requêtes,Non renseigné,OBC Customer Support,Priorité 2,Terminé(e),2024-04-16 18:15,26/5/2024 12:18,2024-05-03 18:20,
OBCS-1126,OD-1551,Avoir la possibilité de modifier une écriture comptable à partir de l'interrogation de comptes,Avoir la possibilité de modifier une écriture comptable à partir de l'interrogation de comptes,EVA BASSE,Auguste QUENUM,KOFFI & DIABATE,,En présentiel,Finance,Comptabilité Générale,Requêtes,Non renseigné,OBC Customer Support,Priorité 2,À faire,2024-04-16 10:21,16/4/2024 10:21,,
OBCS-1125,OD-1550,Donner la possibilité de modifier les données dans PERSONNES A CONTACTER EN CAS D'URGENCE,"Donner la possibilité de modifier les données dans *PERSONNES A CONTACTER EN CAS D'URGENCE*

",Edwige KOUASSI,EHUI Inesse,CILAGRI,,Appel Téléphonique,RH,Gestion employé,Requêtes,Non renseigné,OBC Customer Support,Priorité 2,Terminé(e),2024-04-16 10:04,22/8/2024 11:46,2024-06-21 14:08,
OBCS-1124,OD-1549,L'extraction du fichier du personnel ne donne pas des données explicite. On aura besoin d'avoir toutes les infos présentes sur le formulaire du fichier du personnel.,L'extraction du fichier du personnel ne donne pas des données. On aura besoin d'avoir toutes les infos présentes sur le formulaire du fichier du personnel.,EVA BASSE,Auguste QUENUM,KOFFI & DIABATE,,En présentiel,RH,Gestion employé,Requêtes,Non renseigné,OBC Customer Support,Priorité 2,Terminé(e),2024-04-16 09:52,19/6/2024 15:22,2024-06-19 15:22,
OBCS-1121,OD-1546,"Lorsqu'on édite un projet et qu'on modifie manuellement le code projet généré automatiquement, on constate aprés enregistrement que l'informations de l'ancien code projet est gardé en historique","Lorsqu'on enregistre un projet et qu'on modifie manuellement le code projet généré automatiquement, on constate aprés enregistrement que l'informations de l'ancien code projet est gardé en historique.

",EVA BASSE,Jacob N'DJAN,KOFFI & DIABATE,,Appel Téléphonique,Projets,Gérer mes projets,Bug,Mauvais déversement des données,OBC Customer Support,Priorité 2,Terminé(e),2024-04-16 08:04,19/4/2024 15:31,2024-04-19 15:31,
OBCS-1157,OD-1582,Faire ressortir dans l'historique des journaux Les journaux déséquilibré,"Donner la possibilité aux utilisateurs d’avoir un point récap sur : 

# Les écritures non équilibrées 
# Les journaux équilibrées

",Edwige KOUASSI,Siaka TIOTE,ONPOINT,,En présentiel,Finance,Comptabilité Générale,Requêtes,Non renseigné,OBC Customer Support,Priorité 3,Terminé(e),2024-04-24 11:57,8/7/2024 12:15,2024-04-24 19:08,
OBCS-1120,OD-1545,Correction RAN 2023,Correction du RAN de l’exercice 2023 sur toutes les entités du client ONPOINT,Edwige KOUASSI,Siaka TIOTE,ONPOINT,,En présentiel,Finance,Comptabilité Générale,Requêtes,Non renseigné,OBC Customer Support,Priorité 2,Terminé(e),2024-04-15 19:34,14/11/2024 10:02,2024-11-14 10:02,
OBCS-1118,OD-1542,"Le filtre du menu ""Comptabilité générale"" de la partie Analytique de Finance ne fonctionne pas par entité","Le filtre du menu ""Comptabilité générale"" de la partie Analytique de Finance ne fonctionne pas par entité",EVA BASSE,,SERTEM,,En présentiel,Finance,Analytique,Bug,Mauvais déversement des données,OBC Customer Support,Priorité 2,Terminé(e),2024-04-14 18:48,14/11/2024 17:06,2024-11-14 17:06,
OBCS-1116,OD-1540,Impossible d'ajouter des phases (voir capture joint),Impossible d'ajouter des phases (voir capture joint),Vivien DAKPOGAN,,KOFFI & DIABATE,,En présentiel,Projets,Gérer mes projets,Bug,Page d'erreur,OBC Customer Support,Priorité 2,Terminé(e),2024-04-14 18:39,17/4/2024 07:31,2024-04-17 07:31,
OBCS-1115,OD-1539,Non affichage de livre de paie général sur l'entité OACI,Non affichage de livre de paie général sur l'entité OACI,N'GBRA MOYE BERNICE DORIS,KOFFI MARIUS,ONPOINT,,En présentiel,RH,Documents,Bug,Non affichage de pages/données,OBC Customer Support,Priorité 2,Terminé(e),2024-04-12 16:42,17/4/2024 18:31,2024-04-17 18:31,
OBCS-1114,OD-1538,Trace des opérations supprimer dans les livres comptable,"Lors de la modification d'une facture de vente, les anciennes données de la facture restent inchangées dans les registres comptables.

Afin de régler le problème, nous avons complètement supprimé la facture de la base, mais nous avons remarqué que l'écriture est toujours présente.

L'écriture a finalement été supprimée à partir les journaux.

Il est souhaité par le client de supprimer automatiquement les écritures passées lors de la suppression des factures.",Edwige KOUASSI,Raïssa CAMARA,JOEL K PROPERTIES,,Appel WhatsApp,Finance,Comptabilité Générale,Bug,Suppression impossible,OBC Customer Support,Priorité 2,Terminé(e),2024-04-12 15:08,8/7/2024 12:15,2024-05-10 18:48,
OBCS-1128,OD-1553,Bénin : Calcul de la paie Journaliers/Prestataires,Intégration du modèle de calcul de paie des prestataires et des journaliers,Vivien DAKPOGAN,,KOFFI & DIABATE,,En présentiel,RH,Salaire,Requêtes,Non renseigné,OBC Customer Support,Priorité 2,Terminé(e),2024-04-16 17:30,3/5/2024 11:28,2024-05-03 11:28,
OBCS-1127,OD-1552,Bénin : Fichier Import Journaliers/Prestataires,Intégration d’import de fichier du personnel pour les journaliers et les prestataires,Vivien DAKPOGAN,,KOFFI & DIABATE,,En présentiel,RH,Gestion employé,Requêtes,Non renseigné,OBC Customer Support,Priorité 2,Terminé(e),2024-04-16 11:45,17/4/2024 07:16,2024-04-17 07:16,
OBCS-1111,OD-1535,Il est impossible d'enregistrer des marques et modèles de véhicule sur plusieurs entités,Il est impossible d'enregistrer des marques et modèles de véhicule sur plusieurs entités,EVA BASSE,MODESTE PRODJINOTHO,KOFFI & DIABATE,,En présentiel,Opérations,Parc Automobile,Bug,Enregistrement impossible,OBC Customer Support,Priorité 2,Terminé(e),2024-04-11 10:49,17/4/2024 07:30,2024-04-17 07:30,
OBCS-1109,OD-1533,Il est impossible de créer un modèle de véhicule rattaché à une autre marque,Il est impossible de créer un modèle de véhicule rattaché à une autre marque,EVA BASSE,MODESTE PRODJINOTHO,KOFFI & DIABATE,,En présentiel,Opérations,Parc automobile,Bug,Enregistrement impossible,OBC Customer Support,Priorité 2,Terminé(e),2024-04-11 09:59,17/4/2024 07:31,2024-04-17 07:31,
OBCS-1112,OD-1536,Demande d'attestation de Travail,Avoir une fonctionnalité ou un formulaire de Demande d’attestation de travail. Faudrait qu’on ait un worklow par derrière pour les étape de validation et de notification de la saisie de l’attestation de travail.,Vivien DAKPOGAN,KADIA KOFFI,KOFFI & DIABATE,,Appel WhatsApp,RH,Documents,Requêtes,Non renseigné,OBC Customer Support,Priorité 2,À faire,2024-04-11 11:27,7/4/2025 11:09,,
OBCS-1110,OD-1534,Il est impossible de modifier l' immatriculation d'un véhicule déjà enregistré,Il est impossible de modifier l' immatriculation d'un véhicule déjà enregistré,EVA BASSE,MODESTE PRODJINOTHO,KOFFI & DIABATE,,En présentiel,Opérations,Paramétrage,Requêtes,Non renseigné,OBC Customer Support,Priorité 2,Terminé(e),2024-04-11 10:04,3/5/2024 07:57,2024-05-03 07:57,
OBCS-1103,OD-1527,Intégration Fichier du personnel : Journalier/Prestataire,Avoir la possibilité d’intégrer le fichier du personnel des journaliers et le fichier du personnel des prestataires.,Vivien DAKPOGAN,,KOFFI & DIABATE,,En présentiel,RH,Gestion employé,Requêtes,Non renseigné,OBC Customer Support,Priorité 2,Terminé(e),2024-04-11 08:52,11/4/2024 12:02,2024-04-11 12:02,
OBCS-1107,OD-1531,La balance comptable sur 2022 déséquilibrée,La balance comptable sur 2022 déséquilibrée,N'GBRA MOYE BERNICE DORIS,MONSIEUR KOUASSI,FALCON,,Appel Téléphonique,Finance,Comptabilité Générale,Bug,Mauvais déversement des données,OBC Customer Support,Priorité 2,Terminé(e),2024-04-11 09:08,4/6/2024 09:38,2024-06-04 09:38,
OBCS-1105,OD-1529,La prime d'ancienneté s'affiche un mois avant le mois d'anniversaire d'un employé,La prime d'ancienneté s'affiche un mois avant le mois d'anniversaire d'un employé,N'GBRA MOYE BERNICE DORIS,Jean-Claude SAMPENNIE,S-TEL,,Appel Téléphonique,RH,Salaire,Bug,Dysfonctionnement sur le Calcul des salaires,OBC Customer Support,Priorité 2,Terminé(e),2024-04-11 09:02,15/4/2024 19:17,2024-04-15 19:17,
OBCS-1104,OD-1528,La prime d'ancienneté ne s'affiche pas pour les employés ayant déjà une prime d'ancienneté à leur actif,La prime d'ancienneté ne s'affiche pas pour les employés ayant déjà une prime d'ancienneté à leur actif n’étant pas dans leur période d’anniversaire,N'GBRA MOYE BERNICE DORIS,Jean-Claude SAMPENNIE,S-TEL,,Appel Téléphonique,RH,Salaire,Bug,Dysfonctionnement sur le Calcul des salaires,OBC Customer Support,Priorité 2,Terminé(e),2024-04-11 09:01,15/4/2024 19:16,2024-04-15 19:16,
OBCS-1102,OD-1526,Montant récupéré par la base fiscale dans le calcul de salaire,"Le montant récupéré par la base fiscale dans le calcul de salaire est différent du montant du salaire brut, ce qui fausse le calcul des impôts comme l’IGR CN et FDFP",N'GBRA MOYE BERNICE DORIS,Jean-Claude SAMPENNIE,S-TEL,,Appel Téléphonique,RH,Salaire,Bug,Dysfonctionnement sur le Calcul des salaires,OBC Customer Support,Priorité 2,Terminé(e),2024-04-11 08:48,13/5/2024 17:37,2024-05-13 17:37,
OBCS-1113,OD-1537,Processus de Validation des bordereaux d'entré en stock - Production,"En ce qui concerne la validation des bordereaux d’entré des produits de la production en stock 

rendre optionnel la fonctionnalité de sorte à ce que le client ne soit pas obligé de valider une entrée en stock avant la vente.

Dans certain processus la production peut être faite pour une vente directe.",Edwige KOUASSI,,IPT,,Constat Interne,Opérations,Production,Requêtes,Non renseigné,OBC Customer Support,Priorité 2,À faire,2024-04-11 18:04,27/6/2024 15:44,,
OBCS-1100,OD-1523,Permettre la duplication des phases avec leurs tâches d'une entité à une autre,Permettre la duplication des phases avec leurs tâches d'une entité à une autre,EVA BASSE,,KOFFI & DIABATE,,En présentiel,Projets,Paramétrage,Requêtes,Non renseigné,OBC Customer Support,Priorité 2,Terminé(e),2024-04-09 14:17,11/4/2024 16:32,2024-04-11 16:32,
OBCS-1099,OD-1522,Avoir des notifications sur le staffing du personnel,Avoir des notifications sur le staffing du personnel,EVA BASSE,,KOFFI & DIABATE,,En présentiel,Projets,Gérer mes projets,Requêtes,Non renseigné,OBC Customer Support,Priorité 2,Terminé(e),2024-04-09 14:15,11/4/2024 14:59,2024-04-11 14:59,
OBCS-1096,OD-1519,Gestion des heures supplémentaires,"Les heures supplémentaires sont calculés que pour les Journaliers.

Cependant il est calculé au prorata du temps passé en fonction du taux journalier. Pour quelqu’un qui a un taux journalier de 5000 pour 8h de travail et qui a passé 6h supplémentaire. Nous ferons une règle de 3

5000 pour 8h de Travail.
pour 6h???

Montant Heure supp : (6*5000)/8
*Montant Heure Supp : 3750 FCFA*

",Vivien DAKPOGAN,,KOFFI & DIABATE,,En présentiel,RH,Gestion employé,Requêtes,Non renseigné,OBC Customer Support,Priorité 2,Terminé(e),2024-04-06 13:08,3/5/2024 18:40,2024-05-03 18:40,
OBCS-1095,OD-1518,Intégration Fonctionnalité  : Contrat de travail des prestataires / journaliers,"Tel le Sénégal la Gestion de la paie des prestataires au Bénin s’apparente sensiblement à celle intégrer pour le Sénégal.

Un impôt AIB est supporté par l’entreprise. La méthode de calcul. Pour un prestataire/journalier qui touche 100.000 par exemple : 
*1.* On recherche le Brut : 100.000/0.97

*Brut :* 103 092,78 soit *103 093*

*2.* On calcule l’AIB

AIB : Brut * 0.03

AIB : 103 093*0.03
*AIB :* 3 092,79 soit *3093*

",Vivien DAKPOGAN,,KOFFI & DIABATE,,En présentiel,RH,Gestion employé,Requêtes,Non renseigné,OBC Customer Support,Priorité 2,Terminé(e),2024-04-06 12:59,24/4/2024 11:00,2024-04-24 11:00,
OBCS-1093,OD-1516,Possilité de faire une remise en montant au lieu d'un taux,Possilité de saisir une remise en montant au lieu d'un taux,JOEL SIE,Jean-Jacques LIKANE,LABOGEM,,Appel Téléphonique,Opérations,Vente,Requêtes,Non renseigné,OBC Customer Support,Priorité 2,Terminé(e),2024-04-04 19:28,21/3/2025 09:57,2025-03-21 09:57,
OBCS-1092,OD-1515,Mettre un bouton export sur le stafing des journaliers,Mettre un bouton export sur le stafing des journaliers,JOEL SIE,Ursula YANGANGOUSSOU,ONPOINT,,En présentiel,Projets,Gérer mes projets,Requêtes,Non renseigné,OBC Customer Support,Priorité 2,Terminé(e),2024-04-04 18:59,7/6/2024 19:21,2024-06-07 19:21,
OBCS-1090,OD-1513,Rajouter un Bouton import et export sur la fonctionnalité Staffing employé,Donner la possibilité d’importer et d’exporter les données dans *STAFFINGS PROJETS*,Edwige KOUASSI,Ursula YANGANGOUSSOU,ONPOINT,,En présentiel,Projets,Gérer mes projets,Requêtes,Non renseigné,OBC Customer Support,Priorité 2,Terminé(e),2024-04-04 17:56,8/7/2024 12:15,2024-06-07 12:23,
OBCS-1088,OD-1511,La taxe IBIC Café Cacao disparait lorsqu'on clique sur regénérer écriture,"Lors de la régénération d’une écriture portant une taxes BIC Café Cacao, la taxe disparait et laisse place aux compte de charge et produit uniquement. ",Edwige KOUASSI,,ETRAKOM-CI,,En présentiel,Finance,Comptabilité Générale,Bug,Autres,OBC Customer Support,Priorité 2,Terminé(e),2024-04-04 10:17,8/7/2024 12:15,2024-04-08 10:54,
OBCS-1087,OD-1510,"Impossible de générer le report à nouveau, un message d'erreur apparait ","Impossible de générer le report à nouveau, un message d'erreur apparait ",Edwige KOUASSI,Raïssa CAMARA,JOEL K PROPERTIES,,En présentiel,Finance,Comptabilité Générale,Bug,Mauvais déversement des données,OBC Customer Support,Priorité 2,Terminé(e),2024-04-03 19:50,8/7/2024 12:15,2024-04-04 11:02,
OBCS-1086,OD-1509,Déséquilibre Balance comptable dû au RAN,"Au transfert du RAN bien que les données soient équilibré la balance affiche un solde différent des soldes initiaux.

Le Compte 471209. étant un compte de tiers s’affiche dans la balance générale avec un montant de 125000 au débit.",Edwige KOUASSI,Raïssa CAMARA,JOEL K PROPERTIES,,En présentiel,Finance,Comptabilité Générale,Bug,Mauvais déversement des données,OBC Customer Support,Priorité 2,Terminé(e),2024-04-03 19:48,8/7/2024 12:15,2024-04-04 11:02,
OBCS-1085,OD-1508,Régularisation RH S-TEL,"Point 1 : Régularisation du nombre de congés inscrit sur les bulletins de salaire

Point 2 : Déduire les absences du nombre de jours travaillés de façon automatique

Point 3 : Régularisation du bonus de congés pour les employés ayant fait un certain nombre d’année dans l’entreprise",N'GBRA MOYE BERNICE DORIS,Jean-Claude SAMPENNIE,S-TEL,,Appel Téléphonique,RH,Gestion employé,Requêtes,Non renseigné,OBC Customer Support,Priorité 2,Terminé(e),2024-04-03 19:42,23/10/2024 18:35,2024-10-23 18:35,
OBCS-1084,OD-1507,Intégrer les impôts de la nouvelle réforme dans le formulaire de la déclaration ITS,Intégrer les impôts de la nouvelle réforme dans le formulaire de la déclaration ITS,N'GBRA MOYE BERNICE DORIS,CHARLES IPO,FALCON,,Appel Téléphonique,RH,Documents,Requêtes,Non renseigné,OBC Customer Support,Priorité 2,Terminé(e),2024-04-03 19:37,22/8/2024 11:47,2024-08-22 11:47,
OBCS-1082,OD-1505,Adaptation feuille de temps en rajoutant Phase et Tâches,"Pour Koffi et Diabaté, vu que les feuilles de temps des architectes et des gars de projet sont liées aux Phases/Tâches. Intégrer dans le formulaire Phase et Tâches de sorte à ce qu’ils puissent sélectionner au moment d’enregistrer leurs TimeSheet.

Cependant ça doit être optionnel, puisque tout le monde ne travaille pas sur les projets.",Vivien DAKPOGAN,,KOFFI & DIABATE,,En présentiel,Projets,Feuille de temps,Requêtes,Non renseigné,OBC Customer Support,Priorité 2,Terminé(e),2024-04-03 07:41,8/4/2024 09:03,2024-04-08 09:03,
OBCS-1081,OD-1504,Notification à une ou plusieurs assignations de tâches,"A l’assignations d’une ou plusieurs tâches, le collaborateur doit recevoir une notification par mail avec les tâches assignées et les deadlines.

Cas d’assignation dans le CRM",Vivien DAKPOGAN,,KOFFI & DIABATE,,En présentiel,Projets,Gérer mes tâches,Requêtes,Non renseigné,OBC Customer Support,Priorité 2,Terminé(e),2024-04-03 07:37,11/4/2024 14:57,2024-04-11 14:57,
OBCS-1080,OD-1503,Bénin : Séparation des Grades par entités,"L’historique des grades et même les grades affichant dans le contrat ne tient pas compte de l’entité. Tous les grades se déversent sans distinction des entités. Du coup impossible de savoir pour un même grade avec un salaire catégoriel différent, à quelle entité il appartient",Vivien DAKPOGAN,,KOFFI & DIABATE,,En présentiel,RH,Paramétrage,Bug,Dysfonctionnement des filtres,OBC Customer Support,Priorité 2,Terminé(e),2024-04-02 19:30,11/4/2024 14:45,2024-04-11 14:45,
OBCS-1079,OD-1502,A l'édition des bulletins le modèle choisi n'est pas celui qui s'affiche. Il affiche le modèle standard,A l'édition des bulletins le modèle choisi n'est pas celui qui s'affiche. Il affiche le modèle standard,JOEL SIE,Jean-Jacques LIKANE,LABOGEM,,Appel Téléphonique,RH,Documents,Bug,Autres,OBC Customer Support,Priorité 2,Terminé(e),2024-04-02 18:21,3/4/2024 10:47,2024-04-03 10:47,
OBCS-1083,OD-1506,Ranger dans l'ordre décroissant les dates la liste dans l'historique de l'arbitrage,Ranger dans l'ordre décroissant les dates la liste dans l'historique de l'arbitrage,N'GBRA MOYE BERNICE DORIS,KALOGO Nabarakissa,S-TEL,,Appel Téléphonique,Opérations,Achat,Requêtes,Non renseigné,OBC Customer Support,Priorité 2,Terminé(e),2024-04-03 19:31,11/12/2024 09:35,2024-12-11 09:35,
OBCS-1073,OD-1496,Bénin - Contrat de Travail Mise à jour Régime,"Mise à jour des régimes au niveau du contrat de travail Bénin / CADRE, AGENT DE MAITRISE, OUVRIER/MANOEUVRE, EMPLOYE, CATEGORIE A, CATEGORIE B, CATEGORIE C",Vivien DAKPOGAN,,KOFFI & DIABATE,,En présentiel,RH,Gestion employé,Requêtes,Non renseigné,OBC Customer Support,Priorité 2,Terminé(e),2024-03-29 18:00,14/6/2024 10:55,2024-06-14 10:55,
OBCS-1063,OD-1493,Entités Bénin : Mise à jour Base Congé et Absence,Mise à jour des absences autorisées par le code du travail béninois,Vivien DAKPOGAN,,KOFFI & DIABATE,,En présentiel,RH,Paramétrage,Requêtes,Non renseigné,OBC Customer Support,Priorité 2,Terminé(e),2024-03-28 16:12,29/3/2024 18:08,2024-03-29 18:08,
OBCS-1062,OD-1492,Possibilité de générer une référente interne à K&D,"Définir le code projet sous cette nomenclature : 2 LETTRES ""Famille Article"" + 3 LETTRES ""Sous-famille"" + 5 Chiffres incrémentés",Vivien DAKPOGAN,Yves ASSANVO,KOFFI & DIABATE,,En présentiel,Opérations,Gestion de stock,Requêtes,Non renseigné,OBC Customer Support,Priorité 2,Terminé(e),2024-03-28 11:24,4/4/2024 07:18,2024-04-04 07:18,
OBCS-1077,OD-1500,Automatisation du kilométrage correspondant à la prise de carburant.,Automatisation du kilométrage correspondant à la prise de carburant.,EVA BASSE,,KOFFI & DIABATE,Team Parc Automobile,En présentiel,Opérations,Analytique,Requêtes,Non renseigné,OBC Customer Support,Priorité 2,Terminé(e),2024-04-01 18:07,29/4/2024 18:21,2024-04-29 18:21,
OBCS-1075,OD-1498,"Imprimer les bons de commandes une seule fois et marquer ""duplicata"" sur les autres impressions.","Imprimer les bons de commandes une seule fois et marquer ""duplicata"" sur les autres impressions.",EVA BASSE,,KOFFI & DIABATE,Team ACHAT,En présentiel,Opérations,Achat,Requêtes,Non renseigné,OBC Customer Support,Priorité 2,À faire,2024-04-01 18:03,1/4/2024 18:03,,
OBCS-1057,OD-1488,Impossible d'éditer une fiche prospect,"Je n’arrive pas à enregistrer les modifications apportées aux informations d’un prospect. Quand on clique sur enregistrer, le curseur se transforme en 🛑 ",CHARLEY KOUAME,,ONPOINT,,Constat Interne,CRM,Client,Bug,Edition impossible,OBC Customer Support,Priorité 1,Terminé(e),2024-03-26 18:13,3/4/2024 09:13,2024-04-03 09:13,
OBCS-1076,OD-1499,Intégrer le plus tôt possible les Signatures électroniques,"Intégrer le plus tôt possible les Signatures électroniques car cela est incontournable dans leurs processus

",EVA BASSE,,KOFFI & DIABATE,Team ACHAT,En présentiel,Opérations,Achat,Requêtes,Non renseigné,OBC Customer Support,Priorité 2,À faire,2024-04-01 18:05,1/4/2024 18:05,,
OBCS-1074,OD-1497,Créer un API si possible au site de l'Etat sur lequel les factures clients sont enregistrées.,"Toutes les factures de ventes sont éditées sur un site de l’Etat.

L’idée est de relier ce site à OBC puisque l’Etat Béninois le permet",EVA BASSE,,KOFFI & DIABATE,Team Finance,En présentiel,Finance,Comptabilité Générale,Requêtes,Non renseigné,OBC Customer Support,Priorité 2,À faire,2024-04-01 18:00,1/4/2024 18:00,,
OBCS-1054,OD-1484,Suppression Bordereau de sortie impossible - Production,Revoir la suppression d'un bordereau de sortie dans le cas de la production,Edwige KOUASSI,,IPT,,Constat Interne,Opérations,Production,Bug,Autres,OBC Customer Support,Priorité 2,Terminé(e),2024-03-26 12:18,8/7/2024 12:15,2024-04-12 19:18,
OBCS-1061,OD-1491,Vérrouillage Timesheet,Permettre le verrouillage des TimeSheet semaine par semaine.,Vivien DAKPOGAN,M. Martial,ONPOINT,,Chat WhatsApp,Projets,Feuille de temps,Requêtes,Non renseigné,OBC Customer Support,Priorité 2,Terminé(e),2024-03-28 11:17,5/4/2024 11:03,2024-04-05 11:03,
OBCS-1056,OD-1486,Generer le programme de vente,Intégration du programme de vente,Edwige KOUASSI,,IPT,,Constat Interne,Opérations,Production,Requêtes,Non renseigné,OBC Customer Support,Priorité 2,À faire,2024-03-26 12:25,27/6/2024 15:44,,
OBCS-1055,OD-1485,Revoir l'Etat bordereau de sortie dans l'historique,"Bien que les bordereaux soient validé, l'état dans l’historique de la production reste pareil, il reste inchangé à zéro.

Faire la mise à jour pour finaliser complètement le processus de production.",Edwige KOUASSI,,IPT,,Constat Interne,Opérations,Production,Requêtes,Non renseigné,OBC Customer Support,Priorité 2,À faire,2024-03-26 12:23,27/6/2024 15:44,,
OBCS-1051,OD-1481,Mettre une action ''supprimer'' sur les frais de mission et permettre de d'attribuer cette action à qui de droit.,Mettre une action ''supprimer'' sur les frais de mission et permettre de d'attribuer cette action à qui de droit. (Client KORI TRANSPORT),JOEL SIE,Brahima COULIBALY,KORI TRANSPORT,,Appel Téléphonique,RH,Gestion employé,Requêtes,Non renseigné,OBC Customer Support,Priorité 1,Terminé(e),2024-03-25 18:00,10/5/2024 19:06,2024-05-10 19:06,
OBCS-1049,OD-1479,Système très lent - EJARA,Impossible de travailler en raison de la lenteur du système,Edwige KOUASSI,Ousseyni Oumarou,EJARA,,En présentiel,Global,Global,Bug,Lenteur Système,OBC Customer Support,Priorité 4,Terminé(e),2024-03-22 15:06,8/7/2024 12:15,2024-03-28 08:34,Global
OBCS-1032,OD-1462,Message d'erreur apparaissant sur OBC,Message d'erreur apparaissant sur OBC,EVA BASSE,,KOFFI & DIABATE,,En présentiel,Global,Global,Bug,Page d'erreur,OBC Customer Support,Priorité 1,Terminé(e),2024-03-21 14:33,4/4/2024 17:11,2024-04-04 17:11,Global
OBCS-1031,OD-1461,Parametrage trésorerie: Mettre action supprimer,Lorsqu’on enregistre un compte  bancaire par erreur le client n’a pas la main pour supprimer.,JOEL SIE,Brahima COULIBALY,KORI TRANSPORT,,Appel Téléphonique,Finance,Paramétrage,Requêtes,Non renseigné,OBC Customer Support,Priorité 1,À faire,2024-03-21 10:10,27/6/2024 15:39,,
OBCS-1030,OD-1460,Intégration de IMPOT SALAIRE dans le bordereau de déclaration des impôts,Intégrer IMPOT salaire de la nouvelle réforme dans le bordereau de déclaration des impôts sur toutes les bases clients,N'GBRA MOYE BERNICE DORIS,CHARLES IPO,FALCON,,Appel Téléphonique,RH,Documents,Requêtes,Non renseigné,OBC Customer Support,Priorité 1,Terminé(e),2024-03-21 08:46,5/8/2024 15:23,2024-08-05 15:23,
OBCS-1038,OD-1468,Avoir la possibilité d'imprimer le modèle type BICICI pour les ordres de virements internationaux.,Avoir la possibilité d'imprimer le modèle type BICICI pour les virements internationaux.,EVA BASSE,,KOFFI & DIABATE,Team Finance,En présentiel,Paiement,Centre de paiement,Requêtes,Non renseigné,OBC Customer Support,Priorité 2,À faire,2024-03-22 06:17,22/3/2024 06:17,,
OBCS-1037,OD-1467,Avoir la possibilité de préciser le signataire lors de l'édition de l'ordre de virement.,Avoir la possibilité de préciser le signataire lors de l'édition de l'ordre de virement.,EVA BASSE,,KOFFI & DIABATE,Team Finance,En présentiel,Paiement,Centre de paiement,Requêtes,Non renseigné,OBC Customer Support,Priorité 2,À faire,2024-03-22 06:15,22/3/2024 06:15,,
OBCS-1036,OD-1466,Figer le FCFA comme devise sur l'ensemble des formulaires,Figer le FCFA comme devise sur l'ensemble des formulaires,EVA BASSE,,KOFFI & DIABATE,Team Finance,En présentiel,Global,Global,Requêtes,Non renseigné,OBC Customer Support,Priorité 2,Terminé(e),2024-03-22 06:14,24/1/2025 08:30,2025-01-24 08:30,Global
OBCS-1035,OD-1465,Avoir la possibilité d'enregistrer des heures travaillées sur plusieurs entités,Avoir la possibilité d'enregistrer des heures travaillées sur plusieurs entités,EVA BASSE,,KOFFI & DIABATE,Team Finance,En présentiel,Projets,Feuille de temps,Requêtes,Non renseigné,OBC Customer Support,Priorité 2,À faire,2024-03-22 06:13,22/3/2024 06:13,,
OBCS-1034,OD-1464,Empêcher les utilisateurs de saisir deux fois le même numéro de pièces,Empêcher les utilisateurs de saisir deux fois le même numéro de pièces,EVA BASSE,,KOFFI & DIABATE,Team Finance,En présentiel,Finance,Comptabilité Générale,Requêtes,Non renseigné,OBC Customer Support,Priorité 2,Terminé(e),2024-03-22 06:11,8/7/2024 09:06,2024-07-08 09:06,
OBCS-1046,OD-1476,Avoir une liste déroulante des tâches,Avoir une liste déroulante des tâches,EVA BASSE,,KOFFI & DIABATE,Team Project,En présentiel,Projets,Gérer mes projets,Requêtes,Non renseigné,OBC Customer Support,Priorité 2,Terminé(e),2024-03-22 06:35,29/4/2024 18:18,2024-04-29 18:18,
OBCS-1043,OD-1473,Avoir la possibilité de générer des versions V1 à Vx quand un projet est repris,Avoir la possibilité de générer des versions V1 à Vx quand un projet est repris,EVA BASSE,,KOFFI & DIABATE,Team Project,En présentiel,Projets,Gérer mes projets,Requêtes,Non renseigné,OBC Customer Support,Priorité 2,À faire,2024-03-22 06:25,2/10/2024 18:02,,
OBCS-1041,OD-1471,Possibilité d'avoir une date d'échéance avec des alertes sur les synthèses de cotations.,Possibilité d'avoir une date d'échéance avec des alertes sur les synthèses de cotations.,EVA BASSE,Eric KOFFI,KOFFI & DIABATE,,En présentiel,Opérations,Achat,Requêtes,Non renseigné,OBC Customer Support,Priorité 3,À faire,2024-03-22 06:23,22/3/2024 06:23,,
OBCS-1040,OD-1470,Donner la possibilité à l'utilisateur d'imprimer/télécharger une version originale du bulletin de salaire et les autres impressions devront être des duplicatas.,Donner la possibilité à l'utilisateur d'imprimer/télécharger une version originale du bulletin de salaire et les autres impressions devront être des duplicatas.,EVA BASSE,,KOFFI & DIABATE,Team RH,En présentiel,RH,Documents,Requêtes,Non renseigné,OBC Customer Support,Priorité 1,En cours,2024-03-22 06:20,23/9/2025 18:49,,
OBCS-1023,OD-1453,Possibilité de mettre des sous totaux sur les dévis et factures,A l’enregistrement d’un dévis ou factures l’on peut avoir plusieurs lignes avec des sous totaux donner la possibilité de mettre les sous totaux.,JOEL SIE,KASSI KABLAN,LABOGEM,,En présentiel,Opérations,Vente,Requêtes,Non renseigné,OBC Customer Support,Priorité 4,À faire,2024-03-19 08:10,17/12/2024 09:48,,
OBCS-1021,OD-1451,Export Barème Impossible,"L’export des Barèmes génère un message d’erreur.

",Vivien DAKPOGAN,,KOFFI & DIABATE,,En présentiel,RH,Paramétrage,Bug,Export de données impossible,OBC Customer Support,Priorité 2,Terminé(e),2024-03-18 13:48,22/3/2024 13:00,2024-03-20 11:57,
OBCS-1020,OD-1450,Non déversement des Barèmes,"Les barèmes (Imposition Progressive et Réduction d’impôt) n’affichent aucune données.

Les données devraient se déverser automatiquement. Prière de tenir compte des pays des entités.",Vivien DAKPOGAN,,KOFFI & DIABATE,,En présentiel,RH,Paramétrage,Bug,Non affichage de pages/données,OBC Customer Support,Priorité 4,Terminé(e),2024-03-18 13:39,18/3/2024 18:39,2024-03-18 18:39,
OBCS-1044,OD-1474,Avoir la possibilité de dupliquer les tâches/projets/phases et modifier les dates de fin tout en gardant l'historique et ajouter des commentaires.,Avoir la possibilité de dupliquer les tâches/projets/phases et modifier les dates de fin tout en gardant l'historique et ajouter des commentaires.,EVA BASSE,,KOFFI & DIABATE,Team Project,En présentiel,Projets,Gérer mes projets,Requêtes,Non renseigné,OBC Customer Support,Priorité 2,Terminé(e),2024-03-22 06:26,21/8/2024 19:08,2024-08-21 19:08,
OBCS-1042,OD-1472,Définir une pondération par phases pour l'état d'avancement des projets.,Définir une pondération par phases pour l'état d'avancement des projets.,EVA BASSE,,KOFFI & DIABATE,Team Project,En présentiel,Projets,Gérer mes projets,Requêtes,Non renseigné,OBC Customer Support,Priorité 2,À faire,2024-03-22 06:24,7/6/2024 14:49,,
OBCS-1022,OD-1452,Distinguer Nom et Prénom,"Dans la fiche client, pour Type client “Particulier : Avoir Nom et Prénom.",Vivien DAKPOGAN,Natasha DELAGE,KOFFI & DIABATE,,En présentiel,CRM,Client,Requêtes,Non renseigné,OBC Customer Support,Priorité 4,Terminé(e),2024-03-18 15:04,10/5/2024 21:16,2024-05-10 21:16,
OBCS-1016,OD-1446,"A l'importation du fichier du personnel, l'écran indique certaines valeurs(voir vidéo joint). Il faut obligatoirement passé d'une page à une autre avant que les informations ne se déversent.","A l'importation du fichier du personnel, l'écran indique certaines valeurs(voir vidéo joint). Il faut obligatoirement passé d'une page à une autre avant que les informations ne se déversent.",EVA BASSE,,KOFFI & DIABATE,,En présentiel,RH,Gestion employé,Bug,Page d'erreur,OBC Customer Support,Priorité 4,Terminé(e),2024-03-16 14:05,26/3/2024 18:07,2024-03-26 18:07,
OBCS-1015,OD-1445,"Après avoir paramétré la paie selon la nouvelle réforme, le calcul de la paie s'adosse à l'ancien système avant la réforme","Après avoir paramétré la paie selon la nouvelle réforme, le calcul de la paie s'adosse à l'ancien système avant la réforme",EVA BASSE,,KOFFI & DIABATE,,En présentiel,RH,Salaire,Bug,Dysfonctionnement sur le Calcul des salaires,OBC Customer Support,Priorité 4,Terminé(e),2024-03-15 18:08,22/3/2024 16:57,2024-03-22 16:57,
OBCS-1014,OD-1444,Permettre que la modification d'article se répercute sur les bons de commande et bons de livraison,Permettre que la modification d'article se répercute sur les bons de commande et bons de livraison,N'GBRA MOYE BERNICE DORIS,KALOGO Nabarakissa,S-TEL,,Appel Téléphonique,Opérations,Gestion de stock,Requêtes,Non renseigné,OBC Customer Support,Priorité 4,À faire,2024-03-15 16:18,27/6/2024 10:26,,
OBCS-1013,OD-1443,Stock de congés à paramétrer pour 2 jours ouvrés par mois au lieu de 2.2 jours par mois,Stock de congés à paramétrer pour 2 jours ouvrés par mois au lieu de 2.2 jours par mois,N'GBRA MOYE BERNICE DORIS,Jean-Claude SAMPENNIE,S-TEL,,Appel Téléphonique,RH,Gestion employé,Requêtes,Non renseigné,OBC Customer Support,Priorité 4,Terminé(e),2024-03-15 16:16,26/3/2024 17:39,2024-03-20 10:01,
OBCS-1012,OD-1442,Prime d'ancienneté à paramétrer de tel sorte que l'employé perçoive son ancienneté dans son mois d'anniversaire après deux années.,Prime d'ancienneté à paramétrer de tel sorte que l'employé perçoive son ancienneté dans son mois d'anniversaire ( Aout 2021 à Août 2023) 2% et 1% à partir de l’année suivante dans son mois d’anniversaire ( Août 2024).,N'GBRA MOYE BERNICE DORIS,Jean-Claude SAMPENNIE,S-TEL,,Appel Téléphonique,RH,Salaire,Requêtes,Non renseigné,OBC Customer Support,Priorité 4,Terminé(e),2024-03-15 16:09,21/3/2024 09:35,2024-03-21 09:35,
OBCS-1011,OD-1441,Assignation - Filtre sur département,Appliquer le filtre de façon générale sur les Assignations. Il devrait charger la liste en fonction du filtre et non chargé toute la liste des employés.,Vivien DAKPOGAN,,KOFFI & DIABATE,,En présentiel,Opérations,Immobilisations,Requêtes,Non renseigné,OBC Customer Support,Priorité 2,Terminé(e),2024-03-15 10:05,4/7/2024 07:05,2024-07-04 07:05,
OBCS-1007,OD-1437,"Impossible de supprimer un poste créer sur la base client qui est vide à date (sans contrat, aucun calcul de paie...)","Impossible de supprimer un poste créer sur la base client qui est vide à date (sans contrat, aucun calcul de paie...)",EVA BASSE,,KOFFI & DIABATE,,En présentiel,RH,Paramétrage,Bug,Suppression impossible,OBC Customer Support,Priorité 2,Terminé(e),2024-03-12 20:19,8/4/2024 11:51,2024-04-08 11:50,
OBCS-1008,OD-1438,PERSONNES A CONTACTER EN CAS D'URGENCE,"A l’enregistrement des *personnes à contacter en cas d’urgence*, les informations ne se déversent pas. 

Un peu comme si elles étaient masquées.",Edwige KOUASSI,,ETRAKOM-CI,,En présentiel,RH,Gestion employé,Bug,Autres,OBC Customer Support,Priorité 2,Terminé(e),2024-03-13 08:50,8/7/2024 12:15,2024-03-28 09:33,
OBCS-1018,OD-1448,Commission commerciaux à intégrer dans le calcul de paie de façon automatique,"Intégrer au calcul de salaire le % des commissions des commerciaux, de sorte à ce qu'au calcul de paie les commissions soient calculées automatiquement.",Edwige KOUASSI,GAHI Lezou Jean,IVOIRE DEVELOPPEMENT,,En présentiel,RH,Salaire,Requêtes,Non renseigné,OBC Customer Support,Priorité 4,À faire,2024-03-18 12:31,27/6/2024 15:44,,
OBCS-11493,OD-2951,Finance/Comptabilité Générale/Historique des imputations comptable - Montant de Ecriture de stock est incorrecte,"Montant de Ecriture de stock est incorrecte

Paramétrage effectué : 3111100000 ───>Débit

                                        601100000 ───>Débit

                                        603110000 ───>Crédit

                                        408100000 / 401110000 ───>Crédit

!image-20251023-143000.png|width=447,alt=""image-20251023-143000.png""!

Montant récupéré =  Montant Brut + Commission Vendeur + Transport

!image-20251023-130845.png|width=671,alt=""image-20251023-130845.png""!",Edwige KOUASSI,MICHEL TETE,ECORIGINE,,"Online (Google Meet, Teams...)",Finance,Comptabilité Générale,Bug,Duplication anormale,OBC Customer Support,Priorité 1,En cours,2025-10-23 13:08,28/10/2025 06:23,,
OBCS-11491,OD-2949,Finance/Comptabilité Générale/Historique des imputations comptable - Doublon constaté lors de la génération des écritures comptable lié au bordereau de réception,"Duplication constaté dans l’historique des imputations comptable lors de l’enregistrement d’un bordereau de réception.

!image-20251023-142456.png|width=447,alt=""image-20251023-142456.png""!",Edwige KOUASSI,MICHEL TETE,ECORIGINE,,"Online (Google Meet, Teams...)",Finance,Comptabilité Générale,Bug,Duplication anormale,OBC Customer Support,Priorité 1,En cours,2025-10-23 12:58,30/10/2025 13:03,2025-10-30 13:03,
OBCS-9531,OD-2565,Finance/Opération de caisse : Impossible de modifier une opération de caisse,Finance/Opération de caisse : Impossible de modifier une opération de caisse,EVA BASSE,Mme BRISSI,AFRIC URBA,,Appel Téléphonique,Finance,Comptabilité Générale,Bug,Autres,OBC Customer Support,Priorité 1,Terminé(e),2025-04-30 11:16,30/4/2025 17:45,2025-04-30 17:45,
OBCS-8413,OD-2332,"Finance/Opérations de Caisse : Quand on clique sur opération de caisse, une page d'erreur apparait après le chargement de la page","Finance/Opérations de Caisse : Quand on clique sur opération de caisse, une page d'erreur apparait après le chargement de la page sur l’entité GDF TRANSPORT

Ci-dessous la capture



!image-20250112-203554.png|width=1640,height=912,alt=""image-20250112-203554.png""!",N'GBRA MOYE BERNICE DORIS,Koné SEYDOU,VENUS DISTRIBUTION,,Chat WhatsApp,Finance,Comptabilité Générale,Bug,Page d'erreur,OBC Customer Support,Priorité 1,Terminé(e),2025-01-12 20:31,15/1/2025 15:03,2025-01-15 15:03,
OBCS-9537,OD-2570,Finance/Comptabilité Général/ Demande de sortie de Caisse et Opération de Caisse - Rajouter une action annuler pour les profils standard de sorte a ce qu'il puisse annuler leur demande au lieu de la supprimer qui revient aux admins,Rajouter une action “annuler” pour les profils standard de sorte à ce que les utilisateurs puissent annuler leurs demandes au lieu de la supprimer qui revient aux admins,Edwige KOUASSI,Léa N'GUESSAN,CILAGRI,,Appel Téléphonique,Finance,Comptabilité Générale,Requêtes,Non renseigné,OBC Customer Support,Priorité 1,À faire,2025-05-02 09:00,2/5/2025 09:00,,
OBCS-9159,OD-2433,Finance/Opérations de caisse : Supprimer la nature de prestation « Règlement client » sur le formulaire d’opération de caisse,Finance/Opérations de caisse : Supprimer la nature de prestation « Règlement client » sur le formulaire d’opération de caisse,EVA BASSE,Jean-Jacques LIKANE,LABOGEM,,Appel Téléphonique,Finance,Comptabilité Générale,Requêtes,Non renseigné,OBC Customer Support,Priorité 1,Terminé(e),2025-03-19 11:23,28/3/2025 09:12,2025-03-28 09:12,
OBCS-8340,OD-2329,Finance/Comptabilité/Caisse - Récupérer le montant enregistré dans une demande de sortie validé lors de la saisie d'une opération de sortie de caisse,"Récupérer le montant enregistré dans une demande de sortie validé lors de la saisie d'une opération de sortie de caisse

!20250110-1003-18.5584946.mp4|width=1860,height=1018,alt=""20250110-1003-18.5584946.mp4""!",Edwige KOUASSI,,CILAGRI,,Constat Interne,Finance,Comptabilité Générale,Requêtes,Non renseigné,OBC Customer Support,Priorité 1,En cours,2025-01-10 11:51,10/1/2025 13:24,,
OBCS-10360,OD-2708,Suppression de toutes les opérations effectué sur  2024,Suppression de toutes les opérations effectué en 2024 qui ont une source dans les opérations ou caisse,Edwige KOUASSI,Abdoulaye Faye,SERTEM,,E-mail,Finance,Comptabilité Générale,Requêtes,Non renseigné,OBC Customer Support,Priorité 1,À faire,2025-07-18 09:54,18/7/2025 09:54,,
OBCS-9649,OD-2588,Demande de sortie + Opération de caisse : Avoir la possibilité de joindre un fichier à la demande et à l'opération de caisse (Entrée+Sortie),Demande de sortie + Opération de caisse : Avoir la possibilité de joindre un fichier à la demande et à l'opération de caisse (Entrée+Sortie),Vivien DAKPOGAN,NADIA CISSE,ARIC,,"Online (Google Meet, Teams...)",Finance,Comptabilité Générale,Requêtes,Non renseigné,OBC Customer Support,Priorité 2,Terminé(e),2025-05-12 17:17,14/5/2025 09:47,2025-05-14 09:47,
OBCS-954,OD-1384,Une opération d'approvisionnement caisse n'impacte pas le solde de la caisse,Une opération d’approvisionnement caisse n’impacte pas le solde de la caisse,JOEL SIE,Gaelle TOURE,ONPOINT,,En présentiel,Finance,Comptabilité Générale,Bug,Autres,OBC Customer Support,Priorité 4,Terminé(e),2024-03-04 10:02,22/3/2024 16:58,2024-03-22 16:58,
OBCS-863,OD-1290,"A l'enregistrement d'une opération de caisse de 2023, les projets de 2023 ne se déversent pas dans la partie ""Axe analytique""","A l'enregistrement d'une opération de caisse de 2023, les projets de 2023 ne se déversent pas dans la partie ""Axe analytique""",EVA BASSE,Gaelle TOURE,ONPOINT,,En présentiel,Finance,Comptabilité Générale,Bug,Mauvais déversement des données,OBC Customer Support,Priorité 2,Terminé(e),2024-01-31 13:31,1/2/2024 17:48,2024-02-01 17:48,
OBCS-862,OD-1289,"A la modification d'une opération de caisse de 2023, certains codes projets ne se déverse pas dans ""Axe Analytique""","A la modification d'une opération de caisse de 2023, certains codes projets ne se déverse pas dans ""Axe Analytique""",EVA BASSE,Gaelle TOURE,ONPOINT,,Appel Téléphonique,Finance,Comptabilité Générale,Bug,Mauvais déversement des données,OBC Customer Support,Priorité 4,Terminé(e),2024-01-30 10:15,1/2/2024 17:48,2024-02-01 17:48,
OBCS-9878,OD-2640,"Caisse : A l'édition d'une opération de caisse, le formulaire met assez de temps à s'afficher.","Caisse : A l'édition d'une opération de caisse, le formulaire met assez de temps à s'afficher.",Vivien DAKPOGAN,Brahima COULIBALY,KORI TRANSPORT,,Appel Téléphonique,Finance,Comptabilité Générale,Bug,Lenteur Système,OBC Customer Support,Priorité 1,Terminé(e),2025-06-12 16:24,23/6/2025 09:07,2025-06-23 09:07,
OBCS-7431,OD-2133,"Sur l'entité ""ONPOINT MANAGEMENT""  de l'entreprise ""ARTIS HOLDING"" ,le formulaire des opérations de caisse n'apparait pas et l'historique est différent des autres bases clients (Voir capture joint)","Sur l'entité ""ONPOINT MANAGEMENT""  de l'entreprise ""ARTIS HOLDING"" ,le formulaire des opérations de caisse n'apparait pas et l'historique est différent des autres bases clients (Voir capture joint)",EVA BASSE,Joël SIE,ARTIS HOLDING,,Appel Téléphonique,Finance,Comptabilité Générale,Bug,Non affichage de pages/données,OBC Customer Support,Priorité 1,Terminé(e),2024-10-30 09:28,30/10/2024 16:55,2024-10-30 16:55,
OBCS-7429,OD-2131,"Quand on import l'historique des opérations de caisse, le solde est différent de celui qu'on constate lorsqu'on est connecté sur OBC","Quand on import l'historique des opérations de caisse, le solde est différent de celui qu'on constate lorsqu'on est connecté sur OBC",EVA BASSE,Mme Traoré,KORI TRANSPORT,,Appel Téléphonique,Finance,Comptabilité Générale,Bug,Mauvais déversement des données,OBC Customer Support,Priorité 1,Terminé(e),2024-10-29 09:57,29/10/2024 11:05,2024-10-29 11:05,
OBCS-1182,OD-1609,Impossible de générer les écritures comptable lorqu'on sélectionne la nature d'opération: ''Rembourssement Apport Associé'',Impossible de générer les écritures comptable lorqu'on sélectionne la nature d'opération: ''Rembourssement Apport Associé'',JOEL SIE,Raïssa CAMARA,JOEL K PROPERTIES,,Appel Téléphonique,Finance,Comptabilité Générale,Bug,Autres,OBC Customer Support,Priorité 1,Terminé(e),2024-05-02 18:47,7/5/2024 16:57,2024-05-07 16:57,
OBCS-8429,OD-2346,Opération/Expression De Besoin/ Page d'accueil User - Réception d'une demande d'approbation bien que l'utilisateur ne soit au niveau de validation et que la demande soit adressé au service achat,"Mr KOFFI, n'arrive pas à comprendre pourquoi cette requête adressée au service achat est en attente à son niveau alors qu’il n’est pas du service achat.

!image-20250115-100725.png|width=871,height=489,alt=""image-20250115-100725.png""!",Edwige KOUASSI,Narcisse Abaleyty KOFFI,CILAGRI,,E-mail,Opérations,Achat,Bug,Mauvais déversement des données,OBC Customer Support,Priorité 1,En cours,2025-01-15 10:14,20/1/2025 09:29,,
OBCS-7644,OD-2185,"Dans la partie ""Opération à valider"" , les utilisateurs ne voient pas que les demande à leur niveau mais l'ensemble des demande (Cas de demande d'absence et Programmation de salaire confirmer avec l'écran de plusieurs utilisateurs)","Dans la partie ""Opération à valider"" , les utilisateurs ne voient pas que les demande à leur niveau mais l'ensemble des demande (Cas de demande d'absence et Programmation de salaire confirmer avec l'écran de plusieurs utilisateurs)",EVA BASSE,LAURENT IDOHOU,KOFFI & DIABATE,,E-mail,Finance,Comptabilité Analytique,Bug,Mauvais déversement des données,OBC Customer Support,Priorité 1,Terminé(e),2024-11-13 16:29,14/11/2024 17:06,2024-11-14 17:06,
OBCS-8414,OD-2333,RH/GestionEmployé/Validation demande d'absence - Donner l’option “retirer le nombre de jour d’absence” dans le calcul de paie lors de la validation de celle ci,Donner l’option “retirer le nombre de jour d’absence” dans le calcul de paie lors de la validation de celle ci,Edwige KOUASSI,Ismaël KONE,ECORIGINE,,Appel Téléphonique,RH,Gestion employé,Requêtes,Non renseigné,OBC Customer Support,Priorité 1,Terminé(e),2025-01-13 11:04,7/2/2025 15:42,2025-02-07 09:08,
OBCS-10687,OD-2809,Dashboard utilisateur V2 / Refonte tableau de bord utilisateur  - Création d'une section Paiements effectués,Refonte tableau de bord utilisateur  - Création d'une section Paiements effectués,Edwige KOUASSI,M. SANANKOUA,ONPOINT,,En présentiel,Global,Global,Requêtes,Non renseigné,OBC Customer Support,Priorité 1,En cours,2025-08-18 18:43,16/10/2025 10:25,,
OBCS-10686,OD-2808,Dashboard utilisateur V2 / Analytique / Refonte tableau de bord utilisateur V2 - Création d'une section Paiements reçus,Refonte tableau de bord utilisateur V2 - Création d'une section Paiements reçus,Edwige KOUASSI,M. SANANKOUA,ONPOINT,,En présentiel,Global,Global,Requêtes,Non renseigné,OBC Customer Support,Priorité 1,Terminé(e),2025-08-18 18:36,17/10/2025 10:48,2025-10-17 10:48,
OBCS-10685,OD-2807,Dashboard utilisateur V2 / Analytique / Refonte tableau de bord utilisateur V2 - Création d'une section Paiements en attente,Refonte tableau de bord utilisateur V2 - Création d'une section Paiements en attente,Edwige KOUASSI,M. SANANKOUA,ONPOINT,,En présentiel,Global,Global,Requêtes,Non renseigné,OBC Customer Support,Priorité 1,Terminé(e),2025-08-18 18:31,17/10/2025 10:36,2025-10-17 10:36,
OBCS-9599,OD-2578,"Bon de sortie:  Dans le rapport, supprimez forme de paiement et le département, ainsi que le bénéficiaire dans le tableau car il existe déjà dans l'entête","Bon de sortie:  Dans le rapport, supprimez forme de paiement et le département, ainsi que le bénéficiaire dans le tableau car il existe déjà dans l'entête",Vivien DAKPOGAN,NADIA CISSE,ARIC,,"Online (Google Meet, Teams...)",Finance,Comptabilité Générale,Requêtes,Non renseigné,OBC Customer Support,Priorité 2,Terminé(e),2025-05-06 11:23,7/5/2025 10:36,2025-05-07 10:36,
OBCS-6567,OD-1941,A l'affichage du détail de bon de commande avant validation le projet ne se déverse pas,A l'affichage du détail de bon de commande avant validation le projet ne se déverse pas,Vivien DAKPOGAN,KALOGO Nabarakissa,S-TEL,,Chat WhatsApp,Opérations,Achat,Bug,Non affichage de pages/données,OBC Customer Support,Priorité 1,Terminé(e),2024-08-27 16:52,29/8/2024 09:22,2024-08-29 09:22,
OBCS-590,OD-751,Donner la possibilité de modifier les demandes de caisse par le validateur si nécessaire avant la validation,Donner la possibilité de modifier les demandes de caisse par le validateur si nécessaire avant la validation,Vivien DAKPOGAN,,LABOGEM,,En présentiel,Finance,Comptabilité Générale,Requêtes,Non renseigné,OBC Customer Support,Priorité 2,Terminé(e),2023-12-04 13:49,11/12/2023 17:36,2023-12-11 17:36,
OBCS-501,OD-504,Workflow validation inventaire de caisse,Workflow validation inventaire de caisse,Vivien DAKPOGAN,,KORI TRANSPORT,,En présentiel,Finance,Comptabilité Générale,Requêtes,Non renseigné,OBC Customer Support,Priorité 3,Terminé(e),2023-12-04 13:44,24/1/2024 10:51,2024-01-24 10:51,
OBCS-479,OD-482,Rajouter une demande d'approvisionnement de la caisse,Rajouter une demande d'approvisionnement de la caisse,Vivien DAKPOGAN,,ETRAKOM-CI,,En présentiel,Finance,Comptabilité Générale,Requêtes,Non renseigné,OBC Customer Support,Priorité 2,À faire,2023-12-04 13:43,6/12/2023 12:47,,
OBCS-461,OD-464,Griser le bouton enregistrer après avoir appuyer une fois dans la saisie de caisse,"Il faudrait griser le bouton enregistrer car lorsqu'on clique sur le bouton enregistrer plusieurs fois dans la saisie de caisse, celle ci s'enregistre a plusieurs reprises.",Vivien DAKPOGAN,,EGBV,,En présentiel,Finance,Comptabilité Générale,Requêtes,Non renseigné,OBC Customer Support,Priorité 2,Terminé(e),2023-12-04 13:42,6/12/2023 17:33,2023-12-06 17:33,
OBCS-729,OD-1147,"Solde initial & progressif, banque et Caisse Non récupéré","Bien que le RAN soit importé dans les journaux les soldes initiaux caisse et banque ne sont pas récupéré. Aucun impacte sur les rapports, tableaux de bord ainsi que la valeur des soldes actuel.",Edwige KOUASSI,OUATTARA GNEKITTA,ETRAKOM-CI,,Chat WhatsApp,Finance,Comptabilité Générale,Bug,Mauvais déversement des données,OBC Customer Support,Priorité 4,Terminé(e),2023-12-16 12:33,8/7/2024 12:15,2024-02-19 15:25,Paramétrage
OBCS-9465,OD-2535,Les écritures d'interco ne se déverse pas correctement dans les comptabilité,Les écritures d'interco ne se déverse pas correctement dans les comptabilité,EVA BASSE,Mr KOFFI,EJARA,,Appel Téléphonique,Finance,Comptabilité Générale,Bug,Mauvais déversement des données,OBC Customer Support,Priorité 1,Terminé(e),2025-04-16 16:09,18/4/2025 14:16,2025-04-18 14:16,
OBCS-1296,OD-1720,"Le solde du dashboard caisse ne correspond pas au solde réel de la caisse Wave OCGCI, mais il affiche le bon solde à l'extraction","Le solde du dashboard caisse ne correspond pas au solde réel de la caisse Wave OCGCI, mais il affiche le bon solde à l'extraction",JOEL SIE,Gaelle TOURE,ONPOINT,,E-mail,Finance,Comptabilité Générale,Bug,Autres,OBC Customer Support,Priorité 1,Terminé(e),2024-06-05 10:10,5/6/2024 16:28,2024-06-05 16:28,
OBCS-463,OD-466,Doublon de numéro d'imputation dans le grand livre caisse,"Au niveau du grand livre caisse, nous avons un doublon de numéro d'imputation 24 au mois de Janvier 2023",Vivien DAKPOGAN,,EGBV,,En présentiel,Finance,Comptabilité Générale,Bug,Non renseigné,OBC Customer Support,Priorité 4,Terminé(e),2023-12-04 13:42,16/2/2024 10:02,2024-02-16 10:02,
OBCS-460,OD-463,SUPPRESSION DE DOUBLON DANS LE GRAND LIVRE CAISSE,SUPPRESSION DE DOUBLON DANS LE GRAND LIVRE CAISSE,Vivien DAKPOGAN,,EGBV,,En présentiel,Finance,Comptabilité Générale,Bug,Non renseigné,OBC Customer Support,Priorité 1,Terminé(e),2023-12-04 13:42,6/12/2023 17:33,2023-12-06 17:33,
OBCS-9759,OD-2619,Operations caisse - Bénéficiaire et Ressource entrée :  Ajouter une liste déroulante qui récupèrera la liste des employées à la saisie et au click ( création et Edition),Opérations caisse - Bénéficiaire et Ressource entrée :  Ajouter une liste déroulante qui récupèrera la liste des employées à la saisie et au click ( création et Edition),Vivien DAKPOGAN,NADIA CISSE,ARIC,,"Online (Google Meet, Teams...)",Finance,Comptabilité Générale,Requêtes,Non renseigné,OBC Customer Support,Priorité 2,Terminé(e),2025-05-28 19:37,3/6/2025 16:51,2025-06-03 16:51,
OBCS-7143,OD-2084,Possibilité d'utiliser la demande de sortie de caisse validée jusqu'à son épuisement,Possibilité d'utiliser la demande de sortie de caisse validée jusqu'à son épuisement,JOEL SIE,KONE Mariam,SIT BTP,,Appel Téléphonique,Finance,Comptabilité Générale,Requêtes,Non renseigné,OBC Customer Support,Priorité 1,À faire,2024-10-07 18:39,7/10/2024 18:40,,
OBCS-1269,OD-1697,"Avoir la possibilité de joindre un fichier (PDF, Excel..) sur le formulaire de sortie de caisse","Avoir la possibilité de joindre un fichier (PDF, Excel..) sur le formulaire de sortie de caisse",EVA BASSE,KADIA KOFFI,KOFFI & DIABATE,,En présentiel,Finance,Comptabilité Générale,Requêtes,Non renseigné,OBC Customer Support,Priorité 3,Terminé(e),2024-05-30 10:38,14/8/2025 15:50,2025-08-14 15:50,
OBCS-941,OD-1371,Erreur de saisie à corriger - Marquer date de début et Date de Fin au lieu de : Date de Début x 2,"Dans l’historique des “rapports détaillés des opérations de caisse” 

Corriger Date de Fin au lieu de date de début qui à été répété deux fois sur le formulaire",Edwige KOUASSI,Gaelle TOURE,ONPOINT,,En présentiel,Finance,Comptabilité Générale,Requêtes,Non renseigné,OBC Customer Support,Priorité 4,Terminé(e),2024-02-28 14:38,8/7/2024 12:15,2024-05-10 19:31,
OBCS-920,OD-1348,Agrandir la zone de libellé afin de voir la saisie,Agrandir la zone de libellé caisse afin de voir la saisie effectuée,N'GBRA MOYE BERNICE DORIS,Koné SEYDOU,VENUS DISTRIBUTION,,Appel Téléphonique,Finance,Comptabilité Générale,Requêtes,Non renseigné,OBC Customer Support,Priorité 4,Terminé(e),2024-02-21 09:10,14/6/2024 10:03,2024-06-14 10:03,
OBCS-7863,OD-2236,Suppressions saisies comptable,Suppression de toutes les saisies comptable pour importation  et mise à jour de la base !,Edwige KOUASSI,OURAGA Edwige,CIP,,Appel Téléphonique,Finance,Comptabilité Générale,Requêtes,Non renseigné,OBC Customer Support,Priorité 1,Terminé(e),2024-11-26 10:13,11/12/2024 09:02,2024-12-11 09:02,Traitement Comptable
OBCS-816,OD-1237,Rattacher les numéros de compte aux rubriques pour la caisse par exemple,Rattacher les numéros de compte aux rubriques pour la caisse par exemple,EVA BASSE,KOFFI MARIUS,ONPOINT,Team Comptabilité,"Online (Google Meet, Teams...)",Finance,Comptabilité Générale,Requêtes,Non renseigné,OBC Customer Support,Priorité 4,À faire,2024-01-15 17:51,15/1/2024 17:51,,
OBCS-9925,OD-2653,Mr YOH n'arrive pas à valider les demandes sur FCEM or il est dans les workflows,Mr YOH n'arrive pas à valider les demandes sur FCEM or il est dans les workflows,EVA BASSE,HERVE GERARD YOH,FIRST CAPITAL,,"Online (Google Meet, Teams...)",Support,Gestion des workflows,Bug,Dysfonctionnement Workflow,OBC Customer Support,Priorité 1,Terminé(e),2025-06-13 22:11,17/6/2025 18:51,2025-06-17 18:51,
OBCS-9527,OD-2561,Workflow : Un utilisateur faisant partie du workflow n'arrive pas à enregistrer un arbitrage (voir message en capture),"!image-20250429-101057.png|width=2045,height=956,alt=""image-20250429-101057.png""!",EVA BASSE,Alassane MEITE,KOFFI & DIABATE,,"Online (Google Meet, Teams...)",Support,Gestion des workflows,Bug,Dysfonctionnement Workflow,OBC Customer Support,Priorité 1,Terminé(e),2025-04-29 10:29,30/4/2025 09:35,2025-04-30 09:35,
OBCS-9408,OD-2520,"Acceuil/ Dashboard utilisateur : Un employé mis en ""sommeil"" à certains niveaux du workflow peut valider des demandes comme étant validateur","!image-20250408-162627.png|width=1442,height=892,alt=""image-20250408-162627.png""!

Dah",EVA BASSE,KADIA KOFFI,KORI TRANSPORT,,Chat WhatsApp,Support,Gestion des workflows,Bug,Mauvais déversement des données,OBC Customer Support,Priorité 1,Terminé(e),2025-04-08 16:27,1/8/2025 16:42,2025-08-01 16:42,
OBCS-8885,OD-2412,"Lorsqu'on enregistre une opération et qu'on ne choisi pas 'type d'achat' , on a plusieurs mails qui sont envoyés au demandeur et au validateur (Très urgentt)","Lorsqu'on enregistre une opération et qu'on ne choisi pas 'type d'achat' , on a plusieurs mails qui sont envoyés au demandeur et au validateur (Très urgentt)",EVA BASSE,Auguste QUENUM,KOFFI & DIABATE,,Appel Téléphonique,Support,Gestion des workflows,Bug,Dysfonctionnement Workflow,OBC Customer Support,Priorité 1,Terminé(e),2025-02-10 17:34,21/3/2025 09:44,2025-03-21 09:44,
OBCS-8641,OD-2366,"Quand on veut valider un workflow, l'affichage de la page est anormale (voir capture)","Quand on veut valider un workflow, l'affichage de la page est anormale (voir capture)",EVA BASSE,ZAGBAYOU ANNE,EDIPRESSE,,Appel Téléphonique,Support,Gestion des workflows,Bug,Autres,OBC Customer Support,Priorité 1,Terminé(e),2025-01-28 09:10,29/1/2025 17:08,2025-01-29 17:08,
OBCS-7732,OD-2204,Nous constatons des validations déjà effectuées qui reviennent en attente de validation,"Nous constatons des validations déjà effectuées qui reviennent en attente de validation.

Exemple de la cotation validée qui a été suivi d’un arbitrage également validé qui revient en attente de validation pour la cotation.

Pièce jointe ci-dessous.



!image-20241120-113622.png|width=1893,height=888,alt=""image-20241120-113622.png""!",N'GBRA MOYE BERNICE DORIS,KALOGO Nabarakissa,S-TEL,,Appel Téléphonique,Support,Gestion des workflows,Bug,Dysfonctionnement Workflow,OBC Customer Support,Priorité 1,Terminé(e),2024-11-20 11:34,21/11/2024 18:20,2024-11-21 18:20,
OBCS-7516,OD-2161,"Lorsqu'une expression de besoin est validé, les utilisateurs autorisés à faire les cotations ne reçoivent pas de mail","Lorsqu'une expression de besoin est validé, les utilisateurs autorisés à faire les cotations ne reçoivent pas de mail",EVA BASSE,Kouadio N'dri Florent Alfred YAO,KOFFI & DIABATE,,En présentiel,Support,Gestion des workflows,Bug,Dysfonctionnement Workflow,OBC Customer Support,Priorité 1,Terminé(e),2024-11-05 18:39,8/11/2024 08:25,2024-11-08 08:25,
OBCS-860,OD-1287,Absence de notification Workflow,"A une période donnée de la journée (17H), les notifications de workflow par mail ne passent plus.",Vivien DAKPOGAN,Brahima COULIBALY,KORI TRANSPORT,,E-mail,Support,Gestion des workflows,Requêtes,Non renseigné,OBC Customer Support,Priorité 3,Terminé(e),2024-01-29 08:55,1/2/2024 06:58,2024-02-01 06:58,
OBCS-688,OD-872,Rajouter un Workflow au processus de calcul de salaire,Le client exige que toute ce qui est en rapport avec les flux financier soient soumis à validation. Comme pour les programmations de règlement fournisseur il souhaite valider les programmation et exécution de salaire,Vivien DAKPOGAN,,ETRAKOM-CI,,En présentiel,Support,Gestion des workflows,Requêtes,Non renseigné,OBC Customer Support,Priorité 3,Terminé(e),2023-12-04 13:57,10/5/2024 20:46,2024-05-10 20:46,
OBCS-564,OD-614,METTRE LES HEURES SUR LE DETAIL DE LA VALIDATION DE LA DEMANDE D'ABSENCE,METTRE LES HEURES AU NIVEAU DU DETAIL DE LA DATE DE DEMANDE D'ABSENCE A VALIDER PAR LE SUPERIEUR,Vivien DAKPOGAN,,S-TEL,,En présentiel,Support,Gestion des workflows,Requêtes,Non renseigné,OBC Customer Support,Priorité 1,Terminé(e),2023-12-04 13:48,6/12/2023 17:33,2023-12-06 17:33,
OBCS-483,OD-486,"Donner la possibilité, lors d'une modification de supprimer des utilisateurs de façon groupé","Lors de la suppression de certain utilisateurs du workflow, donner la possibilité de sélectionner plusieurs mail a la fois pour une suppression global. Même principe lorsqu'on ajoute des mail ou utilisateurs dans un workflow",Vivien DAKPOGAN,,ETRAKOM-CI,,En présentiel,Support,Gestion des workflows,Requêtes,Non renseigné,OBC Customer Support,Priorité 2,Terminé(e),2023-12-04 13:43,4/7/2024 08:04,2024-07-04 08:04,
OBCS-831,OD-1258,Paramétrage Workflow,Dysfonctionnement workflow,Edwige KOUASSI,Koné SEYDOU,VENUS DISTRIBUTION,,Appel Téléphonique,Support,Gestion des workflows,Bug,Dysfonctionnement Workflow,OBC Customer Support,Priorité 4,Terminé(e),2024-01-18 08:43,8/7/2024 12:15,2024-01-26 07:14,
OBCS-9596,OD-2576,Validation des bons de commandes : Lors de la validation avoir la possibilité de voir le détails des expressions de besoins rattaché au bon de commandé,Validation des bons de commandes : Lors de la validation avoir la possibilité de voir le détails des expressions de besoins rattaché au bon de commandé,EVA BASSE,ISSA DIABATE,KOFFI & DIABATE,,En présentiel,Support,Gestion des workflows,Requêtes,Non renseigné,OBC Customer Support,Priorité 1,Terminé(e),2025-05-05 18:26,20/5/2025 19:51,2025-05-20 19:51,
OBCS-7699,OD-2193,"Sur les formulaires, faudrait faire apparaitre uniquement les types d'achat rattaché à un workflow de l'entité","Sur les formulaires, faudrait faire apparaitre uniquement les types d'achat rattaché à un workflow de l'entité",EVA BASSE,,KOFFI & DIABATE,,En présentiel,Support,Gestion des workflows,Requêtes,Non renseigné,OBC Customer Support,Priorité 1,Terminé(e),2024-11-14 18:55,18/11/2024 09:14,2024-11-18 09:14,
OBCS-7455,OD-2144,"Dans les workflow, les personnes en sommeil qui reçoivent l'information d'une demande n'arrivent pas à voir la demande complète dans le mail (Voir capture joint)","Dans les workflow, les personnes en sommeil qui reçoivent l'information d'une demande n'arrivent pas à voir la demande complète dans le mail (Voir capture joint)",EVA BASSE,,KOFFI & DIABATE,,En présentiel,Support,Gestion des workflows,Requêtes,Non renseigné,OBC Customer Support,Priorité 1,À faire,2024-10-31 11:23,31/10/2024 11:23,,
OBCS-1365,OD-1745,"Ne pas rendre obligatoire le champs ""commentaire"" à la validation des demandes","Ne pas rendre obligatoire le champs ""commentaire"" à la validation des demandes",EVA BASSE,KADIA KOFFI,KOFFI & DIABATE,,En présentiel,Support,Gestion des workflows,Requêtes,Non renseigné,OBC Customer Support,Priorité 1,Terminé(e),2024-06-11 11:14,20/6/2024 11:27,2024-06-20 11:27,
OBCS-7433,OD-2135,Impossible de supprimer une ligne en plus présent sur le workflow or aucune règle n'a été associé,Impossible de supprimer une ligne en plus présent sur le workflow or aucune règle n'a été associé,EVA BASSE,,KOFFI & DIABATE,,En présentiel,Support,Gestion des workflows,Bug,Suppression impossible,OBC Customer Support,Priorité 1,Terminé(e),2024-10-30 10:53,31/10/2024 17:19,2024-10-31 17:19,
OBCS-7343,OD-2112,"Après une demande d'achat, nous constatons dans le mail reçu par le demandeur qu'une personne mis en sommeil est la personne devant valider la demande ","Après une demande d'achat, nous constatons dans le mail reçu par le demandeur qu'une personne mis en sommeil est la personne devant valider la demande ",EVA BASSE,DESIRE ERIKA SARAKA,KOFFI & DIABATE,,En présentiel,Support,Gestion des workflows,Bug,Autres,OBC Customer Support,Priorité 1,Terminé(e),2024-10-22 17:34,31/10/2024 10:06,2024-10-31 10:06,
OBCS-7259,OD-2105,Nous constatons une lenteur de plus d'une heure lorsqu'on lance une requête de validation en masse,Nous constatons une lenteur de plus d'une heure lorsqu'on lance une requête de validation en masse,N'GBRA MOYE BERNICE DORIS,Koné SEYDOU,VENUS DISTRIBUTION,,Appel Téléphonique,Support,Gestion des workflows,Bug,Dysfonctionnement Workflow,OBC Customer Support,Priorité 1,Terminé(e),2024-10-16 10:30,25/10/2024 18:13,2024-10-25 18:13,
OBCS-1266,OD-1694,"Les personnes en sommeil devant recevoir juste l'information pour une demande , on aussi la possibilité de donner leur accord ou non","Les personnes en sommeil devant recevoir juste l'information pour une demande , on aussi la possibilité de donner leur accord ou non",EVA BASSE,,KOFFI & DIABATE,,En présentiel,Support,Gestion des workflows,Bug,Dysfonctionnement Workflow,OBC Customer Support,Priorité 1,Terminé(e),2024-05-29 15:13,5/6/2024 17:42,2024-06-05 17:42,
OBCS-1122,OD-1547,Permettre la suppression simultané de plusieurs utilisateurs dans le paramétrage du workflow,Permettre la suppression simultané de plusieurs utilisateurs dans le paramétrage du workflow,EVA BASSE,,KOFFI & DIABATE,,En présentiel,Support,Gestion des workflows,Bug,Autres,OBC Customer Support,Priorité 2,Terminé(e),2024-04-16 09:13,2/5/2024 12:49,2024-05-02 12:49,
OBCS-916,OD-1344,Workflows non déclanchés à la modification d'une opération de caisse,"Lorsqu’on modifi une opération caisse suite à une demande d’information, le workflow ne se déclanche plus. 

",JOEL SIE,Gaelle TOURE,ONPOINT,,En présentiel,Support,Gestion des workflows,Bug,Autres,OBC Customer Support,Priorité 1,Terminé(e),2024-02-20 12:53,22/2/2024 17:58,2024-02-22 17:58,
OBCS-7442,OD-2140,"(Urgent) Lorsqu'on enregistre une absence constaté, le supérieur hiérarchique recoit un mail pour validation, ce qui n'est pas normal. (voir pièce jointe)","En effet, seul la personne pour qui l’enregistrement est fait doit avoir un mail informatif



!Capture (1).PNG|width=746,height=440,alt=""Capture (1).PNG""!",EVA BASSE,,KOFFI & DIABATE,,En présentiel,Support,Gestion des workflows,Bug,Dysfonctionnement Workflow,OBC Customer Support,Priorité 3,Terminé(e),2024-10-30 16:11,14/11/2024 08:02,2024-11-14 08:02,
OBCS-852,OD-1279,"Lors du processus de workflow, lorsque la décision ""demande d'information"" est choisi, la demande devient introuvable dans le système.",Plusieurs clients ont remonté le point,EVA BASSE,COULIBALY SERGES,S-TEL,,E-mail,Support,Gestion des workflows,Bug,Dysfonctionnement Workflow,OBC Customer Support,Priorité 4,Terminé(e),2024-01-25 08:21,30/1/2024 08:20,2024-01-30 08:20,
OBCS-1142,OD-1567,"Lors de la programmation de salaire, envoyer un mail groupé pour la validation","Lors de la programmation de salaire, envoyer un mail groupé pour la validation",EVA BASSE,KOFFI MARIUS,KOFFI & DIABATE,Team Comptabilité,En présentiel,Support,Gestion des workflows,Requêtes,Non renseigné,OBC Customer Support,Priorité 2,À faire,2024-04-21 13:53,21/4/2024 13:53,,
OBCS-582,OD-667,"Pour les expression de besoin, arbitrage, bon de commande,etc… rendre le champ ""Unité"" obligatoire","Pour les expression de besoin, arbitrage, bon de commande,etc… rendre le champ ""Unité"" obligatoire",Vivien DAKPOGAN,,KORI TRANSPORT,,Constat Interne,Opérations,Achat,Requêtes,Non renseigné,OBC Customer Support,Priorité 4,Terminé(e),2023-12-04 13:49,7/4/2025 16:09,2025-04-07 16:09,
OBCS-581,OD-666,"Suppression test Effectuer ""Demande de sortie"" - Supprimer toutes les lignes enregistrer (Valider ou pas)",Demande de suppression des tests effectuer sur la partie Production - Historique demande de sortie,Vivien DAKPOGAN,,IPT,,Constat Interne,Opérations,Production,Requêtes,Non renseigné,OBC Customer Support,Priorité 1,Terminé(e),2023-12-04 13:49,6/12/2023 17:33,2023-12-06 17:33,
OBCS-580,OD-665,"Pour les Bons de Livraison ; faire apparaître le statut ""Réceptionné"" pour dire que la commande a été vraiment exécutée avant Paiement","Pour les Bons de Livraison ; faire apparaître le statut ""Réceptionné"" pour dire que la commande a été vraiment exécutée avant Paiement",Vivien DAKPOGAN,,ARIC,,Constat Interne,Opérations,Achat,Requêtes,Non renseigné,OBC Customer Support,Priorité 4,À faire,2023-12-04 13:49,5/12/2023 10:39,,
OBCS-578,OD-659,"Intégration Suivi Gonflage des Pneus, Plaquette de Frein, Battérie et Lubrifiant",Fiche suivi des batteries et des plaquettes de frein,Vivien DAKPOGAN,,KORI TRANSPORT,,Constat Interne,Opérations,Parc automobile,Requêtes,Non renseigné,OBC Customer Support,Priorité 4,À faire,2023-12-04 13:49,6/12/2023 12:11,,
OBCS-575,OD-626,FIGER LE NOM DE L'ENTITE SUR TOUS LES ONGLETS DE SAISIES ET DE FILTRES,FIGER LE NOM DE L'ENTITE SUR TOUS LES ONGLETS DE SAISIES ET DE FILTRES,Vivien DAKPOGAN,,S-TEL,,Constat Interne,RH,Paramétrage,Requêtes,Non renseigné,OBC Customer Support,Priorité 4,Terminé(e),2023-12-04 13:49,6/12/2023 17:33,2023-12-06 17:33,
OBCS-574,OD-625,Récupérer les tiers salariés dans les opérations de paie à générer,Récupérer les tiers salariés dans les opérations de paie à générer ( au lieu du 422 compte général récupéré avec le détail des salariés il faudrait récupérer chaque compte tiers salarié dans les livres comptables),Vivien DAKPOGAN,,S-TEL,,Constat Interne,RH,Salaire,Requêtes,Non renseigné,OBC Customer Support,Priorité 4,Terminé(e),2023-12-04 13:49,11/11/2024 16:28,2024-11-11 16:28,
OBCS-570,OD-620,Afficher le détail des heures d'absence lors de la validation de l’absence,afficher le détail des heures d'absence lors de la validation de l’absence,Vivien DAKPOGAN,,S-TEL,,Constat Interne,RH,Gestion employé,Requêtes,Non renseigné,OBC Customer Support,Priorité 1,Terminé(e),2023-12-04 13:48,6/12/2023 17:33,2023-12-06 17:33,
OBCS-568,OD-618,FIGER LE NOM DE L'ENTITE SUR TOUS LES ONGLETS DE SAISIES ET DE FILTRES,FIGER LE NOM DE L'ENTITE SUR TOUS LES ONGLETS DE SAISIES ET DE FILTRES,Vivien DAKPOGAN,,S-TEL,,Constat Interne,Projets,Paramétrage,Requêtes,Non renseigné,OBC Customer Support,Priorité 4,Terminé(e),2023-12-04 13:48,6/12/2023 17:33,2023-12-06 17:33,
OBCS-567,OD-617,Créer un lien entre les notes de frais et la gestion du remboursements par la caisse ou autre,"Requête pertinente et exigence du client

{panel:bgColor=#e3fcef}
1 - Créer un formulaire pour programmer les paiements des note de frais justifiée et non remboursée.
{panel}

{panel:bgColor=#e3fcef}
2 - Rajouter une date de programmation et une date d'échéance lors de la programmation.
{panel}

{panel:bgColor=#e3fcef}
3 - Afficher l’historique des note de frais programmer
{panel}

{panel:bgColor=#e3fcef}
4 - Générer les écritures comptables à l’exécution d’un paiement de note de frais
{panel}

{panel:bgColor=#e3fcef}
5 - Générer une écriture comptable à l’enregistrement d’une note de frais. 
{panel}",Vivien DAKPOGAN,,S-TEL,,Constat Interne,Projets,Note de frais,Requêtes,Non renseigné,OBC Customer Support,Priorité 2,Terminé(e),2023-12-04 13:48,6/12/2023 17:33,2023-12-06 17:33,
OBCS-565,OD-615,P1- Créer un workflow de validation des timesheets (heures enregistrées) sur les projets et imputer les heures validées directement au projet en terme de charge,"Créer un workflow de validation des heures enregistrées sur les projets et imputer les heures validées directement au projet en terme de charge.

Il y’a un validateur des timesheets au niveau de S-TEL. Il faut donc créer le workflow et lui permettre de faire des validations groupés (par employé/par semaine/par mois…)",Vivien DAKPOGAN,,S-TEL,,Constat Interne,Projets,Feuille de temps,Requêtes,Non renseigné,OBC Customer Support,Priorité 1,En cours,2023-12-04 13:48,21/1/2025 08:32,,
OBCS-563,OD-613,Rajouter un champ par ligne afin de saisir les libellés de chaque virement et non les groupés,Rajouter un champ par ligne afin de saisir les libellés de chaque virement et non les groupés,Vivien DAKPOGAN,,S-TEL,,Constat Interne,Paiement,Centre de paiement,Requêtes,Non renseigné,OBC Customer Support,Priorité 2,À faire,2023-12-04 13:48,6/12/2023 12:29,,
OBCS-562,OD-612,AJOUTER LES CODES PROJETS DANS L'AFFICHAGE DES PROJETS A CHOISIR DANS L'ENREGISTREMENT D'UNE FACTURE,AJOUTER LES CODES PROJETS DANS L'AFFICHAGE DES PROJETS A CHOISIR DANS L'ENREGISTREMENT D'UNE FACTURE,Vivien DAKPOGAN,,S-TEL,,Constat Interne,Opérations,Vente,Requêtes,Non renseigné,OBC Customer Support,Priorité 4,À faire,2023-12-04 13:48,6/12/2023 12:29,,
OBCS-561,OD-611,FIGER LE NOM DE L'ENTITE SUR TOUS LES ONGLETS DE SAISIES ET DE FILTRES,FIGER LE NOM DE L'ENTITE SUR TOUS LES ONGLETS DE SAISIES ET DE FILTRES,Vivien DAKPOGAN,,S-TEL,,Constat Interne,Opérations,Paramétrage,Requêtes,Non renseigné,OBC Customer Support,Priorité 4,Terminé(e),2023-12-04 13:48,6/12/2023 17:33,2023-12-06 17:33,
OBCS-559,OD-608,"adopter une nomenclature plus simple S-TEL- XXX -2023 – 0001 ( XXX variable selon la nature de la requête ( exemple ACH pour achat , numérotation incrémentée )","adopter une nomenclature plus simple S-TEL- XXX -2023 – 0001 ( XXX variable selon la nature de la requête ( exemple ACH pour achat , numérotation incrémentée )",Vivien DAKPOGAN,,S-TEL,,Constat Interne,Global,Global,Requêtes,Non renseigné,OBC Customer Support,Priorité 4,À faire,2023-12-04 13:48,6/12/2023 12:29,,Global
OBCS-558,OD-607,Transmettre le mail de notifications de validateur au responsable hiérarchique du demandeur,Transmettre le mail de notifications de validateur au responsable hiérarchique du demandeur,Vivien DAKPOGAN,,S-TEL,,Constat Interne,Global,Global,Requêtes,Non renseigné,OBC Customer Support,Priorité 1,À faire,2023-12-04 13:48,6/12/2023 12:29,,Global
OBCS-557,OD-606,FIGER LE NOM DE L'ENTITE SUR TOUS LES ONGLETS DE SAISIES ET DE FILTRES,FIGER LE NOM DE L'ENTITE SUR TOUS LES ONGLETS DE SAISIES ET DE FILTRES,Vivien DAKPOGAN,,S-TEL,,Constat Interne,Finance,Paramétrage,Requêtes,Non renseigné,OBC Customer Support,Priorité 2,Terminé(e),2023-12-04 13:48,6/12/2023 17:33,2023-12-06 17:33,
OBCS-556,OD-604,V1 - P1 : Etablir La liaison des saisies manuelles affectées au projets de l'exercice en cours,Etablir La liaison des saisies manuelles effectuées au projets de l'exercice en cours,Vivien DAKPOGAN,,S-TEL,,Constat Interne,Finance,Comptabilité Générale,Requêtes,Non renseigné,OBC Customer Support,Priorité 1,À faire,2023-12-04 13:48,6/12/2023 12:29,,
OBCS-554,OD-601,Intégrer la notion de budget commercial - Budget prévisionnelle a date,Intégrer la notion de budget commercial - Budget prévisionnelle a date,Vivien DAKPOGAN,,S-TEL,,Constat Interne,Finance,Budget,Requêtes,Non renseigné,OBC Customer Support,Priorité 2,À faire,2023-12-04 13:47,6/12/2023 12:29,,
OBCS-553,OD-600,Créer une vue globale des budgets de dépenses pour tous les projets en cours,"Créer une vue globale des budgets de dépenses pour tous les projets en cours.

Avoir une vue centralisée des dépenses par projet pour faciliter la planification (par semaine, par mois, par année…).",Vivien DAKPOGAN,,S-TEL,,Constat Interne,Finance,Budget,Requêtes,Non renseigné,OBC Customer Support,Priorité 1,En cours,2023-12-04 13:47,23/10/2024 11:48,,
OBCS-551,OD-594,Mettre une passerelle entre la fiche contact et la fiche client permettant de visualiser tous les contact sur un client,Mettre une passerelle entre la fiche contact et la fiche client permettant de visualiser tous les contact sur un client,Vivien DAKPOGAN,,S-TEL,,Constat Interne,CRM,Analytique,Requêtes,Non renseigné,OBC Customer Support,Priorité 2,Terminé(e),2023-12-04 13:47,4/4/2025 11:25,2025-04-04 11:25,
OBCS-550,OD-591,Possibilité de modifier le nom d'une opportunité et la périodicité de paiement,Possibilité de modifier le nom d'une opportunité et la périodicité de paiement après enregistrement,Vivien DAKPOGAN,,S-TEL,,Constat Interne,CRM,Analytique,Requêtes,Non renseigné,OBC Customer Support,Priorité 1,Terminé(e),2023-12-04 13:47,6/12/2023 17:33,2023-12-06 17:33,
OBCS-548,OD-588,Le montant des factures import sont recupéré en dollard au lieu du FCFA,Pour ce cas sur le dasboard des projets nous retrouvons des montants en dollard et en FCA. Nous devons donc recupérer le montant en FCFA,Vivien DAKPOGAN,,SIS,,Constat Interne,Projets,Analytique,Requêtes,Non renseigné,OBC Customer Support,Priorité 4,Terminé(e),2023-12-04 13:47,6/12/2023 17:33,2023-12-06 17:33,
OBCS-547,OD-587,V1 - Impacter le réalisé du projet par la sortie du stock sur les projets,"A la sortie du stock nous avons la possibilité de sélectionner le projet auquel il est affecté. Par contre il n'impacte pas le réalisé du projet.



Les montants réalisés projets doivent être liés à la sortie du stock lorsque nous avons des achats articles.",Vivien DAKPOGAN,,SIS,,Constat Interne,Projets,Analytique,Requêtes,Non renseigné,OBC Customer Support,Priorité 1,Terminé(e),2023-12-04 13:47,19/12/2023 20:07,2023-12-19 20:07,
OBCS-546,OD-586,Au règlement le montant de la facture achat import s'affiche en dollard au lieu du FCFA,Au règlement le montant de la facture achat import s'affiche en dollard au lieu du FCFA,Vivien DAKPOGAN,,SIS,,Constat Interne,Paiement,Centre de paiement,Requêtes,Non renseigné,OBC Customer Support,Priorité 4,Terminé(e),2023-12-04 13:47,6/12/2023 17:33,2023-12-06 17:33,
OBCS-545,OD-585,Possibilité de ratacher une retenue sur avance à plusieur avance encaissées,Possibilité de ratacher une retenue sur avance à plusieur avance encaissées,Vivien DAKPOGAN,,SIS,,Constat Interne,Opérations,Vente,Requêtes,Non renseigné,OBC Customer Support,Priorité 1,Terminé(e),2023-12-04 13:47,6/12/2023 17:33,2023-12-06 17:33,
OBCS-544,OD-583,"A l'édition du suivi de stock, la collonne sortie marque zéro sur tous les articles malgré les sorties éffectuées","A l'édition de la fonctionnalité suivi de stock, la collonne sortie affiche toujours zéro sur tous les articles malgré les sorties éffectuées.",Vivien DAKPOGAN,,SIS,,Constat Interne,Opérations,Gestion de stock,Requêtes,Non renseigné,OBC Customer Support,Priorité 1,Terminé(e),2023-12-04 13:47,6/12/2023 17:33,2023-12-06 17:33,
OBCS-543,OD-582,Impacter directement le stock à l'enregistrement de la facture achat ou vente requete pour un prospect.,Indispensable pour le client,Vivien DAKPOGAN,,SIS,,Constat Interne,Opérations,Achat,Requêtes,Non renseigné,OBC Customer Support,Priorité 4,Terminé(e),2023-12-04 13:47,21/12/2023 17:04,2023-12-21 17:04,
OBCS-542,OD-581,Afficher dans l'h'istorique les natures de prestations avec leur postes comptable,Cela évitera d'éditer la nature de prestation pour voir le numéro de poste comptable,Vivien DAKPOGAN,,SIS,,Constat Interne,Finance,Paramétrage,Requêtes,Non renseigné,OBC Customer Support,Priorité 2,Terminé(e),2023-12-04 13:47,6/12/2023 17:33,2023-12-06 17:33,
OBCS-541,OD-580,Impossible d'ajouter plusieurs épouses sur l'espace employé d'un salarié ayant plusieurs épouses,Impossible d'ajouter plusieurs épouses sur l'espace employé d'un salarié ayant plusieurs épouses,Vivien DAKPOGAN,,SERTEM,,Constat Interne,RH,Gestion employé,Requêtes,Non renseigné,OBC Customer Support,Priorité 3,En cours,2023-12-04 13:47,6/12/2023 17:33,,
OBCS-540,OD-579,"Paramétrage et développement de la fonctionnalité Paiement par lettre de crédit et billet à ordre, traite et lettre d'échéance.","Paramétrer les traites, les lettres à  crédit, les lettres d'échéance, les billets à ordre. 

Prendre en compte ces 4 moyens de paiement dans mode paiement",Vivien DAKPOGAN,,SERTEM,,Constat Interne,Paiement,Centre de paiement,Requêtes,Non renseigné,OBC Customer Support,Priorité 1,En cours,2023-12-04 13:47,6/12/2023 17:33,,
OBCS-539,OD-578,"V1 : Lier les factures clients aux sorties de stocks, stock disponible à faire apparaitre","→ Générer une demande de sortie à partie de l’enregistrement d’une facture client. 



Les ventes via les sorties de stock ne sont pas possibles en ce moment. 

Répliquer le modèle qu’on a sur achat dans la partie vente.

Impacte opérations, stock et finance.",Vivien DAKPOGAN,,ROCFED,,Constat Interne,Opérations,Achat,Requêtes,Non renseigné,OBC Customer Support,Priorité 1,Terminé(e),2023-12-04 13:47,28/12/2023 09:53,2023-12-28 09:53,
OBCS-538,OD-545,Activer l'impression du Billet d'absence,Activer l'impression du Billet d'absence,Vivien DAKPOGAN,,PROPERTY KRO,,Constat Interne,RH,Gestion employé,Requêtes,Non renseigné,OBC Customer Support,Priorité 3,Terminé(e),2023-12-04 13:46,6/12/2023 17:33,2023-12-06 17:33,Mission
OBCS-537,OD-544,Avoir la possibilité d'intégrer les détails de la mission de Property Kro dans la Proposition d'Honoraires,Avoir la possibilité d'intégrer les détails de la mission de Property Kro dans la Proposition d'Honoraires,Vivien DAKPOGAN,,PROPERTY KRO,,Constat Interne,Opérations,Vente,Requêtes,Non renseigné,OBC Customer Support,Priorité 4,À faire,2023-12-04 13:46,6/12/2023 12:21,,
OBCS-535,OD-542,Rajouter le bouton import et export pour le sous module Gérer mes tâches,"Rajout des boutons Import & Export, avec l'exportation en priorité",Vivien DAKPOGAN,,ONPOINT,,Constat Interne,Projets,Gérer mes tâches,Requêtes,Non renseigné,OBC Customer Support,Priorité 3,En cours,2023-12-04 13:46,24/7/2024 10:40,,
OBCS-533,OD-540," Possibilité de gérer une flotte pour le compte d'une entreprise (Pagani, Orange,etc…)"," Possibilité de gérer une flotte pour le compte d'une entreprise (Pagani, Orange,etc…)",Vivien DAKPOGAN,,ONPOINT,,Constat Interne,Opérations,Parc automobile,Requêtes,Non renseigné,OBC Customer Support,Priorité 4,À faire,2023-12-04 13:46,6/12/2023 12:20,,
OBCS-532,OD-539,"Dans les récap des fonctionnalités d'Achat, avoir la description ou le récap de chaque étapes (Expression de besoin, synthèse de cotation… Enregistrer une facture)","Dans les récap des fonctionnalités d'Achat, avoir la description ou le récap de chaque étapes (Expression de besoin, synthèse de cotation… Enregistrer une facture)",Vivien DAKPOGAN,,ONPOINT,,Constat Interne,Opérations,Achat,Requêtes,Non renseigné,OBC Customer Support,Priorité 3,À faire,2023-12-04 13:46,6/12/2023 12:20,,
OBCS-531,OD-538,Avoir la liste des employés à l'édition des expressions de besoins pour un suivi des demandes par employé,Avoir la liste des employés à l'édition des expressions de besoins pour un suivi des demandes par employé,Vivien DAKPOGAN,,ONPOINT,,Constat Interne,Opérations,Achat,Requêtes,Non renseigné,OBC Customer Support,Priorité 2,Terminé(e),2023-12-04 13:46,26/1/2024 07:17,2024-01-26 07:17,
OBCS-530,OD-537,Envoi direct par mail au fournisseur (Achat) ou du client (Vente) via OBC les factures,"Exemple Corps du mail pour le fournisseur 2MI SARL (à valider):



2MI SARL
+225 XXXXXXXXXX
Abidjan, le 25/10/2023

Bonjour Madame/ Monsieur,

J'espère que ce mail vous trouve en parfaite santé.

Vous trouverez ci-joint le bon de commande N° *2023-045.*

La commande a été effectué le 18/10/2023.

Cordialement,

L'équipe comptable OnPoint Analytics CI



Nommage du ficher pdf:

“<Nom Fournisseur>Bon_Commande_Fournisseur.pdf”",Vivien DAKPOGAN,,ONPOINT,,Constat Interne,Opérations,Achat,Requêtes,Non renseigné,OBC Customer Support,Priorité 1,Terminé(e),2023-12-04 13:46,6/12/2023 17:33,2023-12-06 17:33,
OBCS-528,OD-535,Exporter l'interrogation des comptes,Exporter l'interrogation des comptes,Vivien DAKPOGAN,,ONPOINT,,Constat Interne,Finance,Comptabilité Générale,Requêtes,Non renseigné,OBC Customer Support,Priorité 4,Terminé(e),2023-12-04 13:46,1/7/2024 08:42,2024-07-01 08:42,
OBCS-527,OD-534,mettre une interdiction de modification des écritures lettrées,Lorqu'on lettre des écritures il est encore possible de modifier les opérations ce qui n'est pas normal,Vivien DAKPOGAN,,ONPOINT,,Constat Interne,Finance,Comptabilité Générale,Requêtes,Non renseigné,OBC Customer Support,Priorité 2,À faire,2023-12-04 13:46,6/12/2023 12:20,,
OBCS-526,OD-531,"S’assurer que dans etats des deals, les opporunités cloturées sont archivées dans order pour qu’on ait une visibilité sur tous les deals closés","S’assurer que dans etats des deals, les opporunités cloturées sont archivées dans order pour qu’on ait une visibilité sur tous les deals closés",Vivien DAKPOGAN,,ONPOINT,,Constat Interne,CRM,Analytique,Requêtes,Non renseigné,OBC Customer Support,Priorité 1,Terminé(e),2023-12-04 13:46,6/12/2023 17:33,2023-12-06 17:33,
OBCS-525,OD-530,"Lors d'une recherche sur les filtres, il est impossible de passer aux pages suivantes.","Lors d'une recherche sur les filtres, il est impossible de passer aux pages suivantes.",Vivien DAKPOGAN,,ONPOINT,,Constat Interne,CRM,Analytique,Requêtes,Non renseigné,OBC Customer Support,Priorité 1,Terminé(e),2023-12-04 13:46,27/3/2024 12:31,2024-03-27 12:31,
OBCS-524,OD-529,Dahboard Pilotage Commercial ne s'affiche pas : Erreur ajax dash vente : SyntaxError: Unexpected end of JSON input,Impactes tous les comptes qui utilisent CRM. Priorité à traiter,Vivien DAKPOGAN,,ONPOINT,,Constat Interne,CRM,Analytique,Requêtes,Non renseigné,OBC Customer Support,Priorité 1,Terminé(e),2023-12-04 13:46,29/12/2023 12:40,2023-12-29 12:40,
OBCS-523,OD-528,Activités commerciales : le filtre commercial appel tout le personnel de l'employé,Activités commerciales : le filtre commercial appel tout le personnel de l'employé,Vivien DAKPOGAN,,ONPOINT,,Constat Interne,CRM,Analytique,Requêtes,Non renseigné,OBC Customer Support,Priorité 1,Terminé(e),2023-12-04 13:46,27/3/2024 12:31,2024-03-27 12:31,
OBCS-522,OD-527,Possibilité de récupérer les articles du débours à faire apparaitre dans les expressions de besoins. De sorte à éviter les doubles saisies. Un achat lié à un débours depuis l'expression de besoin,Débours lié à Expression de besoin vs Process Achats Projets,Vivien DAKPOGAN,,NOAH,,Constat Interne,Opérations,Vente,Requêtes,Non renseigné,OBC Customer Support,Priorité 2,Terminé(e),2023-12-04 13:45,29/12/2023 12:38,2023-12-29 12:38,Gestion de débours
OBCS-521,OD-526,Définir des périodes pour la réception des rapports,Définir des périodes pour la réception des rapports,Vivien DAKPOGAN,,MYKA,,Constat Interne,Opérations,Parc automobile,Requêtes,Non renseigné,OBC Customer Support,Priorité 4,À faire,2023-12-04 13:45,6/12/2023 12:43,,
OBCS-520,OD-524,Intégrer le modèle de devis et de facture,Intégrer le modèle de devis et de facture,Vivien DAKPOGAN,,MATRELEC,,Constat Interne,Opérations,Vente,Requêtes,Non renseigné,OBC Customer Support,Priorité 3,À faire,2023-12-04 13:45,6/12/2023 12:17,,
OBCS-518,OD-522,Récupération des dépenses en HT dans le budget et non en TTC,Avoir le choix entre la récupération en HT ou en TTC,Vivien DAKPOGAN,,MATRELEC,,Constat Interne,Finance,Budget,Requêtes,Non renseigné,OBC Customer Support,Priorité 4,À faire,2023-12-04 13:45,27/3/2024 10:51,,
OBCS-517,OD-521,Faire ressortir écart dans le prévu/réalisé entre le prévu et le réalisé,Essentiel pour un meilleur suivi,Vivien DAKPOGAN,,MATRELEC,,Constat Interne,Finance,Budget,Requêtes,Non renseigné,OBC Customer Support,Priorité 1,Terminé(e),2023-12-04 13:45,19/12/2023 09:31,2023-12-19 09:31,
OBCS-516,OD-520,Donner la possibilité de modifier les dévis par le validateur si nécessaire avant la validation,Le DG ou DAF peut modifier le taux de la remise avant la validation du dévis,Vivien DAKPOGAN,,LABOGEM,,Constat Interne,Opérations,Vente,Requêtes,Non renseigné,OBC Customer Support,Priorité 2,Terminé(e),2023-12-04 13:45,9/4/2024 17:51,2024-04-09 17:51,
OBCS-515,OD-519,Donner la possibilité au validateur de modifier les opérations de workflow (Expression de besoin) avant de valider sans toute fois aller dans le détail des fonctionnalités,Chez eux le DAF doit pouvoir modifier l'expression de besoin afin de gagner en temps,Vivien DAKPOGAN,,LABOGEM,,Constat Interne,Opérations,Achat,Requêtes,Non renseigné,OBC Customer Support,Priorité 2,Terminé(e),2023-12-04 13:45,6/12/2023 17:33,2023-12-06 17:33,
OBCS-514,OD-518,Mettre les codifications des normes qualitité QHSE sur les documents à imprimer,Pour le client aucun document ne sera imprimé d'OBC si les documents ne sont pas codifier ISO,Vivien DAKPOGAN,,LABOGEM,,Constat Interne,Global,Global,Requêtes,Non renseigné,OBC Customer Support,Priorité 1,Terminé(e),2023-12-04 13:45,6/12/2023 17:33,2023-12-06 17:33,Global
OBCS-512,OD-515, Lettre de voyage vs Ordre de Mission, Lettre de voyage vs Ordre de Mission,Vivien DAKPOGAN,,KORI TRANSPORT,,Constat Interne,RH,Gestion employé,Requêtes,Non renseigné,OBC Customer Support,Priorité 4,À faire,2023-12-04 13:45,6/12/2023 12:11,,Mission
OBCS-511,OD-514," Intégrer un barème pour les avances sur Mission en fonction des villes vs pays,etc…"," Intégrer un barème pour les avances sur Mission en fonction des villes vs pays,etc…",Vivien DAKPOGAN,,KORI TRANSPORT,,Constat Interne,RH,Gestion employé,Requêtes,Non renseigné,OBC Customer Support,Priorité 3,À faire,2023-12-04 13:45,6/12/2023 12:11,,Mission
OBCS-509,OD-512,"Avoir les descriptions des opérations sur les rapports (Devis, Facture Clients)","Avoir les descriptions des opérations sur les rapports (Devis, Facture Clients)",Vivien DAKPOGAN,,KORI TRANSPORT,,Constat Interne,Opérations,Vente,Requêtes,Non renseigné,OBC Customer Support,Priorité 1,Terminé(e),2023-12-04 13:45,26/3/2024 19:06,2024-03-26 19:06,
OBCS-508,OD-511,Nombre et pourcentage des maintenances curatives,Nombre et pourcentage des maintenances curatives,Vivien DAKPOGAN,,KORI TRANSPORT,,Constat Interne,Opérations,Parc automobile,Requêtes,Non renseigné,OBC Customer Support,Priorité 4,Terminé(e),2023-12-04 13:45,9/1/2024 09:48,2024-01-09 09:48,
OBCS-507,OD-510,Nombre et pourcentage des maintenances préventives,Nombre et pourcentage des maintenances préventives,Vivien DAKPOGAN,,KORI TRANSPORT,,Constat Interne,Opérations,Parc automobile,Requêtes,Non renseigné,OBC Customer Support,Priorité 4,Terminé(e),2023-12-04 13:45,8/1/2024 16:14,2024-01-08 16:14,
OBCS-506,OD-509,Définir la liste d'ordre de travail (A transmettre par Kori T),Définir la liste d'ordre de travail (A transmettre par Kori T),Vivien DAKPOGAN,,KORI TRANSPORT,,Constat Interne,Opérations,Parc automobile,Requêtes,Non renseigné,OBC Customer Support,Priorité 4,À faire,2023-12-04 13:45,6/12/2023 12:11,,
OBCS-505,OD-508,Dépenses par camions (en montant et en pourcentage),Dépenses par camions (en montant et en pourcentage),Vivien DAKPOGAN,,KORI TRANSPORT,,Constat Interne,Opérations,Parc automobile,Requêtes,Non renseigné,OBC Customer Support,Priorité 4,Terminé(e),2023-12-04 13:45,29/12/2023 12:40,2023-12-29 12:40,
OBCS-504,OD-507,Possibilité d’imprimer les Synthèse de cotation Approuvé ou Non Approuvé,Possibilité d’imprimer les Synthèse de cotation Approuvé ou Non Approuvé,Vivien DAKPOGAN,,KORI TRANSPORT,,Constat Interne,Opérations,Achat,Requêtes,Non renseigné,OBC Customer Support,Priorité 4,À faire,2023-12-04 13:45,6/12/2023 12:11,,
OBCS-502,OD-505,Paramétrages des taxes pour une comptabilisation,"PPSI, IMPOTS FONCIER, RIBNC à intégrer de sorte à pouvoir les imputer dans le parametrage de comptabilisation",Vivien DAKPOGAN,,KORI TRANSPORT,,Constat Interne,Finance,Comptabilité Générale,Requêtes,Non renseigné,OBC Customer Support,Priorité 2,Terminé(e),2023-12-04 13:44,10/5/2024 20:27,2024-05-10 20:27,
OBCS-500,OD-503,Extraction de données par site,Extraction de données par site,Vivien DAKPOGAN,,JOEL K PERFORMANCE,,Constat Interne,Opérations,Vente,Requêtes,Non renseigné,OBC Customer Support,Priorité 2,À faire,2023-12-04 13:44,6/12/2023 12:09,,
OBCS-499,OD-502,Rajouter Budget d'investissement tel que Dépense ou Produits,Rajouter Budget d'investissement tel que Dépense ou Produits,Vivien DAKPOGAN,,JOEL K PERFORMANCE,,Constat Interne,Finance,Budget,Requêtes,Non renseigné,OBC Customer Support,Priorité 2,Terminé(e),2023-12-04 13:44,16/2/2024 12:10,2024-02-16 12:10,
OBCS-498,OD-501,Figer les 3 premières colonnes et donner la possibilité de faire défiler le calendrier par mois,Figer les 3 premières colonnes et donner la possibilité de faire défiler le calendrier par mois,Vivien DAKPOGAN,,IVOIRE DEVELOPPEMENT,,Constat Interne,RH,Gestion employé,Requêtes,Non renseigné,OBC Customer Support,Priorité 1,Terminé(e),2023-12-04 13:44,19/6/2024 11:12,2024-06-19 11:12,
