Signaler Server Error - Autres (Précisez dans la description) - Chef de Projet,OBCS-4932,Assistance,Terminé,,JOEL SIE,2,19/juin/24 11:20,Serveur error - Signaler un serveur error,Autres (Précisez dans la description),Appel Téléphonique,KORI TRANSPORT,,Signaler Server Error,
Assistance - Explication en ligne - Chef de Projet,OBCS-4931,Assistance,Terminé,,JOEL SIE,3,19/juin/24 11:20,Demander une réimputation automatique,Explication en ligne,Appel Téléphonique,KORI TRANSPORT,,Assistance,
Relance sur Requête en cours - Explication en ligne - Comptable,OBCS-4930,Assistance,Terminé,,JOEL SIE,3,19/juin/24 11:20,Relance sur les filtres ''Suivi de stock'',Explication en ligne,Appel Téléphonique,SIS,,Relance sur Requête en cours,
Relance sur Requête en cours - Explication en ligne - Comptable,OBCS-4929,Assistance,Terminé,,JOEL SIE,2,19/juin/24 11:20,Relance sur les filtres,Explication en ligne,Appel Téléphonique,SIS,,Relance sur Requête en cours,
Autres - Explication en ligne - Directeur Général,OBCS-4928,Assistance,Terminé,,JOEL SIE,5,19/juin/24 11:20,Relance pour la fin des tests,Explication en ligne,Appel Téléphonique,SIT BTP,,Autres,
Assistance - Explication en ligne - Directeur Général,OBCS-4927,Assistance,Terminé,,JOEL SIE,7,19/juin/24 11:20,Assistance pour la création des sous comptes,Explication en ligne,Appel Téléphonique,SIT BTP,,Assistance,
Assistance - Autres (Précisez dans la description) - Comptable,OBCS-4926,Assistance,Terminé,,JOEL SIE,3,19/juin/24 11:20,Prise de rendez-vous - Call pour prendre pour une visite de gouvernance,Autres (Précisez dans la description),Appel Téléphonique,LABOGEM,,Assistance,
Assistance - Explication en ligne - Comptable,OBCS-4872,Assistance,Terminé,,JOEL SIE,5,19/juin/24 11:19,Enregistrement factures achat,Explication en ligne,Appel Téléphonique,LABOGEM,,Assistance,
Assistance - Explication en ligne - Comptable,OBCS-4871,Assistance,Terminé,,JOEL SIE,5,19/juin/24 11:19,Assistance sur la balance,Explication en ligne,Appel Téléphonique,KORI TRANSPORT,,Assistance,
Assistance - Explication en ligne - Comptable,OBCS-4870,Assistance,Terminé,,JOEL SIE,7,19/juin/24 11:19,Assistance sur l'intégration de la caisse,Explication en ligne,Appel Téléphonique,AFRIC URBA,,Assistance,
Autres - Explication en ligne - Comptable,OBCS-4869,Assistance,Terminé,,JOEL SIE,5,19/juin/24 11:19,Appel reçu pour informer que l'équipe est sur terrain. D'où relancer le jeudi pour voir leur retour,Explication en ligne,Appel Téléphonique,AFRIC URBA,,Autres,
Planning Séance de travail - Explication en ligne - Comptable,OBCS-4868,Assistance,Terminé,,JOEL SIE,3,19/juin/24 11:19,Call pour la disponibilité des équipes et planifier unséance de travail,Explication en ligne,Appel Téléphonique,AFRIC URBA,,Planning Séance de travail,
Relance sur Bug en cours - Explication en ligne - Comptable,OBCS-4867,Assistance,Terminé,,JOEL SIE,2,19/juin/24 11:19,Relance sur les filtres suivi de stock,Explication en ligne,Appel Téléphonique,SIS,,Relance sur Bug en cours,
Assistance - Explication en ligne - Comptable,OBCS-4866,Assistance,Terminé,,JOEL SIE,5,19/juin/24 11:19,Assistance sur transfert du RAN 2023,Explication en ligne,Appel Téléphonique,SIS,,Assistance,
Assistance - Explication en ligne - Comptable,OBCS-4863,Assistance,Terminé,,JOEL SIE,2,19/juin/24 11:19,Assistance sur enregistrement de facture vente,Explication en ligne,Appel Téléphonique,LABOGEM,,Assistance,
Assistance - Explication en ligne - Comptable,OBCS-4858,Assistance,Terminé,,JOEL SIE,3,19/juin/24 11:19,Demander la un rdv pour faire un point d'étape,Explication en ligne,Appel Téléphonique,LABOGEM,,Assistance,
Assistance - Explication en ligne - Comptable,OBCS-4855,Assistance,Terminé,,JOEL SIE,7,19/juin/24 11:19,Enregistrement des budget dépenses,Explication en ligne,Appel Téléphonique,SIT BTP,,Assistance,
Assistance - Explication en ligne - Comptable,OBCS-4854,Assistance,Terminé,,JOEL SIE,5,19/juin/24 11:19,Enregistrement rubrique budgetaire,Explication en ligne,Appel Téléphonique,SIT BTP,,Assistance,
Assistance - Explication en ligne - Comptable,OBCS-4852,Assistance,Terminé,,JOEL SIE,3,19/juin/24 11:19,Assistance sur enregistrement du budget global,Explication en ligne,Appel Téléphonique,SIT BTP,,Assistance,
Assistance - Explication en ligne - Comptable,OBCS-4799,Assistance,Terminé,,JOEL SIE,5,19/juin/24 11:18,Assister à intégrer de nouvelles rubriques pour calculer le solde de tout compte,Explication en ligne,Appel Téléphonique,LABOGEM,,Assistance,
Assistance - Explication en ligne - Comptable,OBCS-4798,Assistance,Terminé,,JOEL SIE,2,19/juin/24 11:18,Relance pour les fitres sur suivi de stock,Explication en ligne,Appel Téléphonique,SIS,,Assistance,
Assistance - Explication en ligne - Comptable,OBCS-4797,Assistance,Terminé,,JOEL SIE,4,19/juin/24 11:18,Factures achat ne s'affiche pas dans l'historique,Explication en ligne,Appel Téléphonique,SIS,,Assistance,
Assistance - Explication en ligne - Comptable,OBCS-4796,Assistance,Terminé,,JOEL SIE,3,19/juin/24 11:18,Les écritures mannuelles non prises en compte dans le budget,Explication en ligne,Appel Téléphonique,SIS,,Assistance,
Assistance - Explication en ligne - Comptable,OBCS-4795,Assistance,Terminé,,JOEL SIE,6,19/juin/24 11:18,Assistance à la lecture du budget prévu - Réalisé,Explication en ligne,Appel Téléphonique,SIS,,Assistance,
Assistance - Explication en ligne - Comptable,OBCS-4794,Assistance,Terminé,,JOEL SIE,2,19/juin/24 11:18,Relance pour les filtres sur suivi de stock,Explication en ligne,Appel Téléphonique,SIS,,Assistance,
Assistance - Explication en ligne - Comptable,OBCS-4793,Assistance,Terminé,,JOEL SIE,3,19/juin/24 11:18,Assistance à faire la paie,Explication en ligne,Appel Téléphonique,HC CAPITAL PROPERTIES,,Assistance,
Assistance - Explication en ligne - Comptable,OBCS-4792,Assistance,Terminé,,JOEL SIE,5,19/juin/24 11:18,Assister à creer un projet,Explication en ligne,Appel Téléphonique,SIT BTP,,Assistance,
Assistance - Explication en ligne - Chef de Projet,OBCS-4785,Assistance,Terminé,,JOEL SIE,80,19/juin/24 11:18,"Lorqu'on duplique le budget, il faut revenir mettre manuellement les dates sur les différentes rubriques",Explication en ligne,"Online (Google Meet, Teams...)",KORI TRANSPORT,,Assistance,
Assistance - Explication en ligne - Chef de Projet,OBCS-4784,Assistance,Terminé,,JOEL SIE,3,19/juin/24 11:18,Assistance sur la duplication du budget,Explication en ligne,Appel Téléphonique,KORI TRANSPORT,,Assistance,
Assistance - Explication en ligne - Comptable,OBCS-4783,Assistance,Terminé,,JOEL SIE,5,19/juin/24 11:18,Assistance sur calcul de paie,Explication en ligne,Appel Téléphonique,LABOGEM,,Assistance,
Assistance - Explication en ligne - Comptable,OBCS-4782,Assistance,Terminé,,JOEL SIE,2,19/juin/24 11:18,Relance sur les filtre de stock,Explication en ligne,Appel Téléphonique,SIS,,Assistance,
Assistance - Explication en ligne - Chef de Projet,OBCS-4738,Assistance,Terminé,,JOEL SIE,7,19/juin/24 11:17,Une opération déclanchant plusieurs worflows,Explication en ligne,"Online (Google Meet, Teams...)",KORI TRANSPORT,,Assistance,
Assistance - Explication en ligne - Chef de Projet,OBCS-4737,Assistance,Terminé,,JOEL SIE,3,19/juin/24 11:17,Demande de supprimer des comptes bancaire créés par erreur,Explication en ligne,Appel Téléphonique,KORI TRANSPORT,,Assistance,
Assistance - Explication en ligne - Comptable,OBCS-4736,Assistance,Terminé,,JOEL SIE,3,19/juin/24 11:17,Ajouter une nature de pièce dans le fichier du personnel,Explication en ligne,Appel Téléphonique,LABOGEM,,Assistance,
Assistance - Explication en ligne - Comptable,OBCS-4735,Assistance,Terminé,,JOEL SIE,3,19/juin/24 11:17,Assistance sur le filtre suivi de stock,Explication en ligne,Appel Téléphonique,SIS,,Assistance,
Assistance - Explication en ligne - Directeur Administratif et Financier,OBCS-4734,Assistance,Terminé,,JOEL SIE,2,19/juin/24 11:17,Assistance sur le parametrage du nombre de jour acquis,Explication en ligne,Appel Téléphonique,EJARA,,Assistance,
Assistance - Explication en ligne - Directeur Administratif et Financier,OBCS-4729,Assistance,Terminé,,JOEL SIE,2,19/juin/24 11:17,Informer sur l'équibre de la balance après traitement,Explication en ligne,Appel Téléphonique,KORI TRANSPORT,,Assistance,
Assistance - Explication en ligne - Comptable,OBCS-4728,Assistance,Terminé,,JOEL SIE,2,19/juin/24 11:17,Informer sur l'équilibre de la balance après traitement,Explication en ligne,Appel Téléphonique,KORI TRANSPORT,,Assistance,
Assistance - Explication en ligne - Directeur Administratif et Financier,OBCS-4727,Assistance,Terminé,,JOEL SIE,2,19/juin/24 11:17,Assistance afin d'équilibrer la balance,Explication en ligne,Appel Téléphonique,KORI TRANSPORT,,Assistance,
Assistance - Explication en ligne - Directeur Général,OBCS-4683,Assistance,Terminé,,JOEL SIE,5,19/juin/24 11:16,Explication sur le budget réalisé,Explication en ligne,Appel Téléphonique,SIT BTP,,Assistance,
Assistance - Explication en ligne - Comptable,OBCS-4682,Assistance,Terminé,,JOEL SIE,2,19/juin/24 11:16,Affectation automatique des des ouvrier sur les projets,Explication en ligne,Appel Téléphonique,SIS,,Assistance,
Assistance - Explication en ligne - Responsable Commercial & Marketing,OBCS-4636,Assistance,Terminé,,JOEL SIE,5,19/juin/24 11:16,Explication du type d'achat au niveau du bon de commande,Explication en ligne,Appel Téléphonique,SIT BTP,,Assistance,
Assistance - Explication en ligne - Responsable Commercial & Marketing,OBCS-4635,Assistance,Terminé,,JOEL SIE,3,19/juin/24 11:16,Donner des accès à un utilisateur,Explication en ligne,Appel Téléphonique,SIT BTP,,Assistance,
Assistance - Explication en ligne - Responsable Commercial & Marketing,OBCS-4624,Assistance,Terminé,,JOEL SIE,3,19/juin/24 11:16,Assistance pour importation d'un journal,Explication en ligne,Appel Téléphonique,EDIPRESSE,,Assistance,
Assistance - Explication en ligne - Responsable Commercial & Marketing,OBCS-4623,Assistance,Terminé,,JOEL SIE,5,19/juin/24 11:16,Les écritures comptable sont générées même si les factures ne sont pas validées,Explication en ligne,Appel Téléphonique,SIT BTP,,Assistance,
Assistance - Explication en ligne - Responsable Commercial & Marketing,OBCS-4604,Assistance,Terminé,,JOEL SIE,2,19/juin/24 11:15,Relance sur la requete liée au numéro d'imputation,Explication en ligne,Appel Téléphonique,LABOGEM,,Assistance,
Assistance - Explication en ligne - Responsable Commercial & Marketing,OBCS-4602,Assistance,Terminé,,JOEL SIE,2,19/juin/24 11:15,Realance pour la requete liée au nombre de jours acquis et date de depart et retour des congés,Explication en ligne,Appel Téléphonique,LABOGEM,,Assistance,
Assistance - Explication en ligne - Responsable Commercial & Marketing,OBCS-4599,Assistance,Terminé,,JOEL SIE,8,19/juin/24 11:15,Assistance pour activer certaines rubriques,Explication en ligne,Appel Téléphonique,EJARA,,Assistance,
Assistance - Explication en ligne - Responsable Commercial & Marketing,OBCS-4596,Assistance,Terminé,,JOEL SIE,3,19/juin/24 11:15,Assister à résoudre le message d'erreur au lancement de la paie,Explication en ligne,Appel Téléphonique,EJARA,,Assistance,
Assistance - Explication en ligne - Responsable Commercial & Marketing,OBCS-4594,Assistance,Terminé,,JOEL SIE,3,19/juin/24 11:15,Assistance sur un massage qui s'affiche à l'exécution du paiement,Explication en ligne,Appel Téléphonique,SIT BTP,,Assistance,
Assistance - Explication en ligne - Responsable Commercial & Marketing,OBCS-4591,Assistance,Terminé,,JOEL SIE,7,19/juin/24 11:15,Assistance pour le paiement fournisseur,Explication en ligne,Appel Téléphonique,SIT BTP,,Assistance,
Assistance - Explication en ligne - Responsable Commercial & Marketing,OBCS-4589,Assistance,Terminé,,JOEL SIE,6,19/juin/24 11:15,Création d'une nature de prestation,Explication en ligne,Appel Téléphonique,SIT BTP,,Assistance,
Assistance - Explication en ligne - Responsable Commercial & Marketing,OBCS-4587,Assistance,Terminé,,JOEL SIE,5,19/juin/24 11:15,Assistance pour la segmentation de compte tiers,Explication en ligne,Appel Téléphonique,SIT BTP,,Assistance,
Assistance - Explication en ligne - Responsable Commercial & Marketing,OBCS-4586,Assistance,Terminé,,JOEL SIE,5,19/juin/24 11:15,Assistance pour la création de compte client,Explication en ligne,Appel Téléphonique,SIT BTP,,Assistance,
Assistance - Explication en ligne - Responsable Commercial & Marketing,OBCS-4584,Assistance,Terminé,,JOEL SIE,5,19/juin/24 11:15,Encaissement cheque,Explication en ligne,Appel Téléphonique,EDIPRESSE,,Assistance,
Assistance - Explication en ligne - Responsable Commercial & Marketing,OBCS-4583,Assistance,Terminé,,JOEL SIE,7,19/juin/24 11:15,Enregistrement d'un versement espèces en banque,Explication en ligne,Appel Téléphonique,EDIPRESSE,,Assistance,
Assistance - Explication en ligne - Responsable Commercial & Marketing,OBCS-4581,Assistance,Terminé,,JOEL SIE,3,19/juin/24 11:15,Création de compte clients,Explication en ligne,Appel Téléphonique,EDIPRESSE,,Assistance,
Assistance - Explication en ligne - Responsable Commercial & Marketing,OBCS-4523,Assistance,Terminé,,JOEL SIE,2,19/juin/24 11:14,Export du livre de paie,Explication en ligne,Appel Téléphonique,EDIPRESSE,,Assistance,
Assistance - Explication en ligne - Responsable Commercial & Marketing,OBCS-4522,Assistance,Terminé,,JOEL SIE,3,19/juin/24 11:14,Suppression des doublons des comptes tiers,Explication en ligne,Appel Téléphonique,EDIPRESSE,,Assistance,
Assistance - Explication en ligne - Responsable Commercial & Marketing,OBCS-4521,Assistance,Terminé,,JOEL SIE,2,19/juin/24 11:14,Appeler pour avoir un retour après le traitement du bug sur le PUMP,Explication en ligne,Appel Téléphonique,SIS,,Assistance,
Assistance - Explication en ligne - Responsable Commercial & Marketing,OBCS-4520,Assistance,Terminé,,JOEL SIE,2,19/juin/24 11:14,Revision du wokflow achat,Explication en ligne,Appel Téléphonique,SIT BTP,,Assistance,
Assistance - Explication en ligne - Responsable Commercial & Marketing,OBCS-4513,Assistance,Terminé,,JOEL SIE,2,19/juin/24 11:14,Assistance sur la paie de Février,Explication en ligne,Appel Téléphonique,LABOGEM,,Assistance,
Assistance - Explication en ligne - Responsable Commercial & Marketing,OBCS-4512,Assistance,Terminé,,JOEL SIE,3,19/juin/24 11:14,Assistance modification de certains contrats,Explication en ligne,Appel Téléphonique,LABOGEM,,Assistance,
Assistance - Explication en ligne - Responsable Commercial & Marketing,OBCS-4511,Assistance,Terminé,,JOEL SIE,7,19/juin/24 11:14,Assistance sur enregistrement des catégories et natures de prestations,Explication en ligne,Appel Téléphonique,SIT BTP,,Assistance,
Assistance - Explication en ligne - Responsable Commercial & Marketing,OBCS-4510,Assistance,Terminé,,JOEL SIE,11,19/juin/24 11:14,Enregistrement des factures achat,Explication en ligne,Appel Téléphonique,SIT BTP,,Assistance,
Assistance - Explication en ligne - Comptable,OBCS-4482,Assistance,Terminé,,JOEL SIE,6,19/juin/24 11:13,Assistance pur la création d'une catégorie et nature de prestation,Explication en ligne,Appel Téléphonique,ARIC,,Assistance,
Assistance - Explication en ligne - Comptable,OBCS-4481,Assistance,Terminé,,JOEL SIE,5,19/juin/24 11:13,Enregistrement d'un cèque remis à un employé pour une mission,Explication en ligne,Appel Téléphonique,ARIC,,Assistance,
Assistance - Explication en ligne - Comptable,OBCS-4480,Assistance,Terminé,,JOEL SIE,2,19/juin/24 11:13,Relance sur le bug lié à la suppression d'une facture achat,Explication en ligne,Appel Téléphonique,EJARA,,Assistance,
Assistance - Explication en ligne - Comptable,OBCS-4479,Assistance,Terminé,,JOEL SIE,3,19/juin/24 11:13,Une requete sur le stock congé et congé pris s'affichant sur le bulletin,Explication en ligne,Appel Téléphonique,LABOGEM,,Assistance,
Assistance - Explication en ligne - Comptable,OBCS-4458,Assistance,Terminé,,JOEL SIE,3,19/juin/24 11:13,Enregistrement carburant et huile de moteur,Explication en ligne,Appel Téléphonique,LABOGEM,,Assistance,
Assistance - Explication en ligne - Comptable,OBCS-4426,Assistance,Terminé,,JOEL SIE,3,19/juin/24 11:13,Relancer pour le bug sur le PUMP,Explication en ligne,Appel Téléphonique,SIS,,Assistance,
Assistance - Explication en ligne - Comptable,OBCS-4425,Assistance,Terminé,,JOEL SIE,3,19/juin/24 11:13,Transfert du RAN,Explication en ligne,Appel Téléphonique,SIS,,Assistance,
Assistance - Explication en ligne - Directeur Administratif et Financier,OBCS-4424,Assistance,Terminé,,JOEL SIE,2,19/juin/24 11:13,Assistance pour l'édition du grand livre tiers,Explication en ligne,Appel Téléphonique,EDIPRESSE,,Assistance,
Assistance - Explication en ligne - Directeur Administratif et Financier,OBCS-4415,Assistance,Terminé,,JOEL SIE,2,19/juin/24 11:12,Demander de tester la nature de prestation liée à la catégorie investissement qui ne se deversait pas,Explication en ligne,Appel Téléphonique,EJARA,,Assistance,
Assistance - Redirection vers ressources OBC - Comptable,OBCS-4414,Assistance,Terminé,,JOEL SIE,2,19/juin/24 11:12,Relance sur les numéros d'imputation qui ne suivent pas l'ordre bloquant pour eux,Redirection vers ressources OBC,Appel Téléphonique,LABOGEM,,Assistance,
Assistance - Explication en ligne - Comptable,OBCS-4413,Assistance,Terminé,,JOEL SIE,4,19/juin/24 11:12,Faire remonter le nombre de jour travaillé avant le salaire brut et demande d'enlever congés pris sur les bulletins,Explication en ligne,Appel Téléphonique,LABOGEM,,Assistance,
Assistance - Explication en ligne - Comptable,OBCS-4412,Assistance,Terminé,,JOEL SIE,3,19/juin/24 11:12,Assistance sur factures achat qui ne s'affichent pas dans l'historique dû à l'accès à l'exercice comptable,Explication en ligne,Appel Téléphonique,SIS,,Assistance,
Assistance - Explication en ligne - Comptable,OBCS-4411,Assistance,Terminé,,JOEL SIE,2,19/juin/24 11:12,Relancer sur le traitement bug lié au stock,Explication en ligne,Appel Téléphonique,SIS,,Assistance,
Assistance - Explication en ligne - Comptable,OBCS-4410,Assistance,Terminé,,JOEL SIE,2,19/juin/24 11:12,Comment lier le compte analytique à l'enregistrement de la facture achat,Explication en ligne,Appel Téléphonique,ARIC,,Assistance,
Assistance - Explication en ligne - Comptable,OBCS-4409,Assistance,Terminé,,JOEL SIE,7,19/juin/24 11:12,Assistance sur l'enregistrement de facture achat,Explication en ligne,Appel Téléphonique,ARIC,,Assistance,
Assistance - Explication en ligne - Comptable,OBCS-4408,Assistance,Terminé,,JOEL SIE,17,19/juin/24 11:12,Enregistrement et programmation d'impots et taxes,Explication en ligne,Appel Téléphonique,VENUS DISTRIBUTION,,Assistance,
Assistance - Explication en ligne - Caissier(ère),OBCS-4407,Assistance,Terminé,,JOEL SIE,6,19/juin/24 11:12,Assistance sur création du compte client,Explication en ligne,Appel Téléphonique,EDIPRESSE,,Assistance,
Assistance - Explication en ligne - Directeur Administratif et Financier,OBCS-4406,Assistance,Terminé,,JOEL SIE,3,19/juin/24 11:12,La nature de prestation liée à la catégorie Investissement ne se deverse pas à l'enregistrement de la facture achat,Explication en ligne,Appel Téléphonique,EJARA,,Assistance,
Assistance - Explication en ligne - Directeur Administratif et Financier,OBCS-4405,Assistance,Terminé,,JOEL SIE,2,19/juin/24 11:12,Impossible d'enregistrer une nature de prestation existante sur une autre entité,Explication en ligne,Appel Téléphonique,EJARA,,Assistance,
Assistance - Explication en ligne - Directeur Administratif et Financier,OBCS-4404,Assistance,Terminé,,JOEL SIE,3,19/juin/24 11:12,La base de la prime d'ancienneté erronée,Explication en ligne,Appel Téléphonique,EDIPRESSE,,Assistance,
Assistance - Redirection vers ressources OBC - Directeur Administratif et Financier,OBCS-4403,Assistance,Terminé,,JOEL SIE,3,19/juin/24 11:12,Relance pour la requete sur l'onglet timbre à l'encaissement du client,Redirection vers ressources OBC,Appel Téléphonique,EDIPRESSE,,Assistance,
Assistance - Explication en ligne - Comptable,OBCS-4402,Assistance,Terminé,,JOEL SIE,26,19/juin/24 11:12,Assistance l'enregistrement des impots et taxes puis la programation des imots et taxes,Explication en ligne,Appel Téléphonique,VENUS DISTRIBUTION,,Assistance,
Autres - Autres (Précisez dans la description) - Comptable,OBCS-4401,Assistance,Terminé,,JOEL SIE,3,19/juin/24 11:12,Déplacer la formation des RH,Autres (Précisez dans la description),Appel Téléphonique,SIT BTP,,Autres,
Autres - Autres (Précisez dans la description) - Comptable,OBCS-4400,Assistance,Terminé,,JOEL SIE,3,19/juin/24 11:12,Demander la localisation du site sit btp,Autres (Précisez dans la description),Appel Téléphonique,SIT BTP,,Autres,
Planning Séance de travail - Autres (Précisez dans la description) - Comptable,OBCS-4399,Assistance,Terminé,,JOEL SIE,2,19/juin/24 11:12,Confirmer le redez-vous avec leur DG - Confirmation de la séance avec leur DG et toute l'equipe projet pour présenter le point de parametrage et valider le calendrier des formations,Autres (Précisez dans la description),Appel Téléphonique,SIT BTP,,Planning Séance de travail,
Assistance - Explication en ligne - Directeur Administratif et Financier,OBCS-4347,Assistance,Terminé,,JOEL SIE,5,19/juin/24 11:11,Certains impots liés à la paie ne se déverses pas,Explication en ligne,Appel Téléphonique,EJARA,,Assistance,
Assistance - Autres (Précisez dans la description) - Comptable,OBCS-4346,Assistance,Terminé,,JOEL SIE,5,19/juin/24 11:11,"Faire la proposition sur l'importation des données comptable 2021, 2022 et 2023",Autres (Précisez dans la description),Appel Téléphonique,HC CAPITAL PROPERTIES,,Assistance,
Assistance - Explication en ligne - Directeur Administratif et Financier,OBCS-4303,Assistance,Terminé,,JOEL SIE,5,19/juin/24 11:11,Enregistrement des encaissements clients,Explication en ligne,Appel Téléphonique,EDIPRESSE,,Assistance,
Assistance - Explication en ligne - Directeur Administratif et Financier,OBCS-4302,Assistance,Terminé,,JOEL SIE,2,19/juin/24 11:11,Prise de rendez-vous,Explication en ligne,Appel Téléphonique,EDIPRESSE,,Assistance,
Assistance - Explication en ligne - Assistant(e) / Stagiaire,OBCS-4301,Assistance,Terminé,,JOEL SIE,2,19/juin/24 11:11,Comment sélectionner le magasin et l'emplacement lors de l'enregistrement d'une demande de sortie,Explication en ligne,Appel Téléphonique,NOAH,,Assistance,
Assistance - Explication en ligne - Gestionnaire de stock,OBCS-4300,Assistance,Terminé,,JOEL SIE,4,19/juin/24 11:11,Assistance pour l'enregistrement des demandes de sorties,Explication en ligne,Appel Téléphonique,NOAH,,Assistance,
Assistance - Explication en ligne - Gestionnaire de stock,OBCS-4299,Assistance,Terminé,,JOEL SIE,7,19/juin/24 11:11,Assistance pour l'enregistrement d'un borderau de stock,Explication en ligne,Appel Téléphonique,NOAH,,Assistance,
Assistance - Explication en ligne - Comptable,OBCS-4296,Assistance,Terminé,,JOEL SIE,3,19/juin/24 11:11,Un bug au niveau des numéros d'imputations (Des numéros d'imputation différents pour une même facture),Explication en ligne,Appel Téléphonique,LABOGEM,,Assistance,
Assistance - Explication en ligne - Comptable,OBCS-4295,Assistance,Terminé,,JOEL SIE,5,19/juin/24 11:11,Assistance sur facture vente,Explication en ligne,Appel Téléphonique,LABOGEM,,Assistance,
Assistance - Explication en ligne - Comptable,OBCS-4257,Assistance,Terminé,,JOEL SIE,6,19/juin/24 11:10,Simulation salaire,Explication en ligne,Appel Téléphonique,LABOGEM,,Assistance,
Assistance - Explication en ligne - Comptable,OBCS-4256,Assistance,Terminé,,JOEL SIE,5,19/juin/24 11:10,Assistance sur paie,Explication en ligne,Appel Téléphonique,LABOGEM,,Assistance,
Assistance - Explication en ligne - Directeur Administratif et Financier,OBCS-4255,Assistance,Terminé,,JOEL SIE,5,19/juin/24 11:10,Importation des journaux,Explication en ligne,Appel Téléphonique,EDIPRESSE,,Assistance,
Autres - Autres (Précisez dans la description) - Directeur Général,OBCS-4254,Assistance,Terminé,,JOEL SIE,5,19/juin/24 11:10,Faire le point d'utilisation des comptables - Après visite des comptables appeler le DG,Autres (Précisez dans la description),Appel Téléphonique,LABOGEM,,Autres,
Assistance - Explication en ligne - Comptable,OBCS-4252,Assistance,Terminé,,JOEL SIE,5,19/juin/24 11:10,explication de certainnes feuille du fichier recueil de donné,Explication en ligne,Appel Téléphonique,SIT BTP,,Assistance,
Assistance - Explication en ligne - Comptable,OBCS-4250,Assistance,Terminé,,JOEL SIE,21,19/juin/24 11:10,Création compte client et enregistrement facture vente,Explication en ligne,Appel Téléphonique,LABOGEM,,Assistance,
Assistance - Explication en ligne - Comptable,OBCS-4249,Assistance,Terminé,,JOEL SIE,5,19/juin/24 11:10,Une retenue deduite en motant double,Explication en ligne,Appel Téléphonique,LABOGEM,,Assistance,
Assistance - Explication en ligne - Directeur Administratif et Financier,OBCS-4248,Assistance,Terminé,,JOEL SIE,2,19/juin/24 11:10,Confirmer le rendez-vous pour la présentation des états financiers,Explication en ligne,Appel Téléphonique,EJARA,,Assistance,
Assistance - Explication en ligne - Comptable,OBCS-4247,Assistance,Terminé,,JOEL SIE,5,19/juin/24 11:10,Une retenue n'est ne se déduit pas au lencement de la paie,Explication en ligne,Appel Téléphonique,EDIPRESSE,,Assistance,
Assistance - Explication en ligne - Comptable,OBCS-4244,Assistance,Terminé,,JOEL SIE,3,19/juin/24 11:10,Les éléments variable ne s'affichent,Explication en ligne,Appel Téléphonique,LABOGEM,,Assistance,
