Exécuter un paiement la reférence utilisée existe dejà donc il etait impossible d'enregistrer l'opération,OBCS-5854,Assistance,Terminé,Priorité 3,JOEL SIE,2,05/juil./24 17:16,Exécuter un paiement la reférence utilisée existe dejà donc il etait impossible d'enregistrer l'opération,Explication en ligne,Appel Téléphonique,EJARA,,Assistance,
Comptabilisation l'état de la paie du mois de Juin,OBCS-5850,Assistance,Terminé,Priorité 3,JOEL SIE,3,05/juil./24 17:12,Comptabilisation l'état de la paie du mois de Juin,Explication en ligne,Appel Téléphonique,EJARA,,Assistance,
Des données incohérantes constatées sur suivi de stock,OBCS-5847,Assistance,Terminé,Priorité 3,JOEL SIE,8,05/juil./24 17:10,Des données incohérantes constatées sur suivi de stock,Explication en ligne,Appel Téléphonique,SIS,,Assistance,
"Faire le point de la seance de travail avec la comptable sur projet, budget et création des comptes clients",OBCS-5846,Assistance,Terminé,Priorité 3,JOEL SIE,7,05/juil./24 17:06,"Faire le point de la seance de travail avec la comptable sur projet, budget et création des comptes clients",Explication en ligne,Appel Téléphonique,SIT BTP,,Assistance,
Verification des rubriques du budget,OBCS-5845,Assistance,Terminé,Priorité 3,JOEL SIE,5,05/juil./24 17:01,Verification des rubriques du budget,Explication en ligne,"Online (Google Meet, Teams...)",SIT BTP,,Assistance,
Enregistrer un bug sur le filtre du suivi de stock,OBCS-5844,Assistance,Terminé,Priorité 3,JOEL SIE,3,05/juil./24 16:52,Enregistrer un bug sur le filtre du suivi de stock,Explication en ligne,Appel Téléphonique,SIS,,Assistance,
Certains impots ne se deverses pas lorqu'on veut enregistrer les impots et taxes,OBCS-5843,Assistance,Terminé,Priorité 3,JOEL SIE,4,05/juil./24 16:48,Certains impots ne se deverses pas lorqu'on veut enregistrer les impots et taxes,Explication en ligne,Appel Téléphonique,LABOGEM,,Assistance,
Assister pour mettre en ordre les rubriques,OBCS-5842,Assistance,Terminé,Priorité 3,JOEL SIE,5,05/juil./24 16:37,Assister pour mettre en ordre les rubriques,Explication en ligne,Appel Téléphonique,SIT BTP,,Assistance,
La création des rubriques,OBCS-5841,Assistance,Terminé,Priorité 3,JOEL SIE,6,05/juil./24 16:27,La création des rubriques,Explication en ligne,Appel Téléphonique,SIT BTP,,Assistance,
Après importation du RAN un retour pour la correction de certains comptes,OBCS-5839,Assistance,Terminé,Priorité 3,JOEL SIE,3,05/juil./24 16:17,Après importation du RAN un retour pour la correction de certains comptes,Explication en ligne,Appel Téléphonique,EDIPRESSE,,Autres,
Créer une rubrique calculée,OBCS-5794,Assistance,Terminé,Priorité 3,JOEL SIE,3,01/juil./24 15:12,Créer une rubrique calculée,Autres (Précisez dans la description),Appel Téléphonique,SIT BTP,,Assistance,
Relance sur Bug en cours - Explication en ligne - Directeur Administratif et Financier,OBCS-5503,Assistance,Terminé,Priorité 3,JOEL SIE,2,27/juin/24 14:19,Rélance bug sur états financiers,Explication en ligne,Appel Téléphonique,EJARA,,Relance sur Bug en cours,
Assistance - Explication en ligne - Directeur Administratif et Financier,OBCS-5502,Assistance,Terminé,Priorité 3,JOEL SIE,3,27/juin/24 14:19,Bug signalé sur états financiers,Explication en ligne,Appel Téléphonique,EJARA,,Assistance,
Assistance - Explication en ligne - Directeur Administratif et Financier,OBCS-5501,Assistance,Terminé,Priorité 3,JOEL SIE,3,27/juin/24 14:19,Assistance sur états financiers,Explication en ligne,Appel Téléphonique,EJARA,,Assistance,
Assistance - Explication en ligne - Comptable,OBCS-5500,Assistance,Terminé,Priorité 3,JOEL SIE,6,27/juin/24 14:19,Enregistrement de chequier,Explication en ligne,Appel Téléphonique,LABOGEM,,Assistance,
Assistance - Explication en ligne - Comptable,OBCS-5499,Assistance,Terminé,Priorité 3,JOEL SIE,5,27/juin/24 14:19,Assistance sur le suivi de stock,Explication en ligne,Appel Téléphonique,SIS,,Assistance,
Assistance - Explication en ligne - Directeur Général,OBCS-5498,Assistance,Terminé,Priorité 3,JOEL SIE,2,27/juin/24 14:19,Relance sur l'importation du RAN,Explication en ligne,Appel Téléphonique,EDIPRESSE,,Assistance,
Assistance - Explication en ligne - Directeur Administratif et Financier,OBCS-5497,Assistance,Terminé,Priorité 3,JOEL SIE,2,27/juin/24 14:19,Prise de rendez-vous pour la visite gouvernance,Explication en ligne,Appel Téléphonique,EJARA,,Assistance,
Planning Séance de travail - Explication en ligne - Chef Comptable,OBCS-5475,Assistance,Terminé,Priorité 3,JOEL SIE,3,27/juin/24 14:19,Planifier un rendez-vous afin de faire le point mensuel d'utilisation,Explication en ligne,Appel Téléphonique,LABOGEM,,Planning Séance de travail,
Planning Séance de travail - Explication en ligne - Chef Comptable,OBCS-5474,Assistance,Terminé,Priorité 3,JOEL SIE,3,27/juin/24 14:19,Relance pour la visite point mensuel d'utilisation,Explication en ligne,Appel Téléphonique,LABOGEM,,Planning Séance de travail,
Assistance - Explication en ligne - Comptable,OBCS-5473,Assistance,Terminé,Priorité 3,JOEL SIE,8,27/juin/24 14:19,Expliquer l'écart constaté sur le suivi de stock,Explication en ligne,Appel Téléphonique,SIS,,Assistance,
Autres - Explication en ligne - Responsable Admin & FI,OBCS-5472,Assistance,Terminé,Priorité 3,JOEL SIE,2,27/juin/24 14:19,Relance sur le traitement du RAN,Explication en ligne,Appel Téléphonique,EDIPRESSE,,Autres,
Assistance - Autres (Précisez dans la description) - Chef Comptable,OBCS-5471,Assistance,Terminé,Priorité 3,JOEL SIE,4,27/juin/24 14:19,Prise de la localisation de leur locaux,Autres (Précisez dans la description),Appel Téléphonique,ARIC,,Assistance,
Assistance - Explication en ligne - Chef comptable,OBCS-5470,Assistance,Terminé,Priorité 3,JOEL SIE,180,27/juin/24 14:19,"Assistance pour l'enregistrement des impôts et taxes, programmation et paiement. Comptabilisation de la paie",Explication en ligne,Appel Téléphonique,LABOGEM,,Assistance,
Assistance - Explication en ligne - Assistant(e) comptable,OBCS-5469,Assistance,Terminé,Priorité 3,JOEL SIE,18,27/juin/24 14:19,Assister à élaborer le plan analytique,Explication en ligne,Appel Téléphonique,SIT BTP,,Assistance,
Relance sur Requête en cours - Explication en ligne - Comptable,OBCS-5468,Assistance,Terminé,Priorité 3,JOEL SIE,5,27/juin/24 14:19,Relance sur les requetes,Explication en ligne,Appel Téléphonique,SIS,,Relance sur Requête en cours,
Assistance - Explication en ligne - Comptable,OBCS-5467,Assistance,Terminé,Priorité 3,JOEL SIE,17,27/juin/24 14:19,Explication de la valeur du stock s'affichant dans le suivi de stock,Explication en ligne,Appel Téléphonique,SIS,,Assistance,
Assistance - Explication en ligne - Comptable,OBCS-5390,Assistance,Terminé,,JOEL SIE,5,19/juin/24 11:28,Encaissement client par traite,Explication en ligne,Appel Téléphonique,FALCON,,Assistance,
Assistance - Explication en ligne - Comptable,OBCS-5389,Assistance,Terminé,,JOEL SIE,6,19/juin/24 11:28,Assistance sur impots sur salaire,Explication en ligne,Appel Téléphonique,ROCFED,,Assistance,
Assistance - Explication en ligne - Comptable,OBCS-5388,Assistance,Terminé,,JOEL SIE,7,19/juin/24 11:28,Assistance sur dashboard projet,Explication en ligne,Appel Téléphonique,S-TEL,,Assistance,
Assistance - Explication en ligne - Chef de Projet,OBCS-5387,Assistance,Terminé,,JOEL SIE,5,19/juin/24 11:28,Assistance pour la validation d'une expression de besoin,Explication en ligne,Appel Téléphonique,LABOGEM,,Assistance,
Assistance - Explication en ligne - Chef de Projet,OBCS-5386,Assistance,Terminé,,JOEL SIE,5,19/juin/24 11:28,Assistance sur validation d'une expression de besoin,Explication en ligne,Appel Téléphonique,LABOGEM,,Assistance,
Assistance - Explication en ligne - Comptable,OBCS-5385,Assistance,Terminé,,JOEL SIE,8,19/juin/24 11:28,Assistance sur un bug lié à l'enregistrement du carburant,Explication en ligne,Appel Téléphonique,LABOGEM,,Assistance,
Assistance - Explication en ligne - Comptable,OBCS-5384,Assistance,Terminé,,JOEL SIE,2,19/juin/24 11:28,Relance sur le bug lié au PUMP,Explication en ligne,Appel Téléphonique,SIS,,Assistance,
Assistance - Explication en ligne - Directeur Administratif et Financier,OBCS-5383,Assistance,Terminé,,JOEL SIE,5,19/juin/24 11:28,Assistance sur enregistrement d'écriture mannuelle,Explication en ligne,Appel Téléphonique,EJARA,,Assistance,
Assistance - Explication en ligne - Comptable,OBCS-5382,Assistance,Terminé,,JOEL SIE,2,19/juin/24 11:28,Relance sur le bug lié au PUMP négatif,Explication en ligne,Appel Téléphonique,SIS,,Assistance,
Assistance - Explication en ligne - Directeur Général,OBCS-5348,Assistance,Terminé,,JOEL SIE,8,19/juin/24 11:27,Requetes enregistrer,Explication en ligne,Appel Téléphonique,SIT BTP,,Assistance,
Assistance - Explication en ligne - Directeur Administratif et Financier,OBCS-5347,Assistance,Terminé,,JOEL SIE,2,19/juin/24 11:27,Informer de la resolution du bug lié aux états financiers,Explication en ligne,Appel Téléphonique,EJARA,,Assistance,
Assistance - Explication en ligne - Directeur Administratif et Financier,OBCS-5346,Assistance,Terminé,,JOEL SIE,3,19/juin/24 11:27,Assistance sur bug lié aux etats financiers,Explication en ligne,Appel Téléphonique,EJARA,,Assistance,
Assistance - Explication en ligne - Directeur Administratif et Financier,OBCS-5344,Assistance,Terminé,,JOEL SIE,5,19/juin/24 11:27,Assistance sur etats financiers,Explication en ligne,Appel Téléphonique,EJARA,,Assistance,
Assistance - Explication en ligne - Directeur Administratif et Financier,OBCS-5342,Assistance,Terminé,,JOEL SIE,2,19/juin/24 11:27,Planifier un rendez-vous,Explication en ligne,Appel Téléphonique,EDIPRESSE,,Assistance,
Assistance - Explication en ligne - Comptable,OBCS-5328,Assistance,Terminé,,JOEL SIE,5,19/juin/24 11:27,Informer sur la résolution du bug sur PUMP,Explication en ligne,Appel Téléphonique,SIS,,Assistance,
Assistance - Explication en ligne - Comptable,OBCS-5326,Assistance,Terminé,,JOEL SIE,6,19/juin/24 11:27,Staffing des journaliers,Explication en ligne,Appel Téléphonique,SIS,,Assistance,
Relance sur Bug en cours - Explication en ligne - Comptable,OBCS-5325,Assistance,Terminé,,JOEL SIE,2,19/juin/24 11:27,Relance bug sur PUMP,Explication en ligne,Appel Téléphonique,SIS,,Relance sur Bug en cours,
Assistance - Explication en ligne - Comptable,OBCS-5323,Assistance,Terminé,,JOEL SIE,3,19/juin/24 11:27,Relance sur la mise à jour du PUMP du stock,Explication en ligne,Appel Téléphonique,SIS,,Assistance,
Assistance - Explication en ligne - Comptable,OBCS-5322,Assistance,Terminé,,JOEL SIE,3,19/juin/24 11:27,Realance sur bug enregistrement de carburant,Explication en ligne,Appel Téléphonique,LABOGEM,,Assistance,
Assistance - Explication en ligne - Comptable,OBCS-5319,Assistance,Terminé,,JOEL SIE,3,19/juin/24 11:27,Bug à lenregistrement de carburant,Explication en ligne,Appel Téléphonique,LABOGEM,,Assistance,
Assistance - Explication en ligne - Comptable,OBCS-5318,Assistance,Terminé,,JOEL SIE,2,19/juin/24 11:27,Relance sur message d'erreur sur la paie,Explication en ligne,Appel Téléphonique,LABOGEM,,Assistance,
Assistance - Explication en ligne - Comptable,OBCS-5317,Assistance,Terminé,,JOEL SIE,3,19/juin/24 11:27,Message d'erreur constaté sur la paie,Explication en ligne,Appel Téléphonique,LABOGEM,,Assistance,
Assistance - Autres (Précisez dans la description) - Comptable,OBCS-5316,Assistance,Terminé,,JOEL SIE,3,19/juin/24 11:27,Relance sur bug - Relance sur bug éléments variable,Autres (Précisez dans la description),Appel Téléphonique,LABOGEM,,Assistance,
Assistance - Explication en ligne - Comptable,OBCS-5313,Assistance,Terminé,,JOEL SIE,3,19/juin/24 11:27,"Assistance sur la paie, les employés ne se déverses pas au niveau des elements variables",Explication en ligne,Appel Téléphonique,LABOGEM,,Assistance,
Assistance - Explication en ligne - Comptable,OBCS-5255,Assistance,Terminé,,JOEL SIE,4,19/juin/24 11:26,Un bug constaté sur les PUMP,Explication en ligne,Appel Téléphonique,SIS,,Assistance,
Assistance - Explication en ligne - Comptable,OBCS-5254,Assistance,Terminé,,JOEL SIE,3,19/juin/24 11:26,Enregistrement frais carburant,Explication en ligne,Appel Téléphonique,LABOGEM,,Assistance,
Assistance - Explication en ligne - Comptable,OBCS-5253,Assistance,Terminé,,JOEL SIE,2,19/juin/24 11:26,Récupération mot de passe du DAF,Explication en ligne,Appel Téléphonique,LABOGEM,,Assistance,
Assistance - Explication en ligne - Assistant(e) RH,OBCS-5220,Assistance,Terminé,,JOEL SIE,3,19/juin/24 11:25,Prise de rende-vous pour une visite support,Explication en ligne,Appel Téléphonique,AFRIC URBA,,Assistance,
Assistance - Explication en ligne - Comptable,OBCS-5218,Assistance,Terminé,,JOEL SIE,8,19/juin/24 11:25,Call pour prise de rendez-vous,Explication en ligne,Appel Téléphonique,AFRIC URBA,,Assistance,
Assistance - Explication en ligne - Directeur Administratif et Financier,OBCS-5212,Assistance,Terminé,,JOEL SIE,7,19/juin/24 11:25,Demande d'information sur les clients non créés pour l'importation du journal vente,Explication en ligne,Appel Téléphonique,EDIPRESSE,,Assistance,
Assistance - Explication en ligne - Directeur Administratif et Financier,OBCS-5210,Assistance,Terminé,,JOEL SIE,3,19/juin/24 11:25,Relance sur la supression et l'importation du journal vente de 2023,Explication en ligne,Appel Téléphonique,EDIPRESSE,,Assistance,
Assistance - Explication en ligne - Directeur Administratif et Financier,OBCS-5207,Assistance,Terminé,,JOEL SIE,3,19/juin/24 11:25,Informer sur la résolution des requetes liées aux états financiers,Explication en ligne,Appel Téléphonique,EJARA,,Assistance,
Assistance - Explication en ligne - Directeur Administratif et Financier,OBCS-5204,Assistance,Terminé,,JOEL SIE,5,19/juin/24 11:25,Présenter les écritures interco n'ayant pas utiliser le bon numéro de compte,Explication en ligne,"Online (Google Meet, Teams...)",EJARA,,Assistance,
Assistance - Explication en ligne - Directeur Administratif et Financier,OBCS-5201,Assistance,Terminé,,JOEL SIE,5,19/juin/24 11:25,Assistance sur une ecriture interco,Explication en ligne,Appel Téléphonique,EJARA,,Assistance,
Assistance - Explication en ligne - Comptable,OBCS-5198,Assistance,Terminé,,JOEL SIE,5,19/juin/24 11:25,Encaissement d'une avance,Explication en ligne,Appel Téléphonique,LABOGEM,,Assistance,
Assistance - Explication en ligne - Comptable,OBCS-5196,Assistance,Terminé,,JOEL SIE,5,19/juin/24 11:25,Assister pour la modification d'un encaissement option autre,Explication en ligne,Appel Téléphonique,LABOGEM,,Assistance,
Assistance - Explication en ligne - Comptable,OBCS-5195,Assistance,Terminé,,JOEL SIE,8,19/juin/24 11:25,Informer sur la résolution du bug lié au suivi de stock,Explication en ligne,Appel Téléphonique,SIS,,Assistance,
Relance sur Bug en cours - Explication en ligne - Comptable,OBCS-5194,Assistance,Terminé,,JOEL SIE,5,19/juin/24 11:25,Relance de sur le bug,Explication en ligne,Appel Téléphonique,SIS,,Relance sur Bug en cours,
Assistance - Explication en ligne - Comptable,OBCS-5190,Assistance,Terminé,,JOEL SIE,3,19/juin/24 11:25,Relance sur le bug suivi de stock,Explication en ligne,Appel Téléphonique,SIS,,Assistance,
Assistance - Explication en ligne - Comptable,OBCS-5162,Assistance,Terminé,,JOEL SIE,5,19/juin/24 11:24,Enregistrement du bon de commande import,Explication en ligne,Appel Téléphonique,SIT BTP,,Assistance,
Assistance - Explication en ligne - Comptable,OBCS-5161,Assistance,Terminé,,JOEL SIE,5,19/juin/24 11:24,Enregistrement de facture import,Explication en ligne,Appel Téléphonique,SIS,,Assistance,
Assistance - Explication en ligne - Comptable,OBCS-5160,Assistance,Terminé,,JOEL SIE,5,19/juin/24 11:24,Export des frais de carburant,Explication en ligne,Appel Téléphonique,LABOGEM,,Assistance,
Assistance - Explication en ligne - Directeur Administratif et Financier,OBCS-5159,Assistance,Terminé,,JOEL SIE,5,19/juin/24 11:24,Assistance sur impots et taxes,Explication en ligne,Appel Téléphonique,EJARA,,Assistance,
Assistance - Explication en ligne - Directeur Administratif et Financier,OBCS-5158,Assistance,Terminé,,JOEL SIE,2,19/juin/24 11:24,Confirmation du rendez-vous,Explication en ligne,Appel Téléphonique,EDIPRESSE,,Assistance,
Assistance - Explication en ligne - Comptable,OBCS-5157,Assistance,Terminé,,JOEL SIE,2,19/juin/24 11:24,Relance sur le bus suivi de stock,Explication en ligne,Appel Téléphonique,SIS,,Assistance,
Assistance - Explication en ligne - Comptable,OBCS-5156,Assistance,Terminé,,JOEL SIE,5,19/juin/24 11:24,Un bug survenu sur le suivi de stock,Explication en ligne,Appel Téléphonique,SIS,,Assistance,
Assistance - Explication en ligne - Directeur des Ressources Humaines,OBCS-5155,Assistance,Terminé,,JOEL SIE,5,19/juin/24 11:24,Le prorata de calcul non pris en compte sur certaines rubriques,Explication en ligne,Appel Téléphonique,KORI TRANSPORT,,Assistance,
Assistance - Explication en ligne - Directeur des Ressources Humaines,OBCS-5154,Assistance,Terminé,,JOEL SIE,18,19/juin/24 11:24,Calcul des salaire avec 0 jour travaillé,Explication en ligne,Appel Téléphonique,KORI TRANSPORT,,Assistance,
Assistance - Explication en ligne - Comptable,OBCS-5153,Assistance,Terminé,,JOEL SIE,5,19/juin/24 11:24,Assistance sur la balance pour le RAN,Explication en ligne,Appel Téléphonique,LABOGEM,,Assistance,
Assistance - Explication en ligne - Comptable,OBCS-5152,Assistance,Terminé,,JOEL SIE,2,19/juin/24 11:24,Assistance du comptable,Explication en ligne,Appel Téléphonique,LABOGEM,,Assistance,
Assistance - Explication en ligne - Comptable,OBCS-5090,Assistance,Terminé,,JOEL SIE,35,19/juin/24 11:23,Assistance sur comptabilisation des natures de prestation,Explication en ligne,"Online (Google Meet, Teams...)",ROCFED,,Assistance,
Assistance - Explication en ligne - Comptable,OBCS-5088,Assistance,Terminé,,JOEL SIE,5,19/juin/24 11:23,Assistance sur note de débit crédit,Explication en ligne,Appel WhatsApp,ROCFED,,Assistance,
Assistance - Explication en ligne - Comptable,OBCS-5087,Assistance,Terminé,,JOEL SIE,4,19/juin/24 11:23,Assistance sur impot et taxes,Explication en ligne,Appel WhatsApp,ROCFED,,Assistance,
Assistance - Explication en ligne - Comptable,OBCS-5086,Assistance,Terminé,,JOEL SIE,5,19/juin/24 11:23,Encaissement d'une avance,Explication en ligne,Appel Téléphonique,LABOGEM,,Assistance,
Assistance - Autres (Précisez dans la description) - Comptable,OBCS-5084,Assistance,Terminé,,JOEL SIE,5,19/juin/24 11:23,Relance sur la requete heures supplementaires des journaliers,Autres (Précisez dans la description),Appel Téléphonique,SIS,,Assistance,
Assistance - Explication en ligne - Comptable,OBCS-5083,Assistance,Terminé,,JOEL SIE,5,19/juin/24 11:23,Correction du workflow,Explication en ligne,Appel Téléphonique,KORI TRANSPORT,,Assistance,
Assistance - Explication en ligne - Comptable,OBCS-5081,Assistance,Terminé,,JOEL SIE,5,19/juin/24 11:23,Assistance sur le workflow,Explication en ligne,Appel Téléphonique,KORI TRANSPORT,,Assistance,
Assistance - Explication en ligne - Chef de Projet,OBCS-5078,Assistance,Terminé,,JOEL SIE,4,19/juin/24 11:23,Impossible d'enregitrer une facture achat à cause du cotrole mis sur le workflow,Explication en ligne,Appel Téléphonique,KORI TRANSPORT,,Assistance,
Assistance - Explication en ligne - Directeur Administratif et Financier,OBCS-5076,Assistance,Terminé,,JOEL SIE,3,19/juin/24 11:23,Tous les impots et taxes ne se deverses pas,Explication en ligne,Appel Téléphonique,EJARA,,Assistance,
Assistance - Explication en ligne - Comptable,OBCS-5068,Assistance,Terminé,,JOEL SIE,5,19/juin/24 11:23,Assistance sur un paiement fournisseur qui ne passait pas,Explication en ligne,Appel Téléphonique,LABOGEM,,Assistance,
Assistance - Explication en ligne - Assistant(e) / Stagiaire,OBCS-5044,Assistance,Terminé,,JOEL SIE,20,19/juin/24 11:22,Séance google meet sur facture vente,Explication en ligne,"Online (Google Meet, Teams...)",KORI TRANSPORT,,Assistance,
Assistance - Explication en ligne - Assistant(e) / Stagiaire,OBCS-5043,Assistance,Terminé,,JOEL SIE,1,19/juin/24 11:22,Programmer un google meet,Explication en ligne,Appel Téléphonique,KORI TRANSPORT,,Assistance,
Assistance - Explication en ligne - Responsable Achat,OBCS-5042,Assistance,Terminé,,JOEL SIE,3,19/juin/24 11:22,Donner accès au niveau des taxes,Explication en ligne,Appel Téléphonique,SIT BTP,,Assistance,
Assistance - Explication en ligne - Directeur Administratif et Financier,OBCS-5041,Assistance,Terminé,,JOEL SIE,2,19/juin/24 11:22,Prise de rendez-vous,Explication en ligne,Appel Téléphonique,LABOGEM,,Assistance,
Assistance - Explication en ligne - Comptable,OBCS-5040,Assistance,Terminé,,JOEL SIE,2,19/juin/24 11:22,Informer sur la résolution du bug lié au filtre du stock,Explication en ligne,Appel Téléphonique,SIS,,Assistance,
Assistance - Explication en ligne - Comptable,OBCS-5039,Assistance,Terminé,,JOEL SIE,5,19/juin/24 11:22,"Assistance sur la paie, un employé n'y figure pas",Explication en ligne,Appel Téléphonique,LABOGEM,,Assistance,
Assistance - Explication en ligne - Comptable,OBCS-5038,Assistance,Terminé,,JOEL SIE,4,19/juin/24 11:22,ASSISTANCE SUR LA CREATION DU COMPTE CLIENT,Explication en ligne,Appel Téléphonique,LABOGEM,,Assistance,
Assistance - Explication en ligne - Comptable,OBCS-5037,Assistance,Terminé,,JOEL SIE,6,19/juin/24 11:22,Parametrage d'une nature de prestation des immobilisation,Explication en ligne,Appel Téléphonique,LABOGEM,,Assistance,
Assistance - Explication en ligne - Autres,OBCS-4995,Assistance,Terminé,,JOEL SIE,15,19/juin/24 11:21,Un bug lié à facture vente,Explication en ligne,"Online (Google Meet, Teams...)",KORI TRANSPORT,,Assistance,
Assistance - Explication en ligne - Comptable,OBCS-4994,Assistance,Terminé,,JOEL SIE,6,19/juin/24 11:21,Enregistrement factures achat,Explication en ligne,Appel Téléphonique,ROCFED,,Assistance,
Assistance - Explication en ligne - Comptable,OBCS-4993,Assistance,Terminé,,JOEL SIE,5,19/juin/24 11:21,Enregistrement facture achat,Explication en ligne,Appel Téléphonique,ROCFED,,Assistance,
Assistance - Explication en ligne - Comptable,OBCS-4992,Assistance,Terminé,,JOEL SIE,4,19/juin/24 11:21,Exportation du grand livre en excel,Explication en ligne,Appel Téléphonique,NOAH,,Assistance,
Assistance - Explication en ligne - Comptable,OBCS-4991,Assistance,Terminé,,JOEL SIE,4,19/juin/24 11:21,EXPORTATION DU GRAND LIVRE EN EXCEL,Explication en ligne,Appel Téléphonique,NOAH,,Assistance,
Assistance - Explication en ligne - Directeur Administratif et Financier,OBCS-4990,Assistance,Terminé,,JOEL SIE,12,19/juin/24 11:21,Explication du plafond de la CNPS,Explication en ligne,Appel Téléphonique,KORI TRANSPORT,,Assistance,
Assistance - Explication en ligne - Directeur des Ressources Humaines,OBCS-4989,Assistance,Terminé,,JOEL SIE,23,19/juin/24 11:21,Explication sur la plafond prestation familliale de la CNPS,Explication en ligne,Appel Téléphonique,KORI TRANSPORT,,Assistance,
Assistance - Explication en ligne - Comptable,OBCS-4988,Assistance,Terminé,,JOEL SIE,5,19/juin/24 11:21,Call pour mieux comprendre la requete sur encaissement client,Explication en ligne,Appel Téléphonique,KORI TRANSPORT,,Assistance,
Assistance - Explication en ligne - Comptable,OBCS-4987,Assistance,Terminé,,JOEL SIE,5,19/juin/24 11:21,Requete sur encaissement client,Explication en ligne,Appel Téléphonique,KORI TRANSPORT,,Assistance,
Relance sur Requête en cours - Explication en ligne - Comptable,OBCS-4986,Assistance,Terminé,,JOEL SIE,2,19/juin/24 11:21,Relance sur les filtres suivi de stock,Explication en ligne,Appel Téléphonique,SIS,,Relance sur Requête en cours,
Assistance - Redirection vers ressources OBC - Comptable,OBCS-4985,Assistance,Terminé,,JOEL SIE,2,19/juin/24 11:21,Relance sur les filtre du stock,Redirection vers ressources OBC,Appel Téléphonique,SIS,,Assistance,
Assistance - Explication en ligne - Comptable,OBCS-4984,Assistance,Terminé,,JOEL SIE,4,19/juin/24 11:21,Enregistrement de compte client,Explication en ligne,Appel Téléphonique,LABOGEM,,Assistance,
Assistance - Explication en ligne - Comptable,OBCS-4983,Assistance,Terminé,,JOEL SIE,5,19/juin/24 11:21,Enregietrement de catégorie et nature de prestation,Explication en ligne,Appel Téléphonique,LABOGEM,,Assistance,
Assistance - Explication en ligne - Comptable,OBCS-4982,Assistance,Terminé,,JOEL SIE,5,19/juin/24 11:21,Assistance règlement facture fournisseur,Explication en ligne,Appel Téléphonique,LABOGEM,,Assistance,
Assistance - Autres (Précisez dans la description) - Comptable,OBCS-4981,Assistance,Terminé,,JOEL SIE,2,19/juin/24 11:21,Confirmation pour la visite - Appel pour confirmer notre visite support,Autres (Précisez dans la description),Appel Téléphonique,LABOGEM,,Assistance,
Autres - Explication en ligne - Comptable,OBCS-4936,Assistance,Terminé,,JOEL SIE,3,19/juin/24 11:21,Relance sur le paramétrage de Base,Explication en ligne,Appel Téléphonique,ROCFED,,Autres,
Assistance - Explication en ligne - Comptable,OBCS-4935,Assistance,Terminé,,JOEL SIE,3,19/juin/24 11:21,Assistance pour la création des postes comptable,Explication en ligne,Appel Téléphonique,EDIPRESSE,,Assistance,
Assistance - Explication en ligne - Comptable,OBCS-4934,Assistance,Terminé,,JOEL SIE,8,19/juin/24 11:20,Expliquer comment faire les réimputations,Explication en ligne,Appel Téléphonique,KORI TRANSPORT,,Assistance,
Autres - Explication en ligne - Chef de Projet,OBCS-4933,Assistance,Terminé,,JOEL SIE,2,19/juin/24 11:20,Informer sur la résolution du serveur error,Explication en ligne,Appel Téléphonique,KORI TRANSPORT,,Autres,
